"http://ieeexplore.ieee.org/search/searchresult.jsp?bulkSetSize=2000&queryText%3DComputer-Aided+Design+.LB.ICCAD.RB.%2C+2008+IEEE%2FACM+International+Conference",2015/06/23 15:05:48
"Performance optimization of elastic systems using buffer resizing and buffer insertion","Bufistov, D.; Julvez, J.; Cortadella, J.","Univ. Politec. de Catalunya, Barcelona","Computer-Aided Design, 2008. ICCAD 2008. IEEE/ACM International Conference on","20081118","2008","","","442","448","Buffer resizing and buffer insertion are two transformation techniques for the performance optimization of elastic systems. Different approaches for each technique have already been proposed in the literature. Both techniques increase the storage capacity and can potentially contribute to improve the throughput of the system. Each technique offers a different trade-off between area cost and latency. This paper presents a method that combines both techniques to achieve the maximum possible throughput while minimizing the cost of the implementation. The provided method is based on mixed integer linear programming. A set of experiments is designed to show the feasibility of the approach.","1092-3152","978-1-4244-2819-9","978-1-4244-2820-5","10.1109/ICCAD.2008.4681613","http://ieeexplore.ieee.org/stamp/stamp.jsp?arnumber=4681613","","Costs;Delay;Elasticity;Electronic switching systems;Integrated circuit interconnections;Mixed integer linear programming;Optimization;Power system interconnection;Protocols;Throughput","buffer circuits;circuit optimisation;integer programming;linear programming","buffer insertion;buffer resizing;cost of the implementation;elastic systems;integer linear programming;performance optimization;storage capacity;transformation techniques","","4","","22","","","10-13 Nov. 2008","","IEEE","IEEE Conference Publications"
"Linear constraint graph for floorplan optimization with soft blocks","Jia Wang; Hai Zhou","Electr. & Comput. Eng., Illinois Inst. of Technol., Chicago, IL","Computer-Aided Design, 2008. ICCAD 2008. IEEE/ACM International Conference on","20081118","2008","","","9","15","In this paper, we propose the linear constraint graph (LCG) as an efficient general floorplan representation. For n blocks, an LCG has at most 2n+3 vertices and at most 6n+2 edges. Operations with direct geometric meanings are developed to perturb the LCGs. We apply the LCGs to the floorplan optimization with soft blocks to leverage its advantage in terms of the sizes of the graphs, which will improve the efficiency of solving a complex mathematical program in the inner loop of the optimization that decide the block shapes without introducing overlaps to the non-slicing floorplans. Experimental results confirm that the LCGs are effective and efficient.","1092-3152","978-1-4244-2819-9","978-1-4244-2820-5","10.1109/ICCAD.2008.4681545","http://ieeexplore.ieee.org/stamp/stamp.jsp?arnumber=4681545","","Bars;Circuit synthesis;Computer science;Constraint optimization;Design optimization;Shape;Space exploration;TV;Topology;Very large scale integration","circuit layout;graphs","complex mathematical program;direct geometric meanings;floorplan optimization;linear constraint graph;soft blocks","","1","","16","","","10-13 Nov. 2008","","IEEE","IEEE Conference Publications"
"PaRS: Fast and near-optimal grid-based cell sizing for library-based design","Tai-Hsuan Wu; Davoodi, A.","Dept. of Electr. & Comput. Eng., Univ. of Wisconsin-Madison, Madison, WI","Computer-Aided Design, 2008. ICCAD 2008. IEEE/ACM International Conference on","20081118","2008","","","107","111","We propose PaRS, a parallel and randomized tool which solves the discrete gate sizing (cell sizing) problem on a grid. PaRS is formulated based on an optimization framework known as Nested Partitions which uses parallelism and randomization from a novel perspective to better identify the optimization direction. It achieves near-optimal solutions for minimizing total power and area subject to meeting a delay constraint. The embarrassingly-parallel nature of PaRS makes it highly efficient. We show small algorithm run-times, in at most minutes for circuits with over 47,000 cells. We make comparison with the optimal solution generated by a custom and parallel branch-and-bound algorithm. Consequently, we are able to generate the optimal solution within hours. While the optimal algorithm uses up to 200 nodes in our grid, PaRS achieves its speedups and near-optimal solutions using only 20 nodes.","1092-3152","978-1-4244-2819-9","978-1-4244-2820-5","10.1109/ICCAD.2008.4681559","http://ieeexplore.ieee.org/stamp/stamp.jsp?arnumber=4681559","","Circuits;Delay effects;Delay estimation;Design engineering;Grid computing;Libraries;Parallel processing;Partitioning algorithms;Runtime;Sampling methods","circuit CAD;integrated circuit design;parallel algorithms;tree searching","PaRS algorithm;branch-and-bound algorithm;cell sizing;gate sizing;library-based design;nested partitions;parallel-randomized tool","","5","","11","","","10-13 Nov. 2008","","IEEE","IEEE Conference Publications"
"FBT: Filled Buffer Technique to reduce code size for VLIW processors","Bonny, Talal; Henkel, J.","Dept.for Embedded Syst., Univ. of Karlsruhe, Karlsruhe","Computer-Aided Design, 2008. ICCAD 2008. IEEE/ACM International Conference on","20081118","2008","","","549","554","VLIW processors provide higher performance and better efficiency etc. than RISC processors in specific domains like multimedia applications etc. A disadvantage is the bloated code size of the compiled application code. Therefore, reducing the application code size is a design key issue for VLIW processors. In this paper we adapt a hardware-supported approach called ldquoDeflaterdquo which has been used before in data compression. It can significantly reduce the code size compared to state-of-the-art approaches for VLIW processors as we will show within this work. In fact, we enhance the ldquoDeflaterdquo algorithm by using a new technique called Filled Buffer Technique which can be applied to any Lempel-Ziv family algorithms to improve compression ratio in average by more than 13% compared to the sole ldquoDeflaterdquo algorithm. Using our Filled Buffer Technique in conjunction with ldquoV2Frdquo improves the compression ratio by 10%. We have conducted evaluations using a representative set of benchmarks (from Mediabench and Mibench) and have applied our scheme to two VLIW processors, namely TMS320C62x and TMS320C64x. We achieved allover compression ratios as low as 44% using the ldquoDeflaterdquo algorithm (61% and 56% in average for TMS320C62x and TMS320C64x, respectively).","1092-3152","978-1-4244-2819-9","978-1-4244-2820-5","10.1109/ICCAD.2008.4681629","http://ieeexplore.ieee.org/stamp/stamp.jsp?arnumber=4681629","","Data compression;Decoding;Embedded system;Encoding;Flyback transformers;Multimedia systems;Reduced instruction set computing;Silicon;Throughput;VLIW","data compression;multiprocessing systems","Deflate algorithm;Lempel-Ziv family algorithms;TMS320C62x;TMS320C64x;VLIW processors;compression ratio;filled buffer technique;hardware-supported approach","","1","","16","","","10-13 Nov. 2008","","IEEE","IEEE Conference Publications"
"Reliable system design: Models, metrics and design techniques","Mitra, Subhasish; Iyer, Ravishankar K.; Trivedi, Kishor; Tschanz, James W.","Stanford Univ., CA, USA","Computer-Aided Design, 2008. ICCAD 2008. IEEE/ACM International Conference on","20081118","2008","","","xi","xi","Design of reliable systems meeting stringent quality, reliability, and availability requirements is becoming increasingly difficult in advanced technologies. The current design paradigm, which assumes that no gate or interconnect will ever operate incorrectly within the lifetime of a product, must change to cope with this situation. Future systems must be designed with built-in mechanisms for failure tolerance, prediction, detection and recovery during normal system operation. This tutorial will focus on models and metrics for designing reliable systems, algorithms and tools for modeling and evaluating such systems, will discuss a broad spectrum of techniques for building such systems with support for concurrent error detection, failure prediction, error correction, recovery, and self-repair. Complex interplay between power, performance and reliability requirements in future systems, and associated constraints will also be discussed.","1092-3152","978-1-4244-2819-9","978-1-4244-2820-5","10.1109/ICCAD.2008.4681534","http://ieeexplore.ieee.org/stamp/stamp.jsp?arnumber=4681534","","Algorithm design and analysis;Application software;Availability;Buildings;Change detection algorithms;Electronic design automation and methodology;Error correction;Power system modeling;Power system reliability;Predictive models","","","","0","","","","","10-13 Nov. 2008","","IEEE","IEEE Conference Publications"
"Physical models for electron transport in graphene nanoribbons and their junctions","Naeemi, A.; Meindl, J.D.","Georgia Inst. of Technol., Atlanta, GA","Computer-Aided Design, 2008. ICCAD 2008. IEEE/ACM International Conference on","20081118","2008","","","400","405","Physics-based equivalent circuit models are presented for armchair and zigzag graphene nanoribbons (GNRs), and their conductances have been benchmarked against those of carbon nanotubes and copper wires. It is demonstrated that GNRs that have large coherence length behave like waveguides for electrons. This poses both challenges and opportunities for designing graphene nanoelectronic circuits.","1092-3152","978-1-4244-2819-9","978-1-4244-2820-5","10.1109/ICCAD.2008.4681605","http://ieeexplore.ieee.org/stamp/stamp.jsp?arnumber=4681605","","Carbon nanotubes;Copper;Electrons;Fabrication;Geometry;Integrated circuit interconnections;Nonhomogeneous media;Semiconductivity;Temperature;Wires","carbon nanotubes;equivalent circuits;graphene;nanoelectronics;nanowires;network synthesis","carbon nanotubes;coherence length;copper wires;electron transport;graphene nanoelectronic circuit design;graphene nanoribbon;physics-based equivalent circuit model;waveguides;zigzag graphene nanoribbon","","0","","26","","","10-13 Nov. 2008","","IEEE","IEEE Conference Publications"
"Minimizing the energy cost of throughput in a linear pipeline by opportunistic time borrowing","Ghasemazar, M.; Pedram, M.","Dept. of Electr. Eng., Univ. of Southern California, Los Angeles, CA","Computer-Aided Design, 2008. ICCAD 2008. IEEE/ACM International Conference on","20081118","2008","","","155","160","In this paper, we present a technique to optimize the energy-delay product of a synchronous linear pipeline circuit with dynamic error detection and correction capability running. The technique dynamically adjusts the supply voltage level and clock frequency of the design by exploiting slacks that are present in various stages of the pipeline. The key enabler is the utilization of soft-edge flip-flops to allow time borrowing between consecutive stages of the pipeline in order to provide the timing-critical stages with more time to complete their computations resulting in lower error probability. This raises the effective throughput of the pipeline for a fixed energy consumption level, or alternatively, lowers the energy consumption for the same effective throughput. We formulate the problem of optimally selecting the transparency window sizes of the soft-edge flip-flops and the frequency level of the pipeline circuit at different voltage levels so as to optimize the energy cost of the achieved throughput. Experimental results show the efficacy of the problem formulation and solution technique.","1092-3152","978-1-4244-2819-9","978-1-4244-2820-5","10.1109/ICCAD.2008.4681567","http://ieeexplore.ieee.org/stamp/stamp.jsp?arnumber=4681567","","Circuits;Clocks;Costs;Energy consumption;Error correction;Flip-flops;Frequency;Pipelines;Throughput;Voltage","error correction;error detection;error statistics;flip-flops;logic design","energy consumption level;energy-delay product;error correction capability;error detection capability;error probability;soft-edge flip-flops;synchronous linear pipeline circuit;transparency window sizes","","2","","18","","","10-13 Nov. 2008","","IEEE","IEEE Conference Publications"
"Module locking in biochemical synthesis","Fett, B.; Riedel, M.D.","Dept. of Electr. & Comput. Eng., Univ. of Minnesota, Minneapolis, MN","Computer-Aided Design, 2008. ICCAD 2008. IEEE/ACM International Conference on","20081118","2008","","","758","764","We are developing a framework for computation with biochemical reactions with a focus on synthesizing specific logical functionality, a task analogous to technology-independent logic synthesis. Our method synthesizes biochemical reactions that compute output quantities of molecular types as a function of input quantities, either deterministically or probabilistically. An important constraint is the timing, captured in the relative rates of the biochemical reactions: all the outputs of a given phase must be produced before the next phase can begin consuming them as inputs. To achieve this synchronization, the reaction rates must sometimes be separated by orders of magnitude: some much faster than others, some much slower. This might be costly or infeasible given a specific library of biochemical reactions. In this paper, we describe a novel mechanism for locking the computation of biochemical modules - analogous to handshaking mechanisms in asynchronous circuit design. With locking, our method synthesizes robust computation that is nearly rate independent, requiring at most two speeds (ldquofastrdquo and ldquoslowrdquo). The trade-off is with respect to the size of the solution: more reactions are needed. We characterize this trade-off for interand intra-module locking in general and for a variety of specific modules that we have designed. In particular, we discuss locking in detail for a stochastic module that implements probabilistic computation, producing different combinations of molecular types according to specified probability distributions.","1092-3152","978-1-4244-2819-9","978-1-4244-2820-5","10.1109/ICCAD.2008.4681661","http://ieeexplore.ieee.org/stamp/stamp.jsp?arnumber=4681661","","Asynchronous circuits;Biology computing;Circuit synthesis;Design automation;Libraries;Logic;Proteins;Robustness;Synthetic biology;Timing","biochemistry;biocomputing;molecular biophysics;probability;stochastic processes","asynchronous circuit design;biochemical synthesis;handshaking mechanisms;intermodule locking;intramodule locking;probabilistic computation;probability distributions;stochastic module;synchronization;technology-independent logic synthesis","","4","","26","","","10-13 Nov. 2008","","IEEE","IEEE Conference Publications"
"Design and optimization of a digital microfluidic biochip for protein crystallization","Tao Xu; Chakrabarty, K.; Pamula, V.K.","Dept. of Electr. & Comput. Eng., Duke Univ., Durham, NC","Computer-Aided Design, 2008. ICCAD 2008. IEEE/ACM International Conference on","20081118","2008","","","297","301","Proteins crystallization is a commonly used technique for protein analysis and subsequent drug design. It predicts the three-dimensional arrangement of the constituent amino acids, which in turn indicates the specific biological function of a protein. Protein crystallization experiments are typically carried out manually on multi-well plates in the laboratory. These experiments are slow, expensive, and error-prone. We present the design of a multi-well plate microfluidic biochip for protein crystallization; this biochip can transfer protein samples, prepare candidate solutions, and carry out crystallization automatically. To reduce the manufacturing cost of such devices, we present an efficient algorithm to generate a pin-assignment plan for the proposed design. The resulting biochip enables control of a large number of on-chip electrodes using only a small number of pins. Based on the pin-constrained chip design, we present an efficient shuttle-passenger-like droplet manipulation method to achieve high-throughput and defect-tolerant well loading.","1092-3152","978-1-4244-2819-9","978-1-4244-2820-5","10.1109/ICCAD.2008.4681589","http://ieeexplore.ieee.org/stamp/stamp.jsp?arnumber=4681589","","Algorithm design and analysis;Amino acids;Costs;Crystallization;Design optimization;Drugs;Laboratories;Manufacturing;Microfluidics;Proteins","bioMEMS;biochemistry;crystallisation;digital integrated circuits;microfluidics;plates (structures);proteomics","amino acids;crystallization;digital microfluidic biochip;multi-well plates;on-chip electrodes;protein;shuttle-passenger-like droplet manipulation;three-dimensional arrangement","","1","5","18","","","10-13 Nov. 2008","","IEEE","IEEE Conference Publications"
"Special Issues in Flash","Tei-Wei Kuo; Yuan-Hao Chang; Po-Chun Huang; Chang, Che-Wei","National Taiwan University","Computer-Aided Design, 2008. ICCAD 2008. IEEE/ACM International Conference on","20081202","2008","","","821","826","While flash memory has been widely adopted in the implementations of various storage systems, it recently receives a lot of attention in various system-component designs. With the unique characteristics of flash memory, it is highly challenging in the designs of management software, especially when reliability and cost management become major concerns. In this paper, popular implementations of the management software will be summarized, and the behavior analysis of flash-memory storage systems will then be addressed. Challenge issues for current and future implementations, especially on reliability and filesystem considerations, and some potential solutions will be presented.","1092-3152","978-1-4244-2819-9","978-1-4244-2820-5","10.1109/ICCAD.2008.4694174","http://ieeexplore.ieee.org/stamp/stamp.jsp?arnumber=4694174","","","","","","14","","","","","10-13 Nov. 2008","","IEEE","IEEE Conference Publications"
"Automated abstraction by incremental refinement in interpolant-based model checking","Cabodi, G.; Camurati, P.; Murciano, M.","Dipt. di Autom. ed Inf., Politec. di Torino, Torino","Computer-Aided Design, 2008. ICCAD 2008. IEEE/ACM International Conference on","20081118","2008","","","129","136","This paper addresses the field of unbounded model checking (UMC) based on SAT engines, where Craig interpolants have recently gained wide acceptance as an automated abstraction technique. We start from the observation that interpolants can be quite effective on large verification instances. As they operate on SAT-generated refutation proofs, interpolants are very good at automatically abstract facts that are not significant for proofs. In this work, we push forward the new idea of generating abstractions without resorting to SAT proofs, and to accept (reject) abstractions whenever they (do not) fulfill given adequacy constraints. We propose an integrated approach smoothly combining the capabilities of interpolation with abstraction and over-approximation techniques, that do not directly derive from SAT refutation proofs. The driving idea of this combination is to incrementally generate, by refinement, an abstract (over-approximate) image, built up from equivalences, implications, ternary and localization abstraction, then (eventually) from SAT refutation proofs. Experimental results, derived from the verification of hard problems, show the robustness of our approach.","1092-3152","978-1-4244-2819-9","978-1-4244-2820-5","10.1109/ICCAD.2008.4681563","http://ieeexplore.ieee.org/stamp/stamp.jsp?arnumber=4681563","","Binary decision diagrams;Boolean functions;Circuits;Data structures;Engines;Explosions;Interpolation;Performance analysis;Robustness;State-space methods","approximation theory;computability;interpolation","Craig interpolants;automated abstraction technique;incremental refinement;interpolant-based model checking;over-approximation techniques;unbounded model checking","","4","","26","","","10-13 Nov. 2008","","IEEE","IEEE Conference Publications"
"Guiding global placement with wire density","Tsota, K.; Cheng-Kok Koh; Balakrishnan, V.","Sch. of Electr. & Comput. Eng., Purdue Univ., West Lafayette, IN","Computer-Aided Design, 2008. ICCAD 2008. IEEE/ACM International Conference on","20081118","2008","","","212","217","This paper presents an efficient technique for the estimation of the routed wirelength during global placement using the wire density of the net. The proposed method identifies congested regions of the chip and incorporates the model of the routed wirelength into the objective function in order to effectively alleviate these regions from congestion. The method is integrated in the analytical placement framework and the two-level structure improves the scalability of the placer and speeds up the algorithm. The proposed analytical placer provides the best-so-far average routed wirelength in the IBM version2 benchmark suite.","1092-3152","978-1-4244-2819-9","978-1-4244-2820-5","10.1109/ICCAD.2008.4681576","http://ieeexplore.ieee.org/stamp/stamp.jsp?arnumber=4681576","","Algorithm design and analysis;Circuits;Clustering algorithms;Minimization;Phased arrays;Pins;Routing;Scalability;Very large scale integration;Wire","VLSI;integrated circuit design;network routing","IBM version2 benchmark suite;VLSI physical design;objective function;routed wirelength estimation;wire density","","10","","22","","","10-13 Nov. 2008","","IEEE","IEEE Conference Publications"
"System-level thermal aware design of applications with uncertain execution time","Sushu Zhang; Chatha, K.S.","Dept. of Comput. Sci. & Eng., Arizona State Univ., Tempe, AZ","Computer-Aided Design, 2008. ICCAD 2008. IEEE/ACM International Conference on","20081118","2008","","","242","249","The paper introduces the problem of system-level thermal aware design of applications with uncertain run time on an embedded processor equipped with dynamic voltage/frequency scaling features. The problem takes as inputs a task sequence, cycle time distribution of each task, and processor thermal model. The solution specifies a voltage/frequency assignment to the tasks such that the expected latency is minimized subject to the probability that the peak temperature constraint is not violated is no less than a designer specified value. We prove that the problem is at least NP-hard, and present optimal and (1 + epsi) fully polynomial time approximation scheme as solutions. To the best of our knowledge, this paper is the first work that addresses the stochastic version of the system-level thermal-aware design problem. We evaluate the effectiveness of our techniques by experimenting with realistic and synthetic benchmarks.","1092-3152","978-1-4244-2819-9","978-1-4244-2820-5","10.1109/ICCAD.2008.4681581","http://ieeexplore.ieee.org/stamp/stamp.jsp?arnumber=4681581","","Clocks;Delay;Dynamic voltage scaling;Embedded system;Frequency;Microprocessors;Polynomials;Power system management;Temperature;Thermal management","circuit CAD;computational complexity;embedded systems;integrated circuit design;optimisation;polynomial approximation;stochastic processes;thermal analysis;uncertain systems","embedded processor;polynomial time approximation;stochastic version;system-level thermal aware design;uncertain run time","","6","","20","","","10-13 Nov. 2008","","IEEE","IEEE Conference Publications"
