"http://ieeexplore.ieee.org/search/searchresult.jsp?bulkSetSize=2000&queryText%3DComputer-Aided+Design+.LB.ICCAD.RB.%2C+2008+IEEE%2FACM+International+Conference",2015/06/23 15:05:48
"Large-scale atomistic approach to random-dopant-induced characteristic variability in nanoscale CMOS digital and high-frequency integrated circuits","Yiming Li; Chih-Hong Hwang; Ta-Ching Yeh; Tien-Yeh Li","Dept. of Commun. Eng., Nat. Chiao Tung Univ., Hsinchu","Computer-Aided Design, 2008. ICCAD 2008. IEEE/ACM International Conference on","20081118","2008","","","278","285","Modeling of device variability is crucial for the accuracy of timing in circuits and systems, and the stability of high-frequency application. Unfortunately, due to the randomness of dopant position in device, the fluctuation of device gate capacitance is nonlinear and hard to be modeled in current compact models. Therefore, a large-scale statistically sound ldquoatomisticrdquo device/circuit coupled simulation approach is proposed to characterize the random-dopant-induced characteristic fluctuations in 16-nm-gate CMOS integrated circuits concurrently capturing the discrete-dopant-number- and discrete-dopant-position-induced fluctuations. The variations of transition time of digital circuit (inverter, NAND, and NOR gates) and high-frequency characteristic of common-source amplifier are estimated. For the digital circuits, the function-dependent and circuit-topology-dependent characteristic fluctuations resulted from random nature of discrete dopants is for the first time discussed. This study provides an insight into random-dopant- induced intrinsic timing and high-frequency characteristic fluctuations. The accuracy of the simulation technique is confirmed by the use of experimentally calibrated transistor physical model.","1092-3152","978-1-4244-2819-9","978-1-4244-2820-5","10.1109/ICCAD.2008.4681586","http://ieeexplore.ieee.org/stamp/stamp.jsp?arnumber=4681586","Device variability;digital circuit;fluctuation;high frequency circuit;random dopant;timing","Accuracy;CMOS digital integrated circuits;CMOS integrated circuits;Circuit simulation;Digital circuits;Fluctuations;Large scale integration;Semiconductor device modeling;Semiconductor process modeling;Timing","CMOS digital integrated circuits;amplifiers;fluctuations;integrated circuit modelling;logic gates;nanoelectronics;semiconductor doping","NAND gate;NOR gate;common-source amplifier;discrete-dopant-position-induced fluctuations;gate capacitance;high-frequency integrated circuits;inverter;large-scale atomistic approach;nanoscale CMOS digital circuits;random-dopant-induced characteristic variability","","6","","33","","","10-13 Nov. 2008","","IEEE","IEEE Conference Publications"
"Texture Filter Memory — a power-efficient and scalable texture memory architecture for mobile graphics processors","Silpa, B.V.N.; Patney, A.; Krishna, T.; Panda, P.R.; Visweswaran, G.S.","Dept. of Comput. Sci. & Eng., Indian Inst. of Technol., New Delhi","Computer-Aided Design, 2008. ICCAD 2008. IEEE/ACM International Conference on","20081118","2008","","","559","564","With increasing interest in sophisticated graphics capabilities in mobile systems, energy consumption of graphics hardware is becoming a major design concern in addition to the traditional performance enhancement criteria. Among the different steps in the graphics processing pipeline, we have observed that memory accesses during texture mapping - a highly memory intensive phase - contribute 30-40% of the energy consumed in typical embedded graphics processors. This makes the texture mapping subsystem an attractive candidate for energy optimization. We argue that a standard cache hierarchy, commonly used by researchers and commercial graphics processors for texture mapping, is wasteful of energy, and propose the Texture Filter Memory, an energy efficient architecture that exploits locality and the relatively high degree of predictability in texture memory access patterns. Our architecture consumes 75% lesser energy for texturing in a fixed function pipeline, incurring no performance overhead and a small area overhead over conventional texture mapping hardware.","1092-3152","978-1-4244-2819-9","978-1-4244-2820-5","10.1109/ICCAD.2008.4681631","http://ieeexplore.ieee.org/stamp/stamp.jsp?arnumber=4681631","","Central Processing Unit;Computer graphics;Energy consumption;Filters;Geometry;Hardware;Layout;Memory architecture;Mobile computing;Pipelines","computer graphics;coprocessors;image texture","mobile graphics processors;texture filter memory;texture mapping","","3","","24","","","10-13 Nov. 2008","","IEEE","IEEE Conference Publications"
"Incorporating logic exclusivity (LE) constraints in noise analysis using gain guided backtracking method","Ruiming Li; Shey, A.-J.; Laudes, M.","Sun Microsyst. Inc., Santa Clara, CA","Computer-Aided Design, 2008. ICCAD 2008. IEEE/ACM International Conference on","20081118","2008","","","783","789","Crosstalk noise becomes one of the critical issues gating design closure for nano-meter designs. Pessimism in noise analysis can lead to significant additional time spent addressing false violations. Taking logic correlation into consideration, noise analysis can reduce pessimism significantly by eliminating false noise signals [1]-[3][5]-[7][10]-[13]. Eliminating the aggressors from the aggressor candidate set that can not switch simultaneously restricted by the logic exclusivity (LE) relationship among them can save simulation time as well. The LE problem, being proved as NP-complete, is basically to determine the subset (possibly multiple equivalent subsets) of a given aggressor candidate set which has the largest combined weight out of all possible subsets governed by logic exclusivity constraints. This paper presents a new approach in resolving the LE problem, which employs a gain guided backtrack search technique that does not require exhaustive search of all the binary paths to reach an optimal solution. We first prove that under certain conditions, if the gain at each level is non-negative, then the result will be optimal. Based on this theorem, a new algorithm is developed. The experimental results demonstrate the efficiency and accuracy of this approach. The algorithm can quickly find the optimal solutions for most cases from industry designs and outperforms other methods.","1092-3152","978-1-4244-2819-9","978-1-4244-2820-5","10.1109/ICCAD.2008.4681665","http://ieeexplore.ieee.org/stamp/stamp.jsp?arnumber=4681665","","Algorithm design and analysis;Analytical models;Crosstalk;Integrated circuit noise;Logic design;Noise reduction;Signal analysis;Sun;Switches;Very large scale integration","VLSI;backtracking;crosstalk;integrated circuit design;logic analysers;optimisation","NP-complete problem;crosstalk noise;false noise elimination;gain guided backtracking method;guided backtrack search technique;logic correlation;logic exclusivity constraints;nanometer designs;noise analysis","","2","","14","","","10-13 Nov. 2008","","IEEE","IEEE Conference Publications"
"NTHU-Route 2.0: A fast and stable global router","Yen-Jung Chang; Yu-Ting Lee; Ting-Chi Wang","Dept. of Comput. Sci., Nat. Tsing Hua Univ., Hsinchu","Computer-Aided Design, 2008. ICCAD 2008. IEEE/ACM International Conference on","20081118","2008","","","338","343","We present in this paper a fast and stable global router called NTHU-Route 2.0 that improves the solution quality and runtime of a state-of-the-art router, NTHU-Route, by the following enhancements: (1) a new history based cost function, (2) new ordering methods for congested region identification and rip-up and reroute, and (3) two implementation techniques. The experimental results show that NTHU-Router 2.0 solves all ISPD98 benchmarks with very good quality. Moreover, it routes 7 of 8 ISPD07 benchmarks without any overflow. In particular, for one of the ISPD07 benchmarks which are thought to be difficult cases previously, NTHU-Route 2.0 can completely eliminate its total overflow. NTHU-Route 2.0 also successfully solves 12 of 16 ISPD08 benchmarks without causing any overflow.","1092-3152","978-1-4244-2819-9","978-1-4244-2820-5","10.1109/ICCAD.2008.4681595","http://ieeexplore.ieee.org/stamp/stamp.jsp?arnumber=4681595","","Computer science;Cost function;Delay;History;Integrated circuit interconnections;Joining processes;Pins;Routing;Runtime;Very large scale integration","VLSI;integrated circuit design;network routing","ISPD07 benchmarks;ISPD98 benchmarks;NTHU-Route 2.0;VLSI design;stable global router;state-of-the-art router","","29","5","20","","","10-13 Nov. 2008","","IEEE","IEEE Conference Publications"
"SPM management using Markov chain based data access prediction","Yemliha, T.; Srikantaiah, S.; Kandemir, M.; Ozturk, O.","Syracuse Univ., Syracuse, NY","Computer-Aided Design, 2008. ICCAD 2008. IEEE/ACM International Conference on","20081118","2008","","","565","569","Leveraging the power of scratchpad memories (SPMs) available in most embedded systems today is crucial to extract maximum performance from application programs. While regular accesses like scalar values and array expressions with affine subscript functions have been tractable for compiler analysis (to be prefetched into SPM), irregular accesses like pointer accesses and indexed array accesses have not been easily amenable for compiler analysis. This paper presents an SPM management technique using Markov chain based data access prediction for such irregular accesses. Our approach takes advantage of inherent, but hidden reuse in data accesses made by irregular references. We have implemented our proposed approach using an optimizing compiler. In this paper, we also present a thorough comparison of our different dynamic prediction schemes with other SPM management schemes. SPM management using our approaches produces 12.7% to 28.5% improvements in performance across a range of applications with both regular and irregular access patterns, with an average improvement of 20.8%.","1092-3152","978-1-4244-2819-9","978-1-4244-2820-5","10.1109/ICCAD.2008.4681632","http://ieeexplore.ieee.org/stamp/stamp.jsp?arnumber=4681632","","Embedded system;Energy management;Hardware;Memory management;Pattern analysis;Power system management;Predictive models;Prefetching;Runtime;Scanning probe microscopy","Markov processes;SRAM chips;embedded systems;information retrieval;program compilers","Markov chain;SPM management;SRAM;affine subscript functions;compiler analysis;data access prediction;dynamic prediction;embedded systems;indexed array accesses;pointer accesses;scratchpad memories","","2","","22","","","10-13 Nov. 2008","","IEEE","IEEE Conference Publications"
"ICCAD 2008 - Awards","","","Computer-Aided Design, 2008. ICCAD 2008. IEEE/ACM International Conference on","20081118","2008","","","ix","ix","","1092-3152","978-1-4244-2819-9","978-1-4244-2820-5","10.1109/ICCAD.2008.4681531","http://ieeexplore.ieee.org/stamp/stamp.jsp?arnumber=4681531","","Awards","","","","0","","","","","10-13 Nov. 2008","","IEEE","IEEE Conference Publications"
"Mixed-signal simulation challenges and solutions","Chang, Henry; Walker, William; Maneatis, John G.; Croix, John","DesignerÂ¿s Guide Consulting, Los Altos, CA, USA","Computer-Aided Design, 2008. ICCAD 2008. IEEE/ACM International Conference on","20081118","2008","","","xiii","xiii","The design of complex mixed-signal system-on-a-chip (SOC) designer poses challenging requirements on the simulation design environment. The simulation platform has to include simulations at the behavioral, gate and transistor-level which have traditionally been done in separate environments. As the scaling trend continues, the designer needs additional accuracy and capacity, new capabilities such as efficient statistical simulation that takes into account layout dependent effects. In this panel we have representatives from the CAD and design community discussing the challenges and current solutions available to the mixed-signal simulation challenge.","1092-3152","978-1-4244-2819-9","978-1-4244-2820-5","10.1109/ICCAD.2008.4681539","http://ieeexplore.ieee.org/stamp/stamp.jsp?arnumber=4681539","","CMOS technology;Circuit simulation;Costs;DH-HEMTs;Design automation;Environmental economics;Moore's Law;Physics;Process design;System-on-a-chip","","","","1","","","","","10-13 Nov. 2008","","IEEE","IEEE Conference Publications"
"Correct-by-construction microarchitectural pipelining","Kam, T.; Kishinevsky, M.; Cortadella, J.; Galceran-Oms, M.","Strategic CAD Labs., Intel Corp., Oregon, OH","Computer-Aided Design, 2008. ICCAD 2008. IEEE/ACM International Conference on","20081118","2008","","","434","441","This paper presents a method for correct-by-construction microarchitectural pipelining that handles cyclic systems with dependencies between iterations. Our method combines previously known bypass and retiming transformations with a few transformations valid only for elastic systems with early evaluation (namely, empty FIFO insertion, FIFO capacity sizing, insertion of anti-tokens, and introducing early evaluation multiplexors). By converting the design to a synchronous elastic form and then applying this extended set of transformations, one can pipeline a functional specification with an automatically generated distributed controller that implements stalling logic resolving data hazards off the critical path of the design. We have developed an interactive toolkit for exploring elastic microarchitectural transformations. The method is illustrated by pipelining a few simple examples of instruction set architecture ISA specifications.","1092-3152","978-1-4244-2819-9","978-1-4244-2820-5","10.1109/ICCAD.2008.4681612","http://ieeexplore.ieee.org/stamp/stamp.jsp?arnumber=4681612","","Delay;Distributed control;Hazards;Logic;Microarchitecture;Pipeline processing;Radio frequency;Synchronous generators;Systolic arrays;Throughput","controllers;iterative methods;logic circuits;multiplexing equipment;pipeline processing","FIFO capacity sizing;anti-token insertion;automatically generated distributed controller;bypass transformations;correct-by-construction microarchitectural pipelining;cyclic systems;elastic microarchitectural transformations;empty FIFO insertion;evaluation multiplexors;interactive toolkit;iterations;logic resolving data hazards;retiming transformations","","4","","21","","","10-13 Nov. 2008","","IEEE","IEEE Conference Publications"
"MAPS: Multi-Algorithm Parallel circuit Simulation","Xiaoji Ye; Wei Dong; Peng Li; Nassif, S.","Dept. of ECE, Texas A&M Univ., College Station, TX","Computer-Aided Design, 2008. ICCAD 2008. IEEE/ACM International Conference on","20081118","2008","","","73","78","The emergence of multi-core and many-core processors has introduced new opportunities and challenges to EDA research and development. While the availability of increasing parallel computing power holds new promise to address many computing challenges in CAD, the leverage of hardware parallelism can only be possible with a new generation of parallel CAD applications. In this paper, we propose a novel multi-algorithm parallel circuit simulation approach (MAPS) and its multi-core implementation to expedite one of the most fundamental CAD applications: transistor-level transient circuit simulation. MAPS starts multiple simulation algorithms in parallel for a given simulation task. By properly synchronizing these algorithms on-the-fly, we exploit the diversity in simulation algorithms to achieve possibly superlinear overall speedup in transient simulation. In addition, our unique multi-algorithm framework allows unique safe exploration of simulation methods that are conventionally discarded due to convergence concerns. As a coarse grained parallel simulation approach, the implementation of MAPS demands a minimum of parallel programming effort and allows for reuse of existing serial simulation codes.","1092-3152","978-1-4244-2819-9","978-1-4244-2820-5","10.1109/ICCAD.2008.4681554","http://ieeexplore.ieee.org/stamp/stamp.jsp?arnumber=4681554","","Circuit simulation;Clustering algorithms;Computational modeling;Convergence;Hardware;Multicore processing;Parallel processing;Parallel programming;Runtime;Supercomputers","circuit CAD;circuit simulation;parallel programming","CAD;multi-algorithm parallel circuit simulation;multi-core implementation;parallel programming;serial simulation codes;transistor-level transient circuit simulation","","15","","23","","","10-13 Nov. 2008","","IEEE","IEEE Conference Publications"
"Optimization-based framework for simultaneous circuit-and-system design-space exploration: A high-speed link example","Sredojevic, R.; Stojanovic, V.","Dept. of Electr. Eng. & Comput. Sci., Massachusetts Inst. of Technol., Cambridge, MA","Computer-Aided Design, 2008. ICCAD 2008. IEEE/ACM International Conference on","20081118","2008","","","314","321","Connecting system-level performance models with circuit information has been a long-standing problem in analog/mixed-signal front-ends, like radios and high-speed links. High-speed links are particularly hard to analyze because of the complex interplay of device/circuit parasitics and channel filtering operation. In this paper we introduce optimization-based framework for link design-space exploration, connecting the link transmission quality and top-level filter settings with circuit power, sizing and biasing. We derive a special analytical discrete time representation that avoids the size explosion of the symbolic problem description improving the parsing and solver time by orders of magnitude and making this joint optimization possible in real-time. This robust and accurate problem formulation is derived in signomial form and is compatible with existing optimization approaches to circuit sizing. We demonstrate this optimization framework on a link design-space exploration example, investigating trade-offs between the transmit pre-emphasis and linear receiver equalizer and their impact on overall link power vs. data rate.","1092-3152","978-1-4244-2819-9","978-1-4244-2820-5","10.1109/ICCAD.2008.4681592","http://ieeexplore.ieee.org/stamp/stamp.jsp?arnumber=4681592","","Circuit optimization;Circuits and systems;Decision feedback equalizers;Design optimization;Equations;Filters;Phase locked loops;Power system modeling;Radio transmitters;Timing","filtering theory;network synthesis;optimisation","analog-mixed-signal front-ends;channel filtering;high-speed link example;optimization-based framework;simultaneous circuit-and-system design-space exploration;system-level performance models;top-level filter settings","","8","","18","","","10-13 Nov. 2008","","IEEE","IEEE Conference Publications"
"Clock buffer polarity assignment combined with clock tree generation for power/ground noise minimization","Yesin Ryu; Taewhan Kim","Sch. of Electr. Eng. & Comput. Sci., Seoul Nat. Univ., Seoul","Computer-Aided Design, 2008. ICCAD 2008. IEEE/ACM International Conference on","20081118","2008","","","416","419","A new approach to the problem of clock buffer polarity assignment for minimizing power/ground noise on the clock network is presented. The previous approaches solve the assignment problem in two separate steps: (step 1) generating a clock routing tree of minimum total wirelength, satisfying the clock skew constraint and then (step 2) inserting buffering elements with their polarities under the objective of minimizing power/ground noise while satisfying the clock skew constraint. Yet, there is no easy way to predict the result of step 2 during step 1. In our approach, we place the primary importance on the cost of power/ground noise. Consequently, we try to minimize the cost of power/ground noise first and then to construct a clock routing tree later while satisfying the clock skew constraint. Through experimentation using several benchmark circuits, it is shown that this approach is quite effective and produces very good solutions, reducing the power/ground noise by 75% and the peak current by 26% at the expense of 5% wirelength overhead compared to that produced by the conventional approach.","1092-3152","978-1-4244-2819-9","978-1-4244-2820-5","10.1109/ICCAD.2008.4681608","http://ieeexplore.ieee.org/stamp/stamp.jsp?arnumber=4681608","","Circuit noise;Clocks;Costs;Inverters;Noise generators;Noise reduction;Power generation;Power supplies;Routing;Switches","buffer circuits;clocks;network routing;trees (electrical)","benchmark circuits;clock buffer polarity assignment;clock network;clock routing tree;clock skew constraint;ground noise minimization;power noise minimization;wirelength overhead","","6","","13","","","10-13 Nov. 2008","","IEEE","IEEE Conference Publications"
"Hardware protection and authentication through netlist level obfuscation","Chakraborty, R.S.; Bhunia, S.","Dept. of Electr. Eng. & Comput. Sci., Case Western Reserve Univ., Cleveland, OH","Computer-Aided Design, 2008. ICCAD 2008. IEEE/ACM International Conference on","20081118","2008","","","674","677","Hardware intellectual property (IP) cores have emerged as an integral part of modern system-on-chip (SoC) designs. However, IP vendors are facing major challenges to protect hardware IPs and to prevent revenue loss due to IP piracy. In this paper, we propose a novel design methodology for hardware IP protection and authentication using netlist level authentication. The proposed methodology can be integrated in the SoC design and manufacturing flow to provide hardware protection to the IP vendors, the chip designer, and the system designer. Simulation results on ISCAS-89 benchmark circuits show that we can achieve high levels of security through a well-formulated obfuscation scheme at less than 10% area overhead under delay constraint.","1092-3152","978-1-4244-2819-9","978-1-4244-2820-5","10.1109/ICCAD.2008.4681649","http://ieeexplore.ieee.org/stamp/stamp.jsp?arnumber=4681649","Design for security;IP piracy;hardware authentication;hardware obfuscation;hardware protection","Authentication;Circuit simulation;Delay;Design methodology;Hardware;Intellectual property;Manufacturing;Protection;Security;System-on-a-chip","authorisation;benchmark testing;industrial property;system-on-chip","IP vendors;ISCAS-89 benchmark circuits;hardware IP protection;hardware intellectual property cores;netlist level authentication;netlist level obfuscation;system-on-chip","","19","1","16","","","10-13 Nov. 2008","","IEEE","IEEE Conference Publications"
"Double patterning technology friendly detailed routing","Minsik Cho; Yongchan Ban; Pan, D.Z.","Dept. of ECE, Univ. of Texas at Austin, Austin, TX","Computer-Aided Design, 2008. ICCAD 2008. IEEE/ACM International Conference on","20081118","2008","","","506","511","Double patterning technology (DPT) is a most likely lithography solution for 32/22 nm technology nodes as of 2008 due to the delay of extreme ultra violet lithography. However, it should hurdle two challenges before being introduced to mass production, layout decomposition and overlay error. In this paper, we present the first detailed routing algorithm for DPT to improve layout decomposability and robustness against overlay error, by minimizing indecomposable wirelength and the number of stitches. Experimental results show that the proposed approach improves the quality of layout significantly in terms of decomposability and the number of stitches with 3.6x speedup, compared with a current industrial DPT design flow.","1092-3152","978-1-4244-2819-9","978-1-4244-2820-5","10.1109/ICCAD.2008.4681622","http://ieeexplore.ieee.org/stamp/stamp.jsp?arnumber=4681622","","Bridges;Delay;Inorganic materials;Lithography;Manufacturing;Mass production;Optical sensors;Robustness;Routing;Ultraviolet sources","ultraviolet lithography","double patterning technology;extreme ultra violet lithography;layout decomposition;mass production;overlay error;routing algorithm","","24","14","17","","","10-13 Nov. 2008","","IEEE","IEEE Conference Publications"
