"http://ieeexplore.ieee.org/search/searchresult.jsp?bulkSetSize=2000&queryText%3DComputer-Aided+Design+.LB.ICCAD.RB.%2C+2008+IEEE%2FACM+International+Conference",2015/06/23 15:05:48
"Process variability-aware transient fault modeling and analysis","Chopra, K.; Cheng Zhuo; Blaauw, D.; Sylvester, D.","Electr. & Comput. Eng. Dept., Carnegie Mellon Univ., Pittsburgh, PA","Computer-Aided Design, 2008. ICCAD 2008. IEEE/ACM International Conference on","20081118","2008","","","685","690","Due to reduction in device feature size and supply voltage, the sensitivity of digital systems to transient faults is increasing dramatically. As technology scales further, the increase in transistor integration capacity also leads to the increase in process and environmental variations. Despite these difficulties, it is expected that systems remain reliable while delivering the required performance. Reliability and variability are emerging as new design challenges, thus pointing to the importance of modeling and analysis of transient faults and variation sources for the purpose of guiding the design process. This work presents a symbolic approach to modeling the effect of transient faults in digital circuits in the presence of variability due to process manufacturing. The results show that using a nominal case and not including variability effects, can underestimate the SER by 5% for the 50% yield point and by 10% for the 90% yield point.","1092-3152","978-1-4244-2819-9","978-1-4244-2820-5","10.1109/ICCAD.2008.4681651","http://ieeexplore.ieee.org/stamp/stamp.jsp?arnumber=4681651","","Circuit faults;Electromagnetic transients;Error analysis;Logic circuits;Manufacturing processes;Process design;Propagation delay;Semiconductor process modeling;Transient analysis;Voltage","Monte Carlo methods;electric breakdown;integrated circuit reliability;monolithic integrated circuits","Monte Carlo simulation;chip level gate oxide breakdown analysis;die-to-die components;distinct random variable;full-chip gate-oxide reliability analysis;integrated circuit;transformation;within-die components","","3","","20","","","10-13 Nov. 2008","","IEEE","IEEE Conference Publications"
"Efficient online computation of core speeds to maximize the throughput of thermally constrained multi-core processors","Rao, R.; Vrudhula, S.","Dept. of Comput. Sci. & Eng., Arizona State Univ., Tempe, AZ","Computer-Aided Design, 2008. ICCAD 2008. IEEE/ACM International Conference on","20081118","2008","","","537","542","We address the problem of efficient online computation of the speeds of different cores of a multi-core processor to maximize the throughput (which is expressed as a weighted sum of the speeds), subject to an upper bound on the core temperatures. We first compute the solution for steady-state thermal conditions by solving a linear program. We then present two approaches to computing the transient speed curves for each core: (i) a local solution, which involves solving a linear program every time step (of about 10 ms), and (ii) a global solution, which computes the optimal speed curve over a large time window (of about 100 s) by solving a non-linear program. We showed that the local solution is insensitive to the weights assigned in the performance objective (hence the need for the global solution). This is because a reduction in the speed of a core can only reduce the temperature of the other cores over much larger time periods (of the order of several seconds). The local solution is then completely determined by the temperature constraint equations. We show that the constraint matrix exhibits a special property - it can be expressed as the sum of a diagonal matrix and a matrix with identical rows. This allows us to solve the multi-core thermal constraint equations analytically to determine the (temporally) local optimum speeds. Further, we showed that due to this property, the steady-state speed solution selects a set of threads to operate at maximum temperature, and turns off all unused cores. Hence, to ensure that all available threads are scheduled, we impose a ldquofairnessrdquo constraint. Finally, we show how the open-loop speed control methods proposed above could be used together with a feedback controller to achieve robustness to model uncertainty.","1092-3152","978-1-4244-2819-9","978-1-4244-2820-5","10.1109/ICCAD.2008.4681627","http://ieeexplore.ieee.org/stamp/stamp.jsp?arnumber=4681627","","Adaptive control;Equations;Multicore processing;Robust control;Steady-state;Temperature;Throughput;Upper bound;Velocity control;Yarn","microprocessor chips;open loop systems","feedback controller;linear program;local solution;multicore thermal constraint equations;open-loop speed control methods;steady-state speed solution;temperature constraint equations;thermally constrained multicore processors;transient speed curves","","16","","20","","","10-13 Nov. 2008","","IEEE","IEEE Conference Publications"
"The analysis of cyclic circuits with Boolean satisfiability","Backes, J.; Fett, B.; Riedel, M.D.","Dept. of Electr. & Comput. Eng., Univ. of Minnesota, Minneapolis, MN","Computer-Aided Design, 2008. ICCAD 2008. IEEE/ACM International Conference on","20081118","2008","","","143","148","The accepted wisdom is that combinational circuits must have acyclic (i.e., loop-free or feed-forward) topologies. And yet simple examples suggest that this need not be so. In previous work, we advocated the design of cyclic combinational circuits (i.e., circuits with loops or feedback paths). We proposed a synthesis methodology and demonstrated that it produces significant improvements in area and in delay. The analysis method that we used to validate cyclic circuits was based on binary decision diagrams. In this paper, we propose a much more efficient technique for analysis based on Boolean satisfiability (SAT).","1092-3152","978-1-4244-2819-9","978-1-4244-2820-5","10.1109/ICCAD.2008.4681565","http://ieeexplore.ieee.org/stamp/stamp.jsp?arnumber=4681565","","Boolean functions;Circuit analysis;Circuit synthesis;Circuit topology;Combinational circuits;Data structures;Delay;Feedback circuits;Feedback loop;Feedforward systems","Boolean functions;binary decision diagrams;combinational circuits","Boolean satisfiability;acyclic topologies;binary decision diagrams;combinational circuits;cyclic circuits;delay;synthesis methodology","","2","","27","","","10-13 Nov. 2008","","IEEE","IEEE Conference Publications"
"Area-I/O flip-chip routing for chip-package co-design","Jia-Wei Fang; Yao-Wen Chang","Grad. Inst. of Electron. Eng., Nat. Taiwan Univ., Taipei","Computer-Aided Design, 2008. ICCAD 2008. IEEE/ACM International Conference on","20081118","2008","","","518","522","The area-I/O flip-chip package provides a high chip-density solution to the demand of more I/Opsilas in VLSI designs; it can achieve smaller package size, shorter wirelength, and better signal and power integrity. In this paper, we introduce the routing problem for chip and package co-design and present the first work in the literature to handle the multiple Re-Distribution Layer (RDL) routing problem for flip-chip designs, considering pin and layer assignment, total wirelength minimization, and chip-package co-design. Our router adopts a two-stage technique of global routing followed by RDL routing. The global routing assigns each block port to a unique bump pad via an I/O pad and decides the RDL routing among I/O pads and bump pads. Based on the minimum-cost maximum-flow algorithm, we can guarantee 100% RDL routing completion after the assignment and the optimal solution with the minimum wirelength. The RDL routing efficiently distributes the routing points between two adjacent bump pads and then generates a 100% routable sequence to complete the routing. Experimental results based on 10 industry designs demonstrate that our router can achieve 100% routability and the optimal routing wirelength under reasonable CPU times, while related works cannot.","1092-3152","978-1-4244-2819-9","978-1-4244-2820-5","10.1109/ICCAD.2008.4681624","http://ieeexplore.ieee.org/stamp/stamp.jsp?arnumber=4681624","","Design engineering;Electronics packaging;Inductance;Joining processes;Large-scale systems;Routing;Signal design;Very large scale integration","VLSI;chip scale packaging;flip-chip devices;input-output programs","VLSI designs;area-I/O flip-chip routing;bump pads;chip-package codesign;minimum-cost maximum-flow algorithm;multiple redistribution layer routing problem;routing wirelength","","12","1","8","","","10-13 Nov. 2008","","IEEE","IEEE Conference Publications"
"Advancing supercomputer performance through interconnection topology synthesis","Yi Zhu; Taylor, M.; Baden, S.B.; Cheng, C.-K.","Dept. of Comput. Sci. & Eng., Univ. of California, San Diego, CA","Computer-Aided Design, 2008. ICCAD 2008. IEEE/ACM International Conference on","20081118","2008","","","555","558","In todaypsilas many-core era, the interconnection networks have been the key factor that dominates the performance of a computer system. In this paper, we propose a design flow to discover the best topology in terms of the communication latency and physical constraints. First a set of representative candidate topologies are generated for the interconnection networks among computing chips; then an efficient multi-commodity flow algorithm is devised to evaluate the performance. The experiments show that the best topologies identified by our algorithm can achieve better average latency compared to the existing networks.","1092-3152","978-1-4244-2819-9","978-1-4244-2820-5","10.1109/ICCAD.2008.4681630","http://ieeexplore.ieee.org/stamp/stamp.jsp?arnumber=4681630","","Computer networks;Connectors;Delay;Multiprocessing systems;Multiprocessor interconnection networks;Network synthesis;Network topology;Pins;Supercomputers;Wires","logic design;mainframes;microprocessor chips;parallel machines","communication latency;computer system;computing chips;interconnection networks;interconnection topology synthesis;multi-commodity flow algorithm;physical constraints;supercomputer performance","","0","3","12","","","10-13 Nov. 2008","","IEEE","IEEE Conference Publications"
"Breaking the simulation barrier: SRAM evaluation through norm minimization","Dolecek, L.; Qazi, M.; Shah, D.; Chandrakasan, A.","Dept. of Electr. Eng. & Comput. Sci., Massachusetts Inst. of Technol., Cambridge, MA","Computer-Aided Design, 2008. ICCAD 2008. IEEE/ACM International Conference on","20081118","2008","","","322","329","With process variation becoming a growing concern in deep submicron technologies, the ability to efficiently obtain an accurate estimate of failure probability of SRAM components is becoming a central issue. In this paper we present a general methodology for a fast and accurate evaluation of the failure probability of memory designs. The proposed statistical method, which we call importance sampling through norm minimization principle, reduces the variance of the estimator to produce quick estimates. It builds upon the importance sampling, while using a novel norm minimization principle inspired by the classical theory of Large Deviations. Our method can be applied for a wide class of problems, and our illustrative examples are the data retention voltage and the read/write failure tradeoff for 6T SRAM in 32 nm technology. The method yields computational savings on the order of 10000x over the standard Monte Carlo approach in the context of failure probability estimation for SRAM considered in this paper.","1092-3152","978-1-4244-2819-9","978-1-4244-2820-5","10.1109/ICCAD.2008.4681593","http://ieeexplore.ieee.org/stamp/stamp.jsp?arnumber=4681593","","Computational modeling;Computer simulation;Discrete event simulation;Failure analysis;Minimization methods;Monte Carlo methods;Probability;Random access memory;Statistical analysis;Voltage","SRAM chips;estimation theory;failure analysis;importance sampling;minimisation","SRAM components;estimator;failure probability;importance sampling;large deviations theory;memory designs;norm minimization;read-write failure tradeoff;retention voltage;standard Monte Carlo approach;statistical method","","31","4","21","","","10-13 Nov. 2008","","IEEE","IEEE Conference Publications"
"Fault tolerant placement and defect reconfiguration for nano-FPGAs","Agarwal, A.; Cong, J.; Tagiku, B.","Dept. of Comput. Sci., Univ. of California at Los Angeles, Los Angeles, CA","Computer-Aided Design, 2008. ICCAD 2008. IEEE/ACM International Conference on","20081118","2008","","","714","721","When manufacturing nano-devices, defects are a certainty and reliability becomes a critical issue. Until now, the most pervasive methods used to address reliability, involve injecting spare resources. However, these methods use predetermined spare placement that is not optimized for each netlist. This is the first work (to the best of our knowledge) that addresses the problem of fault tolerance for nano-FPGAs at the placement stage; fault tolerant placements are generated that are amenable to fast defect reconfiguration through replacement of defective logic elements with spares. We propose a simulated-annealing based placement algorithm that produces placements with the objective of maximizing the chances of successful recovery from faults in logic elements within the circuitpsilas timing constraints. In addition, our study of the fault reconfiguration problem shows it is NP-Complete, and we propose a fast scheme for achieving a good reconfiguration solution for a random or clustered fault map. Experimental results show that these techniques can increase the probability of successful fault reconfiguration by 55% (compared to a uniform spare distribution scheme), without significantly degrading the circuit performance.","1092-3152","978-1-4244-2819-9","978-1-4244-2820-5","10.1109/ICCAD.2008.4681655","http://ieeexplore.ieee.org/stamp/stamp.jsp?arnumber=4681655","","Circuit faults;Circuit optimization;Circuit simulation;Degradation;Fault tolerance;Logic circuits;Manufacturing;Optimization methods;Reconfigurable logic;Timing","fault tolerance;field programmable gate arrays;nanoelectronics;simulated annealing;timing","circuit timing constraints;clustered fault map;defect reconfiguration;defective logic elements;fault tolerant placement;nanoFPGA;placement algorithm;simulated annealing","","3","","20","","","10-13 Nov. 2008","","IEEE","IEEE Conference Publications"
"Pulse width allocation with clock skew scheduling for optimizing pulsed latch-based sequential circuits","Hyein Lee; Seungwhun Paik; Youngsoo Shin","Dept. of Electr. Eng., KAIST, Daejeon","Computer-Aided Design, 2008. ICCAD 2008. IEEE/ACM International Conference on","20081118","2008","","","224","229","Pulsed latches, latches driven by a brief clock pulse, offer the convenience of flip-flop-like timing verification and optimization, while retaining superior design parameters of latches over flip-flops. But, pulsed latch-based design using a single pulse width has a limitation in reducing clock period. The limitation still exists even if clock skew scheduling is employed, since the amount of skew that can be assigned is practically limited due to process variations. The problem of allocating pulse width (out of discrete number of predefined widths) and scheduling clock skew (within prescribed upper bound) is formulated, for the first time, for optimizing pulsed latch-based sequential circuits. An allocation algorithm called PWCS_Optimize is proposed to solve the problem. Experiments with 65-nm technology demonstrate that small number of variety of pulse widths (up to 5) combined with clock skews (up to 10% of clock period) yield minimum clock period for many benchmark circuits. The design flow including PWCS_Optimize, placement and routing, and synthesis of local and global clock trees is presented and assessed with example circuits.","1092-3152","978-1-4244-2819-9","978-1-4244-2820-5","10.1109/ICCAD.2008.4681578","http://ieeexplore.ieee.org/stamp/stamp.jsp?arnumber=4681578","","Clocks;Design optimization;Flip-flops;Latches;Pulse circuits;Routing;Sequential circuits;Space vector pulse width modulation;Timing;Upper bound","benchmark testing;clocks;flip-flops;sequential circuits","allocation algorithm;benchmark circuits;clock skew scheduling;design flow;flip-flops;global clock trees;local clock trees;pulse width allocation;pulsed latches;routing;sequential circuits","","1","","13","","","10-13 Nov. 2008","","IEEE","IEEE Conference Publications"
"Efficient block-based parameterized timing analysis covering all potentially critical paths","Heloue, K.R.; Onaissi, S.; Najm, F.N.","Dept. of ECE, Univ. of Toronto, Toronto, ON","Computer-Aided Design, 2008. ICCAD 2008. IEEE/ACM International Conference on","20081118","2008","","","173","180","In order for the results of timing analysis to be useful, they must provide insight and guidance on how the circuit may be improved so as to fix any reported timing problems. A limitation of many recent variability-aware timing analysis techniques is that, while they report delay distributions, or verify multiple corners, they do not provide the required guidance for re-design. We propose an efficient block-based parameterized timing analysis technique that can accurately capture circuit delay at every point in the parameter space, by reporting all paths that can become critical. Using an efficient pruning algorithm, only those potentially critical paths are carried forward, while all other paths are discarded during propagation. This allows one to examine local robustness to parameters in different regions of the parameter space, not by considering differential sensitivity at a point (which would be useless in this context) but by knowledge of the paths that can become critical at nearby points in parameter space. We give a formal definition of this problem and propose a technique for solving it that improves on the state of the art, both in terms of theoretical computational complexity and in terms of run time on various test circuits.","1092-3152","978-1-4244-2819-9","978-1-4244-2820-5","10.1109/ICCAD.2008.4681570","http://ieeexplore.ieee.org/stamp/stamp.jsp?arnumber=4681570","","Circuit testing;Clocks;Computational complexity;Delay estimation;Land surface temperature;Random variables;Robustness;Signal processing;Timing;Voltage","computational complexity;critical path analysis;delays;network analysis;timing","circuit delay;computational complexity;delay distributions;efficient block-based parameterized timing analysis;potentially critical paths;variability-aware timing analysis","","6","1","10","","","10-13 Nov. 2008","","IEEE","IEEE Conference Publications"
"A capacitance solver for incremental variation-aware extraction","El-Moselhy, T.A.; Elfadel, I.M.; Daniel, L.","Res. Lab. in Electron., Massachusetts Inst. of Technol., Cambridge, MA","Computer-Aided Design, 2008. ICCAD 2008. IEEE/ACM International Conference on","20081118","2008","","","662","669","Lithographic limitations and manufacturing uncertainties are resulting in fabricated shapes on wafer that are topologically equivalent, but geometrically different from the corresponding drawn shapes. While first-order sensitivity information can measure the change in pattern parasitics when the shape variations are small, there is still a need for a high-order algorithm that can extract parasitic variations incrementally in the presence of a large number of simultaneous shape variations. This paper proposes such an algorithm based on the wellknown method of floating random walk (FRW). Specifically, we formalize the notion of random path sharing between several conductors undergoing shape perturbations and use it as a basis of a fast capacitance sensitivity extraction algorithm and a fast incremental variational capacitance extraction algorithm. The efficiency of these algorithms is further improved with a novel FRW method for dealing with layered media. Our numerical examples show a 10X speed up with respect to the boundary-element method adjoint or finite-difference sensitivity extraction, and more than 560X speed up with respect to a non-incremental FRW method for a high-order variational extraction.","1092-3152","978-1-4244-2819-9","978-1-4244-2820-5","10.1109/ICCAD.2008.4681647","http://ieeexplore.ieee.org/stamp/stamp.jsp?arnumber=4681647","","Computational complexity;Computational geometry;Conductors;Data mining;Finite difference methods;Parasitic capacitance;Random access memory;Recycling;Shape measurement;Stochastic resonance","boundary-value problems;capacitance measurement;finite difference methods;perturbation theory","boundary-element method;capacitance;capacitance solver;extraction algorithm;finite-difference sensitivity extraction;floating random walk;high-order algorithm;incremental variation-aware extraction;layered media;lithography;pattern parasitics;random path sharing;shape perturbations","","11","","13","","","10-13 Nov. 2008","","IEEE","IEEE Conference Publications"
"Table of contents","","","Computer-Aided Design, 2008. ICCAD 2008. IEEE/ACM International Conference on","20081118","2008","","","xiv","xxv","Presents the table of contents of the proceedings.","1092-3152","978-1-4244-2819-9","","10.1109/ICCAD.2008.4681541","http://ieeexplore.ieee.org/stamp/stamp.jsp?arnumber=4681541","","","","","","0","","","","","10-13 Nov. 2008","","IEEE","IEEE Conference Publications"
"STEEL: A technique for stress-enhanced standard cell library design","Cline, B.T.; Joshi, V.; Sylvester, D.; Blaauw, D.","Dept. of Electr. Eng. & Comput. Sci., Univ. of Michigan, Ann Arbor, MI","Computer-Aided Design, 2008. ICCAD 2008. IEEE/ACM International Conference on","20081118","2008","","","691","697","Mobility degradation and device scaling limitations have led process engineers to develop new techniques that introduce mechanical stress in MOSFET channels, which results in enhanced carrier transport. New fabrication steps strive to increase carrier mobility which, consequently, increases both I<sub>on</sub> and I<sub>off</sub> in CMOS devices. However, most stress-enhancement techniques are dependent on layout parameters and their effects can be exploited within standard cell library design. In this work, we propose a new standard cell library design methodology that shares V<sub>DD</sub> and V<sub>SS</sub> source/drain connections across standard cell boundaries. Such sharing allows for increased channel stress in both the corresponding device as well as its neighboring devices. Using an industrial 65 nm process and standard cell library, we show that our standard cell design methodology can be seamlessly integrated into current, state-of-the-art digital IC design flows. The new shared source/ drain technique improves critical path delay by 11% on average over a number of benchmarks for only a ~35% increase in leakage. Furthermore, stress-enhanced standard cell libraries offer a superior power/ delay tradeoff compared to dual-V<sub>th</sub> across a wide range of operating points with reduced manufacturing costs. Specifically, our stress-enhanced library (with a single V<sub>th</sub>) consumes ~2.5X less leakage than its dual-V<sub>th</sub> counterpart.","1092-3152","978-1-4244-2819-9","978-1-4244-2820-5","10.1109/ICCAD.2008.4681652","http://ieeexplore.ieee.org/stamp/stamp.jsp?arnumber=4681652","","Degradation;Delay;Design methodology;Digital integrated circuits;Fabrication;MOSFET circuits;Manufacturing;Software libraries;Steel;Stress","CMOS integrated circuits;MOSFET;carrier mobility;electrical faults","MOSFET channels;carrier mobility;carrier transport;channel stress;critical path delay;digital IC design;mechanical stress;source-drain connections;stress-enhanced standard cell library design","","4","","16","","","10-13 Nov. 2008","","IEEE","IEEE Conference Publications"
"What can brain researchers learn from computer engineers and vice versa?","Chklovskii, Dmitri","Janelia Farm, Howard Hughes Medical Institute, Ashburn, VA, USA","Computer-Aided Design, 2008. ICCAD 2008. IEEE/ACM International Conference on","20081118","2008","","","x","x","The human brain is a network containing a hundred billion neurons, each communicating with several thousand others. As the wiring for neuronal communication draws on limited space and energy resources, evolution had to optimize their use. This principle of minimizing wiring costs, similar to that in computer design, explains many features of brain architecture, including placement and shape of many neurons. However, the shape of some neurons and their synaptic properties remained unexplained. This led us to the principle of maximization of brain’s ability to store information. Combination of the two principles provides a systematic view of brain architecture, necessary to explain brain function. It would be interesting to see whether advances in understanding brain function will make impact on computer design.","1092-3152","978-1-4244-2819-9","978-1-4244-2820-5","10.1109/ICCAD.2008.4681533","http://ieeexplore.ieee.org/stamp/stamp.jsp?arnumber=4681533","","Application specific integrated circuits;Biomedical engineering;Cellular phones;Costs;Holography;Liquid crystal displays;Mass production;Neurons;Portable computers;Thin film transistors","","","","0","","","","","10-13 Nov. 2008","","IEEE","IEEE Conference Publications"
