"http://ieeexplore.ieee.org/search/searchresult.jsp?bulkSetSize=2000&queryText%3D.LB..QT.Publication+Title.QT.%3ANetworks+on+Chip+.LB.NoCS.RB.%2C+2014+Seventh+IEEE%2FACM+International+Symposium+on.RB.",2015/07/17 18:46:56
"Sampling-based approaches to accelerate network-on-chip simulation","Wenbo Dai; Jerger, N.E.","Edward S. Rogers Sr. Dept. of Electr. & Comput. Eng., Univ. of Toronto, Toronto, ON, Canada","Networks-on-Chip (NoCS), 2014 Eighth IEEE/ACM International Symposium on","20150115","2014","","","41","48","Architectural complexity continues to grow as we consider the large design space of multiple cores, cache architectures, networks-on-chip (NoC) and memory controllers. Simulators are growing in complexity to reflect these system components. However, many full-system simulators fail to utilize the underlying hardware resources such as multiple cores; consequently, simulation times have grown significantly. Long turnaround times limit the range and depth of design space exploration. Communication has emerged as a first class design consideration and has led to significant research into NoCs. NoC is yet another component of the architecture that must be faithfully modeled in simulation. Here, we focus on accelerating NoC simulation through the use of sampling techniques. We propose NoCLabs and NoCPoint, two sampling methodologies utilizing statistical sampling theory and traffic phase behavior, respectively. Experimental results show that NoCLabs and NoCPoint estimate NoC performance with an average error of 7% while achieving one order of magnitude speedup.","","","","10.1109/NOCS.2014.7008760","http://ieeexplore.ieee.org/stamp/stamp.jsp?arnumber=7008760","","Accuracy;Sea measurements;Sociology;Statistics;Synchronization;Vectors","integrated circuit modelling;network-on-chip;sampling methods","NoCLabs;NoCPoint;architectural complexity;network-on-chip simulation;sampling methodology;sampling techniques;statistical sampling theory;traffic phase behavior","","0","","32","","","17-19 Sept. 2014","","IEEE","IEEE Conference Publications"
"[Front cover]","","","Networks on Chip (NoCS), 2013 Seventh IEEE/ACM International Symposium on","20130715","2013","","","1","1","The following topics are dealt with: network routing; fault tolerance and reliability; network-on-chip; and network architecture.","","978-1-4673-6491-1","978-1-4673-6492-8","10.1109/NoCS.2013.6558398","http://ieeexplore.ieee.org/stamp/stamp.jsp?arnumber=6558398","","","fault tolerance;network routing;network-on-chip","fault tolerance;network architecture;network routing;network-on-chip;reliability","","0","","","","","21-24 April 2013","","IEEE","IEEE Conference Publications"
"[Copyright notice]","","","Networks-on-Chip (NoCS), 2014 Eighth IEEE/ACM International Symposium on","20150115","2014","","","1","1","Presents the copyright for this conference publication.","","","","10.1109/NOCS.2014.7008749","http://ieeexplore.ieee.org/stamp/stamp.jsp?arnumber=7008749","","","","","","0","","","","","17-19 Sept. 2014","","IEEE","IEEE Conference Publications"
"Towards compelling cases for the viability of silicon-nanophotonic technology in future manycore systems","Ramini, L.; Tatenguem Fankem, H.; Ghiribaldi, A.; Grani, P.; Ortin-Obon, M.; Boos, A.; Bartolini, S.","Univ. of Ferrara, Ferrara, Italy","Networks-on-Chip (NoCS), 2014 Eighth IEEE/ACM International Symposium on","20150115","2014","","","170","171","Many crossbenchmarking results reported in the open literature provide optimistic expectations on the use of optical networks-on-chip (ONoCs) for high-performance and low-power on-chip communication in future manycore systems. The goal of this paper is to highlight key methodological steps for a realistic assessment of the emerging nanophotonic technology. Building on this methodology, the paper provides an accurate energy efficiency comparison between an ONoC and an ENoC counterpart both at the level of the system interconnect and of the system as a whole. As a result, the paper points out the most promising directions for the development of the technology for the sake of practical relevance, and confirms that the technology has potential based on a characterization methodology with uncommon cross-layer visibility.","","","","10.1109/NOCS.2014.7008778","http://ieeexplore.ieee.org/stamp/stamp.jsp?arnumber=7008778","","Fabrics;Optical fiber networks;Optical interconnections;Optical modulation;Optical waveguides;Synchronization;Through-silicon vias","integrated optoelectronics;nanophotonics;network-on-chip;silicon","ONoC;Si;energy efficiency;low-power on-chip communication;manycore systems;optical networks-on-chip;silicon-nanophotonic technology;uncommon cross-layer visibility","","0","","8","","","17-19 Sept. 2014","","IEEE","IEEE Conference Publications"
"DiAMOND:Distributed alteration of messages for on-chip network debug","Abdel-Khalek, R.; Bertacco, V.","Comput. Sci. & Eng. Dept., Univ. of Michigan, Ann Arbor, MI, USA","Networks-on-Chip (NoCS), 2014 Eighth IEEE/ACM International Symposium on","20150115","2014","","","127","134","During emulation and post-silicon validation of networks-on-chip (NoCs), lack of observability of internal operations hinders the detection and debugging of functional bugs. Verifying the correctness of the control-flow portion of the NoC requires tests that exercise its functionality, while abstracting the data content of traffic. We propose a methodology where network packets are repurposed for the storage of debug information collected during execution. Debug data pertaining to each packet is collected at routers along its path and stored by replacing the packet's original data content. Our solution is coupled with a detection scheme consisting of small checkers that monitor execution and flag bugs. Upon bug detection, we analyze the debug information to reconstruct network traffic.We also provide relevant statistics for debugging, such as packet interactions and packet latencies, per router. In our experiments, this approach allows us to reconstruct over 80% of the packets' routes. Moreover, the obtained statistics facilitate debugging erroneous network behavior and identifying performance bottlenecks.","","","","10.1109/NOCS.2014.7008771","http://ieeexplore.ieee.org/stamp/stamp.jsp?arnumber=7008771","","Buffer storage;Computer bugs;Data collection;Emulation;Ports (Computers);Radiation detectors;System-on-chip","network routing;network-on-chip;program debugging","NoC;bug detection;control-flow portion;data content;debug data;debug information;debugging;detection scheme;distributed alteration of messages for on-chip network debug;functional bugs;internal operations observability;network traffic;networks-on-chip;packet interactions;packet latencies;routers","","0","","15","","","17-19 Sept. 2014","","IEEE","IEEE Conference Publications"
"Towards stochastic delay bound analysis for Network-on-Chip","Zhonghai Lu; Yuan Yao; Yuming Jiang","KTH R. Inst. of Technol., Stockholm, Sweden","Networks-on-Chip (NoCS), 2014 Eighth IEEE/ACM International Symposium on","20150115","2014","","","64","71","We propose stochastic performance analysis in order to provide probabilistic quality-of-service guarantees in on-chip packet-switching networks. In contrast to deterministic analysis which gives per-flow absolute delay bound, stochastic analysis derives per-flow probabilistic delay bounding function, which can be used to avoid over-dimensioning network resources. Based on stochastic network calculus, we build a basic analytic model for an on-chip router, propose and exemplify a stochastic performance analysis flow. In experiments, we show the correctness and accuracy of our analysis, and exhibit its potential in enhancing network utilization with a relaxed delay requirement. Moreover, the benefits of such relaxation is demonstrated through a video playback application.","","","","10.1109/NOCS.2014.7008763","http://ieeexplore.ieee.org/stamp/stamp.jsp?arnumber=7008763","","Analytical models;Calculus;Delays;Interference;Servers;Stochastic processes;System-on-chip","network-on-chip;packet switching;quality of service;stochastic processes","network-on-chip;on-chip packet-switching networks;on-chip router;over-dimensioning network;probabilistic quality-of-service;stochastic delay bound analysis","","0","","33","","","17-19 Sept. 2014","","IEEE","IEEE Conference Publications"
"Dynamic traffic distribution among hierarchy levels in hierarchical Networks-on-Chip (NoCs)","Manevich, R.; Cidon, I.; Kolodny, A.","Electr. Eng. Dept., Technion - Israel Inst. of Technol., Haifa, Israel","Networks on Chip (NoCS), 2013 Seventh IEEE/ACM International Symposium on","20130715","2013","","","1","8","As the number of modules grows, performance scalability of planar topology Networks-on-Chip (NoCs) becomes limited due to the increasing hop-distances. The growing hop-distance affects both end-to-end network latency and overall network saturation. Hierarchical topologies provide better traffic hop distance and therefore are more adequate for large systems. However, the introduction of hierarchical NoCs offers new challenges. In particular, how to distribute the traffic among the hierarchy levels to effectively utilize the hierarchical structure. In this paper we propose a dynamic traffic distribution scheme that adapts traffic distribution among the hierarchy levels to the changing traffic conditions. We evaluate our scheme with packet-accurate simulations and show that it enables to realize the potential of hierarchical NoCs in latency reduction under both light and heavy traffic loads.","","978-1-4673-6491-1","978-1-4673-6492-8","10.1109/NoCS.2013.6558412","http://ieeexplore.ieee.org/stamp/stamp.jsp?arnumber=6558412","Adaptive routing;Hierarchical networks on chip","Bandwidth;Measurement;Ports (Computers);Routing;Telecommunication traffic;Topology;Traffic control","circuit simulation;integrated circuit reliability;network routing;network topology;network-on-chip","adaptive routing;dynamic traffic distribution;end-to-end network latency;heavy traffic load;hierarchical NoC;hierarchical networks-on-chip;hierarchical structure;hierarchical topology;hierarchy level;latency reduction;light traffic load;network saturation;packet-accurate simulation;performance scalability;planar topology;traffic condition;traffic hop distance","","0","","22","","","21-24 April 2013","","IEEE","IEEE Conference Publications"
"A deadlock-free routing algorithm requiring no virtual channel on 3D-NoCs with partial vertical connections","Jinho Lee; Kiyoung Choi","Sch. of Electr. Eng. & Comput. Sci., Seoul Nat. Univ., Seoul, South Korea","Networks on Chip (NoCS), 2013 Seventh IEEE/ACM International Symposium on","20130715","2013","","","1","2","Elevator-first routing algorithm has been introduced for partially connected 3D network-on-chips, as a low-cost, distributed and deadlock-free routing algorithm using two virtual channels. This paper proposes Redelf, a modification of the elevator-first routing algorithm on a 3D mesh topology. The proposed algorithm requires no virtual channel to ensure deadlock-freedom.","","978-1-4673-6491-1","978-1-4673-6492-8","10.1109/NoCS.2013.6558407","http://ieeexplore.ieee.org/stamp/stamp.jsp?arnumber=6558407","3D stacking;NoC;deadlock;routing algorithm","Algorithm design and analysis;Computer architecture;Elevators;Network topology;Routing;System recovery;Topology","network-on-chip;topology","3D NoC;3D mesh topology;deadlock free routing algorithm;deadlock freedom;elevator first routing algorithm;partial vertical connection;partially connected 3D network on chips;virtual channel","","0","","7","","","21-24 April 2013","","IEEE","IEEE Conference Publications"
"GCA: Global congestion awareness for load balance in Networks-on-Chip","Ramakrishna, M.; Gratz, P.V.; Sprintson, A.","Dept. of Electr. & Comput. Eng., Texas A&M Univ., College Station, TX, USA","Networks on Chip (NoCS), 2013 Seventh IEEE/ACM International Symposium on","20130715","2013","","","1","8","As modern CMPs scale to ever increasing core counts, Networks-on-Chip (NoCs) are emerging as an interconnection fabric, enabling communication between components. While NoCs provide high and scalable bandwidth, current routing algorithms, such as dimension-ordered routing, suffer from poor load balance, leading to reduced throughput and high latencies. Improving load balance, hence, is critical in future CMP designs where increased latency leads to wasted power and energy waiting for outstanding requests to resolve. Adaptive routing is a known technique to improve load balance, however, prior adaptive routing techniques either use local or regionally aggregated information to form their routing decisions. This paper proposes a new, light-weight, adaptive routing algorithm for on-chip routers based on global link state and congestion information, Global Congestion Awareness (GCA). GCA uses a simple, low-complexity route calculation unit, to calculate paths to their destination without the myopia of local decisions, nor the aggregation of unrelated status information, found in prior designs. In particular GCA outperforms local adaptive routing by 26%, Regional Congestion Awareness (RCA) by 15%, and a recent competing adaptive routing algorithm, DAR, by 8% on average on realistic workloads.","","978-1-4673-6491-1","978-1-4673-6492-8","10.1109/NoCS.2013.6558405","http://ieeexplore.ieee.org/stamp/stamp.jsp?arnumber=6558405","","Algorithm design and analysis;Complexity theory;Computer architecture;Measurement;Ports (Computers);Routing;Vectors","network routing;network-on-chip","CMP design;GCA;NoC;RCA;adaptive routing;congestion information;dimension-ordered routing;global congestion awareness;global link state;light-weight algorithm;load balance;network-on-chip;on-chip router;regional congestion awareness","","3","","17","","","21-24 April 2013","","IEEE","IEEE Conference Publications"
"QuT: A low-power optical Network-on-Chip","Hamedani, P.K.; Jerger, N.E.; Hessabi, S.","Edward S. Rogers Sr. Dept. of Electr. & Comput. Eng., Univ. of Toronto, Toronto, ON, Canada","Networks-on-Chip (NoCS), 2014 Eighth IEEE/ACM International Symposium on","20150115","2014","","","80","87","To enable the adoption of optical Networks-on-Chip (NoCs) and allow them to scale to large systems, they must be designed to consume less power and energy. Therefore, optical NoCs must use a small number of wavelengths, avoid excessive insertion loss and reduce the number of microring resonators. We propose the Quartern Topology (QuT), a novel low-power all-optical NoC. We also propose a deterministic wavelength routing algorithm based on Wavelength Division Multiplexing that allows us to reduce the number of wavelengths and microring resonators in optical routers. The key advantages of QuT network are simplicity and lower power consumption. We compare QuT against three alternative all-optical NoCs: optical Spidergon, λ-router and Corona under different synthetic traffic patterns. QuT demonstrates good scalability with significantly lower power and competitive latency. Our optical topology reduces power by 23%, 86.3% and 52.7% compared with 128-node optical Spidergon, λ-router and Corona, respectively.","","","","10.1109/NOCS.2014.7008765","http://ieeexplore.ieee.org/stamp/stamp.jsp?arnumber=7008765","","Corona;Optical buffering;Optical modulation;Optical resonators;Optical sensors;Optical switches;Optical waveguides","low-power electronics;network routing;network-on-chip;optical interconnections;wavelength assignment;wavelength division multiplexing","QuT network;deterministic wavelength routing algorithm;low-power all-optical NoC;optical networks-on-chip;optical routers;quartern topology;synthetic traffic patterns;wavelength division multiplexing","","0","","31","","","17-19 Sept. 2014","","IEEE","IEEE Conference Publications"
"CLAP: a crosstalk and loss analysis platform for optical interconnects","Nikdast, M.; Duong, L.H.K.; Jiang Xu; Le Beux, S.; Xiaowen Wu; Zhehui Wang; Peng Yang; Yaoyao Ye","Hong Kong Univ. of Sci. & Technol., Hong Kong, China","Networks-on-Chip (NoCS), 2014 Eighth IEEE/ACM International Symposium on","20150115","2014","","","172","173","Basic photonic devices in inter- and intra-chip optical networks suffer from inevitable power loss and crosstalk noise. Incoherent crosstalk introduces quick power fluctuations, while coherent crosstalk varies the optical power of the optical signal in optical interconnection networks (OINs). As a result, the accumulative crosstalk in large scale OINs considerably hurts the signal-to-noise ratio (SNR) and imposes high power penalties. In this work, we aim at studying the worst-case incoherent and coherent crosstalk in OINs at the system level. The proposed analytical models are integrated into a newly developed crosstalk and loss analysis platform, called CLAP, to facilitate the SNR analyses in arbitrary OINs.","","","","10.1109/NOCS.2014.7008779","http://ieeexplore.ieee.org/stamp/stamp.jsp?arnumber=7008779","","Crosstalk;Optical crosstalk;Optical fiber networks;Optical losses;Optical noise;Optical receivers;Optical waveguides","crosstalk;integrated optoelectronics;optical interconnections","CLAP;SNR analyses;coherent crosstalk;crosstalk and loss analysis platform;optical interconnection networks;signal-to-noise ratio","","0","","7","","","17-19 Sept. 2014","","IEEE","IEEE Conference Publications"
"Centralized buffer router: A low latency, low power router for high radix NOCs","Hassan, S.M.; Yalamanchili, S.","","Networks on Chip (NoCS), 2013 Seventh IEEE/ACM International Symposium on","20130715","2013","","","1","8","While router buffers have been used as performance multipliers, they are also major consumers of area and power in on-chip networks. In this paper, we propose centralized elastic bubble router - a router micro-architecture based on the use of centralized buffers (CB) with elastic buffered (EB) links. At low loads, the CB is power gated, bypassed, and optimized to produce single cycle operation. A novel extension to bubble flow control enables routing deadlock and message dependent deadlock to be avoided with the same mechanism having constant buffer size per router independent of the number of message types. This solution enables end-to-end latency reduction via high radix switches with low overall buffer requirements. Comparisons made with other low latency routers across different topologies show consistent performance improvement, for example 26% improvement in no load latency of a 2D Mesh and 4X improvement in saturation throughput in a 2D-Generalized Hypercube.","","978-1-4673-6491-1","978-1-4673-6492-8","10.1109/NoCS.2013.6558397","http://ieeexplore.ieee.org/stamp/stamp.jsp?arnumber=6558397","","Pipelines;Ports (Computers);Resource management;Routing;System recovery;System-on-chip;Throughput","network routing;network-on-chip","2D-generalized hypercube;bubble flow control;centralized buffer router;centralized elastic bubble router;elastic buffered links;end-to-end latency reduction;high radix NOC;low power router;on-chip network;performance multiplier;router microarchitecture","","4","","25","","","21-24 April 2013","","IEEE","IEEE Conference Publications"
"Dynamic synchronizer flip-flop performance in FinFET technologies","Buckler, M.; Vaidya, A.; Xiaobin Liu; Burleson, W.","AMD Res., Boxborough, MA, USA","Networks-on-Chip (NoCS), 2014 Eighth IEEE/ACM International Symposium on","20150115","2014","","","104","110","The use of fine-grain Dynamic Voltage and Frequency Scaling (DVFS) has increased the number of distinct clock domains on a given Network-on-Chip (NoC). This necessitates robust synchronizers to prevent clock domain communication failures, even as FinFET devices have begun to replace planar devices. This paper presents simulation results and comparisons between dynamic (requiring reset) and non-dynamic synchronizer flip-flops implemented in predictive models for both planar technologies and future FinFET technologies. Results demonstrate that synchronizers built with FinFET devices 1) exhibit a tau value which continues to scale with fan-out of four delay and 2) can be improved with forward biasing, but 3) are more sensitive to temperature. Dynamic flip-flops settled metastability fastest when using standard technology voltages, but previously couldn't be used in non-dynamic systems. For this reason, a new synchronizer design is also presented which exploits the benefits of dynamic flip-flops without the need for a dedicated reset signal.","","","","10.1109/NOCS.2014.7008768","http://ieeexplore.ieee.org/stamp/stamp.jsp?arnumber=7008768","FinFET;GALS;Metastability;NoC;Synchronizers","Delays;FinFETs;Integrated circuit modeling;Inverters;Simulation;Synchronization;Temperature sensors","MOSFET;flip-flops;network-on-chip","DVFS;FinFET technology;dynamic flip-flops;dynamic synchronizer;dynamic voltage and frequency scaling;flip-flop performance;forward biasing;planar technology;predictive models;tau value","","0","","23","","","17-19 Sept. 2014","","IEEE","IEEE Conference Publications"
"[Front cover]","","","Networks-on-Chip (NoCS), 2014 Eighth IEEE/ACM International Symposium on","20150115","2014","","","c1","c1","Presents the front cover of the proceedings record.","","","","10.1109/NOCS.2014.7008747","http://ieeexplore.ieee.org/stamp/stamp.jsp?arnumber=7008747","","","","","","0","","","","","17-19 Sept. 2014","","IEEE","IEEE Conference Publications"
"Author index","","","Networks-on-Chip (NoCS), 2014 Eighth IEEE/ACM International Symposium on","20150115","2014","","","194","195","Presents an index of the authors whose articles are published in the conference proceedings record.","","","","10.1109/NOCS.2014.7008790","http://ieeexplore.ieee.org/stamp/stamp.jsp?arnumber=7008790","","","","","","0","","","","","17-19 Sept. 2014","","IEEE","IEEE Conference Publications"
"ElastiNoC: A self-testable distributed VC-based Network-on-Chip architecture","Seitanidis, I.; Psarras, A.; Kalligeros, E.; Nicopoulos, C.; Dimitrakopoulos, G.","Electr. & Comput. Eng., Democritus Univ. of Thrace, Xanthi, Greece","Networks-on-Chip (NoCS), 2014 Eighth IEEE/ACM International Symposium on","20150115","2014","","","135","142","Network-on-Chip (NoC) design tries to keep a balance between network performance and physical implementation flexibility. The adoption of Virtual Channels (VC) holds promise for scalable NoC design. VCs allow for traffic separation and isolation, enable deadlock avoidance and improve network performance. In this paper, we present ElastiNoC, a novel distributed VC-based router architecture that enjoys all the benefits offered by VCs and leads to efficient silicon-aware implementations. The proposed architecture utilizes an efficient buffering strategy and allows for modular pipelined organizations that increase the clock frequency. Moreover, it offers maximum freedom in terms of physical placement, by allowing the NoC components to be physically spread throughout the chip, irrespective of the network topology. The combined effect of all supported features enables significant delay reductions under equal performance, when compared to state-of-the-art VC-based NoC implementations. Moreover, the careful addition of self-test structures allows ElastiNoC to enjoy fully distributed Built-In Self Testability (BIST), where testing unfolds in phases and reaches high fault coverage with small test application time.","","","","10.1109/NOCS.2014.7008772","http://ieeexplore.ieee.org/stamp/stamp.jsp?arnumber=7008772","","Clocks;Delays;Pipeline processing;Ports (Computers);Registers;Resource management;Routing","built-in self test;integrated circuit design;network routing;network-on-chip;pipeline processing","BIST;ElastiNoC;built-in self testability;delay reductions;fault coverage;modular pipelined organizations;network performance;network-on-chip design;novel distributed VC-based router architecture;physical implementation flexibility;physical placement;scalable NoC design;self-test structures;silicon-aware implementations;virtual channels","","0","","30","","","17-19 Sept. 2014","","IEEE","IEEE Conference Publications"
"Physical planning for the architectural exploration of large-scale chip multiprocessors","de San Pedro, J.; Nikitin, N.; Cortadella, J.; Petit, J.","Univ. Politec. de Catalunya, Barcelona, Spain","Networks on Chip (NoCS), 2013 Seventh IEEE/ACM International Symposium on","20130715","2013","","","1","2","This paper presents an integrated flow for architectural exploration and physical planning of large-scale hierarchical tiled CMPs. Classical floorplanning and wire planning techniques have been adapted to incorporate layout constraints that enforce regularity in the interconnect networks. Routing is performed on top of memories and components that underutilize the available metal layers for interconnectivity. The experiments demonstrate the impact of physical parameters in the selection of the most efficient architectures. Thus, the integrated flow contributes to deliver physically-viable architectures and simplify the complex design closure of large-scale CMPs.","","978-1-4673-6491-1","978-1-4673-6492-8","10.1109/NoCS.2013.6558399","http://ieeexplore.ieee.org/stamp/stamp.jsp?arnumber=6558399","","Analytical models;Computer architecture;Estimation;Metals;Planning;Throughput;Wires","circuit layout;microprocessor chips;multiprocessor interconnection networks;network routing","CMP;architectural exploration;floorplanning;interconnect networks;large-scale chip multiprocessors;layout constraints;physical planning;routing;wire planning","","0","","8","","","21-24 April 2013","","IEEE","IEEE Conference Publications"
