"http://ieeexplore.ieee.org/search/searchresult.jsp?bulkSetSize=2000&queryText%3D.LB..QT.Publication+Title.QT.%3ANetworks+on+Chip+.LB.NoCS.RB.%2C+2014+Seventh+IEEE%2FACM+International+Symposium+on.RB.",2015/07/17 18:46:56
"Sharing and placement of on-chip laser sources in silicon-photonic NoCs","Chao Chen; Tiansheng Zhang; Contu, P.; Klamkin, J.; Coskun, A.K.; Joshi, A.","Electr. & Comput. Eng. Dept., Boston Univ., Boston, MA, USA","Networks-on-Chip (NoCS), 2014 Eighth IEEE/ACM International Symposium on","20150115","2014","","","88","95","Silicon-photonic links are projected to replace the electrical links for global on-chip communications in future manycore systems. The use of off-chip laser sources to drive these silicon-photonic links can lead to higher link losses, thermal mismatch between laser source and on-chip photonic devices, and packaging challenges. Therefore, on-chip laser sources are being evaluated as candidates to drive the on-chip photonic links. In this paper, we first explore the power, efficiency and temperature tradeoffs associated with an on-chip laser source. Using a 3D stacked system that integrates a manycore chip with the optical devices and laser sources, we explore the design space for laser source sharing (among waveguides) and placement to minimize laser power by simultaneously considering the network bandwidth requirements, thermal constraints, and physical layout constraints. As part of this exploration we consider Clos and crossbar logical topologies, U-shaped and W-shaped physical layouts, and various sharing/placement strategies: locally-placed dedicated laser sources for waveguides, locally-placed shared laser sources, and shared laser sources placed remotely along the chip edges. Our analysis shows that logical topology, physical layout, and photonic device losses strongly drive the laser source sharing and placement choices to minimize laser power.","","","","10.1109/NOCS.2014.7008766","http://ieeexplore.ieee.org/stamp/stamp.jsp?arnumber=7008766","","Laser modes;Laser theory;Optical waveguides;Photonics;Power lasers;System-on-chip;Waveguide lasers","integrated circuit layout;lasers;network-on-chip;optical interconnections;three-dimensional integrated circuits","3D stacked system;electrical links;global on-chip communications;on-chip laser sources placement;on-chip laser sources sharing;on-chip photonic device;optical devices;optical waveguides;physical layout constraints;silicon photonic NoC","","1","","40","","","17-19 Sept. 2014","","IEEE","IEEE Conference Publications"
"Augmenting manycore programmable accelerators with photonic interconnect technology for the high-end embedded computing domain","Balboni, M.; Ortin Obon, M.; Capotondi, A.; Fankem Tatenguem, H.; Ghiribaldi, A.; Ramini, L.; Vinal, V.; Marongiu, A.; Bertozzi, D.","Univ. of Ferrara, Ferrara, Italy","Networks-on-Chip (NoCS), 2014 Eighth IEEE/ACM International Symposium on","20150115","2014","","","72","79","There is today consensus on the fact that optical interconnects can relieve bandwidth density concerns at integrated circuit boundaries. However, when it comes to the extension of this emerging interconnect technology to on-chip communication as well, such consensus seems to fall apart. The main reason consists of a fundamental lack of compelling cases proving the superior performance and/or energy properties yielded by devices of practical interest, when re-architected around a photonically-integrated communication fabric. This paper takes its steps from the consideration that manycore computing platforms are gaining momentum in the high-end embedded computing domain in the form of general-purpose programmable accelerators. Hence, the performance and energy implications when augmenting these devices with optical interconnect technology are derived by means of an accurate benchmarking framework against an aggressively optimized electrical counterpart.","","","","10.1109/NOCS.2014.7008764","http://ieeexplore.ieee.org/stamp/stamp.jsp?arnumber=7008764","","Computer architecture;Optical buffering;Optical interconnections;Optical switches;Parallel processing;System-on-chip","electronic engineering computing;integrated optoelectronics;microprocessor chips;optical interconnections","bandwidth density concern;general-purpose programmable accelerator;high-end embedded computing domain;integrated circuit boundary;manycore computing platform;manycore programmable accelerator;on-chip communication;optical interconnect technology;photonic interconnect technology;photonically-integrated communication fabric","","0","","46","","","17-19 Sept. 2014","","IEEE","IEEE Conference Publications"
"3D logarithmic interconnect: Stacking multiple L1 memory dies over multi-core clusters","Azarkhish, E.; Loi, I.; Benini, L.","DEI, Univ. of Bologna, Bologna, Italy","Networks on Chip (NoCS), 2013 Seventh IEEE/ACM International Symposium on","20130715","2013","","","1","2","In this paper we propose two synthesizable 3D network architectures: C-LIN and D-LIN, which allow modular stacking of multiple L1 memory dies over a multi-core cluster with a limited number of processing elements (PEs). Two Through Silicon Via (TSV) technologies are used: the state of the art Micro-bumps and the promising and dense Cu-Cu Direct Bonding, with consideration of the ESD protection circuits. Our results demonstrate that, in processor-to-L1-memory context, C-LIN and D-LIN perform significantly better than traditional network on chips and simple time-division multiplexing buses, and they achieve comparable speed vs. their 2D counterparts, while enabling modularity: from 256KB to 2MB L1 memory configurations with a single mask set.","","978-1-4673-6491-1","978-1-4673-6492-8","10.1109/NoCS.2013.6558394","http://ieeexplore.ieee.org/stamp/stamp.jsp?arnumber=6558394","","Bonding;Context;Decoding;Integrated circuit interconnections;Silicon;Stacking;System-on-chip","electrostatic discharge;integrated circuit bonding;integrated circuit interconnections;memory architecture;multiprocessing systems;three-dimensional integrated circuits","3D logarithmic interconnect;C-LIN;Cu;D-LIN;ESD protection circuit;L1 memory dies;PE;TSV technology;direct bonding;memory configuration;microbump;modular stacking;multicore cluster;processing element;processor-to-L1-memory context;single mask set;synthesizable 3D network architecture;through silicon via technology","","1","","8","","","21-24 April 2013","","IEEE","IEEE Conference Publications"
"Using packet information for efficient communication in NoCs","Venkatesh Rengasamy, P.; Mutyam, M.","PACE Lab., IIT Madras, Chennai, India","Networks-on-Chip (NoCS), 2014 Eighth IEEE/ACM International Symposium on","20150115","2014","","","143","150","Multithreaded workloads like SPLASH2 and PARSEC generate heavy network traffic. This traffic consists of different packets injected by various nodes at various points of time. A packet consists of three essential components viz., source, destination and data. In this work, we study the opportunity to increase the efficiency of the underlying network. We come up with novel methods to share various components of the packets present in a router at any time. We provide an analysis of the performance gains over contemporary optimization techniques. We conduct experiments on a 64 node setup as well as a 512 node setup and record the energy consumption, IPC gains, network latency and throughputs. We show that our technique outperforms the contemporary Hamiltonian routing by 8.43% and VCTM routing by 7.7% on an average, in terms of IPC speedup.","","","","10.1109/NOCS.2014.7008773","http://ieeexplore.ieee.org/stamp/stamp.jsp?arnumber=7008773","","Benchmark testing;Coherence;Optimization;Ports (Computers);Routing;Three-dimensional displays;Unicast","low-power electronics;network routing;network-on-chip;optimisation","IPC gains;IPC speedup;NoC;PARSEC;SPLASH2;VCTM routing;contemporary Hamiltonian routing;contemporary optimization;efficient communication;energy consumption;heavy network traffic;multithreaded workloads;network latency;network throughputs;network-on-chip;packet information;underlying network","","0","","34","","","17-19 Sept. 2014","","IEEE","IEEE Conference Publications"
"PROBE: Prediction-based optical bandwidth scaling for energy-efficient NoCs","Li Zhou; Kodi, A.K.","Sch. of Electr. Eng. & Comput. Sci., Ohio Univ., Athens, OH, USA","Networks on Chip (NoCS), 2013 Seventh IEEE/ACM International Symposium on","20130715","2013","","","1","8","Optical interconnect is a disruptive technology solution that can overcome the power and bandwidth limitations of traditional electrical Networks-on-Chip (NoCs). However, the static power dissipated in the external laser may limit the performance of future optical NoCs by dominating the stringent network power budget. From the analysis of real benchmarks for multicores, it is observed that high static power is consumed due to the external laser even for low channel utilization. In this paper, we propose PROBE: Prediction-based Optical Bandwidth Scaling for Energy-efficient NoCs by exploiting the latency/bandwidth trade-off to reduce the static power consumption by increasing the average channel utilization. With a lightweight prediction technique, we scale the bandwidth adaptively to the changing traffic demands while maintaining reasonable performance. The performance on synthetic and real traffic (PARSEC, Splash2) for 64-cores indicate that our proposed bandwidth scaling technique can reduce optical power by about 60% with at most 11% throughput penalty.","","978-1-4673-6491-1","978-1-4673-6492-8","10.1109/NoCS.2013.6558413","http://ieeexplore.ieee.org/stamp/stamp.jsp?arnumber=6558413","","Bandwidth;Optical buffering;Optical ring resonators;Optical waveguides;Power lasers;Tiles;Waveguide lasers","energy conservation;integrated circuit interconnections;microprocessor chips;network-on-chip;optical interconnections","PARSEC;PROBE;Splash2;channel utilization;electrical networks-on-chip;energy efficiency;external laser;multicore;optical NoC;optical interconnect;prediction-based optical bandwidth scaling;static power consumption reduction","","3","","29","","","21-24 April 2013","","IEEE","IEEE Conference Publications"
"SpinNNaker: The world's biggest NoC","Furber, S.","Univ. of Manchester, Manchester, UK","Networks-on-Chip (NoCS), 2014 Eighth IEEE/ACM International Symposium on","20150115","2014","","","ii","ii","The SpiNNaker (Spiking Neural Network Architecture) project will soon deliver a machine incorporating a million ARM processor cores for real-time modelling of large-scale spiking neural networks. Although the scale of the machine is in the realms of high-performance computing, the technology used to build the machine comes very much from the mobile embedded world, using small integer cores and Network-on-Chip communications both on and between chips. The full machine will use a total of 10 square meters of active silicon area with 57,600 routers using predominantly multicast algorithms to convey real- time spike information through a lightweight asynchronous packet-switched fabric. In this talk I will focus on the NoC aspects, including novel approaches to fault-tolerance and deadlock avoidance.","","","","10.1109/NOCS.2014.7008754","http://ieeexplore.ieee.org/stamp/stamp.jsp?arnumber=7008754","","Abstracts;Biological neural networks;Computer architecture;Computers;Educational institutions;Modeling;Real-time systems","fault tolerance;integrated circuit modelling;microprocessor chips;network routing;network-on-chip;neural net architecture;silicon","ARM processor cores;NoC;Si;SpinNNaker project;asynchronous packet-switched fabric;deadlock avoidance;fault-tolerance;integer cores;multicast algorithms;network-on-chip communications;silicon area;size 10 m;spike information;spiking neural network architecture","","0","","","","","17-19 Sept. 2014","","IEEE","IEEE Conference Publications"
"Leveraging the geometric properties of on-chip transmission line structures to improve interconnect performance: A case study in 65nm","Das, S.; Manetas, G.; Stevens, K.S.; Suaya, R.","","Networks on Chip (NoCS), 2013 Seventh IEEE/ACM International Symposium on","20130715","2013","","","1","2","Implementation of low energy, low latency transmission line interconnects on a network-on-chip presents the circuit designer with a variety of structural design choices. This work presents a study of the comparative effects of changing the wire geometries on the latency, energy dissipated, area, and noise properties of the transmission lines. These results will aid the engineer in the design and performance analysis of the global interconnect and foster a quantitative understanding of the wave signaling properties in the RLC regime.","","978-1-4673-6491-1","978-1-4673-6492-8","10.1109/NoCS.2013.6558408","http://ieeexplore.ieee.org/stamp/stamp.jsp?arnumber=6558408","","Conductors;Integrated circuit interconnections;Metals;Microstrip;Noise;Substrates;Wires","geometry;integrated circuit interconnections;network-on-chip;transmission lines","geometric properties;interconnect performance;network-on-chip;on-chip transmission line structures;size 65 nm;transmission line interconnects","","0","","6","","","21-24 April 2013","","IEEE","IEEE Conference Publications"
"Variable-width datapath for on-chip network static power reduction","Michelogiannakis, G.; Shalf, J.","Lawrence Berkeley Nat. Lab., Berkeley, CA, USA","Networks-on-Chip (NoCS), 2014 Eighth IEEE/ACM International Symposium on","20150115","2014","","","96","103","With the tight power budgets in modern large-scale chips and the unpredictability of application traffic, on-chip network designers are faced with the dilemma of designing for worst-case traffic loads and incurring high static power overheads, or designing for average traffic and risk degrading performance. This paper proposes adaptive bandwidth networks (ABNs) which divide channels and switches into lanes such that the network provides just the bandwidth necessary in each hop. ABNs also activate virtual channels (VCs) individually and take advantage of drowsy SRAM cells to eliminate false VC activations. In addition, ABNs readily tolerate silicon defects with just the extra cost of detection. For application benchmarks, ABNs reduce total power consumption by up to 45% with comparable performance compared to single-lane power-gated networks, and up to 33% compared to multi-network designs.","","","","10.1109/NOCS.2014.7008767","http://ieeexplore.ieee.org/stamp/stamp.jsp?arnumber=7008767","","Bandwidth;Benchmark testing;Clocks;Delays;Logic gates;Ports (Computers);Resource management","SRAM chips;elemental semiconductors;low-power electronics;network-on-chip;silicon","Si;adaptive bandwidth networks;application traffic;average traffic;drowsy SRAM cells;false VC activation elimination;large-scale chips;on-chip network;power budgets;power consumption;risk degrading performance;silicon defects;static power overheads;static power reduction;variable-width datapath;virtual channels;worst-case traffic loads","","0","","39","","","17-19 Sept. 2014","","IEEE","IEEE Conference Publications"
"Extending bufferless on-chip networks to high-throughput workloads","Hanjoon Kim; Changhyun Kim; Kim, M.; Kanghee Won; Kim, J.","Dept. of Comput. Sci., KAIST, Daejeon, South Korea","Networks-on-Chip (NoCS), 2014 Eighth IEEE/ACM International Symposium on","20150115","2014","","","9","16","Bufferless networks-on-chip (NoC) has been proposed to reduce network cost by removing router input buffers and improve energy-efficiency. However, bufferless NoC has some limitations that include lower network throughput caused by deflection routing at high load. In addition, the longer router critical path impacts the router frequency, which reduces the amount of bandwidth provided by the network router. These limitations reduce any benefit of bufferless NoC - especially for high-throughput workloads such as GPGPU. In this work, we first provide a simple analysis into how the benefit of bufferless NoC can be reduced for high throughput workloads, especially in terms of energy-efficiency. We then propose clumsy flow control (CFC) - a congestion control mechanism that can reduce the amount of deflection and improve the efficiency of bufferless NoC. The clumsy flow control enables the allocation to be simplified and we propose a novel switch allocation (randomized-deterministic allocation) which significantly reduces the router critical path. The combination of these two techniques result in our bufferless NoC to exceed the system performance of buffered network by approximately 7% (up to 22%) while reducing network area by 53% and energy by 52%.","","","","10.1109/NOCS.2014.7008756","http://ieeexplore.ieee.org/stamp/stamp.jsp?arnumber=7008756","","Artificial neural networks;Bandwidth;Erbium;Resource management;Routing;System recovery;Throughput","flow control;network routing;network-on-chip","CFC;bufferless NoC;bufferless on-chip networks;clumsy flow control;congestion control mechanism;deflection routing;energy-efficiency;high-throughput workloads;randomized-deterministic allocation;router critical path;switch allocation","","0","","22","","","17-19 Sept. 2014","","IEEE","IEEE Conference Publications"
"An accurate and scalable analytic model for round-robin arbitration in network-on-chip","Fischer, E.; Fettweis, G.P.","Dept. of Mobile Commun. Syst., Tech. Univ. Dresden, Dresden, Germany","Networks on Chip (NoCS), 2013 Seventh IEEE/ACM International Symposium on","20130715","2013","","","1","8","Due to continuously increasing performance requirements of embedded applications, today's multi-processor system-on-chips will evolve towards many-core system-on-chips with thousands of processors on a single chip. Accurate, fast and flexible (i.e., parameterizable) simulation models are necessary to be able to analyze and optimize these large systems. Network-on-chip is a common solution for the interconnection of large processor arrays. Existing analytic models for the performance analysis of network-on-chip often possess a lack of accuracy, if applied for the popular round-robin arbitration scheme. It turns out to be challenging to find an appropriate analytic representation for this apparently simple scheme. In this paper, we propose an accurate service time estimation model that is designed for round-robin arbiters. It is further employed to a queueing model for network-on-chip. The comparison with cycle-accurate simulation proves the accuracy of the proposed service time model, which is essential for predicting key performance indicators, such as network throughput or latencies.","","978-1-4673-6491-1","978-1-4673-6492-8","10.1109/NoCS.2013.6558403","http://ieeexplore.ieee.org/stamp/stamp.jsp?arnumber=6558403","analytic model;network-on-chip;noc;queueing theory;round-robin","Accuracy;Analytical models;Equations;Estimation;Network topology;Routing;Switches","circuit simulation;estimation theory;integrated circuit interconnections;multiprocessing systems;network-on-chip;queueing theory","cycle-accurate simulation;embedded application;many-core system-on-chip;multiprocessor system-on-chip;network latency;network throughput;network-on-chip;performance analysis;performance requirement;processor array interconnection;queueing model;round-robin arbitration scheme;service time estimation model;service time model;simulation model","","0","","20","","","21-24 April 2013","","IEEE","IEEE Conference Publications"
"Transient queuing models for input-buffered routers in Network-on-Chip","Ohmann, D.; Fischer, E.; Fettweis, G.","Dept. of Mobile Commun. Syst., Tech. Univ., Dresden, Germany","Networks-on-Chip (NoCS), 2014 Eighth IEEE/ACM International Symposium on","20150115","2014","","","57","63","Analytical modeling of Network-on-Chip mainly focuses on steady-state conditions although traffic patterns and the behavior of applications are frequently non-stationary. Hence, in such scenarios, it is likely that a system seldom reaches stationarity, and steady-state models are inapplicable. In this work, we propose queuing-theoretic models for the transient analysis of output contention in Network-on-Chip. Contention occurs when multiple input queues intend to forward to the same output, and it is one of the main reasons for increased latencies and blocking probabilities in input-buffered routers. In Network-on-Chip, the end-to-end latency of a single packet can be determined by adding the latencies along its path. Therefore, understanding interactions within a single router are beneficial for system and parameter design of Network-on-Chip. Furthermore, we validate the models proposed by numerical evaluations which confirm the accuracy and practicality of the queuing models.","","","","10.1109/NOCS.2014.7008762","http://ieeexplore.ieee.org/stamp/stamp.jsp?arnumber=7008762","","Analytical models;Computational modeling;Network-on-chip;Numerical models;Queueing analysis;Steady-state;Transient analysis","network-on-chip;probability;queueing theory;transient analysis","blocking probabilities;end-to-end latency;input-buffered routers;network-on-chip;queuing-theoretic models;steady-state conditions;steady-state models;traffic patterns;transient analysis;transient queuing models","","0","","17","","","17-19 Sept. 2014","","IEEE","IEEE Conference Publications"
"An OFDMA based RF interconnect for massive multi-core processors","Unlu, E.; Hamieh, M.; Moy, C.; Ariaudo, M.; Louet, Y.; Drillet, F.; Briere, A.; Zerioul, L.; Denoulet, J.; Pinna, A.; Granado, B.; Pecheux, F.; Duperrier, C.; Quintanel, S.; Romain, O.; Bourdel, E.","SUPELEC/IETR, Cesson-Sevigne, France","Networks-on-Chip (NoCS), 2014 Eighth IEEE/ACM International Symposium on","20150115","2014","","","182","183","A paradigm shift is apparent in Chip Multiprocessor (CMP) design, as the new performance bottleneck is becoming communication rather than computation. It is widely provisioned that number of cores on a single chip will reach thousands in a decade. Thus, new high rate interconnects such as optical or RF have been proposed by various researchers. However, these interconnect structures fail to provide essential requirements of heterogeneous on-chip traffic; bandwidth reconfigurability and broadcast support with a low complex design. In this paper we investigate the feasibility of a new Orthogonal Frequency Division Multiple Access (OFDMA) RF interconnect for the first time to the best of our knowledge. In addition we provide a novel dynamic bandwidth arbitration and modulation order selection policy, that is designed regarding the bimodal on-chip packets. The proposed approach decreases the average latency up to 3.5 times compared to conventional static approach.","","","","10.1109/NOCS.2014.7008784","http://ieeexplore.ieee.org/stamp/stamp.jsp?arnumber=7008784","","Bandwidth;OFDM;Payloads;Protocols;Radio frequency;Registers;System-on-chip","OFDM modulation;frequency division multiple access;integrated circuit design;integrated circuit interconnections;microprocessor chips;multiprocessing systems;radiofrequency interconnections","CMP design;OFDMA RF interconnect;bandwidth reconfigurability;bimodal on-chip packets;chip multiprocessor design;heterogeneous on-chip traffic;massive multicore processors;modulation order selection policy;orthogonal frequency division multiple access","","2","","5","","","17-19 Sept. 2014","","IEEE","IEEE Conference Publications"
"High-performance energy-efficient NoC fabrics: Evolution and future challenges","Anders, M.A.","Circuit Res. Lab., Intel, Hillsboro, OR, USA","Networks-on-Chip (NoCS), 2014 Eighth IEEE/ACM International Symposium on","20150115","2014","","","i","i","As exa-scale microprocessor and SoC core and IP block counts increase, networks-on-chip are increasingly becoming performance and power limiters. Recent scaling and integration trends pose further challenges for on-die communication networks with topologies that have evolved from crossbars to rings to 2D meshes. These future challenges include i) reducing energy associated with global clock distribution, synchronization, and data storage, ii) adapting to process, voltage, and temperature variations, and iii) flexibility for different operating voltages, frequencies, and IP blocks. In this presentation, we will review some of the key network-on-chip scaling trends and challenges as well as discuss architecture and circuit solutions. Recent advancements implemented in 22nm tri-gate CMOS to demonstrate the combination of hybrid packet/circuit switching with source-synchronous operation to address these challenges by removing intra-route data storage and costly global clock distribution power will be presented.","","","","10.1109/NOCS.2014.7008753","http://ieeexplore.ieee.org/stamp/stamp.jsp?arnumber=7008753","","Abstracts;Fabrics;IP networks;Market research;Memory;Synchronization;System-on-chip","CMOS digital integrated circuits;low-power electronics;network-on-chip","IP blocks;data storage;energy efficient NoC fabrics;exascale microprocessor;global clock distribution;network-on-chip scaling trends;networks-on-chip;size 22 nm;trigate CMOS","","0","","","","","17-19 Sept. 2014","","IEEE","IEEE Conference Publications"
