"http://ieeexplore.ieee.org/search/searchresult.jsp?bulkSetSize=2000&queryText%3DComputer-Aided+Design+.LB.ICCAD.RB.%2C+2012+IEEE%2FACM+International+Conference",2015/06/23 15:08:27
"Efficient parametric yield estimation of analog/mixed-signal circuits via Bayesian model fusion","Xin Li; Wangyang Zhang; Fa Wang; Shupeng Sun; Chenjie Gu","Carnegie Mellon Univ., Pittsburgh, PA, USA","Computer-Aided Design (ICCAD), 2012 IEEE/ACM International Conference on","20121220","2012","","","627","634","Parametric yield estimation is one of the most critical-yet-challenging tasks for designing and verifying nanoscale analog and mixed-signal circuits. In this paper, we propose a novel Bayesian model fusion (BMF) technique for efficient parametric yield estimation. Our key idea is to borrow the simulation data from an early stage (e.g., schematic-level simulation) to efficiently estimate the performance distributions at a late stage (e.g., post-layout simulation). BMF statistically models the correlation between early-stage and late-stage performance distributions by Bayesian inference. In addition, a convex optimization is formulated to solve the unknown late-stage performance distributions both accurately and robustly. Several circuit examples designed in a commercial 32 nm CMOS process demonstrate that the proposed BMF technique achieves up to 3.75× runtime speedup over the traditional kernel estimation method.","1092-3152","","","","http://ieeexplore.ieee.org/stamp/stamp.jsp?arnumber=6386737","","Bayesian methods;Covariance matrix;Data models;Integrated circuit modeling;Probability density function;Vectors;Yield estimation","Bayes methods;CMOS integrated circuits;integrated circuit layout;mixed analogue-digital integrated circuits","Bayesian inference;Bayesian model fusion;CMOS;analog/mixed-signal circuits;kernel estimation;nanoscale analog circuits;nanoscale mixed-signal circuits;parametric yield estimation;post-layout simulation;schematic-level simulation;size 32 nm","","0","","21","","","5-8 Nov. 2012","","IEEE","IEEE Conference Publications"
"Simultaneous information flow security and circuit redundancy in Boolean gates","Wei Hu; Oberg, J.; Dejun Mu; Kastner, R.","Sch. of Autom., Northwestern Polytech. Univ., Xian, China","Computer-Aided Design (ICCAD), 2012 IEEE/ACM International Conference on","20121220","2012","","","585","590","High assurance systems require strict guarantees on information flow security and fault tolerance or else face catastrophic consequences. Recently, Gate Level Information Flow Tracking (GLIFT) has been proposed to monitor information flows at the level of Boolean logic. At this level, all flows are explicit which makes it possible to detect security violations, even those that occur due to difficult to detect timing channels. In this paper, we show that the encoding technique used in previous GLIFT generation methods includes redundant encoding states, which leads to large overheads in area, delay and verification time. We present a new encoding technique with fewer encoding states by leveraging an inherent property of GLIFT. By denoting don't-care input conditions to logic synthesis tools, smaller GLIFT logic for dynamic information flow tracking is obtained and shorter simulation time for static information flow security verification is achieved. Experimental results using the IWLS benchmarks show average reductions of 39.8%, 31.1% and 57.5% in area, delay and simulation time respectively. Furthermore, the new encoding technique enables the GLIFT tracking logic to function both as information flow tracking and redundant logic. As a result, information flow security and fault tolerance can be simultaneously enforced with the same logic.","1092-3152","","","","http://ieeexplore.ieee.org/stamp/stamp.jsp?arnumber=6386731","","Delay;Encoding;Integrated circuit modeling;Logic gates;Redundancy;Security;Vectors","fault tolerance;logic circuits;logic design;logic gates;redundancy;security of data","Boolean gates;Boolean logic;circuit redundancy;dynamic information flow tracking;encoding technique;fault tolerance;gate level information flow tracking;logic synthesis tool;redundant encoding state;redundant logic;static information flow security verification","","0","","21","","","5-8 Nov. 2012","","IEEE","IEEE Conference Publications"
"Efficient parallel power grid analysis via Additive Schwarz Method","Ting Yu; Zigang Xiao; Wong, M.D.F.","Dept. of ECE, Univ. of Illinois at Urbana-Champaign, Urbana, IL, USA","Computer-Aided Design (ICCAD), 2012 IEEE/ACM International Conference on","20121220","2012","","","399","406","Due to the rapid advances of integrated circuit technology, the size of power distribution network (power grid) is becoming larger and larger. There are usually multi-million nodes on a power grid. Analyzing these huge power grids has become very expensive in terms of both time and memory. This paper presents an efficient parallel implementation of the Additive Schwarz Method (ASM) for IR-drop analysis of large-scale power grid. Based on distributed memory system, a new data storage method is proposed to overcome memory bottleneck of traditional methods. Techniques including overlapping in multiple layer and irregular power grid, via detection and grouping are utilized to accelerate the simulation. Moreover, a new communication strategy exhibiting minimum communication overhead is proposed. The proposed method is very accurate in the final solution, with the maximum error less than 0.1mv. Experimental results on industrial medium size benchmarks show that the proposed method achieves more than 110X speedup over a state-of-the-art direct LU solver. The proposed approach can easily solve very large-scale benchmarks, while LU solver fails to obtain the solution because of system memory limitation. It is the first time reported in literature that IR-drop analysis of power grid with over 190M nodes is successfully solved within 5 minutes.","1092-3152","","","","http://ieeexplore.ieee.org/stamp/stamp.jsp?arnumber=6386643","","Acceleration;Additives;Data mining;Mathematical model;Matrix decomposition;Power grids;Writing","benchmark testing;distributed memory systems;distribution networks;power grids","IR-drop analysis;additive Schwarz method;communication strategy;data storage method;distributed memory system;efficient parallel implementation;industrial medium size benchmarks;integrated circuit technology;maximum error less;minimum communication overhead;multiple layer;parallel power grid analysis;power distribution network;very large-scale benchmarks","","0","","16","","","5-8 Nov. 2012","","IEEE","IEEE Conference Publications"
"A thermal and process variation aware MTJ switching model and its applications in soft error analysis","Peiyuan Wang; Wei Zhang; Joshi, R.; Kanj, R.; Yiran Chen","Dept. of ECE, Univ. of Pittsburgh, Pittsburgh, PA, USA","Computer-Aided Design (ICCAD), 2012 IEEE/ACM International Conference on","20121220","2012","","","720","727","Spin-transfer torque random access memory (STT-RAM) has recently gained increased attentions from circuit design and architecture societies. Although STT-RAM offers a good combination of small cell size, nanosecond access time and non-volatility for embedded memory applications, the reliability of STT-RAM is severely impacted by device variations and environmental disturbances. In this paper, we develop a compact switching model for magnetic tunneling junction (MTJ), which is the data storage device in STT-RAM cells. By leveraging the capability to simulate the impacts of thermal and process variations on MTJ switching, our model is able to analyze the diverse mechanisms of STT-RAM write operation failures. Besides the impacts of thermal and process variation, the soft error induced by radiation striking on the access transistor is another important threat to the MTJ reliability. It can also be analyzed by using our model. The incurred computation cost of our model is much less than the conventional macro-magnetic model, and hence, enabling its applications in comprehensive STT-RAM reliability analysis and design optimizations.","1092-3152","","","","http://ieeexplore.ieee.org/stamp/stamp.jsp?arnumber=6386753","MTJ;soft error;switching model;variation","Analytical models;Computational modeling;Fluctuations;Magnetic tunneling;Magnetization;Resistance;Switches","integrated circuit reliability;magnetic tunnelling;optimisation;radiation hardening (electronics);random-access storage","MTJ reliability;MTJ switching model;access transistor;compact switching model;data storage device;embedded memory applications;environmental disturbances;magnetic tunneling junction;nanosecond access time;nonvolatility;optimizations;process variation aware;small cell size;soft error analysis;spin-transfer torque random access memory;thermal variation aware","","1","","20","","","5-8 Nov. 2012","","IEEE","IEEE Conference Publications"
"Fast and scalable hybrid functional verification and debug with dynamically reconfigurable co-simulation","Banerjee, S.; Gupta, T.","Mentor Graphics Pvt. Ltd., India","Computer-Aided Design (ICCAD), 2012 IEEE/ACM International Conference on","20121220","2012","","","115","122","Hybrid functional verification and debug systems which combine high execution speed of logic emulators and full observability and controllability of software simulators are widely used, but suffer from scalability problem since software simulators cannot handle large and complex System-on-chip (SoC) designs efficiently, restricting their application to only relatively small designs. This paper presents a completely scalable hybrid verification and debug system based on dynamically reconfigurable co-simulation. Unlike existing systems, it allows one or more component logic blocks of a SoC to run on simulator for debugging while rest of the design still runs on emulator. The full design under test (DUT) is run on emulator at near hardware speed for long test sequences, and on error detection one or more logic blocks are transparently switched over to simulation for debugging, initializing the system as a piecewise co-simulator. Logic blocks can be flexibly relocated between simulator and emulator dynamically, without going through time consuming design recompilation phase, allowing designers to quickly debug functional issues. Application of the system to verification of real complex designs shows the effectiveness of our approach.","1092-3152","","","","http://ieeexplore.ieee.org/stamp/stamp.jsp?arnumber=6386597","Co-Simulation;Debug;Scalability","Clocks;Databases;Debugging;Emulation;Hardware design languages;Load modeling;Synchronization","circuit CAD;digital simulation;program debugging;program verification;system-on-chip","DUT;SoC;debug systems;design recompilation phase;design under test;dynamically reconfigurable cosimulation;functional issues;hybrid functional verification;logic blocks;logic emulators;piecewise cosimulator;scalability problem;software simulators;system-on-chip designs","","0","","14","","","5-8 Nov. 2012","","IEEE","IEEE Conference Publications"
"Optimization of on-chip switched-capacitor DC-DC converters for high-performance applications","Pingqiang Zhou; Won Ho Choi; Bongjin Kim; Kim, C.H.; Sapatnekar, S.S.","Dept. of Electr. & Comput. Eng., Univ. of Minnesota, Minneapolis, MN, USA","Computer-Aided Design (ICCAD), 2012 IEEE/ACM International Conference on","20121220","2012","","","263","270","On-chip switched-capacitor (SC) DC-DC converters have recently been demonstrated in silicon for high-performance applications such as multicore processors. The efficiency of the power delivery system using SC converters is a major concern, but this has not been addressed at the system level in prior research. This work develops models for the efficiency of such a system as a function of size and layout of the SC converters, and proposes an approach to optimize the size and layout of the SC converter to minimize power loss. The efficiency of these techniques is demonstrated on both homogenous and heterogenous multicore chips.","1092-3152","","","","http://ieeexplore.ieee.org/stamp/stamp.jsp?arnumber=6386619","","Capacitance;Clocks;Equations;Optimization;Switches;System-on-a-chip;Topology","DC-DC power convertors;switched capacitor networks","SC converters;heterogenous multicore chips;homogenous multicore chips;multicore processors;on-chip switched-capacitor dc-dc converters;power delivery system","","1","","18","","","5-8 Nov. 2012","","IEEE","IEEE Conference Publications"
"Construction of rectilinear Steiner minimum trees with slew constraints over obstacles","Tao Huang; Young, E.F.Y.","Dept. of Comput. Sci. & Eng., Chinese Univ. of Hong Kong, Hong Kong, China","Computer-Aided Design (ICCAD), 2012 IEEE/ACM International Conference on","20121220","2012","","","144","151","This work studies the problem of finding a rectilinear Steiner minimum tree (RSMT) for a set of given terminals in the presence of obstacles. In modern VLSI designs, obstacles usually block the device layer and a fraction of metal layers. Therefore, routing wires on top of obstacles is possible. However, if a long wire is routed over an obstacle, there will be signal integrity problems because buffers cannot be placed on top of any obstacle. To tackle this problem, we impose slew constraints on the interconnects that are routed over an obstacle. This is called the obstacle-avoiding rectilinear Steiner minimum trees (OARSMT) problem with slew constraints over obstacles. In this paper, we first analyze an optimal solution to this problem and show that the tree structures over obstacles with slew constraints will follow some very simple forms. Based on this observation, we propose an algorithm to find an optimal solution embedded in the extended Hanan grid [1]. The solutions can guarantee the interconnect performance and avoid post-routing electrical fixups due to slew violations. We also show that our algorithm achieves over 800 times speedup and is able reduce nearly 5% routing resources on average in comparison with the state-of-the-art optimal OARSMT algorithm.","1092-3152","","","","http://ieeexplore.ieee.org/stamp/stamp.jsp?arnumber=6386601","","Capacitance;Delay;Joining processes;Routing;Steiner trees;Wires","VLSI;integrated circuit interconnections;network routing;trees (mathematics)","OARSMT problem;device layer block;extended Hanan grid;interconnect performance;metal layer fraction;modern VLSI designs;obstacle-avoiding rectilinear Steiner minimum trees;optimal solution;routing wires;signal integrity problems;slew constraints;tree structures","","0","","16","","","5-8 Nov. 2012","","IEEE","IEEE Conference Publications"
"Stability assurance and design optimization of large power delivery networks with multiple on-chip voltage regulators","Suming Lai; Boyuan Yan; Peng Li","Dept. of Electr. &amp; Comput. Eng., Texas A&amp;M Univ., College Station, TX, USA","Computer-Aided Design (ICCAD), 2012 IEEE/ACM International Conference on","20121220","2012","","","247","254","Distributive on-chip voltage regulation is appealing to solving the power integrity problems in nowadays high-end SoCs. Nevertheless, ensuring the stability of large-scale power delivery networks regulated by a multiplicity of voltage regulators is challenging due to the size of the system and complex interactions between the regulators and the large loading network. We present a theoretically elegant framework that provides a rigorous guarantee for network stability. We further develop a practical design approach that largely decouples the design of linear voltage regulators from that of the complex load, making it feasible to ensure the stability of the complete network. The presented design approach has been successfully applied to several design examples with guaranteed stability and competitive performances.","1092-3152","","","","http://ieeexplore.ieee.org/stamp/stamp.jsp?arnumber=6386617","","Circuit stability;Power system stability;Regulators;Stability criteria;System-on-a-chip;Voltage control","integrated circuit design;stability;system-on-chip;voltage regulators","SoC;design optimization;distributive on-chip voltage regulation;large power delivery networks;linear voltage regulator;multiple on-chip voltage regulators;power integrity problem;stability assurance","","1","","10","","","5-8 Nov. 2012","","IEEE","IEEE Conference Publications"
"A dynamic method for efficient random mismatch characterization of standard cells","Wangyang Zhang; Singhee, A.; Jinjun Xiong; Habitz, P.; Joshi, A.; Visweswariah, C.; Sundquist, J.","IBM Syst. & Technol. Group, Hopewell Junction, NY, USA","Computer-Aided Design (ICCAD), 2012 IEEE/ACM International Conference on","20121220","2012","","","180","186","To enable statistical static timing analysis, for each cell in a digital library, a timing model that considers variations must be characterized. In this paper, we propose a dynamic method to accurately and efficiently characterize a cell's delay and output slew as a function of random mismatch variations. Based on a tight error bound for characterization using partial devices, our method sequentially performs simulations based on decreasing importance of devices and stops when the error requirement is met. Results on an industrial 32nm library demonstrate that the proposed method achieves significantly better accuracy-efficiency trade-off compared to other partial finite differencing approaches.","1092-3152","","","","http://ieeexplore.ieee.org/stamp/stamp.jsp?arnumber=6386607","","Accuracy;Delay;Finite difference methods;Logic gates;Performance evaluation;Sensitivity;Transistors","cellular arrays;delay circuits;error statistics;timing circuits","cell delay;digital library;dynamic method;industrial library;partial devices;random mismatch characterization;size 32 nm;standard cells;statistical static timing analysis;tight error;timing model","","0","","15","","","5-8 Nov. 2012","","IEEE","IEEE Conference Publications"
"Layout small-angle rotation and shift for EUV defect mitigation","Hongbo Zhang; Yuelin Du; Wong, M.D.F.; Yunfei Deng; Mangat, P.","Synopsys Inc., Mountain View, CA, USA","Computer-Aided Design (ICCAD), 2012 IEEE/ACM International Conference on","20121220","2012","","","43","49","Blank defect mitigation is crucial for extreme ultraviolet (EUV) lithography. One of the existing options is to relocate patterns to avoid defect impact. However, when the defect number increases, only pattern shift in X-Y directions becomes far from enough, requiring the reticle holder rotate a small angle to provide a third exploring dimension. This non-trivial extension from 2D to 3D exploration requests efficient runtime as well as enough accuracy to handle different defect sizes and locations on the different features. In this paper, we present the first work with a detailed algorithm to find the optimal shift and rotation for layout patterns on blanks. Compared to the straightforward method, which is to check every pair of defect and feature at every possible relocation position, our proposed algorithm can significantly reduce the runtime complexity to scale linearly with the size of the full solution space. The experimental results validate our method and show a largely increased success rate of defect mitigation by shift and rotation.","1092-3152","","","","http://ieeexplore.ieee.org/stamp/stamp.jsp?arnumber=6386587","","Accuracy;Bismuth;Inspection;Layout;Lithography;Runtime;Ultraviolet sources","reticles;ultraviolet lithography","2D exploration;3D exploration;EUV defect mitigation;defect mitigation rate;defect sizes;extreme ultraviolet lithography;layout small-angle rotation;pattern shift;relocation position;reticle holder;runtime complexity","","1","","18","","","5-8 Nov. 2012","","IEEE","IEEE Conference Publications"
"System energy consumption is a multi-player game","Mian Dong; Tian Lan; Lin Zhong","Rice Univ., Houston, TX, USA","Computer-Aided Design (ICCAD), 2012 IEEE/ACM International Conference on","20121220","2012","","","351","352","Our key insight is that per-process energy accounting can be formulated as a problem that has been extensively studied in game theory: when multiple players participate in a game and the game produces a surplus, how to divide the surplus among the players? Shapley value is a well-known single value solution to this problem. For any coalition of players S ⊆ N = {1, 2, ... , n}, we denote v(S) as the game surplus if played by coalition S. Shapley value defines the only way to distribute the the grand coalition surplus v(N) among the n players that satisfies four simple axioms: Efficiency, Symmetry, Dummy, and Additivity.","1092-3152","","","","http://ieeexplore.ieee.org/stamp/stamp.jsp?arnumber=6386636","","Educational institutions;Energy consumption;Energy management;Games;Hardware;Mobile communication;Software","energy consumption;game theory","Shapley value;additivity axiom;coalition surplus;dummy axiom;efficiency axiom;energy accounting;game surplus;game theory;multiplayer game;player coalition;single value solution;symmetry axiom;system energy consumption","","0","","12","","","5-8 Nov. 2012","","IEEE","IEEE Conference Publications"
"Overview of vectorless/early power grid verification","Najm, F.N.","ECE Dept., Univ. of Toronto, Toronto, ON, Canada","Computer-Aided Design (ICCAD), 2012 IEEE/ACM International Conference on","20121220","2012","","","670","677","The power distribution network of an integrated circuit must be checked throughout the design process to ensure that supply voltage fluctuations do not exceed certain critical thresholds. One way of doing this is by simulation, which requires knowledge of the circuit currents that load the grid. These currents are hard to specify. In many cases, and certainly during early power grid design, they may be simply unknown because the circuit itself may not yet be specified. Vector-less verification refers to the class of techniques, developed over the last 12 years, for verifying the grid in the absence of complete information about the circuit currents.","1092-3152","","","","http://ieeexplore.ieee.org/stamp/stamp.jsp?arnumber=6386745","","Inductance;Integrated circuit modeling;Power grids;RLC circuits;Threshold voltage;Vectors","distribution networks;power grids","circuit currents;critical thresholds;integrated circuit;power distribution network;supply voltage fluctuations;vector-less verification;vectorless/early power grid verification","","0","","24","","","5-8 Nov. 2012","","IEEE","IEEE Conference Publications"
"Toward codesign in high performance computing systems","Barrett, R.F.; Dosanjh, S.S.; Heroux, M.A.; Hu, X.S.; Parker, S.; Shalf, J.","Sandia Nat. Labs., Albuquerque, NM, USA","Computer-Aided Design (ICCAD), 2012 IEEE/ACM International Conference on","20121220","2012","","","443","449","Preparations for exascale computing have led to the realization that computing environments will be significantly different from those that provide petascale capabilities. This change is driven by energy constraints, which has compelled hardware architects to design systems that will require a significant re-thinking of how application algorithms are selected and implemented. The “codesign” principle may offer a common basis for application and system developers as well as architects to work synergistically towards achieving exascale computing. This paper aims to introduce to the embedded system design community the unique challenges and opportunities as well as exciting developments in exascale HPC system codesign. Given the success of adopting codesign practices in the embedded system design area, this effort should be mutually beneficial to both communities.","1092-3152","","","","http://ieeexplore.ieee.org/stamp/stamp.jsp?arnumber=6386705","hardware/software codesign;high performance computing;parallel architectures;scientific applications","Algorithm design and analysis;Computer architecture;Hardware;Registers;Software;Software algorithms;USA Councils","embedded systems;hardware-software codesign;mainframes;parallel architectures;performance evaluation","application algorithms;application developers;codesign principle;computing environments;embedded system design community;energy constraints;exascale HPC system codesign;exascale computing;hardware-software codesign;high performance computing systems;parallel architectures;system design;system developers","","0","","16","","","5-8 Nov. 2012","","IEEE","IEEE Conference Publications"
"Ultra-low power NEMS FPGA","Sijing Han; Sirigiri, V.; Saab, D.G.; Tabib-Azar, M.","EECS, Case Western Reserve Univ., Cleveland, OH, USA","Computer-Aided Design (ICCAD), 2012 IEEE/ACM International Conference on","20121220","2012","","","533","538","In this paper, we discuss a new type of NEMS switches that can be configured to implement any 2-input logic gates (AND, OR, NAND, NOR, XOR, XNOR, NOT) in a single device structure. These devices can be used to implement FPGA where a four-input CLB requires only nine NEMS switches and at most two mechanical delays per computation. In contrast, CMOS CLBs require 150 traditional switches. By reducing the number of devices, our approach improves yield, reproducibility, speed, power and simplifies implementation.","1092-3152","","","","http://ieeexplore.ieee.org/stamp/stamp.jsp?arnumber=6386722","Embedded system;FPGA;NEMS;design","Bridge circuits;CMOS integrated circuits;Field programmable gate arrays;Logic gates;Nanoelectromechanical systems;Resistors;Routing","field programmable gate arrays;logic gates;low-power electronics;microswitches;nanoelectromechanical devices","2-input logic gates;AND gate;CMOS CLB;NAND gate;NEMS switches;NOR gate;NOT gate;OR gate;XNOR gate;XOR gate;single device structure;ultralow power NEMS FPGA","","0","","19","","","5-8 Nov. 2012","","IEEE","IEEE Conference Publications"
