"http://ieeexplore.ieee.org/search/searchresult.jsp?bulkSetSize=2000&queryText%3DComputer-Aided+Design+.LB.ICCAD.RB.%2C+2012+IEEE%2FACM+International+Conference",2015/06/23 15:08:27
"A silicon-validated methodology for power delivery modeling and simulation","Cheng Zhuo; Wilke, G.; Chakraborty, R.; Aydiner, A.; Chakravarty, S.; Wei-Kai Shih","Intel Corp., Hillsboro, OR, USA","Computer-Aided Design (ICCAD), 2012 IEEE/ACM International Conference on","20121220","2012","","","255","262","Power integrity has become increasingly important for the designs in 32nm or below. This paper discusses a silicon-validated methodology for microprocessor power delivery modeling and simulation. There have been many prior works focusing on power delivery analysis and optimization. However, none of them provided a comprehensive modeling methodology with post-silicon data to validate the use of the models. In this paper, we present power delivery system models that are able to achieve less than 10% deviation from the supply noise measurements on a 32nm industrial microprocessor design. Our models are able to capture the unique impacts of on-die inductance, state dependent coupling capacitance and die-package interaction. Those impacts happen to be prominent for the designs in 32nm or below but were considered negligible or even not noted in earlier technology nodes. Comparisons were made to quantify the impacts of different modeling strategies on supply noise prediction accuracy. This specifically provides designers insights in selecting appropriate models for power delivery analysis. The impact of power delivery noise on timing margin was accurately estimated showing a good agreement to the worst-case jitter measurements.","1092-3152","","","","http://ieeexplore.ieee.org/stamp/stamp.jsp?arnumber=6386618","Power grid;capacitance;inductance;jitter;simulation","Capacitance;Couplings;Inductance;Metals;Noise;Noise measurement;Power supplies","elemental semiconductors;integrated circuit design;integrated circuit modelling;microprocessor chips;silicon","Si;die-package interaction;industrial microprocessor design;microprocessor power delivery modeling;on-die inductance;post-silicon data;power delivery analysis;power delivery optimization;power delivery simulation;power delivery system models;power integrity;silicon-validated methodology;size 32 nm;state dependent coupling capacitance;supply noise measurements;supply noise prediction;timing margin;worst-case jitter measurements","","0","","21","","","5-8 Nov. 2012","","IEEE","IEEE Conference Publications"
"Verifying dynamic properties of nonlinear mixed-signal circuits via efficient SMT-based techniques","Leyi Yin; Yue Deng; Peng Li","Dept. of ECE, Texas A&amp;M Univ., College Station, TX, USA","Computer-Aided Design (ICCAD), 2012 IEEE/ACM International Conference on","20121220","2012","","","436","442","The pressing need for the verification of analog and mixed-signal (AMS) designs is driven by increased design complexity and the integration of such circuits into SoCs. However, verification of AMS circuits remains as a significant challenge. We propose a methodology that leverages SMT-based Satisfiability techniques to tackle the challenges arising from the inherent analog and/or hybrid natures of AMS systems. We demonstrate the feasibility and efficacy of the proposed methodology on conservative verification of dynamic properties of nonlinear AMS circuits.","1092-3152","","","","http://ieeexplore.ieee.org/stamp/stamp.jsp?arnumber=6386704","","Automata;Charge pumps;Phase frequency detector;Phase locked loops;Reachability analysis;Runtime;Transient analysis","integrated circuit design;integration;mixed analogue-digital integrated circuits;system-on-chip","SMT-based satisfiability techniques;SoC;analog circuit design;conservative verification;dynamic properties;integration;nonlinear AMS circuit design;nonlinear mixed-signal circuits","","0","","16","","","5-8 Nov. 2012","","IEEE","IEEE Conference Publications"
"Multi-level cell STT-RAM: Is it realistic or just a dream?","Yaojun Zhang; Lu Zhang; Wujie Wen; Guangyu Sun; Yiran Chen","Dept. of Electr. & Comput. Eng., Univ. of Pittsburgh, Pittsburgh, PA, USA","Computer-Aided Design (ICCAD), 2012 IEEE/ACM International Conference on","20121220","2012","","","526","532","Spin-transfer torque random access memory (STT-RAM) is a promising nonvolatile memory technology aiming on-chip or embedded applications. In recent years, many researches have been conducted to improve the storage density and enhance the scalability of STT-RAM, such as reducing the write current and switching time of magnetic tunneling junction (MTJ) devices. In parallel with these efforts, the continuous increasing of tunnel magneto-resistance(TMR) ratio of the MTJ inspires the development of multi-level cell (MLC) STT-RAM, which allows multiple data bits be stored in a single memory cell. Two types of MLC STT-RAM cells, namely, parallel MLC and series MLC, were also proposed. The storage margin of a MLC STT-RAM cell, i.e., the distinction between the lowest and highest resistance states, is partitioned into multiple segments for multi-level data representation. As a result, the performance and reliability of MLC STT-RAM cells become more sensitive to the MOS and MTJ device variations and the thermal-induced randomness of MTJ switching. In this work, we systematically analyze the variation sources of MLC STT-RAM designs and their impacts on the reliability of the read and write operations. On top of that, we also discuss the optimal device parameters of the MLC MTJ for the minimization of the operation error rate of the MLC STT-RAM cells from statistical design perspective. Our simulation results show that under the current available technology, series MLC STT-RAM demonstrates overwhelming benefits in the read and write reliability compared to parallel MLC STT-RAM and could potentially satisfy the requirement of commercial practices.","1092-3152","","","","http://ieeexplore.ieee.org/stamp/stamp.jsp?arnumber=6386721","","Current density;Error analysis;Magnetic domains;Magnetic tunneling;Magnetization;Resistance;Switches","integrated circuit reliability;minimisation;random-access storage;tunnelling magnetoresistance","MOS device;MTJ device;MTJ switching;STT-RAM scalability;magnetic tunneling junction;minimization;multilevel cell STT-RAM;multilevel data representation;nonvolatile memory technology;reliability;single memory cell;spin-transfer torque random access memory;statistical design;storage density;thermal-induced randomness;tunnel magnetoresistance ratio;write current","","2","","19","","","5-8 Nov. 2012","","IEEE","IEEE Conference Publications"
"Design strategies for high-dimensional electromagnetic systems","Jandhyala, V.; Sathanur, A.V.","Appl. Comput. Eng. Lab. (www.uwacelab.org) Dept. of Electr. Eng., Univ. of Washington, Seattle, WA, USA","Computer-Aided Design (ICCAD), 2012 IEEE/ACM International Conference on","20121220","2012","","","498","498","Summary form only given. The increasing need for more computing power, the integration of multiple functionalities and the trends towards miniaturization of electronic systems have all contributed to rapid advancement in semiconductor and associated technologies. Higher frequencies of operation together with non-negligible coupling arising from form-factor size constraints, and inability to ignore parasitics imply that full-wave EM (Electromagnetic) simulation is an essential part of electronic system design.","1092-3152","","","","http://ieeexplore.ieee.org/stamp/stamp.jsp?arnumber=6386714","","Adaptation models;Computational modeling;Data models;Electromagnetics;Machine learning;Optimization;Semiconductor device modeling","integrated circuit design;three-dimensional integrated circuits","TSV design;electromagnetic simulation;electronic system design strategy;form-factor size constraints;full-wave EM simulation;high-dimensional electromagnetic systems;through-silicon vias design","","0","","4","","","5-8 Nov. 2012","","IEEE","IEEE Conference Publications"
"ISBA: An independent set-based algorithm for automated partial reconfiguration module generation","Ruining He; Yuchun Ma; Kang Zhao; Jinian Bian","Dept. of Comput. Sci. & Technol., Tsinghua Univ., Beijing, China","Computer-Aided Design (ICCAD), 2012 IEEE/ACM International Conference on","20121220","2012","","","500","507","Dynamic Partial Reconfiguration (DPR) on FPGAs has attracted significant research interests in recent years since it provides benefits such as reduced area and flexible functionality. However, due to the lack of supporting synthesis tools in current DPR design flow, leveraging these benefits requires specific designer expertise with laborious manual design effort. Considering the complicated concurrency relations among functions, it is challenging to properly select Partial Reconfiguration Modules (PR Modules) and partition them into groups so that the hardware modules can be swapped in and out during the run time. What's more, the design of PR Modules also impacts reconfiguration latency and resource utilization greatly. In this paper, we formulate the PR Module generation problem into a standard Maximum-Weight Independent Set Problem (MWISP) so that the original manual exploration can be solved optimally and automatically. Our proposed algorithm not only supports various design constraints, but also has the ability to consider multiple objectives such as area and reconfiguration delay. Experimental results show that our approach can optimize resource utilization and reduce reconfiguration delay with good scalability. Especially, the implementation of the real design case shows that our approach can be embedded in the Xilinx's DPR design flow successfully and it can save around 70% reconfiguration latency overhead compared with the heuristic PR Module generation approaches.","1092-3152","","","","http://ieeexplore.ieee.org/stamp/stamp.jsp?arnumber=6386716","Dynamic Partial Reconfiguration;FPGA;Independent set-based model;Partial Reconfiguration Module","Algorithm design and analysis;Concurrent computing;Delay;Field programmable gate arrays;Hardware;Optimization;Resource management","field programmable gate arrays;logic design","FPGA;ISBA;Xilinx's DPR design;automated partial reconfiguration module generation;dynamic partial reconfiguration;hardware modules;independent set-based algorithm;maximum-weight independent set problem;reconfiguration latency;resource utilization","","0","","25","","","5-8 Nov. 2012","","IEEE","IEEE Conference Publications"
"Test challenges in designing complex 3D chips: What in on the horizon for EDA industry?: Designer track","Goel, S.K.","Taiwan Semicond. Manuf. Co. Ltd., San Jose, CA, USA","Computer-Aided Design (ICCAD), 2012 IEEE/ACM International Conference on","20121220","2012","","","273","273","Summary form only given. Recent advances in semiconductor process technology especially interconnects using Through-Silicon Vias (TSVs) enable heterogeneous system integration where dies are implemented in dedicated, optimized process technologies and then stacked together to form a system. Compared to conventional wire-bond chip interconnections, TSVs offer several advantages such as high density, low latency, low power, and possibly lower cost. TSVs provide vertical interconnects and hence naturally used for 3D vertical stacking of multiple dies, However, TSVs also have attractive benefits in interconnecting dies, which are placed next to each other on top of a passive silicon interposer. TSMC has proposed CoWoS (Chip-on-Wafer-on-Substrate) process as the standard design paradigm to assemble interposer-based 3D ICs. Figure 1 shows an example of a CoWoS design with three heterogeneous (RF, logic and memory) dies. In order to reach quality requirements for volume production, several challenges need to be resolved for 3D ICs. Many of these challenges open up new horizon for the EDA industry and academia as they require innovative and compute efficient approaches. One of the critical challenges is effective and efficient testing of 3D ICs. Just like traditional 2D chips, 3D chips need to be tested for possible manufacturing defects. To minimize any yield loss and reduce overall cost, each die should not only be fully tested before stacking, but also post-stacking re-testing of individual dies is required to confirm that the stacking process did not damage the individual die. In addition, a new kind of test must be performed to check that inter-die interconnects are defects free. Furthermore, the passive silicon interposer needs to be tested in order to not become the bottleneck and the major yield killer in the overall design process. In this paper, we describe some of the innovative solutions developed by TSMC in this direction. The paper highlights complexities and- issues related to test architecture development and automation, test flow optimization as well as testing of passive interposer that requires special focus from the EDA industry.","1092-3152","","","","http://ieeexplore.ieee.org/stamp/stamp.jsp?arnumber=6386621","3D Stacked ICs;Design-for-Test;Silicon Interposer;Test Architecture and Wrappers","Companies;Conferences;Industries;Manufacturing;Silicon;Stacking;Testing","assembling;integrated circuit design;integrated circuit interconnections;integrated circuit manufacture;integrated circuit testing;three-dimensional integrated circuits","2D chips;3D IC testing;3D vertical stacking;CoWoS process design;EDA industry;TSMC;TSV;chip-on-wafer-on-substrate process;complex 3D chip design;heterogeneous dies;heterogeneous system integration;interdie interconnects;interposer-based 3D IC assembly;manufacturing defects;optimized process technology;passive silicon interposer;post-stacking retesting;semiconductor process technology;test architecture development;test flow optimization;through-silicon vias interconnects;volume production;wire-bond chip interconnections;yield loss","","2","","","","","5-8 Nov. 2012","","IEEE","IEEE Conference Publications"
"Keynote addresses [2 abstracts]","","","Computer-Aided Design (ICCAD), 2012 IEEE/ACM International Conference on","20121220","2012","","","1","1","Provides an abstract for each of the two keynote presentations and a brief professional biography of each presenter.","1092-3152","","","","http://ieeexplore.ieee.org/stamp/stamp.jsp?arnumber=6386576","","","","","","0","","","","","5-8 Nov. 2012","","IEEE","IEEE Conference Publications"
"Modeling and design automation of biological circuits and systems","Miskov-Zivanov, N.; Faeder, J.R.; Myers, C.J.; Sauro, H.M.","Univ. of Pittsburgh, Pittsburgh, PA, USA","Computer-Aided Design (ICCAD), 2012 IEEE/ACM International Conference on","20121220","2012","","","291","293","Circuit designers are increasingly more drawn to challenges in modeling and designing biological circuits and systems. While the principles of biological organization and architecture resemble those in systems that engineers are designing, the complexity of biological systems still seems to be beyond the designed ones. This session discusses state-of-the-art in tackling such challenges, and presents existing methods for automation of model development, design and analysis of biological circuits and systems. The speakers are experts from systems biology, synthetic biology, and design automation fields. The three talks will cover a range of topics that include rule-based modeling approach to model cell signaling networks, automation of genetic circuit design, and the importance and development of standards in synthetic biology.","1092-3152","","","","http://ieeexplore.ieee.org/stamp/stamp.jsp?arnumber=6386625","Systems biology;biodesign automation;biological parts;chemical reaction networks;genetic circuits;rule-based modeling;synthetic biology","Biological system modeling;Computational modeling;Design automation;Genetics;Integrated circuit modeling;Standards;Synthetic biology","biology computing;cellular biophysics;complex networks;genetics;knowledge based systems;modelling;molecular biophysics","analysis automation;biological architecture;biological circuit design automation;biological circuit modeling;biological organization;biological system design automation;biological system modeling;cell signaling networks;genetic circuit design automation;model development automation;rule based modeling;synthetic biology standards;systems biology","","0","","","","","5-8 Nov. 2012","","IEEE","IEEE Conference Publications"
"Analytical-based approach for capacitor placement with gradient error compensation and device correlation enhancement in analog integrated circuits","Cheng-Wu Lin; Chung-Lin Lee; Jai-Ming Lin; Soon-Jyh Chang","Dept. of Electr. Eng., Nat. Cheng Kung Univ., Tainan, Taiwan","Computer-Aided Design (ICCAD), 2012 IEEE/ACM International Conference on","20121220","2012","","","635","642","Switched capacitors are commonly used in analog design. The circuit performance based on this technique relies on the accuracy of capacitance ratios, which are affected by random and systematic mismatches. To meet the accuracy requirement, designers can increase the layout area of unit capacitors to reduce random mismatch. Since increasing layout area enlarges the distance between unit capacitors, it induces more gradient errors, which results in larger systematic mismatch. Therefore, the better way for reducing the gradient errors is to carefully determine the locations of unit capacitors in a capacitor array. Moreover, the resulting placement must have high capacitance correlation in order to enhance yield. In this paper, we first explore the attributes of a good capacitor placement, which can reduce gradient errors and increase capacitance correlation. Then, an analytical-based approach is proposed to complete capacitor placement considering these issues. Finally, the results are optimized by arbitrarily swapping two unit capacitors. Compared with the simulated annealing based approach, the proposed method not only achieves better placement results but also gets 34x faster for the largest benchmark capacitor array.","1092-3152","","","","http://ieeexplore.ieee.org/stamp/stamp.jsp?arnumber=6386738","Analog placement;capacitor array","Arrays;Capacitance;Capacitors;Correlation;Dispersion;Indexes;Symmetric matrices","analogue integrated circuits;capacitors;gradient methods;integrated circuit layout;simulated annealing","accuracy requirement;analog design;analog integrated circuits;capacitance correlation;capacitance ratios;capacitor array;capacitor placement;circuit performance;device correlation enhancement;gradient error compensation;gradient errors;layout area;simulated annealing;switched capacitors;systematic mismatches;unit capacitors","","0","","29","","","5-8 Nov. 2012","","IEEE","IEEE Conference Publications"
"Minimizing area and power of sequential CMOS circuits using threshold decomposition","Kulkarni, N.; Nukala, N.; Vrudhula, S.","Sch. of Comput., Arizona State Univ., Tempe, AZ, USA","Computer-Aided Design (ICCAD), 2012 IEEE/ACM International Conference on","20121220","2012","","","605","612","This paper describes the design of a standard cell library of differential mode threshold gates, referred to as a Threshold Logic Latch or TLL, and new threshold function identification and decomposition methods to map a conventional logic network consisting of logic gates and flipflops, into a hybrid network that consists of both TLLs and conventional logic gates. After logic synthesis and physical design (placement and routing) using a commercial 65nm LP (low power) library, and commercial design tools, the hybrid circuits are shown to have up to 35% less dynamic power, about 50% less leakage power and around 37% less area when compared to the corresponding conventional design operated at the same (peak) frequency.","1092-3152","","","","http://ieeexplore.ieee.org/stamp/stamp.jsp?arnumber=6386734","Boolean Decomposition;Dynamic Power;Leakage Power;Sequential Circuits;TLL;Technology Mapping;Threshold Logic","Boolean functions;Data structures;Delay;Libraries;Logic gates;Microprocessors","CMOS logic circuits;flip-flops;logic design;logic gates;sequential circuits","conventional logic network;differential mode threshold gates;flipflops;hybrid circuits;hybrid network;leakage power;logic gates;logic synthesis;physical design;sequential CMOS circuits;size 65 nm;standard cell library;threshold decomposition;threshold function identification;threshold logic latch","","0","","12","","","5-8 Nov. 2012","","IEEE","IEEE Conference Publications"
"On logic synthesis for timing speculation","Yuxi Liu; Rong Ye; Feng Yuan; Kumar, R.; Qiang Xu","CUhk REliable Comput. Lab. (CURE), Chinese Univ. of Hong Kong, Shatin, China","Computer-Aided Design (ICCAD), 2012 IEEE/ACM International Conference on","20121220","2012","","","591","596","By allowing the occurrence of infrequent timing errors and correcting them with rollback mechanisms, the so-called timing speculation (TS) technique can significantly improve circuit energy-efficiency and hence has become one of the most promising solutions to mitigate the ever-increasing variation effects in nanometer technologies. As timing error recovery incurs non-trivial performance/energy overhead, it is important to reshape the delay distribution of critical paths in timing-speculated circuits to minimize their timing error rates. Most existing TS optimization techniques achieve this objective with post-synthesis techniques such as gate sizing or body biasing. In this work, we propose to conduct logic synthesis for timing-speculated circuits from the ground up. Being able to manipulate circuit structures during logic optimization, the proposed solution is able to dramatically reduce circuit timing error rates and hence improve its throughput, as demonstrated with experimental results on various benchmark circuits.","1092-3152","","","","http://ieeexplore.ieee.org/stamp/stamp.jsp?arnumber=6386732","","Delay;Error analysis;Error probability;Logic gates;Optimization;Throughput","logic circuits;optimisation;timing circuits","TS optimization;body biasing;circuit energy-efficiency;circuit structures;critical paths;delay distribution;ever-increasing variation effects;gate sizing;infrequent timing errors;logic optimization;logic synthesis;nanometer technologies;nontrivial performance/energy overhead;rollback mechanisms;timing error recovery;timing-speculated circuits","","0","","25","","","5-8 Nov. 2012","","IEEE","IEEE Conference Publications"
"Collaborative calibration of on-chip thermal sensors using performance counters","Shiting Lu; Tessier, R.; Burleson, W.","Dept. of Electr. & Comput. Eng., Univ. of Massachusetts, Amherst, MA, USA","Computer-Aided Design (ICCAD), 2012 IEEE/ACM International Conference on","20121220","2012","","","15","22","Thermal sensors are currently deployed in processors to collect thermal information for dynamic thermal management (DTM). The calibration cost for thermal sensors can be prohibitively high as the number of on-chip sensors increases. We propose an on-line multi-sensor calibration method which combines potentially inaccurate temperature values obtained from two sources: temperature readings from thermal sensors and temperature estimations using system performance counters. A data fusion strategy based on Bayesian inference, which combines information from these two sources, is demonstrated along with a temperature estimation approach using performance counters. The approaches are verified via simulation for an AMD Athlon 64 processor with 24 on-chip temperature sensors scaled to a 45nm technology node. Our results show that the standard deviation of temperature sensor measurement errors can be reduced from 3 ~ 4°C to ≤ 1°C using the proposed method. Additionally, our MATLAB implementation shows that the new approach runs at least 67x faster than competing approaches based on Kalman filtering making it highly appropriate for run-time use.","1092-3152","","","","http://ieeexplore.ieee.org/stamp/stamp.jsp?arnumber=6386583","","Calibration;Correlation;Estimation;Radiation detectors;Temperature sensors","calibration;integrated circuit packaging;microprocessor chips;sensor fusion;temperature sensors;thermal management (packaging)","AMD Athlon 64 processor;Bayesian inference;collaborative calibration;data fusion strategy;dynamic thermal management;on-chip thermal sensor;performance counters;temperature estimation;thermal information","","0","","18","","","5-8 Nov. 2012","","IEEE","IEEE Conference Publications"
