"http://ieeexplore.ieee.org/search/searchresult.jsp?bulkSetSize=2000&queryText%3DComputer-Aided+Design+.LB.ICCAD.RB.%2C+2012+IEEE%2FACM+International+Conference",2015/06/23 15:08:27
"Scalable sampling methodology for logic simulation: Reduced-Ordered Monte Carlo","Chien-Chih Yu; Alaghi, A.; Hayes, J.P.","Dept. of Electr. Eng. & Comput. Sci., Univ. of Michigan, Ann Arbor, MI, USA","Computer-Aided Design (ICCAD), 2012 IEEE/ACM International Conference on","20121220","2012","","","195","201","Monte Carlo (MC) simulation plays a key role in EDA as the gold standard against which heuristics are measured. It is also an important stand-alone technique for statistics-based tasks like power estimation and reliability analysis. Accurate simulation requires large sample sets and long runtimes, which can be hard to achieve with conventional MC. We propose an approach called Reduced-Ordered Monte Carlo (ROMC), which improves simulation efficiency, while still producing accurate results. ROMC takes advantage of the (partial) redundancy inherent in digital signals. It prioritizes input signals based on their observability at the outputs, and combines inputs based on a compatibility property that enables them to share samples. Experimental results are presented which demonstrate that the ROMC methodology can decrease simulation runtime by several orders of magnitude.","1092-3152","","","","http://ieeexplore.ieee.org/stamp/stamp.jsp?arnumber=6386609","Logic simulation;Monte Carlo simulation;redundancy;sampling methods;signal probability","Accuracy;Estimation;Integrated circuit modeling;Monte Carlo methods;Multiplexing;Observability;Redundancy","Monte Carlo methods;electronic design automation;logic simulation;sampling methods","EDA;digital signal redundancy;gold standard;logic simulation;reduced ordered Monte Carlo method;scalable sampling methodology","","0","","19","","","5-8 Nov. 2012","","IEEE","IEEE Conference Publications"
"Online fault detection and tolerance for photovoltaic energy harvesting systems","Xue Lin; Yanzhi Wang; Di Zhu; Naehyuck Chang; Pedram, M.","Dept. of Electr. Eng., Univ. of Southern California, Los Angeles, CA, USA","Computer-Aided Design (ICCAD), 2012 IEEE/ACM International Conference on","20121220","2012","","","1","6","Photovoltaic energy harvesting systems (PV systems) are subject to PV cell faults, which decrease the efficiency of PV systems and even shorten the PV system lifespan. Manual PV cell fault detection and elimination are expensive and nearly impossible for remote PV systems, e.g., PV systems on satellites. Therefore, online fault detection techniques and fault tolerance solutions are needed that can detect and tolerate PV cell faults without manual intervention. In this work, we present an online fault detection and tolerance technique for remote PV systems, which is capable of dynamically locating faulty PV cells and tolerating PV cell faults. More precisely, we present a modified PV panel structure and an efficient algorithm for our online fault detection and tolerance. Our fault detection and tolerance technique reduces output power degradation due to PV cell faults in a PV system by up to 81.31%.","1092-3152","","","","http://ieeexplore.ieee.org/stamp/stamp.jsp?arnumber=6386581","Fault Detection;Fault Tolerance;Photovoltaic Panel Reconfiguration;Photovoltaic System","Circuit faults;Computer architecture;Fault detection;Fault tolerance;Fault tolerant systems;Microprocessors;Power generation","energy harvesting;fault diagnosis;fault tolerance;photovoltaic power systems;power generation faults;power generation reliability","manual PV cell fault detection system;modified PV panel structure;online fault detection technique;online fault tolerance solution;photovoltaic energy harvesting system","","0","","10","","","5-8 Nov. 2012","","IEEE","IEEE Conference Publications"
"[Copyright notice]","","","Computer-Aided Design (ICCAD), 2012 IEEE/ACM International Conference on","20121220","2012","","","1","1","The following topics are dealt with: energy harvesting; test cost and security; extreme ultraviolet lithography; multiple patterning lithography; cyber physical systems; network routing; random noise; leakage and technology-aware gate sizing; CMOS manufacturing-reliability; power ground networks; 3D IC reliability technology; biological system modeling; power-aware architecture; CAD; smartphones; high-performance computing systems co-design; high-level design methods; electromagnetic-based design automation; printable electronics; embedded CPU-GPU core design; analog-mixed-signal post-silicon validation; network-on-chips; logic synthesis; nanoscale analog circuit synthesis; billion-transistor VLSI designs; OLED displays; and 2D-3D physical design optimization.","1092-3152","","","","http://ieeexplore.ieee.org/stamp/stamp.jsp?arnumber=6386580","","","CAD;CMOS integrated circuits;LED displays;VLSI;energy harvesting;graphics processing units;integrated circuit design;integrated circuit reliability;logic design;mixed analogue-digital integrated circuits;network routing;network-on-chip;organic light emitting diodes;parallel processing;random noise;smart phones;ultraviolet lithography","2D-3D physical design optimization;3D IC reliability technology;CAD;CMOS manufacturing;CMOS reliability;OLED displays;analog-mixed-signal post-silicon validation;billion-transistor VLSI designs;biological system modeling;cyber physical systems;electromagnetic-based design automation;embedded CPU-GPU core design;energy harvesting;extreme ultraviolet lithography;high-level design methods;high-performance computing systems co-design;logic synthesis;multiple patterning lithography;nanoscale analog circuit synthesis;network routing;network-on-chips;power ground networks;power-aware architecture;printable electronics;random noise;security;smartphones;technology-aware gate sizing;test cost","","0","","","","","5-8 Nov. 2012","","IEEE","IEEE Conference Publications"
"PowerRush : Efficient transient simulation for power grid analysis","Jianlei Yang; Zuowei Li; Yici Cai; Qiang Zhou","Dept. of Comput. Sci. & Technol., Tsinghua Univ., Beijing, China","Computer-Aided Design (ICCAD), 2012 IEEE/ACM International Conference on","20121220","2012","","","653","659","Transient analysis is the most practical and effective approach for power grid validation, but which is very challengeable for large scale VLSI chips because it is really time consuming and requires large memory resources. In this paper we proposed a parallel transient simulation approach for efficient power grid analysis. Firstly we adopt symmetric formulation for NA equation of RLC power grid to reduce memory usage. Meanwhile, fast Cholesky factorization solver can be used to improve simulation efficiency. Secondly, we perform partition-based parallel transient simulation for naturally independent subnets without accuracy lost. Thirdly, we propose a composite simulation flow for efficient and practical transient analysis for industrial power grid. Finally, several industrial power grid benchmarks are evaluated on our approaches for high accurate transient simulation with extremely low memory consumption.","1092-3152","","","","http://ieeexplore.ieee.org/stamp/stamp.jsp?arnumber=6386741","Circuit Simulation;Power Grid;PowerRush;Transient Analysis","Analytical models;Computational modeling;Equations;Integrated circuit modeling;Mathematical model;Power grids;Transient analysis","VLSI;matrix decomposition;microprocessor chips;power grids;transient analysis","Cholesky factorization solver;NA equation;PowerRush;RLC power grid;composite simulation flow;independent subnets;large scale VLSI chips;memory resources;partition-based parallel transient simulation;power grid analysis;time consuming;transient analysis","","1","","20","","","5-8 Nov. 2012","","IEEE","IEEE Conference Publications"
"Deterministic random walk preconditioning for power grid analysis","Jia Wang","Dept. of Electr. & Comput. Eng., Illinois Inst. of Technol., Chicago, IL, USA","Computer-Aided Design (ICCAD), 2012 IEEE/ACM International Conference on","20121220","2012","","","392","398","Iterative linear equation solvers depend on high quality pre-conditioners to achieve fast convergence. For sparse symmetric systems arising from large power grid analysis problems, however, preconditioners generated by traditional incomplete Cholesky factorizations are usually of low quality, resulting in slow convergence. On the other hand, although preconditioners generated by random walks are quite effective to reduce the number of iterations, it takes considerable amount of time to compute them in a stochastic manner. In this paper, we propose a new preconditioning technique for power grid analysis, named deterministic random walk, that combines the advantages of the above two approaches. Our proposed algorithm computes the preconditioners in a deterministic manner to reduce computation time, while achieving similar quality as stochastic random walk preconditioning by modifying fill-ins to compensate dropped entries. We have proved that for such compensation scheme, our algorithm will not fail for certain matrix orderings, which otherwise cannot be guaranteed by traditional incomplete factorizations. We demonstrate that by incorporating our proposed preconditioner, a conjugate gradient solver is able to outperform a state-of-the-art algebraic multigrid preconditioned solver on public IBM power grid benchmarks for DC power grid analysis, while potentially remaining very efficient for transient analysis.","1092-3152","","","","http://ieeexplore.ieee.org/stamp/stamp.jsp?arnumber=6386642","","Algorithm design and analysis;Benchmark testing;Monte Carlo methods;Power grids;Stochastic processes;Symmetric matrices;Vectors","iterative methods;matrix decomposition;power grids","Cholesky factorizations;deterministic random walk preconditioning;high quality pre-conditioners;iterative linear equation solvers;matrix orderings;power grid analysis;preconditioners;preconditioning technique;sparse symmetric systems;stochastic random walk preconditioning;transient analysis","","0","","39","","","5-8 Nov. 2012","","IEEE","IEEE Conference Publications"
"Reclaiming over-the-IP-block routing resources with buffering-aware rectilinear Steiner minimum tree construction","Yilin Zhang; Chakraborty, A.; Chowdhury, S.; Pan, D.Z.","Dept. of ECE, Univ. of Texas at Austin, Austin, TX, USA","Computer-Aided Design (ICCAD), 2012 IEEE/ACM International Conference on","20121220","2012","","","137","143","In this paper, we study an often overlooked but very important and practical problem of building Buffering-aware Over-the-Block rectilinear Steiner minimum tree (BOB-RSMT). In most previous works, the routing resources over the IP blocks were simply treated as routing blockages, resulting in significant waste of routing resources on higher metal layers not utilized by internal intra-block routing. On the other hand, routing over large IP blocks needs special attention as there is no way to insert buffers inside hard IP blocks, which can lead to unresolvable slew/timing violations. In this paper, we propose a novel BOB-RSMT algorithm which helps reclaim the “wasted” over-the-block routing resources while meeting user-specified slew constraints. Our algorithm incrementally and efficiently migrates initial tree structures with buffering-awareness to meet slew constraints while minimizing wire length. It can handle complex blocks including rectilinear shapes. Our experiments on various benchmarks demonstrate very promising results. By utilizing over-the-block routing resources intelligently, we can save the outside-block wire length as well as the total wire length significantly compared with the conventional obstacle-avoiding rectilinear Steiner minimum tree (OA-RSMT) algorithms. BOB-RSMT also reduces the repeater count/area needed to satisfy slew constraints, which is very important for modern design closure.","1092-3152","","","","http://ieeexplore.ieee.org/stamp/stamp.jsp?arnumber=6386600","","Capacitance;IP networks;Merging;Optimization;Routing;Timing;Wires","IP networks;telecommunication network routing;trees (mathematics)","BOB-RSMT;OA-RSMT algorithms;buffering-aware over-the-block rectilinear Steiner minimum tree construction;buffering-awareness;metal layers;obstacle-avoiding rectilinear Steiner minimum tree algorithms;over-the-IP-block routing resources;rectilinear shapes;slew constraints;unresolvable slew-timing violations;user-specified slew constraints;wasted over-the-block routing resources","","0","","21","","","5-8 Nov. 2012","","IEEE","IEEE Conference Publications"
"Circuit reliability: From Physics to Architectures: Embedded tutorial paper","Jianxin Fang; Gupta, S.; Kumar, S.V.; Marella, S.K.; Mishra, V.; Pingqiang Zhou; Sapatnekar, S.S.","ECE Dept., Univ. of Minnesota, Minneapolis, MN, USA","Computer-Aided Design (ICCAD), 2012 IEEE/ACM International Conference on","20121220","2012","","","243","246","In the period of extreme CMOS scaling, reliability issues are becoming a critical problem. These problems include issues related to device reliability, in the form of bias temperature instability, hot carrier injection, time-dependent dielectric breakdown of gate oxides, as well as interconnect reliability concerns such as electromigration and TSV stress in 3D integrated circuits. This tutorial surveys these effects, and discusses methods for mitigating them at all levels of design.","1092-3152","","","","http://ieeexplore.ieee.org/stamp/stamp.jsp?arnumber=6386616","3D ICs;Bias temperature instability;electromigration;hot carriers;oxide breakdown;stress","Degradation;Design automation;Integrated circuit modeling;Integrated circuit reliability;Logic gates;Stress","CMOS integrated circuits;dielectric devices;electric breakdown;integrated circuit reliability","3D integrated circuits;TSV stress;bias temperature instability;circuit reliability;electromigration;extreme CMOS scaling;gate oxides;hot carrier injection;interconnect reliability;physics to architectures;time-dependent dielectric breakdown","","0","","74","","","5-8 Nov. 2012","","IEEE","IEEE Conference Publications"
"Experimental analysis of a ring oscillator network for hardware Trojan detection in a 90nm ASIC","Ferraiuolo, A.; Xuehui Zhang; Tehranipoor, M.","ECE, Univ. of Connecticut, Storrs, CT, USA","Computer-Aided Design (ICCAD), 2012 IEEE/ACM International Conference on","20121220","2012","","","37","42","The modern integrated circuit (IC) manufacturing process has exposed chip designers to hardware Trojans which threaten circuits bound for critical applications. This paper details the implementation and analysis of a novel ring oscillator network technique for Trojan detection in an application specific integrated circuit (ASIC). The ring oscillator network serves as a power supply monitor by detecting fluctuations in characteristic frequencies due to malicious modifications (i.e. hardware Trojans) in the circuit under authentication. The ring oscillator network was implemented and fabricated in 40 IBM 90nm ASICs with controlled hardware Trojans. This work analyzes the impact of Trojans with varied partial activity, area, and location on the proposed ring oscillator structure and demonstrates that stealthy Trojans can be efficiently detected with this technique even while obfuscated by process variations, background noise, and environment noise.","1092-3152","","","","http://ieeexplore.ieee.org/stamp/stamp.jsp?arnumber=6386586","Hardware Trojan detection;IC trust;on-chip measurement;process variations","Frequency measurement;Hardware;Integrated circuits;Logic gates;Noise;Ring oscillators;Trojan horses","application specific integrated circuits;authorisation;integrated circuit manufacture;invasive software;logic circuits;power supply circuits","40 IBM ASIC;application specific integrated circuit;authentication;background noise;critical applications;environment noise;exposed chip designers;fluctuation detection;hardware Trojan detection;integrated circuit manufacturing;malicious modifications;power supply monitor;process variations;ring oscillator network;ring oscillator structure;size 90 nm","","0","","16","","","5-8 Nov. 2012","","IEEE","IEEE Conference Publications"
"Latency tolerance for Throughput Computing: Designer track","Chien-Ping Lu; Ko, B.","","Computer-Aided Design (ICCAD), 2012 IEEE/ACM International Conference on","20121220","2012","","","524","525","In Throughput Computing, the data can be processed independently with a substantial amount of threads running similar programs, referred to as kernels, or shaders for graphics specific workload. A Throughput Computing device, such as GPU, requires task latency tolerance to hold the context of the outstanding threads, and data latency tolerance to hold spaces for memory requests issued from the threads. The threads are grouped into thread groups. The register file and the associated number of outstanding thread groups should be sized according to the ratio of the computing resources to load/store units. Such a ratio should reflect the balance between ALU and load/store instructions of target workload.","1092-3152","","","","http://ieeexplore.ieee.org/stamp/stamp.jsp?arnumber=6386720","","Bandwidth;Context;Graphics processing units;Instruction sets;Kernel;Registers;Throughput","computer graphics;multi-threading","ALU;GPU;data latency tolerance;graphics specific workload;load-store instructions;load-store units;memory requests;outstanding thread groups;throughput computing","","0","","","","","5-8 Nov. 2012","","IEEE","IEEE Conference Publications"
"Multiple tunable constant multiplications: Algorithms and applications","Aksoy, L.; Costa, E.; Flores, P.; Monteiro, J.","INESC-ID, Lisbon, Portugal","Computer-Aided Design (ICCAD), 2012 IEEE/ACM International Conference on","20121220","2012","","","473","479","The multiple constant multiplications (MCM) problem, that is defined as finding the minimum number of addition and subtraction operations required for the multiplication of multiple constants by an input variable, has been the subject of great interest since the complexity of many digital signal processing (DSP) systems is dominated by an MCM operation. This paper introduces a variant of the MCM problem, called multiple tunable constant multiplications (MTCM) problem, where each constant is not fixed as in the MCM problem, but can be selected from a set of possible constants. We present an exact algorithm that formalizes the MTCM problem as a 0-1 integer linear programming (ILP) problem when constants are defined under a number representation. We also introduce a local search method for the MTCM problem that includes an efficient MCM algorithm. Furthermore, we show that these techniques can be used to solve various optimization problems in finite impulse response (FIR) filter design and we apply them to one of these problems. Experimental results clearly show the efficiency of the proposed methods when compared to prominent algorithms designed for the MCM problem.","1092-3152","","","","http://ieeexplore.ieee.org/stamp/stamp.jsp?arnumber=6386709","","Adders;Algorithm design and analysis;Cost function;Finite impulse response filter;Logic gates;Signal processing algorithms","FIR filters;digital signal processing chips;integer programming;linear programming;optimisation","addition operations;digital signal processing systems;finite impulse response filter;input variable;integer linear programming problem;local search method;multiple tunable constant multiplications;number representation;optimization problems;subtraction operations","","0","","15","","","5-8 Nov. 2012","","IEEE","IEEE Conference Publications"
"Using standardized quantization for multi-party PPUF matching: Foundations and applications","Meguerdichian, S.; Potkonjak, M.","Comput. Sci. Dept., Univ. of California, Los Angeles, Los Angeles, CA, USA","Computer-Aided Design (ICCAD), 2012 IEEE/ACM International Conference on","20121220","2012","","","577","584","Hardware-based physically unclonable functions (PUFs) are elegant security primitives that leverage process variation inherent in modern integrated circuits. Recently proposed matched public PUFs (mPPUFs) use a combination of coordinated device aging and gate disabling to create two PUFs that securely realize identical input-output mappings. However, mPPUFs of any reasonable size allow for protocols between only a very limited number of parties. We propose quantization of possible delay values to enable matching of an unbounded number of arbitrary PPUF instances, improving stability in the presence of fluctuations in temperature or supply voltage while maintaining resiliency against a wide number of attacks.","1092-3152","","","","http://ieeexplore.ieee.org/stamp/stamp.jsp?arnumber=6386730","","Aging;Computer architecture;Delay;Logic gates;Protocols;Quantization;Security","integrated circuits;protocols;public key cryptography","coordinated device aging;elegant security primitives;hardware-based physically unclonable function;input-output mappings;integrated circuits;multiparty PPUF matching;protocols;stability;standardized quantization;supply voltage fluctuation;temperature fluctuation","","1","","14","","","5-8 Nov. 2012","","IEEE","IEEE Conference Publications"
"High-Performance, Low-Power Resonant Clocking: Embedded tutorial","Guthaus, M.R.; Taskin, B.","Dept. of Comput. Eng., Univ. of California, Santa Cruz, Santa Cruz, CA, USA","Computer-Aided Design (ICCAD), 2012 IEEE/ACM International Conference on","20121220","2012","","","742","745","Clock distribution networks consume a significant portion of on-chip power. Traditional buffered clock distribution power is limited by frequency, capacitance, and activity rates. Resonant clock distributions can reduce this power by “recycling” energy on-chip and reducing the overall clock power. This tutorial introduces recent techniques for distributed-LC, traveling wave, and standing wave resonant clock distributions. In particular, the tutorial discusses the recent developments and open research problems. The tutorial covers both circuits, computer-aided design algorithms and methodologies for resonant clocking.","1092-3152","","","","http://ieeexplore.ieee.org/stamp/stamp.jsp?arnumber=6386756","","Clocks;Computers;Conferences;Design automation;Oscillators;Synchronization;System-on-a-chip","circuit CAD;clock distribution networks;low-power electronics","buffered clock distribution power;clock distribution networks;computer-aided design algorithms;distributed-LC;energy on-chip recycling;high-performance low-power resonant clocking;on-chip power;standing wave resonant clock distributions;traveling wave","","0","","40","","","5-8 Nov. 2012","","IEEE","IEEE Conference Publications"
"Table of contents","","","Computer-Aided Design (ICCAD), 2012 IEEE/ACM International Conference on","20121220","2012","","","1","14","Presents the table of contents of the proceedings record.","1092-3152","","","","http://ieeexplore.ieee.org/stamp/stamp.jsp?arnumber=6386578","","","","","","0","","","","","5-8 Nov. 2012","","IEEE","IEEE Conference Publications"
"Probabilistic design methodology to improve run-time stability and performance of STT-RAM caches","Xiuyuan Bi; Zhenyu Sun; Hai Li; Wenqing Wu","Polytech. Inst., New York Univ., Brooklyn, NY, USA","Computer-Aided Design (ICCAD), 2012 IEEE/ACM International Conference on","20121220","2012","","","88","94","Using the spin-transfer torque random access memory (STT-RAM) technology as lower level on-chip caches has been proposed to minimize leakage power consumption and enhance cache capacity at the scaled technologies. However, programming STT-RAM is a stochastic process due to the random thermal fluctuations. Conventional worst-case (corner) design with a fixed write pulse period cannot completely eliminate the write failures but maintain it at a low level by paying high cost in hardware complexity and system performance. In this work, we systematically study the impacts of the stochastic switching of STT-RAM on circuit and cache performance. Two probabilistic design techniques, write-verify-rewrite with adaptive period (WRAP) and verify-one-while-writing (VOW), then are proposed for performance improvement and write failure reduction. Our simulation results show that compared to the result of the conventional design using Hamming Code to correct the write failures, WRAP is write error free while reducing the cache write latency and energy consumption by 40% and 26%, respectively. When an extremely low write failure rate (i.e., 10<sup>-22</sup>) is allowed, VOW can further boost the reductions on write latency and energy to 52% and 29%, respectively. Furthermore, a hybrid STT-RAM based cache hierarchy taking advantages of probabilistic design techniques is proposed. The novel hierarchy can reduce the write failure rate of STT-RAM cache to 10<sup>-30</sup>, while improving the speed by 6.8% and saving 15% of energy consumption compared to a conventional design with Hamming Code.","1092-3152","","","","http://ieeexplore.ieee.org/stamp/stamp.jsp?arnumber=6386593","","Error analysis;Hamming weight;Optimized production technology;Random access memory;Switches;Temperature sensors;Writing","cache storage;circuit stability;probability;random processes;random-access storage;stochastic processes","STT-RAM cache;VOW;WRAP;cache capacity enhancement;energy consumption;fixed write pulse period;hardware complexity;leakage power consumption minimization;lower level on-chip cache;probabilistic design methodology;random thermal fluctuation;run-time stability;spin-transfer torque random access memory;stochastic process;verify-one-while-writing;write failure reduction;write-verify-rewrite with adaptive period","","0","","19","","","5-8 Nov. 2012","","IEEE","IEEE Conference Publications"
