"http://ieeexplore.ieee.org/search/searchresult.jsp?bulkSetSize=2000&matchBoolean%3Dtrue%26searchField%3DSearch_All%26queryText%3D%28p_Publication_Title%3AHardware%2FSoftware+Codesign+and+System+Synthesis+.LB.CODES.PLS.ISSS.RB.%2C+2010+IEEE%2FACM%2FIFIP+International+Conference+on%29",2015/07/23 13:39:09
"Modeling and analyzing real-time multiprocessor systems","Wiggers, M.; Thiele, L.; Lee, E.A.; Schliecker, S.; Bekooij, M.","Dept. of EEMCS, Univ. of Twente, Enschede, Netherlands","Hardware/Software Codesign and System Synthesis (CODES+ISSS), 2010 IEEE/ACM/IFIP International Conference on","20110415","2010","","","329","330","Researchers have proposed approaches to verify that real-time multiprocessor systems meet their timeliness constraints. These approaches make assumptions on the model of computation, the load placed on the multiprocessor system, and the faults that can arise. This heterogeneous set of assumptions make these approaches hard to compare. This tutorial will present an overview and positioning of four recently proposed approaches. We present for each approach, the application domain in which its assumptions are realistic and the dominant application requirements that have driven its development. Next to discussing timeliness guarantees, we give attention to the robustness aspects of each approach; e.g. against faults such as overload.","","978-1-6055-8905-3","","","http://ieeexplore.ieee.org/stamp/stamp.jsp?arnumber=5751518","Discrete-Event Models;Real-Time Calculus;SymTA/S;Timed Dataflow","Biological system modeling;Computational modeling;Embedded systems;Performance analysis;Processor scheduling;Real time systems","multiprocessing systems;real-time systems","real-time multiprocessor system modeling;timeliness constraint","","0","","18","","","24-29 Oct. 2010","","IEEE","IEEE Conference Publications"
"Verification of dynamically reconfigurable embedded systems by model transformation rules","Madlener, F.; Weingart, J.; Huss, S.A.","Integrated Circuits & Syst. Lab., Tech. Univ. Darmstadt, Darmstadt, Germany","Hardware/Software Codesign and System Synthesis (CODES+ISSS), 2010 IEEE/ACM/IFIP International Conference on","20110415","2010","","","33","40","This paper describes a methodology for the verification of reconfigurable embedded systems. The reconfigurable systems are described by means of the Reconfigurable Discrete Event Specified System (RecDEVS) computational model and the verification is performed by a model transformation from the RecDEVS model into an equivalent representation for the UPPAAL model checking methodology. We introduce an algorithm for the automatic transformation of such models, which originate from disjoint application domains. This allows the usage of an state-of-the art verification tool for the verification of arbitrary properties of system specifications denoted in RecDEVS. We also present a set of important system properties, which now may be verified. This set includes some fundamental reconfiguration domain specific properties, which were not addressed by previous formal verification methods. The feasibility of this approach is demonstrated for a complex automotive application.","","978-1-6055-8905-3","","","http://ieeexplore.ieee.org/stamp/stamp.jsp?arnumber=5751520","Design Methodology;Model Transformation;RecDEVS;Reconfigurable Systems;UPPAAL;Verification","Automata;Clocks;Computational modeling;Embedded systems;Hardware;Integrated circuit modeling;Synchronization","discrete event simulation;embedded systems;formal verification;reconfigurable architectures","RecDEVS model;UPPAAL;formal verification;model checking method;model transformation rules;reconfigurable discrete event specified system;reconfigurable embedded systems","","0","","18","","","24-29 Oct. 2010","","IEEE","IEEE Conference Publications"
"Optimal synthesis of latency and throughput constrained pipelined MPSoCs targeting streaming applications","Javaid, H.; Xin He; Ignjatovic, A.; Parameswaran, S.","Sch. of Comput. Sci. & Eng., Univ. of New South Wales, Sydney, NSW, Australia","Hardware/Software Codesign and System Synthesis (CODES+ISSS), 2010 IEEE/ACM/IFIP International Conference on","20110415","2010","","","75","84","A streaming application, characterized by a kernel that can be broken down into independent tasks which can be executed in a pipelined fashion, inherently allows its implementation on a pipeline of Application Specific Instruction set Processors (ASIPs), called a pipelined MPSoC. The latency and throughput requirements of streaming applications put constraints on the design of such a pipelined MPSoC, where each ASIP has a number of available configurations differing by additional instructions, and instruction and data cache sizes. Thus, the design space of a pipelined MPSoC is all the possible combinations of ASIP configurations (design points). In this paper, a methodology is proposed to optimize the area of a pipelined MPSoC under a latency or a throughput constraint. The final design point is a set of ASIP configurations with one configuration for each ASIP. We proposed an Integer Linear Programming (ILP) based solution to the area optimization problem under a latency constraint, and an algorithm for optimization of pipelined MPSoC area under a throughput constraint. The proposed solutions were evaluated using four streaming applications: JPEG encoder; JPEG decoder; MP3 encoder; and H.264 decoder. The time to find the Pareto front of each pipelined MPSoC was less than 4 minutes where design spaces had up to 10<sup>16</sup> design points, illustrating the applicability of our approach.","","978-1-6055-8905-3","","","http://ieeexplore.ieee.org/stamp/stamp.jsp?arnumber=5751527","Design Space Exploration;Integer Linear Programming","Clocks;Optimization;Pipelines;Program processors;Streaming media;Throughput;Transform coding","Pareto optimisation;application specific integrated circuits;integer programming;linear programming;multiprocessing systems;pipeline processing;system-on-chip","H.264 decoder;JPEG decoder;JPEG encoder;MP3 encoder;Pareto front;application specific instruction set processors;integer linear programming;optimal latency synthesis;streaming applications;throughput constrained pipelined MPSoC","","4","1","33","","","24-29 Oct. 2010","","IEEE","IEEE Conference Publications"
"Scheduling garbage collection in real-time systems","Kero, M.; Aittamaa, S.","Dept. of Comput. Sci., Lulea Univ. of Technol., Lule&#x00E5;, Sweden","Hardware/Software Codesign and System Synthesis (CODES+ISSS), 2010 IEEE/ACM/IFIP International Conference on","20110415","2010","","","51","60","The key to successful deployment of garbage collection in real-time systems is to enable provably safe schedulability tests of the real-time tasks. At the same time one must be able to determine the total heap usage of the system. Schedulability tests typically require a uniformed model of timing assumptions (inter-arrival times, deadlines, etc.). Incorporating the cost of garbage collection in such tests typically requires both artificial timing assumptions of the garbage collector and restricted capabilities of the task scheduler. In this paper, we pursue a different approach. We show how the reactive object model of the programming language Timber enables us to decouple the cost of a concurrently running copying garbage collector from the schedulability of the real-time tasks. I.e., we enable any regular schedulability analysis without the need of incorporating the cost of an interfering garbage collector. We present the garbage collection demand analysis, which determines if the garbage collector can be feasibly scheduled in the system.","","978-1-6055-8905-3","","","http://ieeexplore.ieee.org/stamp/stamp.jsp?arnumber=5751523","Schedulability analysis;reactive systems","Algorithm design and analysis;Data structures;Kernel;Message systems;Real time systems;Synchronization","programming languages;real-time systems;reproduction (copying);scheduling;storage management;task analysis","artificial timing assumption;concurrently running copying garbage collector cost;garbage collection demand analysis;garbage collection scheduling;heap usage;programming language;real-time system;real-time task schedulability;regular schedulability analysis;safe schedulability test;task scheduler","","0","1","30","","","24-29 Oct. 2010","","IEEE","IEEE Conference Publications"
"FEMU: A firmware-based emulation framework for SoC verification","Hao Li; Dong Tong; Kan Huang; Xu Cheng","Microprocessor R&D Center, Peking Univ., Beijing, China","Hardware/Software Codesign and System Synthesis (CODES+ISSS), 2010 IEEE/ACM/IFIP International Conference on","20110415","2010","","","257","266","Full-system emulation on FPGA(Field-Programmable Gate Array) with real-world workloads can enhance the confidence of SoC(System-on-Chip) design. However, since FPGA emulation requires complete implementation of key modules and provides weak visibility, it is time-consuming. This paper proposes FEMU, a hybrid firmware/hardware emulation framework for SoC verification. The core of FEMU is implemented by transplanting QEMU, a full-system emulator, from OS level to BIOS level, so we can directly emulate devices upon hardware. Moreover, FEMU provides programming interfaces to simplify device modeling in firmware. Based on an auxiliary set of hardware modules, FEMU allows hybrid full-system emulation with the combination of real hardware and emulated firmware model. Therefore, FEMU can facilitate full-system emulation in three aspects. First, FEMU enables full-system emulation with the minimum hardware implementation, so the DUT (Design Under Test) module can be verified under target application as early as possible. Second, by comparing the execution traces generated using real hardware and emulated firmware model, respectively, FEMU helps locate and fix bugs occurred in the full-system emulation. Third, by replacing un-verified hardware modules with emulated firmware models, FEMU helps isolating design issues in multiple modules. In a practical SoC project, FEMU helped us identify several design issues in full-system emulation. In addition, the evaluation results show that the emulation speed of FEMU is comparable with QEMU after transplantation.","","978-1-6055-8905-3","","","http://ieeexplore.ieee.org/stamp/stamp.jsp?arnumber=5751510","Firmware;System Emulator;System-on-Chip;Verification","Debugging;Emulation;Field programmable gate arrays;Hardware;Software;Synchronization;System-on-a-chip","field programmable gate arrays;firmware;formal verification;integrated circuit design;system-on-chip","BIOS level;FEMU;QEMU;SoC verification;design under test module;field-programmable gate array;firmware-based emulation framework;hybrid full-system emulation;system-on-chip design","","0","1","19","","","24-29 Oct. 2010","","IEEE","IEEE Conference Publications"
"Embedded market: Challenges and opportunities","Ilderem, V.","Integrated Platform Research Lab, Intel Corporation, USA","Hardware/Software Codesign and System Synthesis (CODES+ISSS), 2010 IEEE/ACM/IFIP International Conference on","20110415","2010","","","1","1","There is a convergence trend in the computing, communication and consumer markets and with a forecast of an additional 1 billion connected computing users by 2015, it is of high value to provide a common experience between the devices. Intel's vision of Compute Continuum will enable the users to realize the potential of a seamless cross-device experience with more consistency and accessibility to their information. The convergence trend and the Compute Continuum make System-on-Chip [SoC] a key ingredient for the embedded markets. At Intel Labs, we are focusing on delivering differentiating technology solutions to enable our business partners to successfully capture their targeted market segments. We are working on a variety of research that will enable modular system architecture and silicon technology breakthroughs for rapid customization and integration facilitating faster time-to-market. Intel's vision along with some technology challenges and possible solutions will be highlighted.","","978-1-6055-8905-3","","","http://ieeexplore.ieee.org/stamp/stamp.jsp?arnumber=5751502","Compute Continuum;System-on-a-Chip","Business;Computer architecture;Convergence;Focusing;Hardware;Silicon;System-on-a-chip","commerce;embedded systems;system-on-chip","Intel labs;compute continuum;consumer markets;embedded market;modular system architecture;rapid customization;silicon technology;system-on-chip","","0","","","","","24-29 Oct. 2010","","IEEE","IEEE Conference Publications"
"NeuroNoC: Neural network inspired runtime adaptation for an on-chip communication architecture","Ebi, T.; Faruque, M.A.A.; Henkel, J.","Dept. of Embedded Syst., Karlsruhe Inst. of Technol. (KIT), Karlsruhe, Germany","Hardware/Software Codesign and System Synthesis (CODES+ISSS), 2010 IEEE/ACM/IFIP International Conference on","20110415","2010","","","223","230","The on-chip communication architecture presented in this paper, NeuroNoC, addresses the problems arising in large multi-core systems where global or local routing strategies do not work efficiently anymore since they either do not scale or lack information on the network state. Our communication architecture is runtime adaptive and it deploys a distributed artificial neural network to aid routing decisions. It thereby provides a light-weight mechanism for local routing information to propagate through the communication architecture and is capable of self-organizing efficiently (since scalable) to varying communication workload scenarios. The underlying basic concepts are borrowed from spiking neural networks, a special case of artificial neural networks. Our experiments show that already with low hardware overhead, a significant improvement of the runtime routing behavior compared to current state-of-the-art approaches is possible. We report an improvement of 23% in routing quality compared to wXY routing in terms of failed transactions.","","978-1-6055-8905-3","","","http://ieeexplore.ieee.org/stamp/stamp.jsp?arnumber=5751505","Adaptive system;Network-on-Chip;Spiking Neural Networks","Artificial neural networks;Bandwidth;Biomembranes;Computer architecture;Kernel;Neurons;Routing","multiprocessing systems;multiprocessor interconnection networks;network-on-chip;neural nets","NeuroNoC;communication workload scenario;distributed artificial neural networks;local routing information;multicore system;neural network inspired runtime adaptation;onchip communication architecture;routing decision;spiking neural networks","","1","","22","","","24-29 Oct. 2010","","IEEE","IEEE Conference Publications"
"Workload characterization and its impact on multicore platform design","Bogdan, P.; Marculescu, R.","Dept. of Electr. & Comput. Eng., Carnegie Mellon Univ., Pittsburgh, PA, USA","Hardware/Software Codesign and System Synthesis (CODES+ISSS), 2010 IEEE/ACM/IFIP International Conference on","20110415","2010","","","231","240","Networks-on-chip (NoCs) have been proposed as a scalable solution to solving the communication problem in multicore systems. Although the queuing-based approaches have been traditionally used for performance analysis purposes, they cannot properly account for many of the traffic characteristics (e.g., non-stationary, self-similarity, higher order statistics) that are crucial for multicore platform design when communication happens via the NoC approach. To overcome this limitation, we propose a mean field approach to analyze the traffic dynamics in multicore systems and show how the non-stationary effects of the NoC workload can be effectively captured; this is of fundamental significance for rethinking the very basis of multicore systems design. Moreover, our experimental results demonstrate that both network architecture and application characteristics are the main sources of power law behavior observed in network traffic. Our findings open new research directions into NoC optimization which require accurate models of time- and space-dependent traffic behavior.","","978-1-6055-8905-3","","","http://ieeexplore.ieee.org/stamp/stamp.jsp?arnumber=5751506","Master Equation;Multi-processor systems;Networks-on-Chip;Systems-on-Chip","Analytical models;Equations;Fractals;Mathematical model;Multicore processing;Routing;Stochastic processes","multiprocessing systems;network-on-chip;queueing theory","NoC approach;multicore platform design;networks-on-chip;queuing-based approaches;workload characterization","","1","","26","","","24-29 Oct. 2010","","IEEE","IEEE Conference Publications"
"A performance model and code overlay generator for scratchpad enhanced embedded processors","Baker, M.A.; Panda, A.; Ghadge, N.; Kadne, A.; Chatha, K.S.","Comput. Sci. & Eng. Dept., Arizona State Univ., Tempe, AZ, USA","Hardware/Software Codesign and System Synthesis (CODES+ISSS), 2010 IEEE/ACM/IFIP International Conference on","20110415","2010","","","287","296","Software managed scratchpad memories (SPMs) provide improved performance and power in embedded processors by reducing required hardware resources. Performance depends strongly on the scheme used to map code and data onto the SPM, but generating optimal mappings can be extremely difficult. Here we address instruction mapping on SPMs and present a performance model and algorithm, “Code Overlay Generator” (COG), for producing high performance dynamic SPM code mappings. Our heuristic does not require profiling information, and is suitable for generating mapping solutions for large programs which are otherwise infeasible using previously proposed Integer Linear Programming (ILP) techniques. We compare our algorithm with a published heuristic and the code overlay mapping algorithm provided with the Cell Broadband Engine (CBE) Synergistic Processing Unit (SPU) compiler from IBM, spu-gcc. We find an average performance advantage of 34% compared to the previous algorithm, and 87% with respect to spu-gcc. We additionally show that our performance model enables improved tools for offline evaluation of code overlay performance and mapping selection.","","978-1-6055-8905-3","","","http://ieeexplore.ieee.org/stamp/stamp.jsp?arnumber=5751513","Cell Broadband Engine;Code Mapping;Code Overlay;Compiler;Embedded Systems;Scratchpad Memory","Algorithm design and analysis;Computer architecture;Generators;Heuristic algorithms;Interference;Performance evaluation;Software","embedded systems;microprocessor chips;performance evaluation;power aware computing;program compilers;random-access storage","code overlay generator;high performance dynamic SPM code mapping;instruction mapping;performance model;scratchpad enhanced embedded processor;software managed scratchpad memories","","0","","14","","","24-29 Oct. 2010","","IEEE","IEEE Conference Publications"
"Heap data management for limited local memory (LLM) multi-core processors","Ke Bai; Shrivastava, A.","Microarchitecture Lab., Arizona State Univ., Tempe, AZ, USA","Hardware/Software Codesign and System Synthesis (CODES+ISSS), 2010 IEEE/ACM/IFIP International Conference on","20110415","2010","","","317","325","This paper presents a scheme to manage heap data in the local memory present in each core of a limited local memory (LLM) multi-core processor. While it is possible to manage heap data semi-automatically using software cache, managing heap data of a core through software cache may require changing the code of the other threads. Cross thread modifications are difficult to code and debug, and only become more difficult as we scale the number of cores. We propose a semi-automatic, and scalable scheme for heap data management that hides this complexity in a library with a much natural programming interface. Furthermore, for embedded applications, where the maximum heap size can be known at compile time, we propose optimizations on the heap management to significantly improve the application performance. Experiments on several benchmarks of MiBench executing on the Sony Playstation 3 show that our scheme is easier to use, and if we know the maximum size of heap data, then our optimizations can improve application performance by an average of 14%.","","978-1-6055-8905-3","","","http://ieeexplore.ieee.org/stamp/stamp.jsp?arnumber=5751516","Heap;IBM Cell;MPI;PS3;embedded systems;local memory;multi-core processor;scratch pad memory","Data structures;Instruction sets;Memory management;Multicore processing","cache storage;embedded systems;multiprocessing systems;optimisation","embedded systems;heap data management;limited local memory;multicore processor;natural programming interface;optimizations;software cache","","0","","30","","","24-29 Oct. 2010","","IEEE","IEEE Conference Publications"
"Accurate online power estimation and automatic battery behavior based power model generation for smartphones","Lide Zhang; Tiwana, B.; Dick, R.P.; Zhiyun Qian; Mao, Z.M.; Zhaoguang Wang; Lei Yang","EECS Dept., Univ. of Michigan, Ann Arbor, MI, USA","Hardware/Software Codesign and System Synthesis (CODES+ISSS), 2010 IEEE/ACM/IFIP International Conference on","20110415","2010","","","105","114","This paper describes PowerBooter, an automated power model construction technique that uses built-in battery voltage sensors and knowledge of battery discharge behavior to monitor power consumption while explicitly controlling the power management and activity states of individual components. It requires no external measurement equipment. We also describe PowerTutor, a component power management and activity state introspection based tool that uses the model generated by PowerBooter for online power estimation. PowerBooter is intended to make it quick and easy for application developers and end users to generate power models for new smartphone variants, which each have different power consumption properties and therefore require different power models. PowerTutor is intended to ease the design and selection of power efficient software for embedded systems. Combined, PowerBooter and PowerTutor have the goal of opening power modeling and analysis for more smartphone variants and their users.","","978-1-6055-8905-3","","","http://ieeexplore.ieee.org/stamp/stamp.jsp?arnumber=5751489","Power modeling;battery;mobile phones","Batteries;Bluetooth;Brightness;Cameras;Global Positioning System;Ground penetrating radar;Monitoring","battery management systems;electric sensing devices;embedded systems;power consumption;power engineering computing","PowerBooter;automatic battery behavior;built-in battery voltage sensor;embedded system;online power estimation;power efficient software;power management;power model generation;smartphone variant","","64","","18","","","24-29 Oct. 2010","","IEEE","IEEE Conference Publications"
"Automatic parallelization of embedded software using hierarchical task graphs and integer linear programming","Cordes, D.; Marwedel, P.; Mallik, A.","Inf. Centrum Dortmund, Dortmund, Germany","Hardware/Software Codesign and System Synthesis (CODES+ISSS), 2010 IEEE/ACM/IFIP International Conference on","20110415","2010","","","267","276","The last years have shown that there is no way to disregard the advantages provided by multiprocessor System-on-Chip (MPSoC) architectures in the embedded systems domain. Using multiple cores in a single system enables to close the gap between energy consumption, problems concerning heat dissipation, and computational power. Nevertheless, these benefits do not come for free. New challenges arise, if existing applications have to be ported to these multiprocessor platforms. One of the most ambitious tasks is to extract efficient parallelism from these existing sequential applications. Hence, many parallelization tools have been developed, most of them are extracting as much parallelism as possible, which is in general not the best choice for embedded systems with their limitations in hardware and software support. In contrast to previous approaches, we present a new automatic parallelization tool, tailored to the particular requirements of the resource constrained embedded systems. Therefore, this paper presents an algorithm which automatically steers the granularity of the generated tasks, with respect to architectural requirements and the overall execution time reduction. For this purpose, we exploit hierarchical task graphs to simplify a new integer linear programming based approach in order to split up sequential programs in an efficient way. Results on real-life benchmarks have shown that the presented approach is able to speed sequential applications up by a factor of up to 3.7 on a four core MPSoC architecture.","","978-1-6055-8905-3","","","http://ieeexplore.ieee.org/stamp/stamp.jsp?arnumber=5751511","Automatic Parallelization;Embedded Software;Hierarchical Task Graph;Integer Linear Programming","Computer architecture;Embedded systems;Equations;Hardware;Integer linear programming;Mathematical model;Parallel processing","embedded systems;integer programming;linear programming;microprocessor chips;multiprocessing systems;parallel architectures;power aware computing;system-on-chip","automatic parallelization tool;computational power;embedded software;energy consumption;heat dissipation;hierarchical task graphs;integer linear programming;multiple cores;multiprocessor system-on-chip architectures;sequential programs","","2","","25","","","24-29 Oct. 2010","","IEEE","IEEE Conference Publications"
