"http://ieeexplore.ieee.org/search/searchresult.jsp?bulkSetSize=2000&matchBoolean%3Dtrue%26searchField%3DSearch_All%26queryText%3D%28p_Publication_Title%3AHardware%2FSoftware+Codesign+and+System+Synthesis+.LB.CODES.PLS.ISSS.RB.%2C+2010+IEEE%2FACM%2FIFIP+International+Conference+on%29",2015/07/23 13:39:09
"Exploring models of computation with Ptolemy II","Brooks, C.; Lee, E.A.; Tripakis, S.","EECS Dept., Univ. of California, Berkeley, Berkeley, CA, USA","Hardware/Software Codesign and System Synthesis (CODES+ISSS), 2010 IEEE/ACM/IFIP International Conference on","20110415","2010","","","331","332","The Ptolemy project studies modeling, simulation, and design of concurrent, real-time, embedded systems. The focus is on assembly of concurrent components. The key underlying principle in the project is the use of well-defined models of computation that govern the interaction between components. A major problem area being addressed is the use of heterogeneous mixtures of models of computation. Ptolemy II takes a component view of design, in that models are constructed as a set of interacting components. A model of computation governs the semantics of the interaction, and thus imposes an execution-time discipline. Ptolemy II has implementations of many models of computation including Synchronous Data Flow, Kahn Process Networks, Discrete Event, Continuous Time, Synchronous/Reactive and Modal Models This hands-on tutorial explores how these models of computation are implemented in Ptolemy II and how to create new models of computation such as a ""non-dogmatic"" Process Networks example and a left-to-right execution policy example.","","978-1-6055-8905-3","","","http://ieeexplore.ieee.org/stamp/stamp.jsp?arnumber=5751519","Modeling;concurrency;simulation","Computational modeling;Data models;Object oriented modeling;Real time systems;Semantics;Software;Tutorials","embedded systems;object-oriented methods;public domain software","Kahn process networks;Ptolemy II;concurrent embedded systems;continuous time models;discrete event models;execution time discipline;left-to-right execution policy;modal models;non dogmatic process networks;real time embedded systems;synchronous data flow;synchronous-reactive models","","0","","8","","","24-29 Oct. 2010","","IEEE","IEEE Conference Publications"
"High durability in NAND flash memory through effective page reuse mechanisms","Kwangyoon Lee; Orailoglu, A.","Dept. of Comput. Sci. & Eng., Univ. of California, La Jolla, CA, USA","Hardware/Software Codesign and System Synthesis (CODES+ISSS), 2010 IEEE/ACM/IFIP International Conference on","20110415","2010","","","205","211","In this paper, we introduce a highly effective page reuse mechanism to reduce the amount of block erasures and page programming in NAND based primary memory architectures. The proposed techniques provide a very high rate of page reuse by effectively incorporating bit differences in page updates along with a reduction in bit unprogrammability by minimizing programming interference among adjacent pages. We also propose an effective block reclamation scheme to alleviate overall programming stress in a block so as to reduce the probability of run-time cell defects. The page reordering scheme can further increase page reusability by reducing run-time programming disturbance. The experimental results show that our proposed techniques significantly diminish the amount of block reclamation and consequently enhance the durability of the NAND flash based storage systems. Furthermore, by alleviating overall bit stress in NAND flash memory, the probability of bit failure of each cell is also significantly reduced, enabling the construction of more reliable and durable NAND flash based memory.","","978-1-6055-8905-3","","","http://ieeexplore.ieee.org/stamp/stamp.jsp?arnumber=5751503","Durability;Memory Architecture;NAND Flash;Primary Memory","Ash;Embedded systems;Memory management;Microprocessors;Programming;Random access memory","NAND circuits;flash memories;memory architecture","NAND flash memory;block erasures;memory architectures;page programming;page reuse mechanisms;programming interference;run time cell defects;run time programming disturbance","","0","","13","","","24-29 Oct. 2010","","IEEE","IEEE Conference Publications"
"OE+IOE: A novel turn model based fault tolerant routing scheme for networks-on-chip","Pasricha, S.; Yong Zou; Connors, D.; Siegel, H.J.","Dept. of Electr. & Comput. Eng., Colorado State Univ., Fort Collins, CO, USA","Hardware/Software Codesign and System Synthesis (CODES+ISSS), 2010 IEEE/ACM/IFIP International Conference on","20110415","2010","","","85","93","Network-on-chip (NoC) communication architectures are increasingly being used today to interconnect cores on chip multiprocessors (CMPs). Permanent faults in NoCs due to fabrication challenges in ultra deep submicron (UDSM) technology nodes and due to wearout have led to an increased emphasis on fault tolerant design techniques. To ensure fault tolerant communication in NoCs, several fault tolerant routing algorithms have been proposed in recent years with the goal of routing flits around faults. A majority of these algorithms are based on the turn model approach due to its simplicity and inherent freedom from deadlock. However, existing turn model based fault tolerant routing algorithms are either too restrictive in the choice of paths that flits can traverse, or are tailored to work efficiently only on very specific fault distribution patterns. In this paper, we propose a novel low overhead fault tolerant routing scheme that combines the odd-even (OE) and inverted odd-even (IOE) turn models to achieve much better fault tolerance than traditional turn model based schemes. The proposed scheme uses replication opportunistically to optimize the balance between energy overhead and arrival rate. Our experimental results indicate that the proposed OE+IOE routing scheme provides better fault tolerance than existing turn model, N-random walk, and dual virtual channel based routing schemes that have been proposed in literature.","","978-1-6055-8905-3","","","http://ieeexplore.ieee.org/stamp/stamp.jsp?arnumber=5751528","Fault-tolerant routing;Networks-on-chip","Circuit faults;Fault tolerant systems;Redundancy;Routing;Runtime;System recovery","fault tolerance;microprocessor chips;multiprocessing systems;multiprocessor interconnection networks;network-on-chip","N-random walk;OE+IOE routing scheme;dual virtual channel based routing scheme;fault distribution pattern;fault tolerant routing scheme;interconnect core;inverted odd-even turn model;network-on-chip communication architecture;on chip multiprocessor;permanent fault;turn model approach;ultra deep submicron technology","","1","","42","","","24-29 Oct. 2010","","IEEE","IEEE Conference Publications"
"[Title page]","","","Hardware/Software Codesign and System Synthesis (CODES+ISSS), 2010 IEEE/ACM/IFIP International Conference on","20110415","2010","","","1","13","The following topics are dealt with: embedded systems; application-specific algorithms and architectures; reconfigurable and real-time system; HW/SW co-design; high performance computing; optimising multiprocessor and NoC performance, QoS and reliability; power-aware design; MPSoC analysis and synthesis; memory and communication architecture; SystemC synthesis subset standard; compilation techniques for CGRAs; Network-on-Chip systems; accelerating system simulation; embedded software performance optimization; and multi-core systems.","","978-1-6055-8905-3","","","http://ieeexplore.ieee.org/stamp/stamp.jsp?arnumber=5751488","","","C language;application specific integrated circuits;embedded systems;hardware-software codesign;logic design;memory architecture;microprocessor chips;multiprocessing systems;network-on-chip;power aware computing;program compilers;reconfigurable architectures;software performance evaluation","CGRA;HW/SW co-design;MPSoC analysis;MPSoC synthesis;NoC performance;QoS;SystemC synthesis subset standard;accelerating system simulation;application-specific algorithms;application-specific architectures;communication architecture;compilation techniques;embedded software performance optimization;embedded systems;hardware/software codesign;high performance computing;memory architecture;multicore systems;network-on-chip systems;optimising multiprocessor;power-aware design;real-time system;reconfigurable system;reliability;system synthesis","","0","","","","","24-29 Oct. 2010","","IEEE","IEEE Conference Publications"
"Intermediate fabrics: Virtual architectures for circuit portability and fast placement and routing","Coole, J.; Stitt, G.","Dept. of Electr. & Comput. Eng., Univ. of Florida, Gainesville, FL, USA","Hardware/Software Codesign and System Synthesis (CODES+ISSS), 2010 IEEE/ACM/IFIP International Conference on","20110415","2010","","","13","22","Although hardware/software partitioning of embedded applications onto FPGAs is widely known to have performance and power advantages, FPGA usage has been typically limited to hardware experts, due largely to several problems: 1) difficulty of integrating hardware design tools into well-established software tool flows, 2) increasingly lengthy FPGA design iterations due to placement and routing, and 3) a lack of portability and interoperability resulting from device/platform-specific tools and bitfiles. In this paper, we directly address the last two problems by introducing intermediate fabrics, which are virtual reconfigurable architectures specialized for different application domains, implemented on top of commercial-off-the-shelf devices. Such specialization enables near-instantaneous placement and routing by hiding the complexity of fine-grained physical devices, while also enabling circuit portability across all devices that implement the intermediate fabric. When combined with existing work on runtime synthesis from software binaries, intermediate fabrics reduce the effects of all three problems by enabling transparent usage of COTS FPGAs by software designers. In this paper, we explore intermediate fabric architectures using specialization techniques to minimize area and performance overhead of the virtual fabric while maximizing routability and speedup of placement and routing. We present results showing an average placement and routing speedup of 554×, with an average area overhead of 10% and clock overhead of 18%, which corresponds to an average frequency of 195 MHz.","","978-1-6055-8905-3","","","http://ieeexplore.ieee.org/stamp/stamp.jsp?arnumber=5751493","FPGA;intermediate fabrics;placement and routing;speedup;virtualization","Computer architecture;Digital signal processing;Fabrics;Field programmable gate arrays;Integrated circuit modeling;Libraries;Routing","electronic engineering computing;field programmable gate arrays;hardware-software codesign;network routing;open systems;reconfigurable architectures;virtual reality","COTS;FPGA design;circuit portability;circuit routing;commercial-off-the-shelf devices;device-platform-specific tool;embedded application;field programmable gate arrays;hardware design tool;hardware-software partitioning;intermediate fabrics;interoperability;runtime synthesis;virtual reconfigurable architecture","","4","1","36","","","24-29 Oct. 2010","","IEEE","IEEE Conference Publications"
"Exploring programming model-driven QoS support for NoC-based platforms","Joven, J.; Marongiu, A.; Angiolini, F.; Benini, L.; De Micheli, G.","LSI, EPFL, Lausanne, Switzerland","Hardware/Software Codesign and System Synthesis (CODES+ISSS), 2010 IEEE/ACM/IFIP International Conference on","20110415","2010","","","65","74","Networks-on-Chip (NoCs) are being increasingly considered as a central enabling technology to communication-centric designs as more and more IP blocks are integrated on the same SoC. Embedded applications, in turn, are becoming extremely sophisticated, and often require guaranteed levels of service and performance. The complex and non-uniform nature of network traffic generated by parallel applications running on a large number of possibly heterogeneous IPs makes a strong case for providing Quality of Service (QoS) support for traffic streams over the NoC infrastructure. In this paper we consider an integrated hardware/software approach for delivering QoS at the application level. We designed NoC hardware support, low-level middleware and APIs which enable QoS control at the application level. Furthermore, we identify a set of programming abstractions useful to associate the notion of priority to each running task in the system. An initial implementation of this programming model is also presented, which leverages a set of extensions to a MPSoC-specific OpenMP compiler and run-time environment.","","978-1-6055-8905-3","","","http://ieeexplore.ieee.org/stamp/stamp.jsp?arnumber=5751526","Design;Performance","Argon;Computer architecture;Flip-flops;Programming;Quality of service;Runtime;Software","middleware;multiprocessing systems;network-on-chip;program compilers;quality of service","API;IP blocks;MPSoC-specific OpenMP compiler;NoC hardware support;communication-centric designs;low-level middleware;networks-on-chip;programming abstractions;programming model-driven QoS support;quality of service","","0","","39","","","24-29 Oct. 2010","","IEEE","IEEE Conference Publications"
"Performance modeling of embedded applications with zero architectural knowledge","Lattuada, M.; Ferrandi, F.","Dipt. di Elettron. e Inf., Politec. di Milano, Milan, Italy","Hardware/Software Codesign and System Synthesis (CODES+ISSS), 2010 IEEE/ACM/IFIP International Conference on","20110415","2010","","","277","286","Performance estimation is a key step in the development of an embedded system. Normally, the performance evaluation is performed using a simulator or a performance mathematical model of the target architecture. However, both these approaches are usually based on the knowledge of the architectural details of the target. In this paper we present a methodology for automatically building an analytical model to estimate the performance of an application on a generic processor without requiring any information about the processor architecture but the one provided by the GNU GCC Intermediate Representation. The proposed methodology exploits the linear regression technique based on an application analysis performed on the Register Transfer Level internal representation of the GNU GCC compiler. The benefits of working with this type of model and with this intermediate representation are three: we take into account most of the compiler optimizations, we implicitly consider some architectural characteristics of the target processor and we can easily estimate the performance of portions of the specification. We validate our approach by evaluating with cross-validation technique the accuracy and the generality of the performance models built for the ARM926EJ-S and the LEON3 processors.","","978-1-6055-8905-3","","","http://ieeexplore.ieee.org/stamp/stamp.jsp?arnumber=5751512","GNU GCC;Performance Estimation;profiling","Analytical models;Assembly;Estimation;Feature extraction;Linear regression;Numerical models;Optimization","embedded systems;multiprocessing systems;program compilers;regression analysis","ARM926EJ-S;GNU GCC intermediate representation;LEON3 processors;cross-validation technique;embedded system;generic processor;linear regression technique;performance estimation;performance evaluation;performance mathematical model;processor architecture;register transfer level internal representation;zero architectural knowledge","","0","","25","","","24-29 Oct. 2010","","IEEE","IEEE Conference Publications"
"Power aware SID-based simulator for embedded multicore DSP subsystems","Cheng-Yen Lin; Po-Yu Chen; Chun-Kai Tseng; Chung-Wen Huang; Chia-Chieh Weng; Chi-Bang Kuan; Shih-Han Lin; Shi-Yu Huang; Jenq-Kuen Lee","Nat. Tsing-Hua Univ., Hsinchu, Taiwan","Hardware/Software Codesign and System Synthesis (CODES+ISSS), 2010 IEEE/ACM/IFIP International Conference on","20110415","2010","","","95","103","The embedded multicore DSP systems are playing increasingly important role for consumer electronic design. Such systems try to optimize the objective for both performance and power with mobile devices. Embedded application developers will then devise designs to optimize embedded applications for not only performance but also power. However, currently there are no power metrics support for popular application design platforms such as QEMU and SID, where application developers develop their applications. This hinders application developers to help tune optimizations for power. In this paper, we propose a power aware simulation framework on embedded multicore DSP subsystems for SID framework. To the best of our knowledge, this is the first work to attempt to build a power aware simulator based on SID simulation framework. The power estimation flow includes two phases, IP level power modeling and system level power power profiling. In the IP level power modeling, PowerMixer<sup>IP</sup> is employed to build up the power model for PAC DSP and major IPs. In the system level power profiling, we provide a power profiling hierarchy that meets the demand of embedded software developers. The granularity of power profiling can be configured to the whole simulation stage or any specific time slot in the simulation such as a dedicated function loop. In our experiments, DSP programs with SIMD intrinsics for DSPStone benchmark are examined with our proposed power aware simulator. In addition, a face detection application is deployed as a running example on multi-core DSP systems to show how our power simulator can be used to help collaborate with developers in the optimization process to illustrate views of power dissipations of applications.","","978-1-6055-8905-3","","","http://ieeexplore.ieee.org/stamp/stamp.jsp?arnumber=5751529","DSP;Embedded Processor;Multicore Simulation;Power","Artificial neural networks;Digital signal processing;Multicore processing;Random access memory;Switches","consumer electronics;digital signal processing chips;embedded systems;logic design;logic simulation;mobile computing;multiprocessing systems;parallel processing;power aware computing","DSPStone benchmark;IP level power modeling;PAC DSP;PowerMixer7;SIMD;consumer electronic design;embedded application optimize;embedded multicore DSP subsystem;embedded software developer;mobile device;power aware SID-based simulator;power aware simulation framework;power estimation flow;power profiling hierarchy;system level power profiling","","0","","31","","","24-29 Oct. 2010","","IEEE","IEEE Conference Publications"
"Automatic Memory Partitioning: Increasing memory parallelism via data structure partitioning","Ben Asher, Y.; Rotem, N.","Comput. Sci. Dept., Haifa Univ., Haifa, Israel","Hardware/Software Codesign and System Synthesis (CODES+ISSS), 2010 IEEE/ACM/IFIP International Conference on","20110415","2010","","","155","161","In high-level synthesis, pipelined designs are often restricted by the number of memory banks available to the synthesis system. Using multiple memory banks can improve the performance of accelerated applications. Currently, programmers must manually assign data structures to specific memory banks on the accelerator. This paper presents Automatic Memory Partitioning, a method for automatically partitioning data structures into multiple memory banks for increased parallelism and performance. We use source code instrumentation to collect memory traces in order to detect linear memory access patterns. The memory traces are used to split data structures into disjoint memory regions and determine which segments may benefit from parallel memory access. Experiments show significant improvements in performance while using a minimal number of memory banks.","","978-1-6055-8905-3","","","http://ieeexplore.ieee.org/stamp/stamp.jsp?arnumber=5751495","FPGA;Memory;Parallelism","Arrays;Color;Field programmable gate arrays;Hardware;Instruments;Resource management","data structures;high level synthesis;logic partitioning;parallel memories","automatic memory partitioning;data structure partitioning;high level synthesis;memory parallelism;multiple memory bank;parallel memory access","","2","","24","","","24-29 Oct. 2010","","IEEE","IEEE Conference Publications"
"An elastic software cache with fast prefetching for Motion Compensation in video decoding","Ping Chao; Youn-Long Lin","Dept. of Comput. Sci., Nat. Tsing Hua Univ., Hsinchu, Taiwan","Hardware/Software Codesign and System Synthesis (CODES+ISSS), 2010 IEEE/ACM/IFIP International Conference on","20110415","2010","","","23","32","Real-time decoding of ultrahigh resolution video using multicore architectures is important for future embedded systems. However, memory bandwidth is still a bottleneck of system performance. Video coding performs irregular DRAM access resulting in very low and unstable efficiency. The conventional cache approach is insufficient because it reduces only the redundant accesses to data that has already been fetched during prior-macroblock decoding. We present an Elastic Software Cache (ESC) for ultrahigh resolution video decoding on Scratchpad Memory (SPM)-based systems. Utilizing access region analysis, our latency-optimized prefetching scheme rearranges accesses to minimize both data redundancy and DRAM access latency. Compared to the conventional cache approach, our scheme requires only 4.6 Kbytes of SPM space but it can save up to 25% of memory access cycles resulting in both higher performance and lower power.","","978-1-6055-8905-3","","","http://ieeexplore.ieee.org/stamp/stamp.jsp?arnumber=5751507","H.264/AVC;Memory Access Optimization;Motion Compensation;Software Cache;Video Decoding","Bandwidth;Decoding;Merging;Motion segmentation;Prefetching;Random access memory","DRAM chips;cache storage;embedded systems;motion compensation;multiprocessing systems;optimisation;video coding","DRAM access;elastic software cache;embedded systems;memory access cycles;memory access optimization;memory bandwidth;motion compensation;multicore architectures;prefetching;prior-macroblock decoding;scratchpad memory;video decoding","","0","","11","","","24-29 Oct. 2010","","IEEE","IEEE Conference Publications"
"parSC: Synchronous parallel SystemC simulation on multi-core host architectures","Schumacher, C.; Leupers, R.; Petras, D.; Hoffmann, A.","Inst. for Integrated Signal Process. Syst., RWTH Aachen Univ., Aachen, Germany","Hardware/Software Codesign and System Synthesis (CODES+ISSS), 2010 IEEE/ACM/IFIP International Conference on","20110415","2010","","","241","246","Time-consuming cycle-accurate MPSoC simulation is often needed for debugging and verification. Its practicability is put at risk by the growing MPSoC complexity. This work presents a conservative synchronous parallel simulation approach along with a SystemC framework to accelerate tightly-coupled MPSoC simulations on multi-core hosts. Key contribution is the implementation strategy, which utilizes techniques from the high-performance computing domain. Results show speed-ups of up to 4.4 on four host cores.","","978-1-6055-8905-3","","","http://ieeexplore.ieee.org/stamp/stamp.jsp?arnumber=5751508","Experimentation;Measurement;Performance","Computational modeling;Data models;Kernel;Load modeling;Logic gates;Prefetching;Synchronization","computer debugging;multiprocessing systems;network interfaces;parallel architectures;system-on-chip","MPSoC complexity;high performance computing domain;multicore host architectures;multicore host core;synchronous parallel systemC simulation;tightly coupled MPSoC simulation;time consuming cycle accurate MPSoC simulation","","10","","19","","","24-29 Oct. 2010","","IEEE","IEEE Conference Publications"
