"http://ieeexplore.ieee.org/search/searchresult.jsp?bulkSetSize=2000&matchBoolean%3Dtrue%26searchField%3DSearch_All%26queryText%3D%28%28Design%2C+Automation+and+Test+in+Europe+Conference+and+Exhibition%29+AND+2004%29",2015/06/23 14:53:54
"Synthesis for manufacturability: a sanity check","Nardi, Alessandra; Sangiovanni-Vincentelli, A.L.","Dept. of Electr. Eng. & Comput. Sci., California Univ., Berkeley, CA, USA","Design, Automation and Test in Europe Conference and Exhibition, 2004. Proceedings","20040308","2004","2","","796","801 Vol.2","As we move towards nanometer technology, manufacturing problems become overwhelmingly difficult to solve. Presently, optimization for manufacturability is performed at a post-synthesis stage and has been shown capable of reducing manufacturing cost up to 10%. As in other cases, raising the abstraction layer where optimization is applied is expected to yield substantial gains. This paper focuses on a new approach to design for manufacturability: logic synthesis for manufacturability. This methodology consists of replacing the traditional area-driven technology mapping with a new manufacturability-driven one. We leverage existing logic synthesis tools to test our method. The results obtained by using STMicroelectronics 0.13 μm library confirm that this approach is a promising solution for designing circuits with lower manufacturing cost, while retaining performance. Finally, we show that our synthesis for manufacturability can achieve even larger cost reduction when yield-optimized cells are added to the library, thus enabling a wider area-yield tradeoff exploration.","1530-1591","0-7695-2085-5","","10.1109/DATE.2004.1268978","http://ieeexplore.ieee.org/stamp/stamp.jsp?arnumber=1268978","","Circuit synthesis;Circuit testing;Cost function;Design for manufacture;Design optimization;Libraries;Logic design;Logic testing;Manufacturing processes;Pulp manufacturing","circuit optimisation;cost reduction;integrated circuit design;integrated circuit manufacture;logic design","cost reduction;integrated circuit design;logic synthesis;manufacturability;manufacturing cost;nanometer technology;optimization;post synthesis stage;technology mapping","","6","","12","","","16-20 Feb. 2004","","IEEE","IEEE Conference Publications"
"Level of similarity: a metric for fault collapsing","Pomeranz, I.; Reddy, S.M.","Sch. of Electr. & Comput. Eng., Purdue Univ., W. Lafayette, IN, USA","Design, Automation and Test in Europe Conference and Exhibition, 2004. Proceedings","20040308","2004","1","","56","61 Vol.1","We describe a new approach to fault collapsing that extends fault collapsing based on fault equivalence and fault dominance. The new approach is based on a metric called level of similarity between faults. Informally, a fault f<sub>j</sub> is said to be similar to a fault f<sub>i</sub> with a level of similarity SL<sub>i,j</sub> ≤ 1 if a fraction SL<sub>i,j</sub> of the tests for f<sub>i</sub> also detect f<sub>j</sub>. If SL<sub>i,j</sub> is high enough, one may exclude f<sub>j</sub> from the set of target faults and rely on the test for f<sub>i</sub> (and tests for other faults) to detect f<sub>j</sub>. We describe a procedure for fault collapsing based on the level of similarity, and study its effectiveness experimentally.","1530-1591","0-7695-2085-5","","10.1109/DATE.2004.1268827","http://ieeexplore.ieee.org/stamp/stamp.jsp?arnumber=1268827","","Circuit faults;Circuit testing;Cities and towns;Electrical fault detection;Fault detection;Fault diagnosis;Sampling methods","automatic test pattern generation;fault simulation;logic testing","fault collapsing;fault dominance;fault equivalence;level of similarity;target faults","","2","","7","","","16-20 Feb. 2004","","IEEE","IEEE Conference Publications"
"Can IP quality be objectively measured?","Werner, K.","Mentor Graphics Corp., Beaverton, OR, USA","Design, Automation and Test in Europe Conference and Exhibition, 2004. Proceedings","20040308","2004","3","","330","331 Vol.3","Virtual components (VC), also known as intellectual property (IP), have long been a part of the engineering reality. Business drivers, such as improved time to market and better resource utilization are factoring ever more into the make versus buy decision process. Maximizing in-house design resources and purchasing commodity or standard IP has become the de facto business model. Unfortunately, with the increasing number of IP vendors competing in the marketplace, the decision making process is not clear. Simplistically, functionality needs to be the first criteria, but when two or more similar IPs are available, the selection criterion quickly becomes more difficult. This paper addresses the process of measuring IP quality, presents a summary of the VSIA quality IP (QIP) metric, and reports the on-going work.","1530-1591","0-7695-2085-5","","10.1109/DATE.2004.1269264","http://ieeexplore.ieee.org/stamp/stamp.jsp?arnumber=1269264","","Area measurement;Assembly;Decision making;Graphics;Intellectual property;Process design;Resource management;Testing;Time to market;Virtual colonoscopy","decision making;industrial property;virtual reality","business drivers;de facto business model;decision making process;engineering reality;intellectual property quality;intellectual property vendors;purchasing commodity;virtual components;virtual socket interface alliance quality","","4","","1","","","16-20 Feb. 2004","","IEEE","IEEE Conference Publications"
"Evaluating the effects of SEUs affecting the configuration memory of an SRAM-based FPGA","Bellato, M.; Bernardi, P.; Bortolato, D.; Candelori, A.; Ceschia, M.; Paccagnella, A.; Rebaudengo, M.; Reorda, M.S.; Violante, M.; Zambolin, P.","","Design, Automation and Test in Europe Conference and Exhibition, 2004. Proceedings","20040308","2004","1","","584","589 Vol.1","This paper analyses the effects of single event upsets in an SRAM-based FPGA, with special emphasis for the transient faults affecting the configuration memory. Two approaches are combined: from one side, by exploiting the available information and tools dealing with the device configuration memory, we were able to make hypothesis on the meaning of every bit in the configuration memory. From the other side, radiation testing was exploited to validate the hypothesis and to gather experimental evidence about the correctness of the obtained results. As a major result, we can provide detailed information about the effects of SEUs affecting the configuration memory of a commercial FPGA device. As a second contribution, we describe a method for obtaining the same result with similar devices. Finally, the obtained results are crucial to allow the possible usage of SRAM-based FPGAs in safety-critical environments, e.g., by working on the place and route strategies of the supporting tools.","1530-1591","0-7695-2085-5","","10.1109/DATE.2004.1268908","http://ieeexplore.ieee.org/stamp/stamp.jsp?arnumber=1268908","","CMOS technology;Circuits;Field programmable gate arrays;Predictive models;Programmable logic devices;Silicon;Single event transient;Single event upset;Testing;Transient analysis","SRAM chips;field programmable gate arrays;integrated circuit reliability;logic design;logic testing;radiation effects","ASIC;FPGA device;SEU;SRAM-based FPGA;configurable logic blocks;device configuration memory;field programmable gate arrays;programmable logic devices;radiation testing;route strategies;safety-critical environments;single event upsets;supporting tools;transient faults","","31","1","10","","","16-20 Feb. 2004","","IEEE","IEEE Conference Publications"
"Functional coverage metric generation from temporal event relation graph","Young-Su Kwon; Chong-Min Kyung","Lab. of VLSI Syst., Korea Adv. Inst. of Sci. & Technol., Taejon, South Korea","Design, Automation and Test in Europe Conference and Exhibition, 2004. Proceedings","20040308","2004","1","","670","671 Vol.1","Functional coverage is a technique which can be used for checking the completeness of test vectors. In this paper, automatic generation of temporal events for functional coverage is proposed. The TERG (Temporal Event Relation Graph) is the graph where the nodes represent basic temporal property and the edges represent the time-shift value between two properties. Hierarchical temporal events are generated by traversing TERG such that invalid or irrelevant properties are eliminated. Concurrent edge groups in TERG make it possible to generate more comprehensive temporal properties.","1530-1591","0-7695-2085-5","","10.1109/DATE.2004.1268923","http://ieeexplore.ieee.org/stamp/stamp.jsp?arnumber=1268923","","Automatic testing;Boolean functions;Character generation;Design automation;Europe;Formal verification;Monitoring;Specification languages;Time measurement;Very large scale integration","automatic test pattern generation;formal verification;graph theory;temporal logic","TERG;concurrent edge groups;functional coverage;hierarchical temporal events;metric generation;temporal event relation graph;temporal property;test vector completeness checking;time-shift value","","3","","13","","","16-20 Feb. 2004","","IEEE","IEEE Conference Publications"
"Co-processor synthesis: a new methodology for embedded software acceleration","Hounsell, B.; Taylor, R.","Critical Blue Ltd., Edinburgh, UK","Design, Automation and Test in Europe Conference and Exhibition, 2004. Proceedings","20040308","2004","1","","682","683 Vol.1","This paper introduces co-processor synthesis - a methodology that provides design benefits by implementing hardware co-processors directly from embedded software. The paper examines the design benefits in this new approach vs. behavioral synthesis and configurable processor methodologies.","1530-1591","0-7695-2085-5","","10.1109/DATE.2004.1268929","http://ieeexplore.ieee.org/stamp/stamp.jsp?arnumber=1268929","","Acceleration;Application software;Coprocessors;Design methodology;Electronic design automation and methodology;Embedded software;Hardware;Parallel processing;Software standards;Software tools","embedded systems;hardware-software codesign;microprocessor chips","configurable processor methodologies;coprocessor synthesis;embedded software acceleration","","4","1","25","","","16-20 Feb. 2004","","IEEE","IEEE Conference Publications"
"Intermittent scan chain fault diagnosis based on signal probability analysis","Yu Huang; Wu-Tung Cheng; Cheng-Ju Hsieh; Huan-Yung Tseng; Alou Huang; Yu-Ting Hung","Mentor Graphics Corp., Wilsonville, OR, USA","Design, Automation and Test in Europe Conference and Exhibition, 2004. Proceedings","20040308","2004","2","","1072","1077 Vol.2","A new algorithm to diagnose intermittent scan chain fault in scan-based designs is proposed in this paper. An intermittent scan chain fault sometimes is triggered and sometimes is not triggered during scan chain shifting, which makes it very difficult to locate the fault sites. In this paper, we provide answers to three questions: (1) Why intermittent scan chain faults happen? (2) Why diagnosis of this type of faults is necessary? (3) How to diagnose this type of faults? The experimental results presented demonstrate that the proposed diagnosis algorithm is effective for large industrial designs with multiple intermittent scan chain faults.","1530-1591","0-7695-2085-5","","10.1109/DATE.2004.1269035","http://ieeexplore.ieee.org/stamp/stamp.jsp?arnumber=1269035","","Algorithm design and analysis;Circuit faults;Circuit testing;Design for testability;Fault diagnosis;Graphics;Mass production;Signal analysis;Silicon;Very large scale integration","boundary scan testing;fault diagnosis;probability","industrial designs;multiple intermittent scan chain fault diagnosis;scan based designs;signal probability analysis","","12","10","10","","","16-20 Feb. 2004","","IEEE","IEEE Conference Publications"
"OCCN: a network-on-chip modeling and simulation framework","Coppola, M.; Curaba, S.; Grammatikakis, M.D.; Maruccia, G.; Papariello, F.","AST Grenoble Lab, STMicroelectron., Grenoble, France","Design, Automation and Test in Europe Conference and Exhibition, 2004. Proceedings","20040308","2004","3","","174","179 Vol.3","The open-source on-chip communication network (OCCN) defines an efficient framework for network-on-chip modeling and simulation based on an object-oriented C++ library built on top of systemC. OCCN increases the productivity of developing communication driver models through the definition of a universal communication API. This API provides a new design pattern that enables creation and reuse of executable transaction level models (TLMs). OCCN also addresses protocol refinement, design exploration, and high-level performance modeling.","1530-1591","0-7695-2085-5","","10.1109/DATE.2004.1269226","http://ieeexplore.ieee.org/stamp/stamp.jsp?arnumber=1269226","","Communication networks;Computational modeling;Computer architecture;Design methodology;Libraries;Network-on-a-chip;Object oriented modeling;Open source software;Protocols;System-on-a-chip","C++ language;application program interfaces;digital simulation;object-oriented programming;open systems;telecommunication networks","API;application program interfaces;communication driver models;network on chip modeling;network on chip simulation;object oriented C++;open source on chip communication network;systemC;transaction level models","","15","","21","","","16-20 Feb. 2004","","IEEE","IEEE Conference Publications"
"Task feasibility analysis and dynamic voltage scaling in fault-tolerant real-time embedded systems","Ying Zhang; Chakrabarty, K.","Dept. of Electr. & Comput. Eng., Duke Univ., Durham, NC, USA","Design, Automation and Test in Europe Conference and Exhibition, 2004. Proceedings","20040308","2004","2","","1170","1175 Vol.2","We investigate dynamic voltage scaling (DVS) in real-time embedded systems that use checkpointing for fault tolerance. We present feasibility-of-scheduling tests for checkpointing schemes for a constant processor speed as well as for variable processor speeds. DVS is then carried out on the basis of the feasibility analysis. We incorporate practical issues such as faults during checkpointing and state restoration, rollback recovery time, memory access time and energy, and DVS overhead. Simulation results are presented for real-life checkpointing data and embedded processors.","1530-1591","0-7695-2085-5","","10.1109/DATE.2004.1269050","http://ieeexplore.ieee.org/stamp/stamp.jsp?arnumber=1269050","","Checkpointing;Dynamic voltage scaling;Embedded system;Energy management;Fault tolerance;Fault tolerant systems;Nonvolatile memory;Real time systems;Testing;Voltage control","embedded systems;energy management systems;fault tolerant computing;genetic algorithms;system recovery;task analysis","checkpointing data;dynamic voltage scaling;embedded processors;energy management systems;fault tolerant real time embedded systems;genetic algorithms;memory access energy;memory access time;processor speeds;rollback recovery time;task feasibility analysis","","10","","19","","","16-20 Feb. 2004","","IEEE","IEEE Conference Publications"
"A tunneling model for gate oxide failure in deep sub-micron technology","Bernardini, S.; Portal, J.M.; Masson, P.","IMT Technopole de Chateau Gombert, Marseille, France","Design, Automation and Test in Europe Conference and Exhibition, 2004. Proceedings","20040308","2004","2","","1404","1405 Vol.2","Parametric failures in CMOS IC nanoelectronics, leads to strong detection problem. In order to develop new defect oriented test methods, it is of prime importance to study the behavior of the transistor affected by those kind of failures. In this paper, we present a new electrical transistor model, which allows to study the impact of gate oxide thickness drop. It is shown that electrical behavior of the proposed model matches in a satisfactory way the defective transistor behavior.","1530-1591","0-7695-2085-5","","10.1109/DATE.2004.1269108","http://ieeexplore.ieee.org/stamp/stamp.jsp?arnumber=1269108","","Atomic layer deposition;Automatic testing;Design automation;Equations;Europe;Leakage current;MOSFETs;Portals;Tunneling;Voltage","MOSFET;semiconductor device models;semiconductor process modelling;tunnelling","CMOS IC nanoelectronics;complementary metal-oxide-semiconductor;deep submicron technology;defect oriented test methods;electrical transistor;gate oxide failure;gate oxide thickness drop;integrated circuit;parametric failures;tunneling model","","0","","7","","","16-20 Feb. 2004","","IEEE","IEEE Conference Publications"
"Diagnosis of scan-chains by use of a configurable signature register and error-correcting codes","Leininger, A.; Goessel, M.; Muhmenthaler, P.","Infineon Technol. AG, Munich, Germany","Design, Automation and Test in Europe Conference and Exhibition, 2004. Proceedings","20040308","2004","2","","1302","1307 Vol.2","In this paper a new diagnosis method for scan designs with many scan-paths based on error correcting linear block codes with N information bits and K control bits is proposed, where N is the number of scan-paths. The new approach can be implemented on a modified STUMPS-architecture. In diagnosis mode the test has K times to be repeated. In the K repetitions of the test the outputs of the scan-paths are connected to a configurable signature register (with disconnected feedback logic) according to the coefficients of the K syndrome equations of the code. By monitoring the one-dimensional output sequence of the configurable signature register the failing scan-cells in the different scan-paths can be identified with the resolution of the selected error correcting code. Since for the relevant codes, e.g. (shortened) Hamming codes, T-error correcting BCH-code, the ratio K/N decreases very fast with an increasing number N the method is useful for a large number of scan-paths.","1530-1591","0-7695-2085-5","","10.1109/DATE.2004.1269075","http://ieeexplore.ieee.org/stamp/stamp.jsp?arnumber=1269075","","Automatic testing;Circuit faults;Circuit testing;Computer science;Design methodology;Error correction codes;Fault diagnosis;Logic testing;Output feedback;Registers","block codes;error correction codes;linear codes;logic testing","K control bits;K syndrome equations;N information bits;configurable signature register;error correcting linear block codes;modified STUMPS architecture;scan chain diagnosis method;scan designs","","10","8","20","","","16-20 Feb. 2004","","IEEE","IEEE Conference Publications"
"Fast comparisons of circuit implementations","Karandikar, S.K.; Sapatnekar, S.S.","Dept. of Electr. & Comput. Eng., Minnesota Univ., Minneapolis, MN, USA","Design, Automation and Test in Europe Conference and Exhibition, 2004. Proceedings","20040308","2004","2","","910","915 Vol.2","Digital designs can be mapped to different implementations using diverse approaches, with varying cost criteria. Post-processing transforms, such as transistor sizing can drastically improve circuit performance, by optimizing critical paths to meet timing specifications. However, most transistor sizing tools have high execution times, and the attainable circuit delay can be determined only after running the tool. In this paper, we present an approach for fast transistor sizing that can enable a designer to choose one among several functionally identical implementations. Our algorithm computes the minimum achievable delay of a circuit with a maximum average error of 5.5% in less than a second for even the largest benchmarks.","1530-1591","0-7695-2085-5","","10.1109/DATE.2004.1269005","http://ieeexplore.ieee.org/stamp/stamp.jsp?arnumber=1269005","","Algorithm design and analysis;Circuit optimization;Circuit synthesis;Costs;Delay estimation;Design optimization;Logic circuits;Logic gates;Routing;Timing","circuit optimisation;delay circuits;digital circuits;integrated circuit design","benchmarks;circuit delay;circuit implementations;digital circuit designs;post processing transforms;timing specifications;transistor sizing tools","","5","","15","","","16-20 Feb. 2004","","IEEE","IEEE Conference Publications"
"IEM926: an energy efficient SoC with dynamic voltage scaling","Flautner, K.; Flynn, D.; Roberts, D.; Patel, D.I.","ARM Ltd., Cambridge, UK","Design, Automation and Test in Europe Conference and Exhibition, 2004. Proceedings","20040308","2004","3","","324","327 Vol.3","One of today's most successful embedded devices, the mobile phone, embodies a set of challenging design requirements: long battery life, small size, high performance and low cost. The single parameter that complicates the simultaneous fulfilment of all of these design goals is energy efficiency of the system, since batteries only hold a finite amount of charge. To operate within the allotted energy budget, systems must be optimized for energy consumption during design and also at run-time. Increasingly it is not sufficient to statically optimize for worst-case conditions but designers must enable systems to adapt to conditions at run-time. The intelligent energy manager™ (IEM) technology provides an integrated solution for addressing energy management of SoC devices. In this paper we present data about the energy consumption characteristics of a multiple power-domain based SoC which includes PDA functionality built around an ARM926EJ-S core.","1530-1591","0-7695-2085-5","","10.1109/DATE.2004.1269261","http://ieeexplore.ieee.org/stamp/stamp.jsp?arnumber=1269261","","Batteries;Costs;Design optimization;Dynamic voltage scaling;Energy consumption;Energy efficiency;Energy management;Mobile handsets;Runtime;Technology management","circuit optimisation;energy management systems;mobile handsets;power consumption;system-on-chip","SoC devices;circuit optimization;dynamic voltage scaling;embedded devices;energy consumption;energy management;intelligent energy manager;mobile phone;multiple power domain;system-on-chip","","16","1","6","","","16-20 Feb. 2004","","IEEE","IEEE Conference Publications"
"A scalable architecture for LDPC decoding","Cocco, M.; Dielissen, J.; Heijligers, M.; Hekstra, A.; Huisken, J.","Silicon Hive, Eindhoven, Netherlands","Design, Automation and Test in Europe Conference and Exhibition, 2004. Proceedings","20040308","2004","3","","88","93 Vol.3","Low density parity check (LDPC) codes offer excellent error correcting performance. However, current implementations are not capable of achieving the performance required by next generation storage and telecom applications. Extrapolation of many of those designs is not possible because of routing congestions. This article proposes a new architecture, based on a redefinition of a lesser-known LDPC decoding algorithm. As random LDPC codes are the most powerful, we abstain from making simplifying assumptions about the LDPC code which could ease the routing problem. We avoid the routing congestion problem by going for multiple independent sequential decoding machines, each decoding separate received codewords. In this serial approach the required amount of memory must be multiplied by the large number of machines. Our key contribution is a check node centric reformulation of the algorithm which gives huge memory reduction and which thus makes the serial approach possible.","1530-1591","0-7695-2085-5","","10.1109/DATE.2004.1269212","http://ieeexplore.ieee.org/stamp/stamp.jsp?arnumber=1269212","","Algorithm design and analysis;Bipartite graph;Computer architecture;Decoding;Equations;Error correction codes;Kernel;Message passing;Parity check codes;Routing","error correction;parity check codes;sequential decoding;telecommunication congestion control","LDPC decoding algorithm;error correcting performance;low density parity check codes;memory reduction;multiple independent sequential decoding machines;routing congestions;scalable architecture","","23","4","6","","","16-20 Feb. 2004","","IEEE","IEEE Conference Publications"
