"http://ieeexplore.ieee.org/search/searchresult.jsp?bulkSetSize=2000&matchBoolean%3Dtrue%26searchField%3DSearch_All%26queryText%3D%28%28Design%2C+Automation+and+Test+in+Europe+Conference+and+Exhibition%29+AND+2004%29",2015/06/23 14:53:54
"Efficient static compaction of test sequence sets through the application of set covering techniques","Dimopoulos, M.; Linardis, P.","Dept. of Informatics, Aristotle Univ. of Thessaloniki, Greece","Design, Automation and Test in Europe Conference and Exhibition, 2004. Proceedings","20040308","2004","1","","194","199 Vol.1","The test sequence compaction problem is modelled here, as a set covering problem. This formulation enables the straightforward application of set covering methods for compaction. Because of the complexity inherent in the first model, a second more efficient, formulation is proposed where the test sequences are modelled as matrix columns with variable costs (number of vectors). Further, matrix reduction rules appropriate to the new formulation, which do not affect the optimality of the solution, are introduced. Finally, the reduced problem is minimized with a branch & bound algorithm. Experiments on a large number of test sets show significant reductions to the original problem by simply using the presented reduction rules. Experimental results comparing our method with others form the literature and also with the absolute minima of the examples, computed separately with the MINCOV algorithm, support the potential of the proposed approach.","1530-1591","0-7695-2085-5","","10.1109/DATE.2004.1268848","http://ieeexplore.ieee.org/stamp/stamp.jsp?arnumber=1268848","","Automatic test pattern generation;Automatic testing;Circuit faults;Circuit testing;Compaction;Costs;Electrical fault detection;Sequential analysis;Sequential circuits;System testing","automatic test pattern generation;logic testing;sequential circuits","MINCOV algorithm;absolute minima;branch & bound algorithm;matrix columns;matrix reduction rules;set covering techniques;static compaction;test sequence sets;variable costs","","6","","25","","","16-20 Feb. 2004","","IEEE","IEEE Conference Publications"
"A logic level design methodology for a secure DPA resistant ASIC or FPGA implementation","Tiri, K.; Verbauwhede, I.","Dept. of Electr. Eng., UCLA, Los Angeles, CA, USA","Design, Automation and Test in Europe Conference and Exhibition, 2004. Proceedings","20040308","2004","1","","246","251 Vol.1","This paper describes a novel design methodology to implement a secure DPA resistant crypto processor. The methodology is suitable for integration in a common automated standard cell ASIC or FPGA design flow. The technique combines standard building blocks to make 'new' compound standard cells, which have a close to constant power consumption. Experimental results indicate a 50 times reduction in the power consumption fluctuations.","1530-1591","0-7695-2085-5","","10.1109/DATE.2004.1268856","http://ieeexplore.ieee.org/stamp/stamp.jsp?arnumber=1268856","","Application specific integrated circuits;Capacitance;Cryptography;Design methodology;Energy consumption;Field programmable gate arrays;Libraries;Logic design;Logic gates;Resistance","application specific integrated circuits;field programmable gate arrays;integrated circuit design;logic design","FPGA implementation;automated standard cell;crypto processor;logic level design methodology;power consumption;secure DPA resistant ASIC","","121","2","9","","","16-20 Feb. 2004","","IEEE","IEEE Conference Publications"
"Communication analysis for system-on-chip design","Siebenborn, A.; Bringmann, O.; Rosenstiel, W.","FZI Forschungszentrum Informatik, Karlsruhe, Germany","Design, Automation and Test in Europe Conference and Exhibition, 2004. Proceedings","20040308","2004","1","","648","653 Vol.1","In this paper we present an approach for analysis of systems of parallel, communicating processes for SoC design. We present a method to detect communications that synchronize the program flow of two or more processes. These synchronization points set the processes into relation and allow the determination of the global timing behavior of such a system. Using the results of our method for communication analysis, we present a new method to detect communications that might produce conflicts on shared communication resources. This information can be used for the assignment of communication resources.","1530-1591","0-7695-2085-5","","10.1109/DATE.2004.1268918","http://ieeexplore.ieee.org/stamp/stamp.jsp?arnumber=1268918","","Automata;Communication channels;Delay;Hardware;Instruction sets;Network-on-a-chip;Petri nets;Process design;System-on-a-chip;Timing","communication complexity;hardware-software codesign;integrated circuit design;synchronisation;system-on-chip","SoC design;global timing behavior;parallel communicating processes;program flow;shared communication resources;synchronization points;system-on-chip design","","4","","18","","","16-20 Feb. 2004","","IEEE","IEEE Conference Publications"
"Highly digital, low-cost design of statistic signal acquisition in SoCs","Junior, A.A.S.; Carro, L.","Univ. Fed. do Rio Grande do Sul, Porto Alegre, Brazil","Design, Automation and Test in Europe Conference and Exhibition, 2004. Proceedings","20040308","2004","3","","10","15 Vol.3","Presently, the gap between analog and digital processes is ever increasing. Although digital circuits are still obeying Moore's law, their analog counterparts follow far behind. Since signal acquisition, through ADC circuits is an often required feature, for many embedded applications the benefits of Moore's law have not been achieved. This paper presents our approach to take advantage of the increasing integration of technology for analog interfacing in SoC's, by converting the statistics of the signal. Digital self-tuning of the threshold levels, the use of less expensive and highly variable analog blocks, and stochastic convergence of resolution allow a robust acquisition process. We present the mathematics behind the approach, as well as a set of target applications and experimental results validating the concept.","1530-1591","0-7695-2085-5","","10.1109/DATE.2004.1269190","http://ieeexplore.ieee.org/stamp/stamp.jsp?arnumber=1269190","","Automatic testing;Built-in self-test;Costs;Design automation;Design for testability;Moore's Law;Signal design;Signal resolution;Statistics;Stochastic processes","analogue-digital conversion;convergence;digital circuits;signal detection;system-on-chip","ADC circuits;Moores law;SOC;analog interfacing technology;analog processes;analogue-digital conversion circuits;digital circuits;digital processes;digital self tuning;statistic signal acquisition;stochastic convergence;system-on-chip","","0","","23","","","16-20 Feb. 2004","","IEEE","IEEE Conference Publications"
"RTL power optimisation: concepts, tools and design experiences [Tutorial]","Poncino, M.; Sithambaram, P.; Zafalon, R.","Verona U.","Design, Automation and Test in Europe Conference and Exhibition, 2004. Proceedings","20040308","2004","1","","xxxiv","xxxiv","","1530-1591","0-7695-2085-5","","10.1109/DATE.2004.1268816","http://ieeexplore.ieee.org/stamp/stamp.jsp?arnumber=1268816","","Design optimization;Digital systems;Electronic design automation and methodology;Integer linear programming;Large-scale systems;Linear programming;Logic programming;Mathematical programming;Power system modeling;Tutorial","","","","0","","","","","16-20 Feb. 2004","","IEEE","IEEE Conference Publications"
"A method for parameter extraction of analogue sine-wave signals for mixed-signal built-in-self-test applications","Vazquez, D.; Leger, G.; Huertas, G.; Rueda, A.; Huertas, J.L.","Instituto de Microelectron. de Sevilla, Univ. de Sevilla, Spain","Design, Automation and Test in Europe Conference and Exhibition, 2004. Proceedings","20040308","2004","1","","298","303 Vol.1","This paper presents a method for extracting, in the digital domain, the main characteristic parameters of an analogue sine-wave signal. The required circuitry for on-chip implementation is very simple and robust, which makes the present approach very suitable for BIST applications. Solutions in this sense are addressed together with simulation results that validate the feasibility of the proposed approach.","1530-1591","0-7695-2085-5","","10.1109/DATE.2004.1268864","http://ieeexplore.ieee.org/stamp/stamp.jsp?arnumber=1268864","","Built-in self-test;Circuits;Digital modulation;Distortion measurement;Frequency measurement;Parameter extraction;Robustness;Signal generators;Signal processing;System-on-a-chip","built-in self test;integrated circuit testing;mixed analogue-digital integrated circuits","BIST applications;analogue sine-wave signals;digital domain;mixed-signal built-in-self-test applications;on-chip implementation;parameter extraction","","2","","7","","","16-20 Feb. 2004","","IEEE","IEEE Conference Publications"
"Block-enabled memory macros: design space exploration and application-specific tuning","Benini, L.; Ivaldi, A.; Macii, A.; Macii, E.","Universita di Bologna, Italy","Design, Automation and Test in Europe Conference and Exhibition, 2004. Proceedings","20040308","2004","1","","698","699 Vol.1","In this paper, we propose a combined solution that allows us to customize the architecture of internally partitioned SRAM macros according to the given application be executed. Energy savings with respect to monolithic memory configurations are above 40%, without access time violation.","1530-1591","0-7695-2085-5","","10.1109/DATE.2004.1268936","http://ieeexplore.ieee.org/stamp/stamp.jsp?arnumber=1268936","","Automatic testing;Design automation;Europe;Space exploration","SRAM chips;application specific integrated circuits;integrated circuit design;integrated memory circuits;memory architecture","SRAM macros;access time violation;application-specific tuning;block-enabled memory macros;design space exploration;internal partitioning;monolithic memory configurations","","1","","14","","","16-20 Feb. 2004","","IEEE","IEEE Conference Publications"
"Modeling and simulating memory hierarchies in a platform-based design methodology","Viana, P.; Barros, E.; Rigo, S.; Azevedo, R.; Araujo, G.","CIn, UFPE, Recife, Brazil","Design, Automation and Test in Europe Conference and Exhibition, 2004. Proceedings","20040308","2004","1","","734","735 Vol.1","This paper presents an environment based on SystemC for architecture specification of programmable systems. Making use of the new architecture description language ArchC, able to capture the processor description as well as the memory subsystem configuration, this environment offers support for system-level specification, intended for platform-based design. As a case study, it is presented the memory architecture exploration for a simple image processing application, yet a more robust environment evaluation is performed through the execution of some real-world benchmarks.","1530-1591","0-7695-2085-5","","10.1109/DATE.2004.1268953","http://ieeexplore.ieee.org/stamp/stamp.jsp?arnumber=1268953","","Architecture description languages;Costs;Design methodology;Digital systems;Image processing;Memory architecture;Performance evaluation;Power system modeling;Robustness;Software performance","C language;formal specification;hardware description languages;image processing;memory architecture","ArchC;SystemC;architecture description language;architecture specification;image processing;memory architecture exploration;memory hierarchy modeling;memory hierarchy simulation;memory subsystem configuration;platform-based design;processor description;programmable systems;system-level specification","","1","","6","","","16-20 Feb. 2004","","IEEE","IEEE Conference Publications"
"Stuctured ASIC tutorial: essential information on devices and design flow (industrial tutorial)","Hecker, C.","NEC Electronics Europe","Design, Automation and Test in Europe Conference and Exhibition, 2004. Proceedings","20040308","2004","1","","xxxiii","xxxiii","","1530-1591","0-7695-2085-5","","10.1109/DATE.2004.1268813","http://ieeexplore.ieee.org/stamp/stamp.jsp?arnumber=1268813","","Application specific integrated circuits;CMOS logic circuits;Circuit synthesis;Costs;Educational institutions;Europe;Logic design;National electric code;Silicon;Tutorial","","","","0","","","","","16-20 Feb. 2004","","IEEE","IEEE Conference Publications"
"The design of a high speed ASIC unit for the hash function SHA-256 (384, 512)","Dadda, L.; Macchetti, M.; Owen, J.","ALaRI-USI, Lugano, Switzerland","Design, Automation and Test in Europe Conference and Exhibition, 2004. Proceedings","20040308","2004","3","","70","75 Vol.3","After recalling the basic algorithms published by NIST for implementing the hash functions SHA-256 (384, 512), a basic circuit characterized by a cascade of full adder arrays is given. Implementation options are discussed and two methods for improving speed are exposed: the delay balancing and the pipelining. An application of the former is first given, obtaining a circuit that reduces the length of the critical path by a full adder array. A pipelined version is then given, obtaining a reduction of two full adder arrays in the critical path. The two methods are afterwards combined and the results obtained through hardware synthesis are exposed, where a comparison between the new circuits is also given.","1530-1591","0-7695-2085-5","","10.1109/DATE.2004.1269207","http://ieeexplore.ieee.org/stamp/stamp.jsp?arnumber=1269207","","Adders;Algorithm design and analysis;Application specific integrated circuits;Circuit synthesis;Delay;Hardware;Microelectronics;NIST;Partitioning algorithms;Pipeline processing","adders;application specific integrated circuits;arrays;cryptography;high-speed integrated circuits","NIST;application specific integrated circuit;full adder arrays;hardware synthesis;hash function SHA-256;high speed ASIC design;national institute of standards and technology","","6","","8","","","16-20 Feb. 2004","","IEEE","IEEE Conference Publications"
"Formal verification for real-world designs: today's technologies [Tutorial]","Bertacco, V.","Michigan U.","Design, Automation and Test in Europe Conference and Exhibition, 2004. Proceedings","20040308","2004","1","","xxx","xxx","","1530-1591","0-7695-2085-5","","10.1109/DATE.2004.1268804","http://ieeexplore.ieee.org/stamp/stamp.jsp?arnumber=1268804","","Costs;Design automation;Design engineering;Design for testability;Formal verification;Integrated circuit testing;Knowledge engineering;Synchronization;Test equipment;Tutorial","","","","0","","","","","16-20 Feb. 2004","","IEEE","IEEE Conference Publications"
"A new effective congestion model in floorplan design","Yi-Lin Hsieh; Tsai-Ming Hsieh","Dept. of Inf. & Comput. Eng., Chung Yuan Christian Univ., Chung-li, Taiwan","Design, Automation and Test in Europe Conference and Exhibition, 2004. Proceedings","20040308","2004","2","","1204","1209 Vol.2","In this paper, we provide a new efficient and accurate congestion model embedded into a floorplanner to estimate the congestion of floorplans. It is based on probabilistic analysis and a new concept of Irregular-Grid which uses the routing information to determine the evaluating regions instead of fixed-size grids. Three complete experiments are performed and the experimental results show the correctness, accuracy and efficiency of our new congestion model.","1530-1591","0-7695-2085-5","","10.1109/DATE.2004.1269056","http://ieeexplore.ieee.org/stamp/stamp.jsp?arnumber=1269056","","Costs;Design engineering;Embedded computing;Grid computing;Information analysis;Pins;Routing;Tellurium;Time measurement;Timing","circuit layout;network routing;probability","fixed size grids;floorplan design;irregular grid congestion model;probabilistic analysis;routing information","","6","","7","","","16-20 Feb. 2004","","IEEE","IEEE Conference Publications"
"Decomposition of instruction decoder for low power design","Wu-An Kuo; TingTing Hwang; Wu, A.C.H.","Dept. of Comput. Sci., Tsing Hua Univ., Hsin-Chu, Taiwan","Design, Automation and Test in Europe Conference and Exhibition, 2004. Proceedings","20040308","2004","1","","664","665 Vol.1","Microprocessors have been used in wide-ranged applications. During the execution of instructions, instruction decoding is a major task for identifying instructions and generating control signals for data-paths. By exploiting program behaviors, we propose a novel instruction-decoding approach for power minimization. Using the proposed instruction-decoding structure, we present a partitioning method that decomposes the instruction-decoding circuit into two sub-circuits according to the execution frequencies of instructions. Using our proposed decoding structure, only one sub-circuit will be activated when executing an instruction. Experimental results have demonstrated that our proposed approach achieves on an average of 26.71% and 15.69% power reductions for the instruction decoder and the control unit, respectively.","1530-1591","0-7695-2085-5","","10.1109/DATE.2004.1268920","http://ieeexplore.ieee.org/stamp/stamp.jsp?arnumber=1268920","","Application software;Circuits;Computer science;Decoding;Logic testing;Microprocessors;Minimization;Pipelines;Signal generators;Signal processing","decoding;instruction sets;logic circuits;logic design;low-power electronics;microprocessor chips;reduced instruction set computing","control signal generation;control unit;data-paths;instruction decoder;instruction decoding;instruction execution;instruction identification;instruction-decoding circuit decomposition;low power design;microprocessors;partitioning method;power minimization;power reductions;program behavior","","0","","11","","","16-20 Feb. 2004","","IEEE","IEEE Conference Publications"
"Energy-efficient design for highly associative instruction caches in next-generation embedded processors","Aragon JL; Nicolaescu, D.; Veidenbaum, A.; Badulescu, A.-M.","Center for Embedded Comput. Syst., California Univ., Irvine, CA, USA","Design, Automation and Test in Europe Conference and Exhibition, 2004. Proceedings","20040308","2004","2","","1374","1375 Vol.2","This paper proposes a low-energy solution for CAM-based highly associative I-caches using a segmented word-line and a predictor-based instruction fetch mechanism. Not all instructions in a given I-cache fetch are used due to branches. The proposed predictor determines which instructions in a cache access will be used and does not fetch any other instructions. Results show an average I-cache energy savings of 44% over the baseline case and 6% over the segmented case with no negative impact on performance.","1530-1591","0-7695-2085-5","","10.1109/DATE.2004.1269095","http://ieeexplore.ieee.org/stamp/stamp.jsp?arnumber=1269095","","CADCAM;Clocks;Computer aided instruction;Computer aided manufacturing;Embedded computing;Energy consumption;Energy efficiency;Frequency;Proposals;Random access memory","cache storage;content-addressable storage;embedded systems;memory architecture","I-cache energy saving;associative instruction caches;embedded processors;predictor based instruction fetch mechanism;segmented wordline","","0","","7","","","16-20 Feb. 2004","","IEEE","IEEE Conference Publications"
"Advanced domino circuit design [Tutorial]","Harris, D.; Grutkowski, T.","Harvey Mudd College","Design, Automation and Test in Europe Conference and Exhibition, 2004. Proceedings","20040308","2004","1","","xxxiii","xxxiii","","1530-1591","0-7695-2085-5","","10.1109/DATE.2004.1268814","http://ieeexplore.ieee.org/stamp/stamp.jsp?arnumber=1268814","","Application specific integrated circuits;CMOS logic circuits;Circuit synthesis;Costs;Educational institutions;Europe;Industrial electronics;National electric code;Silicon;Tutorial","","","","1","","","","","16-20 Feb. 2004","","IEEE","IEEE Conference Publications"
"Context-aware performance analysis for efficient embedded system design","Jersak, M.; Henia, R.; Ernst, R.","Inst. fur Datentech. & Kommunikationsnetze, Technische Univ. Braunschweig, Germany","Design, Automation and Test in Europe Conference and Exhibition, 2004. Proceedings","20040308","2004","2","","1046","1051 Vol.2","Performance analysis has many advantages in theory compared to simulation for the validation of complex embedded systems, but is rarely used in practice. To make analysis more attractive, it is critical to calculate tight analysis bounds. This paper shows that advanced performance analysis techniques taking correlations between successive computation or communication requests as well a correlated load distribution into account can yield much tighter analysis bounds. Cases where such correlations have a large impact on system timing are especially difficult to simulate and, hence, are an ideal target for formal performance analysis.","1530-1591","0-7695-2085-5","","10.1109/DATE.2004.1269031","http://ieeexplore.ieee.org/stamp/stamp.jsp?arnumber=1269031","","Analytical models;Computational modeling;Distributed computing;Embedded system;Equations;Performance analysis;Processor scheduling;Throughput;Timing;Upper bound","embedded systems;formal verification","context aware performance analysis;embedded system design;formal verification;load distribution;tight analysis bounds","","15","","9","","","16-20 Feb. 2004","","IEEE","IEEE Conference Publications"
"Reliable design: a system perspective [Tutorial]","De Micheli, G.; Iyer, R.","Stanford U.","Design, Automation and Test in Europe Conference and Exhibition, 2004. Proceedings","20040308","2004","1","","xxxii","xxxii","","1530-1591","0-7695-2085-5","","10.1109/DATE.2004.1268811","http://ieeexplore.ieee.org/stamp/stamp.jsp?arnumber=1268811","","Application software;Computer architecture;Fault diagnosis;Hardware;Multimedia communication;Programming;Scheduling;Silicon;Testing;Tutorial","","","","0","","","","","16-20 Feb. 2004","","IEEE","IEEE Conference Publications"
"DATE 2004 Executive Committee","","","Design, Automation and Test in Europe Conference and Exhibition, 2004. Proceedings","20040308","2004","1","","xvii","xviii","Provides a listing of current committee members.","1530-1591","0-7695-2085-5","","10.1109/DATE.2004.1268797","http://ieeexplore.ieee.org/stamp/stamp.jsp?arnumber=1268797","","","","","","0","","","","","16-20 Feb. 2004","","IEEE","IEEE Conference Publications"
"SystemC and SystemVerilog: Where do they fit? Where are they going?","Rosenstiel, W.; Swan, S.; Ghenassia, F.; Flake, P.","Tubingen Univ., Germany","Design, Automation and Test in Europe Conference and Exhibition, 2004. Proceedings","20040308","2004","1","","122","127 Vol.1","There is tremendous interest in design languages these days - and more particularly, SystemC and SystemVerilog. Sometimes the truth about design languages can be obscured by marketing and the press. This panel is meant to deepen the technical understanding of the DATE audience on the issue of design languages. It contains five technical experts - an academic expert in design languages and SystemC and SystemVerilog in particular; a language expert for each of SystemC and SystemVerilog; and a user expert for these two languages. The language experts have been heavily involved in the specification and evolution of their respective languages. The user experts have been heavily involved in developing use methodologies for these languages within their own design communities, and in applying them to real design problems. The panellists will consider the questions: 1) what are the key capabilities of these languages and what do they offer to users?; 2) which design problems are they best used for? what is their scope?; 3) how has application of these languages to real design problems improved the productivity of designers and the quality of the design results?; and 4) where should the languages develop further capabilities?.","1530-1591","0-7695-2085-5","","10.1109/DATE.2004.1268837","http://ieeexplore.ieee.org/stamp/stamp.jsp?arnumber=1268837","","Automatic testing;Clouds;Computer science education;Design automation;Electronic design automation and methodology;Encapsulation;Europe;Hardware design languages;Microelectronics;Productivity","hardware description languages","SystemC;SystemVerilog;design languages","","0","","7","","","16-20 Feb. 2004","","IEEE","IEEE Conference Publications"
