"http://ieeexplore.ieee.org/search/searchresult.jsp?bulkSetSize=2000&matchBoolean%3Dtrue%26searchField%3DSearch_All%26queryText%3D%28%28Design%2C+Automation+and+Test+in+Europe+Conference+and+Exhibition%29+AND+2004%29",2015/06/23 14:53:54
"A framework for battery-aware sensor management","Dasika, S.; Vrudhula, S.; Chopra, K.; Srinivasan, R.","ECE Dept., Arizona Univ., Tucson, AZ, USA","Design, Automation and Test in Europe Conference and Exhibition, 2004. Proceedings","20040308","2004","2","","962","967 Vol.2","A distributed sensor network (DSN) designed to cover a given region R, is said to be alive if there is at least one subset of sensors that can collectively cover (sense) the region R. When no such subset exists, the network is said to be dead. A key challenge in the design of a DSN is to maximize the operational life of the network. Since sensors are typically powered by batteries, this requires maximizing the battery lifetime. One way to achieve this is to determine the optimal schedule for transitioning sets of sensors between active and inactive states while satisfying user specified performance constraints. This requires identification of feasible subsets (covers) of sensors and a scheme for switching between such subsets. We present an algorithmic solution to compute all the sensor covers in an implicit manner by formulating the problem as unate covering problem (UCP). The representation of all possible sensor sets is extremely efficient and can accommodate very large number of sensor covers. The representation and formulation makes it possible to consider the residual battery charge when switching between covers. We develop algorithms for switching between sensor covers aimed at maximizing the lifetime of the network. The algorithms take into account the transmission/reception costs of sensors, a user specified quality constraint and also utilize a novel battery model that accounts for the rate-dependent capacity effect and charge recovery during idle periods. Our simulation results show that lifetime improvement can be achieved by exploiting the charge recovery process. The work presented here constitutes a framework for battery aware sensor management in which various types of constraints can be incorporated and a range of other communication protocols can be examined.","1530-1591","0-7695-2085-5","","10.1109/DATE.2004.1269017","http://ieeexplore.ieee.org/stamp/stamp.jsp?arnumber=1269017","","Battery management systems;Capacitive sensors;Costs;Data processing;Low power electronics;Maintenance;Optimal scheduling;Permission;Protocols;Telecommunication network reliability","cells (electric);distributed sensors;energy management systems;reliability","battery aware sensor management;battery lifetime;charge recovery process;communication protocols;distributed sensor network design;quality constraint;rate dependent capacity effect;residual battery charge;sensor covers;sensors subset;transmission/reception costs;unate covering problem","","12","","16","","","16-20 Feb. 2004","","IEEE","IEEE Conference Publications"
"Exploiting crosstalk to speed up on-chip buses","Duan, C.; Khatri, S.P.","Ericsson Wireless Commun., Boulder, CO, USA","Design, Automation and Test in Europe Conference and Exhibition, 2004. Proceedings","20040308","2004","2","","778","783 Vol.2","In modern VLSI processes, the cross-coupling capacitance between adjacent neighboring wires on the same metal layer is a very large fraction of the total wire capacitance. This leads to problems of delay variation due to crosstalk and reduced noise immunity, arguably one of the biggest obstacles in the design ICs in recent times. This problem is particularly severe in long on-chip buses, since bus signals are routed at minimum pitch for long distances. In this work, we propose to solve this problem by the use of crosstalk canceling CODECs. We only utilize memoryless CODECs, to reduce the logical complexity and enhance the robustness of our techniques. Bus data patterns can be classified (as 4·C, 3·C, 2·C, 1·C or 0·C patterns) based on the maximum amount of crosstalk that they can exhibit. Crosstalk avoidance CODECs which eliminate 4·C and 3·C patterns have been reported. In this paper, we describe crosstalk avoidance techniques which eliminate 2·C and 1·C patterns. We describe an analytical methodology to accurately characterize the bus area overhead 2·C pattern CODECs. Using these results, we characterize the area overhead versus crosstalk immunity achieved. A similar exercise is performed for 1·C patterns. Our experimental results show that by using 2·C crosstalk canceling techniques, buses can be sped up by up to a factor of 6 with an area overhead of about 200%, and that 1·C techniques are not very robust.","1530-1591","0-7695-2085-5","","10.1109/DATE.2004.1268974","http://ieeexplore.ieee.org/stamp/stamp.jsp?arnumber=1268974","","Capacitance;Codecs;Crosstalk;Delay;Noise cancellation;Noise reduction;Pattern analysis;Robustness;Very large scale integration;Wires","VLSI;capacitance;codecs;crosstalk;delays;memoryless systems;system buses","IC design;VLSI process;bus signals;cross coupling capacitance;crosstalk avoidance techniques;crosstalk canceling CODEC;crosstalk immunity;memoryless CODEC;metal layer;noise immunity;on-chip buses;very large scale integration process;wire capacitance","","26","","14","","","16-20 Feb. 2004","","IEEE","IEEE Conference Publications"
"Value-conscious cache: simple technique for reducing cache access power","Yen-Jen Chang; Chia-Lin Yang; Feipei Lai","Dept. of Comput. Sci., Nat. ChungHsing Univ., Taichung, Taiwan","Design, Automation and Test in Europe Conference and Exhibition, 2004. Proceedings","20040308","2004","1","","16","21 Vol.1","Most microprocessors employ the on-chip caches to bridge the performance gap between the processor and main memory. However, the cache accesses usually contribute significantly to the total power consumption of the chip. Based on the observation that an overwhelming majority of the cache access bits are '0', in this paper we propose a value-conscious (VC) cache to reduce the average cache power consumption during an access. Unlike the conventional cache with differential-bitline implementation, the VC cache is a single-bitline design. Depending on the access bit value, the VC cache can dynamically prevent the bitline from being discharged such that the power dissipated in accessing '0' is much less than the power dissipated in accessing '1'. The implementation of the VC cache is a circuit-level technique, which is software independent and orthogonal to other low power techniques at architecture-level. The experimental results based on the SPEC2000 and MediaBench traces show that without compromise of both performance and stability, by exploiting the prevalence of '0' bits in access data the VC cache can reduce the average cache read and write power by about 18%∼22% and 36%∼40%, respectively.","1530-1591","0-7695-2085-5","","10.1109/DATE.2004.1268821","http://ieeexplore.ieee.org/stamp/stamp.jsp?arnumber=1268821","","Batteries;Bridge circuits;Capacitance;Circuit stability;Energy consumption;Microprocessors;Pressing;Random access memory;Virtual colonoscopy;Writing","cache storage;circuit optimisation;low-power electronics;memory architecture;microprocessor chips","MediaBench;SPEC2000;VC;access bit value;access data;architecture-level;average cache power consumption;cache access power reduction;circuit-level technique;low power techniques;single-bitline design;software independent;value-conscious cache","","1","10","11","","","16-20 Feb. 2004","","IEEE","IEEE Conference Publications"
"Low power analogue 90 degree phase shifter","Saul, Peter H.","","Design, Automation and Test in Europe Conference and Exhibition, 2004. Proceedings","20040308","2004","3","","28","33 Vol.3","This paper describes a re-useable circuit module for a 90° phase shifter, sometimes called a ""Hilbert transformer"", which has been demonstrated on a 0.35-micron CMOS process. The 10-pole circuit is entirely analogue in operation, and achieves measured amplitude and phase accuracy compatible with >50 dB sideband suppression. Statistical design techniques assure good functional yields. Total current consumption is 236 microamps at 3.3 V, and chip area is 1.42 square mm, excluding bond pads. Applications include low power, low cost SSB receivers, more advanced communications architectures in GSM, DCS and G3, and sonar.","1530-1591","0-7695-2085-5","","10.1109/DATE.2004.1269194","http://ieeexplore.ieee.org/stamp/stamp.jsp?arnumber=1269194","","Amplitude modulation;Bonding;CMOS process;Circuits;Costs;GSM;Phase measurement;Phase shifters;Phase transformers;Semiconductor device measurement","CMOS analogue integrated circuits;Hilbert transforms;cellular radio;phase shifters","0.35 micron CMOS process;236 muA;3.3 V;DCS;GSM;Hilbert transformer;SSB receivers;analogue 90 degree phase shifter;communication architecture;current consumption;digital cellular service;global system for mobile communications;reuseable circuit module;sideband suppression;single sideband receivers;sonar;statistical design technique","","1","","6","","","16-20 Feb. 2004","","IEEE","IEEE Conference Publications"
"Power aware variable partitioning and instruction scheduling for multiple memory banks","Zhong Wang; Hu, X.S.","Dept. of Comput. Sci. & Eng., Notre Dame Univ., USA","Design, Automation and Test in Europe Conference and Exhibition, 2004. Proceedings","20040308","2004","1","","312","317 Vol.1","Many high-end DSP processors employ both multiple memory banks and heterogeneous register files to improve performance and power consumption. The complexity of such architectures presents a great challenge to compiler design. In this paper, we present an approach for variable partitioning and instruction scheduling to maximally exploit the benefits provided by such architectures. Our approach is built on a novel graph model which strives to capture both performance and power demands. We propose an algorithm to iteratively find the variable partition such that the maximum energy saving is achieved while satisfying the given performance constraint. Experimental results demonstrate the effectiveness of our approach.","1530-1591","0-7695-2085-5","","10.1109/DATE.2004.1268866","http://ieeexplore.ieee.org/stamp/stamp.jsp?arnumber=1268866","","Digital signal processing;Embedded system;Energy consumption;Iterative algorithms;National electric code;Partitioning algorithms;Potential energy;Power demand;Processor scheduling;Registers","logic partitioning;low-power electronics;memory architecture;processor scheduling","DSP processors;compiler design;energy saving;graph model;heterogeneous register files;instruction scheduling;multiple memory banks;power aware variable partitioning;power consumption;power demands","","5","","19","","","16-20 Feb. 2004","","IEEE","IEEE Conference Publications"
"Scheduling reusable instructions for power reduction","Hu, J.S.; Vijaykrishnan, N.; Kim, S.; Kandemir, M.; Irwin, M.J.","Microsystems Design Lab., Pennsylvania State Univ., University Park, PA, USA","Design, Automation and Test in Europe Conference and Exhibition, 2004. Proceedings","20040308","2004","1","","148","153 Vol.1","In this paper, we propose a new issue queue design that is capable of scheduling reusable instructions. Once the issue queue is reusing instructions, no instruction cache access is needed since the instructions are supplied by the issue queue itself. Furthermore, dynamic branch prediction and instruction decoding can also be avoided permitting the gating of the front-end stages of the pipeline (the stages before register renaming). Results using array-intensive codes show that up to 82% of the total execution cycles, the pipeline front-end can be gated, providing a power reduction of 72% in the instruction cache, 33% in the branch predictor, and 21% in the issue queue, respectively, at a small performance cost. Our analysis of compiler optimizations indicates that the power savings can be further improved by using optimized code.","1530-1591","0-7695-2085-5","","10.1109/DATE.2004.1268841","http://ieeexplore.ieee.org/stamp/stamp.jsp?arnumber=1268841","","Buffer storage;Costs;Decoding;Delay;Energy consumption;Filters;Microprocessors;Optimizing compilers;Pipelines;Systolic arrays","cache storage;instruction sets;optimising compilers;pipeline processing;processor scheduling;queueing theory","array-intensive codes;branch predictor;compiler optimizations;dynamic branch prediction;instruction cache access;instruction decoding;issue queue design;pipeline front-end;power reduction;reusable instructions;scheduling","","1","","15","","","16-20 Feb. 2004","","IEEE","IEEE Conference Publications"
"Wire retiming for system-on-chip by fixpoint computation","Chuan Lin; Hai Zhou","Dept. of Electr. & Comput. Eng., Northwestern Univ., Evanston, IL, USA","Design, Automation and Test in Europe Conference and Exhibition, 2004. Proceedings","20040308","2004","2","","1092","1097 Vol.2","In the current and future System-On-Chips, a non-negligible part of operation time is spent on multiple-clock period wires. Retiming-that is moving flip-flops in a circuit without changing its functionality-can be explored to pipeline long interconnect wires in SOC designs. The problem of retiming over a netlist of macro-blocks, where the internal structures may not be changed and flip-flops may not be inserted on some wire segments is called the wire retiming problem. In this paper, we formulate the constraints of the wire retiming problem as a fixpoint computation and use an iterative algorithm to solve it. Experimental results show that this approach is multiple orders more efficient than the previous one.","1530-1591","0-7695-2085-5","","10.1109/DATE.2004.1269038","http://ieeexplore.ieee.org/stamp/stamp.jsp?arnumber=1269038","","Clocks;Delay;Flip-flops;Frequency;Integrated circuit interconnections;Iterative algorithms;Polynomials;System-on-a-chip;Timing;Wire","clocks;flip-flops;iterative methods;system-on-chip;wires","SOC designs;fixpoint computation;flip flops;iterative algorithm;multiple clock period wires;system-on-chip;wire retiming","","4","","12","","","16-20 Feb. 2004","","IEEE","IEEE Conference Publications"
"Digital ground bounce reduction by phase modulation of the clock","Badaroglu, M.; Wambacq, P.; Van der Plas, G.; Donnay, S.; Gielen, G.; De Man, H.","","Design, Automation and Test in Europe Conference and Exhibition, 2004. Proceedings","20040308","2004","1","","88","93 Vol.1","The digital switching noise that propagates through the chip substrate to the analogue circuitry on the same chip is a major limitation for mixed-signal SoC integration. In synchronous digital systems, digital circuits switch simultaneously on the clock edge, hereby generating a large ground bounce. In order to reduce the spectral peaks in the ground bounce spectrum, we combine the two techniques: (1) phase modulation of the clock; and (2) introducing intended clock skews to spread the switching activities. Experimental results show around 16 dB reductions in the spectral peaks of the noise spectrum when these two techniques are combined. These two techniques are believed to be good candidates for the development of methodologies for digital low-noise design techniques in future CMOS technologies.","1530-1591","0-7695-2085-5","","10.1109/DATE.2004.1268832","http://ieeexplore.ieee.org/stamp/stamp.jsp?arnumber=1268832","","CMOS technology;Circuit noise;Clocks;Digital circuits;Digital systems;Noise reduction;Phase modulation;Switches;Switching circuits;Synchronous generators","clocks;digital circuits;integrated circuit noise;mixed analogue-digital integrated circuits;phase modulation","CMOS technologies;analogue circuitry;chip substrate;clock skews;digital circuits;digital ground bounce reduction;digital low-noise design;digital switching noise;ground bounce spectrum;mixed-signal SoC integration;noise spectrum;phase modulation;spectral peaks;switching activities;synchronous digital systems","","6","3","9","","","16-20 Feb. 2004","","IEEE","IEEE Conference Publications"
"Issues in implementing latency insensitive protocols","Casu, M.R.; Macchiarulo, L.","Dipt. di Elettronica, Politecnico di Torino, Italy","Design, Automation and Test in Europe Conference and Exhibition, 2004. Proceedings","20040308","2004","2","","1390","1391 Vol.2","A design that works under the assumption of zero-delay connections between functional modules is modified in a latency insensitive design (LID) by encapsulating them within the wrappers (""shells"") and connecting them through internally pipelined blocks (""relay stations"") complying with a protocol that guarantees identity of behavior.","1530-1591","0-7695-2085-5","","10.1109/DATE.2004.1269102","http://ieeexplore.ieee.org/stamp/stamp.jsp?arnumber=1269102","","Clocks;Delay;Joining processes;Proposals;Protocols;Registers;Relays;Signal generators;Throughput;Topology","feedback;feedforward;protocols;system-on-chip;trees (mathematics)","feedback;feedforward;functional modules;latency insensitive design;latency insensitive protocols;pipelined blocks;system-on-chip;trees;wrappers","","3","6","5","","","16-20 Feb. 2004","","IEEE","IEEE Conference Publications"
"A macromodelling methodology for efficient high-level simulation of substrate noise generation","Elvira, L.; Martorell, F.; Aragones, X.; Gonzalez, J.L.","Electron. Eng. Dept., Univ. Politecnica de Catalunya, Barcelona, Spain","Design, Automation and Test in Europe Conference and Exhibition, 2004. Proceedings","20040308","2004","2","","1362","1363 Vol.2","Efficient prediction of the substrate noise generated by digital sections is currently a major challenge in system-on-a-chip design. In this paper a macromodel to accurately and efficiently predict the substrate noise generated by digital standard cells is presented. The macromodel accuracy is demonstrated for some simple circuits.","1530-1591","0-7695-2085-5","","10.1109/DATE.2004.1269089","http://ieeexplore.ieee.org/stamp/stamp.jsp?arnumber=1269089","","Capacitance;Circuit noise;Circuit simulation;Discrete event simulation;Equivalent circuits;Integrated circuit noise;Noise generators;Noise level;Performance analysis;Software libraries","cellular arrays;circuit simulation;integrated circuit modelling;integrated circuit noise;substrates;system-on-chip","SOC;digital standard cells;high level simulation;macromodelling;substrate noise generation;system-on-chip design","","4","","7","","","16-20 Feb. 2004","","IEEE","IEEE Conference Publications"
"A low cost individual-well adaptive body bias (IWABB) scheme for leakage power reduction and performance enhancement in the presence of intra-die variations","Chen, T.W.; Gregg, J.","Syst. VLSI Technol. Organ., Hewlett Packard Co., Fort Collins, CO, USA","Design, Automation and Test in Europe Conference and Exhibition, 2004. Proceedings","20040308","2004","1","","240","245 Vol.1","This paper presents a new method of adapting body biasing on a chip during post-fabrication testing in order to mitigate the effects of process variations. Individual well biasing voltages can be changed to be connected either to a chip wide well bias or to a different bias voltage through a self-regulating mechanism, allowing biasing voltage adjustments on a per well basis. The scheme requires only one bias voltage distribution network, but allows for back biasing adjustments to more effectively mitigate die-to-die and within-die process variations. The biasing setting for each well is determined using a modified genetic algorithm. Our experimental results show that binning yields as low as 17% can be improved to greater than 90% after using the proposed IWABB method.","1530-1591","0-7695-2085-5","","10.1109/DATE.2004.1268855","http://ieeexplore.ieee.org/stamp/stamp.jsp?arnumber=1268855","","CMOS technology;Costs;Counting circuits;Energy consumption;Frequency;Manufacturing processes;Power dissipation;Power engineering computing;Very large scale integration;Voltage","CMOS integrated circuits;adaptive control;integrated circuit manufacture;leakage currents;low-power electronics;microprocessor chips","IWABB scheme;back biasing adjustments;bias voltage distribution network;biasing setting;biasing voltage adjustments;body biasing;die-to-die process variations;individual-well adaptive body bias;intradie variations;leakage power reduction;modified genetic algorithm;performance enhancement;post-fabrication testing;self-regulating mechanism;within-die process variations","","6","","14","","","16-20 Feb. 2004","","IEEE","IEEE Conference Publications"
"A new self-checking sum-bit duplicated carry-select adder","Sogomonyan, E.S.; Marienfeld, D.; Ocheretnij, V.; Gossel, M.","Dept. of Comput. Sci., Univ. of Potsdam, Germany","Design, Automation and Test in Europe Conference and Exhibition, 2004. Proceedings","20040308","2004","2","","1360","1361 Vol.2","In this paper the first code-disjoint totally self-checking carry-select adder is proposed. The adder blocks are fast ripple adders with a single NAND-gate delay for carry-propagation per cell. In every adder block both the sum-bits and the corresponding inverted sum-bits are simultaneously implemented. The parity of the input operands is checked against the XOR-sum of the propagate signals. For 64 bits area and maximal delay are determined by the SYNOPSYS CAD tool of the EUROCHIP project. Compared to a 64 bit carry-select adder without error detection the delay of the most significant sum-bit does not increase. The area is 170% of a 64 bit carry-select adder (without error detection and not code-disjoint).","1530-1591","0-7695-2085-5","","10.1109/DATE.2004.1269087","http://ieeexplore.ieee.org/stamp/stamp.jsp?arnumber=1269087","","Computer science;Delay;Fault tolerance;Signal generators","CAD;adders;carry logic;logic gates;parity check codes","64 bit;64 bit carry select adder;CAD tool;EUROCHIP project;NAND gate delay;XOR;computer aided design;error detection;exclusive OR;parity;ripple adders;self checking carry select adder;self checking sum bit","","4","","5","","","16-20 Feb. 2004","","IEEE","IEEE Conference Publications"
"SubCALM: a program for hierarchical substrate coupling simulation on floorplan level","Brandtner, T.; Weigel, R.","Infineon Technol., Munich, Austria","Design, Automation and Test in Europe Conference and Exhibition, 2004. Proceedings","20040308","2004","1","","616","621 Vol.1","The hierarchical substrate coupling simulation tool Sub-CALM offers the opportunity to estimate substrate coupling on floorplan level. A novel approach for modeling well and SOI structures in a boundary element description is introduced. Several acceleration techniques like precalculated macromodels and sophisticated preconditioning algorithms are presented which are applied to an O(n)-conjugate-gradient Poisson solver in order to be able to process large full-chip layouts during floorplanning.","1530-1591","0-7695-2085-5","","10.1109/DATE.2004.1268913","http://ieeexplore.ieee.org/stamp/stamp.jsp?arnumber=1268913","","Acceleration;BiCMOS integrated circuits;CMOS technology;Conductivity;Impedance;Integrated circuit modeling;Power supplies;Semiconductor device modeling;Semiconductor process modeling;Silicon","circuit complexity;circuit layout CAD;circuit simulation;electromagnetic coupling;integrated circuit modelling;semiconductor quantum wells;silicon-on-insulator;substrates","O(n)-conjugate-gradient Poisson solver;SOI structure modeling;SubCALM;acceleration techniques;boundary element description;floorplan level;hierarchical substrate coupling simulation;mixed-signal IC design;precalculated macromodels;preconditioning algorithms;substrate noise;well structure modeling","","2","","14","","","16-20 Feb. 2004","","IEEE","IEEE Conference Publications"
