"http://ieeexplore.ieee.org/search/searchresult.jsp?bulkSetSize=2000&refinements%3D4294967269%26matchBoolean%3Dtrue%26searchField%3DSearch_All%26queryText%3D%28%28Design+Automation+Conference+.LB.DAC.RB.%29+AND+2011%29",2015/06/23 14:46:50
"CMOS compatible nanowires for biosensing","Stern, E.; Routenberg, D.A.; Vacic, A.; Rajan, N.K.; Criscione, J.M.; Park, J.; Fahmy, T.M.; Reed, M.","Dept. of Biomed., Yale Univ., New Haven, CT, USA","Design Automation Conference (DAC), 2011 48th ACM/EDAC/IEEE","20110811","2011","","","718","722","Semiconducting nanowires (NWs) have the potential to function as highly sensitive and selective sensors for label-free detection of minute concentrations of target molecules. We discuss here an approach to NW sensors using CMOS (complementary metal - oxide - semiconductor) - FET (field effect transistor) compatible technology, which enables detection of biomolecules to clinically relevant concentrations, as well as real-time monitoring of response. This approach eliminates the need for hybrid methods and enables system-scale integration of these sensors with signal processing and information systems. The ability to monitor antibody binding and sense real-time live cellular immune response with readily available technology will facilitate widespread diagnostic applications.","0738-100x","978-1-4503-0636-2","","","http://ieeexplore.ieee.org/stamp/stamp.jsp?arnumber=5981866","bioFETs;biomarker detection;biosensors;nanowires","Biosensors;Blood;FETs;Microfluidics;Nanowires;Sensitivity","MOSFET;biosensors;molecular biophysics;nanomedicine;nanowires","CMOS-FET;antibody binding;biomolecules;biosensing;complementary metal oxide semiconductor;diagnostic applications;field effect transistor;hybrid methods;information systems;label-free detection;real-time live cellular immune response;real-time monitoring;semiconducting nanowires;signal processing;system-scale integration;target molecules","","0","","5","","","5-9 June 2011","","IEEE","IEEE Conference Publications"
"ChronOS Linux: A best-effort real-time multiprocessor Linux kernel","Dellinger, M.; Garyali, P.; Ravindran, B.","Electr. & Comput. Eng., Virginia Tech, Blacksburg, VA, USA","Design Automation Conference (DAC), 2011 48th ACM/EDAC/IEEE","20110811","2011","","","474","479","We present ChronOS Linux, a best-effort real-time Linux kernel for chip multiprocessors (CMPs). ChronOS addresses the intersection of three problem spaces: a) OS-support for obtaining best-effort timing assurances, b) real-time Linux kernel augmented with the PREEMPT_RT patch, and c) OS support for CMP-aware real-time scheduling. While each of these spaces have been studied in the past, their intersection, which has strong problem motivations, was previously empty. Best-effort timeliness targets real-time applications with run-time uncertainties and resource overloads, and optimizes collective application timeliness - as specified by the application. ChronOS directly supports the implementation of best-effort real-time schedulers on CMPs, in addition to others, in the global and partitioned scheduling disciplines. ChronOS extends the PREEMPT_RT Linux patch, and thus provides full kernel preemptibility and retains stock Linux features. We validate our claims by reporting on the implementation of a suite of best-effort and non-best-effort CMP schedulers on a quad-core AMD Phenom platform.","0738-100x","978-1-4503-0636-2","","","http://ieeexplore.ieee.org/stamp/stamp.jsp?arnumber=5981849","Linux;Real-time;task scheduling","Kernel;Linux;Program processors;Real time systems;Schedules;Scheduling algorithm","Linux;microprocessor chips;processor scheduling","CMP-aware real-time scheduling;ChronOS Linux;OS-support;PREEMPT-RT patch;chip multiprocessors;quad-core AMD Phenom platform;real-time multiprocessor Linux kernel","","0","","11","","","5-9 June 2011","","IEEE","IEEE Conference Publications"
"Generalized reliability-oriented energy management for real-time embedded applications","Baoxian Zhao; Aydin, H.; Dakai Zhu","Dept. of Comput. Sci., George Mason Univ., Fairfax, VA, USA","Design Automation Conference (DAC), 2011 48th ACM/EDAC/IEEE","20110811","2011","","","381","386","DVFS remains an important energy management technique for embedded systems. However, its negative impact on transient fault rates has been recently shown. In this paper, we propose the Generalized Shared Recovery (GSHR) technique to optimally use the DVFS technique in order to achieve a given reliability goal for real-time embedded applications. Our technique determines the optimal number of recoveries to deploy as well as task-level processing frequencies to minimize the energy consumption while achieving the reliability goal and meeting the timing constraints. The recoveries may be shared among tasks, improving the prospects of DVFS compared to existing reliability-aware power management frameworks. The experimental evaluation points to the close-to-optimal energy savings of our proposed technique.","0738-100x","978-1-4503-0636-2","","","http://ieeexplore.ieee.org/stamp/stamp.jsp?arnumber=5981959","DVFS;Energy Management;Real-Time Embedded Systems","Energy consumption;Optimized production technology;Real time systems;Reliability engineering;Time frequency analysis;Transient analysis","power aware computing;reliability","DVFS technique;GSHR;close-to-optimal energy savings;dynamic voltage-and-frequency scaling;energy consumption minimization;energy management technique;generalized reliability-oriented energy management;generalized shared recovery technique;real-time embedded applications;reliability-aware power management frameworks;task-level processing frequencies","","0","","18","","","5-9 June 2011","","IEEE","IEEE Conference Publications"
"Full-chip TSV-to-TSV coupling analysis and optimization in 3D IC","Chang Liu; Taigon Song; Jonghyun Cho; Joohee Kim; Joungho Kim; Sung Kyu Lim","Sch. of Electr. & Comput. Eng., Georgia Inst. of Technol., Atlanta, GA, USA","Design Automation Conference (DAC), 2011 48th ACM/EDAC/IEEE","20110811","2011","","","783","788","This paper studies TSV-to-TSV coupling in 3D ICs. A full-chip SI analysis flow is proposed based on the proposed coupling model. Analysis results show that TSVs cause significant coupling noise and timing problems despite that TSV count is much smaller compared with the gate count. Two approaches are proposed to alleviate TSV-to-TSV coupling, namely TSV shielding and buffer insertion. Analysis results show that both approaches are effective in reducing the TSV-caused-coupling and improving timing.","0738-100x","978-1-4503-0636-2","","","http://ieeexplore.ieee.org/stamp/stamp.jsp?arnumber=5981999","3D IC;TSV-to-TSV coupling","Couplings;Integrated circuit modeling;Noise;Silicon;Three dimensional displays;Through-silicon vias;Timing","integrated circuit modelling;integrated circuit noise;optimisation;three-dimensional integrated circuits;timing","3D IC;TSV shielding;buffer insertion;coupling noise;full-chip TSV-to-TSV coupling analysis;optimization;timing problems","","2","","8","","","5-9 June 2011","","IEEE","IEEE Conference Publications"
"A closed-form expression for estimating minimum operating voltage (V<inf>DDmin</inf>) of CMOS logic gates","Fuketa, H.; Iida, S.; Yasufuku, T.; Takamiya, M.; Nomura, M.; Shinohara, H.; Sakurai, T.","Inst. of Ind. Sci., Univ. of Tokyo, Tokyo, Japan","Design Automation Conference (DAC), 2011 48th ACM/EDAC/IEEE","20110811","2011","","","984","989","In this paper, a closed-form expression for estimating a minimum operating voltage (V<sub>DDmin</sub>) of CMOS logic gates is proposed. V<sub>DDmin</sub> is defined as the minimum supply voltage at which circuits can operate correctly. V<sub>DDmin</sub> of combinational circuits can be written as a linear function of the square-root of logarithm of the number of logic gates and its slope is proportional to the standard deviation of the within-die variation in the threshold voltage difference between PMOS and NMOS transistors. The proposed expression is verified with Monte Carlo simulations using various gate chains. The verification reveals that V<sub>DDmin</sub> of inverter chains can be estimated within 11% error. The expression is also verified with silicon measurements in a 65nm CMOS process.","0738-100x","978-1-4503-0636-2","","","http://ieeexplore.ieee.org/stamp/stamp.jsp?arnumber=5981890","Minimum operating voltage;subthreshold circuits;variations","CMOS process;Integrated circuit modeling;Inverters;Logic gates;MOSFETs;Semiconductor device modeling;Threshold voltage","CMOS logic circuits;MOSFET;Monte Carlo methods;logic gates","CMOS logic gates;Monte Carlo simulations;NMOS transistors;PMOS transistors;closed-form expression;combinational circuits;inverter chains;linear function;minimum operating voltage;silicon measurements;size 65 nm","","5","","7","","","5-9 June 2011","","IEEE","IEEE Conference Publications"
"In silico synchronization of cellular populations through expression data deconvolution","Eisenberg, M.; Ash, J.; Siegal-Gaskins, D.","Math. Biosci. Inst., Ohio State Univ., Columbus, OH, USA","Design Automation Conference (DAC), 2011 48th ACM/EDAC/IEEE","20110811","2011","","","812","817","Cellular populations are typically heterogenous collections of cells at different points in their respective cell cycles, each with a cell cycle time that varies from individual to individual. As a result, true single-cell behavior, particularly that which is cell-cycle-dependent, is often obscured in population-level (averaged) measurements. We have developed a simple deconvolution method that can be used to remove the effects of asynchronous variability from population-level time-series data. In this paper, we summarize some recent progress in the development and application of our approach, and provide technical updates that result in increased biological fidelity. We also explore several preliminary validation results and discuss several ongoing applications that highlight the method's usefulness for estimating parameters in differential equation models of single-cell gene regulation.","0738-100x","978-1-4503-0636-2","","","http://ieeexplore.ieee.org/stamp/stamp.jsp?arnumber=5981873","bioinformatics;caulobacter;cell cycle;deconvolution;time series","Biological system modeling;Data models;Deconvolution;Equations;Mathematical model;Predator prey systems","bioinformatics;differential equations;parameter estimation;time series","biological fidelity;cellular populations;differential equation models;expression data deconvolution;in silico synchronization;parameter estimation;population-level time-series data;single-cell gene regulation","","0","","12","","","5-9 June 2011","","IEEE","IEEE Conference Publications"
"Integrated circuit security techniques using variable supply voltage","Sheng Wei; Potkonjak, M.","Comput. Sci. Dept., Univ. of California, Los Angeles, CA, USA","Design Automation Conference (DAC), 2011 48th ACM/EDAC/IEEE","20110811","2011","","","248","253","This paper addresses integrated circuit (IC) security issues by using supply voltage based gate-level characterization (GLC). Our GLC scheme is capable of characterizing both manifestation and physical level properties of an IC accurately using variable supply voltage. We demonstrate that the proposed scheme can detect three types of IC attacks with low false positives and false negatives.","0738-100x","978-1-4503-0636-2","","","http://ieeexplore.ieee.org/stamp/stamp.jsp?arnumber=5981758","Gate-level characterization;integrated circuit security;process variation;supply voltage control","Aging;Delay;Equations;Integrated circuits;Logic gates;Mathematical model;Security","integrated circuit testing;security of data","GLC scheme;IC;IC attacks;gate-level characterization;integrated circuit security techniques;variable supply voltage","","1","","19","","","5-9 June 2011","","IEEE","IEEE Conference Publications"
"Power management of hybrid DRAM/PRAM-based main memory","Hyunsun Park; Sungjoo Yoo; Sunggu Lee","Dept. of Electron. & Electr. Eng., POSTECH, Pohang, South Korea","Design Automation Conference (DAC), 2011 48th ACM/EDAC/IEEE","20110811","2011","","","59","64","Hybrid main memory consisting of DRAM and non-volatile memory is attractive since the non-volatile memory can give the advantage of low standby power while DRAM provides high performance and better active power. In this work, we address the power management of such a hybrid main memory consisting of DRAM and phase-change RAM (PRAM). In order to reduce DRAM refresh energy which occupies a significant portion of total memory energy, we present a runtime-adaptive method of DRAM decay. In addition, we present two methods, DRAM bypass and dirty data keeping, for further reduction in refresh energy and memory access latency, respectively. The experiments show that by reducing DRAM refreshes, we can obtain 23.5%~94.7% reduction in the energy consumption with negligible performance overhead compared with the conventional DRAM-only main memory.","0738-100x","978-1-4503-0636-2","","","http://ieeexplore.ieee.org/stamp/stamp.jsp?arnumber=5981703","DRAM;phase-change RAM;power;refresh","Energy consumption;Hybrid power systems;Memory management;Phase change random access memory;Radiation detectors;Runtime","DRAM chips;computer power supplies;concurrency theory;random-access storage","DRAM bypass;DRAM decay;DRAM refresh energy reduction;DRAM refreshes reduction;dirty data keeping;hybrid DRAM-based main memory;hybrid PRAM-based main memory;nonvolatile memory;phase-change RAM;power management;runtime-adaptive method;total memory energy","","2","1","28","","","5-9 June 2011","","IEEE","IEEE Conference Publications"
"Megatrends Driving Embedded Multicore Innovation","Su, Lisa","Freescale Semiconductor, Inc., Austin, TX, USA","Design Automation Conference (DAC), 2011 48th ACM/EDAC/IEEE","20110811","2011","","","xvi","xvi","Summary form only given. It has been said that any good idea takes about 25 years to be widely adopted by industry. Simulation modeling was adapted to software development projects and processes in the early late 80s and 90s with the seminal work of Abdel-Hamid and Madnick [1] in applying Systems Dynamics to software project management, as well as the work of Kellner [2] and Raffo [3] in adapting State-based and Discrete Event Simulation models to software development. Using the 25 year metric above, Process Simulation will soon come of age - but where's the party? Why has Process Simulation not been widely adopted as other software engineering best practices such as inspections or cost estimation?","0738-100x","978-1-4503-0636-2","","","http://ieeexplore.ieee.org/stamp/stamp.jsp?arnumber=5981908","","","","","","0","","","","","5-9 June 2011","","IEEE","IEEE Conference Publications"
"A fast approach for static timing analysis covering all PVT corners","Onaissi, S.; Taraporevala, F.; Jinfeng Liu; Najm, F.","Univ. of Toronto, Toronto, ON, Canada","Design Automation Conference (DAC), 2011 48th ACM/EDAC/IEEE","20110811","2011","","","777","782","The increasing sensitivity of circuit performance to process, temperature, and supply voltage (PVT) variations has led to an increase in the number of process corners that are required to verify circuit timing. Typically, designers attempt to reduce this computational load by choosing, based on experience, a subset of the available corners and running static timing analysis (STA) at only these corners. Although running a few corners, which are chosen beforehand, can lead to acceptable results in some cases, this is not always the case. Our results show that in the case of setup timing analysis, one can indeed bound circuit slacks across all corners by running a small number of corners. On the other hand, we show that this is not possible in the case of hold analysis. Instead, we present an alternative method for performing fast and accurate hold timing analysis which covers all corners. In this method a full timing run is performed for a small number of corners, and partial timing runs, which cover only the clock network, are performed for others. We then combine the results of the full and partial runs to find the worst-case hold slacks over all corners. Our results show that this method is accurate and can achieve much improved runtimes.","0738-100x","978-1-4503-0636-2","","","http://ieeexplore.ieee.org/stamp/stamp.jsp?arnumber=5981998","Corner analysis;PVT corners;clock network;corner dominance","Accuracy;Clocks;Delay;Industries;Integrated circuit interconnections;Runtime","clocks;timing circuits","PVT corners;bound circuit;circuit performance;circuit timing;clock network;computational load;hold analysis;partial timing runs;process variations;static timing analysis;supply voltage variations;temperature variations;worst-case hold","","1","","7","","","5-9 June 2011","","IEEE","IEEE Conference Publications"
"Power-aware variable partitioning for DSPs with hybrid PRAM and DRAM main memory","Tiantian Liu; Yingchao Zhao; Xue, C.J.; Minming Li","City Univ. of Hong Kong, Hong Kong, China","Design Automation Conference (DAC), 2011 48th ACM/EDAC/IEEE","20110811","2011","","","405","410","In this paper, we utilize a hybrid main memory composed of DRAM and Phase Change Random Access Memory (PRAM) for DSP systems, which leverages the low power consumption of PRAM while minimizing the performance and endurance degradation caused by write operations on PRAM. We re-consider the variable partitioning problem on this hybrid main memory. Different objectives, for example power consumption and the number of writes on PRAM, are considered in this paper. By using the proposed models and algorithms, experiments show that we can reduce 53% power consumption and 79% the number of writes on PRAM on average, compared with pure DRAM and pure PRAM memory, respectively.","0738-100x","978-1-4503-0636-2","","","http://ieeexplore.ieee.org/stamp/stamp.jsp?arnumber=5981844","Phase Change Random Access Memory;Power Efficiency;Variable Partitioning","Computer architecture;Digital signal processing;Partitioning algorithms;Phase change random access memory;Power demand;Schedules","DRAM chips;digital signal processing chips;low-power electronics;phase change memories;power consumption","DRAM;DSP systems;PRAM;hybrid main memory;phase change random access memory;power consumption;power-aware variable partitioning","","2","","12","","","5-9 June 2011","","IEEE","IEEE Conference Publications"
"Biochemical oscillator sensitivity analysis in the presence of conservation constraints","Toettcher, J.; Castillo, A.; Tidor, B.; White, J.","Univ. of California, San Francisco, CA, USA","Design Automation Conference (DAC), 2011 48th ACM/EDAC/IEEE","20110811","2011","","","806","811","Computing parametric sensitivities for oscillators has a now well-understood subtlety associated with the indeterminacy of phase. A less universal, but still vexing, subtlety arises when an oscillator is described by a system of differential equations with “hidden” conservation constraints (HCC's); defined as weighted sums of state variables that are time-invariant. If there are HCC's, as is commonly the case for models of biochemical oscillators but rarely the case for practical circuit oscillators, the now-standard approach to computing parametric sensitivities can yield incorrect results. In addition, the monodromy matrix (the matrix of state sensitivities over one oscillation period), is often defective in a way that interferes with the usual approach to computing oscillator phase noise. In this paper we analyze the HCC case, and show that by augmenting the standard sensitivity approach with explicit HCC's, one can recover the correct parametric sensitivities. In addition, we prove that there is a typically satisfied condition that guarantees that a system with HCCs will have a defective monodromy matrix. A deliberately “flawed” ring oscillator circuit and a cyanobacterial circadian clock biochemical oscillator are used to demonstrate the parametric sensitivity problem and its resolution, and to show the issue of the defective monodromy matrix.","0738-100x","978-1-4503-0636-2","","","http://ieeexplore.ieee.org/stamp/stamp.jsp?arnumber=5981872","biochemical kinetics;periodic steady-state;sensitivity analysis","Biological system modeling;Equations;Integrated circuit modeling;Mathematical model;Orbits;Oscillators;Sensitivity","biochemistry;differential equations;matrix algebra;oscillators;sensitivity analysis","HCC;circuit oscillators;cyanobacterial circadian clock biochemical oscillator sensitivity analysis;defective monodromy matrix;differential equations;flawed ring oscillator circuit;hidden conservation constraints;oscillation period;oscillator phase noise;parametric sensitivity problem;state sensitivities","","0","","15","","","5-9 June 2011","","IEEE","IEEE Conference Publications"
"Performance bound analysis of analog circuits considering process variations","Zhigang Hao; Tan, S.X.-D.; Ruijing Shen; Guoyong Shi","Sch. of Microelectron., Shanghai Jiao Tong Univ., Shanghai, China","Design Automation Conference (DAC), 2011 48th ACM/EDAC/IEEE","20110811","2011","","","310","315","In this paper, we propose a new performance bound analysis of analog circuits considering process variations. We model the variations of component values as intervals measured from tested chip and manufacture processes. The new method applies a graph-based symbolic analysis and affine interval arithmetic to derive the variational transfer functions of analog circuits (linearized) with variational coefficients in forms of intervals. Then the frequency response bounds (maximum and minimum) are obtained by performing analysis of a finite number of transfer functions given by the Kharitonov's polynomial functions. We show that symbolic de-cancellation is critical for the affine interval analysis. The response bound given by the Kharitonov's functions are conservative given the correlations among coefficient intervals in transfer functions. Experimental results demonstrate the effectiveness of the proposed compared to the Monte Carlo method.","0738-100x","978-1-4503-0636-2","","","http://ieeexplore.ieee.org/stamp/stamp.jsp?arnumber=5981764","interval;performance bound;process variation;symbolic","Analog circuits;Frequency domain analysis;Integrated circuit modeling;Monte Carlo methods;Noise;Polynomials;Transfer functions","analogue circuits;graph theory;performance evaluation;transfer functions;variational techniques","affine interval arithmetic;analog circuits;frequency response bounds;graph-based symbolic analysis;performance bound analysis;polynomial functions;process variations;variational transfer functions","","0","","23","","","5-9 June 2011","","IEEE","IEEE Conference Publications"
"A helper thread based dynamic cache partitioning scheme for multithreaded applications","Kandemir, M.; Yemliha, T.; Kultursay, E.","Pennsylvania State Univ., University Park, PA, USA","Design Automation Conference (DAC), 2011 48th ACM/EDAC/IEEE","20110811","2011","","","954","959","Focusing on the problem of how to partition the cache space given to a multithreaded application across its threads, we show that different threads of a multithreaded application can have different cache space requirements, propose a fully automated, dynamic, intra-application cache partitioning scheme targeting emerging multicores with multilayer cache hierarchies, present a comprehensive experimental analysis of the proposed scheme, and show average improvements of 17.1% and 18.6% in SPECOMP and PARSEC suites.","0738-100x","978-1-4503-0636-2","","","http://ieeexplore.ieee.org/stamp/stamp.jsp?arnumber=5981888","Cache;helper thread;multi-core;partitioning","Adaptation models;Dynamic scheduling;Hardware;Instruction sets;Multicore processing;Resource management;System-on-a-chip","cache storage;multi-threading;multiprocessing systems","PARSEC suites;SPECOMP suites;cache space requirements;dynamic cache partitioning scheme;helper thread;multilayer cache hierarchies;multithreaded applications","","2","","20","","","5-9 June 2011","","IEEE","IEEE Conference Publications"
"TPM-SIM: A framework for performance evaluation of Trusted Platform Modules","Schmitz, J.; Loew, J.; Elwell, J.; Ponomarev, D.; Abu-Ghazaleh, N.","Dept. of Comput. Sci., State Univ. of New York at Binghamton, Binghamton, NY, USA","Design Automation Conference (DAC), 2011 48th ACM/EDAC/IEEE","20110811","2011","","","236","241","This paper presents a simulation toolset for estimating the impact of Trusted Platform Modules (TPMs) on the performance of applications that use TPM services, especially in multi-core environments. The proposed toolset, consisting of an integrated CPU/TPM simulator and a set of micro-benchmarks that exercise the major TPM services, can be used to analyze and optimize the performance of TPM-based systems and the TPM itself. In this paper, we consider two such optimizations: (1) exploiting multiple TPMs; and (2) reordering requests within the software stack to minimize queueing delays. Our studies indicate that both techniques result in significant performance improvement, especially as the number of concurrent applications using the TPM increases.","0738-100x","978-1-4503-0636-2","","","http://ieeexplore.ieee.org/stamp/stamp.jsp?arnumber=5981940","Performance Evaluation;Trusted Platform Module","Benchmark testing;Delay;Generators;Multicore processing;Seals;Software","security of data","TPM-SIM;integrated CPU/TPM simulator;micro-benchmarks;multicore environment;performance evaluation;queueing delays minimization;reordering requests;simulation toolset;software stack;trusted platform modules","","1","","16","","","5-9 June 2011","","IEEE","IEEE Conference Publications"
