"http://ieeexplore.ieee.org/search/searchresult.jsp?bulkSetSize=2000&queryText%3D.LB..QT.Publication+Title.QT.%3ADesign+Automation+Conference+.LB.DAC.RB.%2C+2013+50th+ACM%2FEDAC%2FIEEE.RB.",2015/07/17 18:49:50
"Improving energy gains of inexact DSP hardware through reciprocative error compensation","Lingamneni, A.; Basu, A.; Enz, C.; Palem, K.V.; Piguet, C.","Dept. of ECE, Rice Univ., Houston, TX, USA","Design Automation Conference (DAC), 2013 50th ACM/EDAC/IEEE","20130718","2013","","","1","8","We present a zero hardware-overhead design approach called reciprocative error compensation(REC) that significantly enhances the energy-accuracy trade-off gains in inexact signal processing datapaths by using a two-pronged approach: (a) deliberately redesigning the basic arithmetic blocks to effectively compensate for each other's (expected) error through inexact logic minimization, and (b) “reshaping” the response waveforms of the systems being designed to further reduce any residual error. We apply REC to several DSP primitives such as the FFT and FIR filter blocks, and show that this approach delivers 2-3 orders of magnitude lower (expected) error and more than an order of magnitude lesser Signal-to-Noise Ratio (SNR) loss (in dB) over the previously proposed inexact design techniques, while yielding similar energy gains. Post-layout comparisons in the 65nm process technology show that our REC approach achieves upto 73% energy savings (with corresponding delay and area savings of upto 16% and 62% respectively) when compared to an existing exact DSP implementation while trading a relatively small loss in SNR of less than 1.5 dB.","0738-100X","","","","http://ieeexplore.ieee.org/stamp/stamp.jsp?arnumber=6560613","","Adders;Delays;Digital signal processing;Hardware;Minimization;Signal to noise ratio;Vectors","FIR filters;digital signal processing chips;error compensation;fast Fourier transforms;integrated circuit design","FFT;FIR filter blocks;REC approach;SNR loss;arithmetic blocks;energy-accuracy trade-off gain enhancement;fast Fourier transform;finite impulse response filter;inexact DSP hardware;inexact logic minimization;inexact signal processing datapaths;reciprocative error compensation;response waveform reshaping;signal-to-noise ratio;size 65 nm;two-pronged approach;zero hardware-overhead design approach","","2","","","","","May 29 2013-June 7 2013","","IEEE","IEEE Conference Publications"
"Proceedings of the 50th Design Automation Conference<sup>®</sup>","","","Design Automation Conference (DAC), 2013 50th ACM/EDAC/IEEE","20130718","2013","","","1","1","Copyright 2013 by the Association for Computing Machinery, Inc. (ACM). Permission to make digital or hard copies of portions of this work for personal or classroom use is granted without fee provided that copies are not made or distributed for profit or commercial advantage and that copies bear this notice and the full citation on the first page. Copyright for components of this work owned by others than ACM must be honored. Abstracting with credit is permitted. To copy otherwise, to republish, to post on servers or to redistribute to lists, requires prior specific permission and/or a fee. Request permission to republish from: Publications Dept., ACM, Inc. Fax: +1-212-869-0481 or permissions@acm.org. Notice to Past Authors of ACM-Published Articles ACM intends to create a complete electronic archive of all articles and/or other material previously published by ACM. If you have written a work that was previously published by ACM in any journal or conference proceedings prior to 1978, or any SIG Newsletter at any time, and you do NOT want this work to appear in the ACM Digital Library, please inform permissions@acm.org, stating the title of the work, the author(s), and where and when published.","0738-100X","","","","http://ieeexplore.ieee.org/stamp/stamp.jsp?arnumber=6560593","","","","","","0","","","","","May 29 2013-June 7 2013","","IEEE","IEEE Conference Publications"
"Pareto epsilon-dominance and identifiable solutions for BioCAD modeling","Angione, C.; Costanza, J.; Carapezza, G.; Lio, P.; Nicosia, G.","Comput. Lab., Univ. of Cambridge, Cambridge, UK","Design Automation Conference (DAC), 2013 50th ACM/EDAC/IEEE","20130718","2013","","","1","9","We propose a framework to design metabolic pathways in which many objectives are optimized simultaneously. This allows to characterize the energy signature in models of algal and mitochondrial metabolism. The optimal design and assessment of the model is achieved through a multi-objective optimization technique driven by epsilon-dominance and identifiability analysis. A faster convergence process with robust candidate solutions is permitted by a relaxed Pareto dominance, regulating the granularity of the approximation of the Pareto front. Our framework is also suitable for black-box analysis, enabling to investigate and optimize any biological pathway modeled with ODEs, DAEs, FBA and GPR.","0738-100X","","","","http://ieeexplore.ieee.org/stamp/stamp.jsp?arnumber=6560636","","Analytical models;Biochemistry;Biological system modeling;Calcium;Mathematical model;Optimization;Production","CAD;Pareto optimisation;biology;biology computing;cellular biophysics;convergence of numerical methods;microorganisms","BioCAD modeling;Pareto epsilon-dominance;algal metabolism;black box analysis;convergence process;energy signature;identifiability analysis;identifiable solution;metabolic pathways;mitochondrial metabolism;multiobjective optimization technique;optimal design","","0","","","","","May 29 2013-June 7 2013","","IEEE","IEEE Conference Publications"
"Creation of ESL power models for communication architectures using automatic calibration","Schurmans, S.; Diandian Zhang; Auras, D.; Leupers, R.; Ascheid, G.; Xiaotao Chen; Lun Wang","Inst. for Commun. Technol. & Embedded Syst., RWTH Aachen Univ., Aachen, Germany","Design Automation Conference (DAC), 2013 50th ACM/EDAC/IEEE","20130718","2013","","","1","6","Power consumption is an important factor in chip design. The fundamental design decisions drawn during early design space exploration at electronic system level (ESL) have a large impact on the power consumption. This requires to estimate power already at ESL, which is usually not possible using standard ESL component libraries due to missing power models. This work proposes a methodology that allows extension of ESL models with a power model and to automatically calibrate it to match a power trace obtained by gate-level simulation or measurements. Two case studies show that the methodology is suitable even for complex communication architectures.","0738-100X","","","","http://ieeexplore.ieee.org/stamp/stamp.jsp?arnumber=6560651","Electronic System Level;Power Estimation;Power Model","Calibration;Data models;Estimation;IP networks;Instruments;Ports (Computers);Power demand","calibration;integrated circuit design;integrated circuit modelling;low-power electronics","ESL power model;automatic calibration;chip design;complex communication architecture;design space exploration;electronic system level;gate level simulation;power consumption;power trace","","0","","","","","May 29 2013-June 7 2013","","IEEE","IEEE Conference Publications"
"Gene modification identification under flux capacity uncertainty","Yousofshahi, M.; Orshansky, M.; Kyongbum Lee; Hassoun, S.","","Design Automation Conference (DAC), 2013 50th ACM/EDAC/IEEE","20130718","2013","","","1","5","Re-engineering cellular behavior promises to advance the production of commercially significant biomolecules and to enhance cellular function for many applications. To achieve a desired cellular objective, it is necessary to identify within a metabolic network a set of reactions whose fluxes should be changed using gene modifications. We develop a computational method, CCOpt, to optimize the selection of an intervention set that consists of gene up/down-regulation using uncertainty-aware chance-constrained optimization. In contrast to deterministic approaches where constraints are met with 100% certainty, constraints in CCOpt are probabilistically met at a user-specified confidence level. We investigate the application of CCOpt to two case studies that utilize the Chinese Hamster Ovary (CHO) cell metabolism. Our results demonstrate that CCOpt is capable of identifying optimal intervention sets without the run-time cost of a sampling based (Monte Carlo) approach.","0738-100X","","","","http://ieeexplore.ieee.org/stamp/stamp.jsp?arnumber=6560638","","Biochemistry;Biological system modeling;Monte Carlo methods;Optimization;Production;Uncertainty;Upper bound","Monte Carlo methods;cellular biophysics;molecular biophysics;optimisation","CCOpt;CHO cell metabolism;Chinese hamster ovary;Monte Carlo approach;biomolecules;cellular function;flux capacity uncertainty;gene modification identification;metabolic network;optimal intervention sets;uncertainty aware chance constrained optimization;user specified confidence level","","0","","","","","May 29 2013-June 7 2013","","IEEE","IEEE Conference Publications"
"Distributed stable states for process networks - Algorithm, analysis, and experiments on intel SCC","Rai, D.; Schor, L.; Stoimenov, N.; Thiele, L.","Comput. Eng. & Networks Lab., ETH Zurich, Zurich, Switzerland","Design Automation Conference (DAC), 2013 50th ACM/EDAC/IEEE","20130718","2013","","","1","10","Technology scaling is a common trend in current embedded systems. It has promoted the use of multi-core, multiprocessor, and distributed platforms. Such systems usually require run-time migration of distributed applications between the different nodes of the platform in order to balance the workload or to tolerate faults. Before an application can be migrated, it needs to be brought to a stable state such that restarting the application after migration does not violate its functional correctness. An application in a stable state does not change its context any further, and therefore, stabilization is a prerequisite for any application migration. Process networks are a common model of computation for specifying distributed applications. However, most results on the migration of process networks do not provide an algorithm to put a general process network into a stable state, suitable for migration. This paper proposes a technique which efficiently and correctly brings a process network executing on a distributed system to a known stable state. The correctness of the technique is independent of the temporal characteristics of the system and the topology of the process network. The required modifications of a process network are lightweight and preserve its original functionality. A model characterizing the timing properties of the technique is provided. The feasibility and efficiency of the proposed approach and the respective model are validated with experimental results on Intel's SCC platform.","0738-100X","","","","http://ieeexplore.ieee.org/stamp/stamp.jsp?arnumber=6560760","","Context;Earth Observing System;Ports (Computers);Tiles;Timing;Upper bound","embedded systems;microprocessor chips","Intel SCC;distributed platforms;distributed stable states;distributed system;embedded systems;general process network;multicore platforms;multiprocessor platforms;process networks;technology scaling","","0","","","","","May 29 2013-June 7 2013","","IEEE","IEEE Conference Publications"
"Automatic clustering of wafer spatial signatures","Wangyang Zhang; Xin Li; Saxena, S.; Strojwas, A.; Rutenbar, R.","ECE Dept., Carnegie Mellon Univ., Pittsburgh, PA, USA","Design Automation Conference (DAC), 2013 50th ACM/EDAC/IEEE","20130718","2013","","","1","6","In this paper, we propose a methodology based on unsupervised learning for automatic clustering of wafer spatial signatures to aid yield improvement. Our proposed methodology is based on three steps. First, we apply sparse regression to automatically capture wafer spatial signatures by a small number of features. Next, we apply an unsupervised hierarchical clustering algorithm to divide wafers into a few clusters where all wafers within the same cluster are similar. Finally, we develop a modified L-method to determine the appropriate number of clusters from the hierarchical clustering result. The accuracy of the proposed methodology is demonstrated by several industrial data sets of silicon measurements.","0738-100X","","","","http://ieeexplore.ieee.org/stamp/stamp.jsp?arnumber=6560664","","Clustering algorithms;Current measurement;Dictionaries;Discrete cosine transforms;Feature extraction;Robustness","elemental semiconductors;pattern clustering;regression analysis;semiconductor technology;silicon;sparse matrices;unsupervised learning","L-method;Si;industrial data sets;sparse regression;unsupervised hierarchical clustering;unsupervised learning;wafer spatial signatures clustering","","1","","","","","May 29 2013-June 7 2013","","IEEE","IEEE Conference Publications"
"Performance enhancement of garbage collection for flash storage devices: An efficient victim block selection design","Che-Wei Tsao; Yuan-Hao Chang; Ming-Chang Yang","Inst. of Inf. Sci., Acad. Sinica, Taipei, Taiwan","Design Automation Conference (DAC), 2013 50th ACM/EDAC/IEEE","20130718","2013","","","1","6","Motivated by the needs to enhance the performance of garbage collection in low-cost Hash storage devices, we propose a victim block selection design to efficiently identify the blocks for erases and reclaim the space of invalid data without extensively scanning Hash memory for the status of data stored in the storage, so as to achieve improved performance of garbage collection on reclaiming space of invalid data. At the same time, this design could also easily identify and reclaim the space released by file systems. A series of experiments based on benchmark traces demonstrates the significantly improved performance of garbage collection with limited system overheads.","0738-100X","","","","http://ieeexplore.ieee.org/stamp/stamp.jsp?arnumber=6560758","Flash memory;performance;reliability","Arrays;Ash;Indexes;Performance evaluation;Radiation detectors;Random access memory;Recycling","flash memories;performance evaluation","block identification;file systems;garbage collection;invalid data reclaiming space;low-cost flash storage devices;performance enhancement;performance improvement;system overheads;victim block selection design","","0","","","","","May 29 2013-June 7 2013","","IEEE","IEEE Conference Publications"
"Single-photon image sensors","Charbon, E.; Regazzoni, F.","Tech. Univ. Delft, Delft, Netherlands","Design Automation Conference (DAC), 2013 50th ACM/EDAC/IEEE","20130718","2013","","","1","4","The main goal of this paper is to expose the EDA community to the emerging class of circuits operating with single quanta of energy (e.g. photons or electrical carriers). We describe recent developments in the field of single-photon detection and single-photon imaging based on the avalanche effect. Single-photon detection is useful in a number of applications, from time-of-flight based 3D vision systems to fluorescence lifetime imaging microscopy, from low-light cameras to quantum random number generators, from positron emission tomography to time-resolved Raman spectroscopy. These applications have speed and accuracy requirements that conventional systems cannot provide if not at a very high cost. EDA has not yet adapted to the revolution introduced by avalanching devices and, though tools capable of simulating these devices exist, there is little or no capability to do so in a coherent flow, let alone at system level. We challenge CAD designers to fill this gap and prepare them to the circuits of the future, quantum in nature but built in standard CMOS technology.","0738-100X","","","","http://ieeexplore.ieee.org/stamp/stamp.jsp?arnumber=6560720","EDA;SPAD;SiPM;Single-photon detection;photon counting;silicon photomultiplier;single-photon avalanche diode;time-resolved imaging","CMOS integrated circuits;CMOS technology;Cameras;Image sensors;Photonics;Silicon","CMOS image sensors;avalanche diodes;cameras;photodetectors","CAD design;CMOS technology;EDA community;avalanche effect;camera;fluorescence lifetime imaging microscopy;positron emission tomography;quantum random number generator;single photon detection;single photon image sensor;single photon imaging;time resolved Raman spectroscopy;time-of-flight based 3D vision system","","0","","","","","May 29 2013-June 7 2013","","IEEE","IEEE Conference Publications"
"Model-based development and verification of control software for electric vehicles","Goswami, D.; Lukasiewycz, M.; Kauer, M.; Steinhorst, S.; Masrur, A.; Chakraborty, S.; Ramesh, S.","Inst. for Real-Time Comput. Syst., Tech. Univ. Munich, Munich, Germany","Design Automation Conference (DAC), 2013 50th ACM/EDAC/IEEE","20130718","2013","","","1","9","Most innovations in the automotive domain are realized by electronics and software. Modern cars have up to 100 Electronic Control Units (ECUs) that implement a variety of control applications in a distributed fashion. The tasks are mapped onto different ECUs, communicating via a heterogeneous network, comprising communication buses like CAN, FlexRay, and Ethernet. For electric vehicles, software functions play an essential role, replacing hydraulic and mechanic control systems. While model-based software development and verification are already used extensively in the automotive domain, their importance significantly increases in electric vehicles as safety-critical functions might no longer rely on mechanical (fall-back) solutions. The need for reducing costs, size, and weight in electric vehicles has also resulted in a considerable interest in topics such as the consolidation of ECUs as well as efficient implementation of control software. In this paper we discuss two broad issues related to model-based software development and verification in electric vehicles. The first is concerned with how to ensure that model-level semantics are preserved in an implementation, which has important implications on the verification and certification of control software. The second issue is related to techniques for reducing the computational and communication demands of distributed automotive control algorithms. For both these topics we provide a broad introduction to the problem followed by a discussion on state-of-the-art techniques.","0738-100X","","","","http://ieeexplore.ieee.org/stamp/stamp.jsp?arnumber=6560689","Electric vehicles;control systems;control/architecture co-design;model-based design","Automotive engineering;Computer architecture;Delays;Electric vehicles;Schedules;Sensors;Software","automobiles;control engineering computing;distributed control;electric vehicles;program verification;safety-critical software","CAN;ECU;Ethernet;FlexRay;automotive domain;cars;communication buses;control software certification;distributed automotive control algorithms;electric vehicles;electronic control units;model-based development;model-based verification;model-level semantics;safety-critical functions","","0","","","","","May 29 2013-June 7 2013","","IEEE","IEEE Conference Publications"
"A high-level synthesis flow for the implementation of iterative stencil loop algorithms on FPGA devices","Nacci, A.A.; Rana, V.; Bruschi, F.; Sciuto, D.; Beretta, I.; Atienza, D.","Dipt. di Elettron. e Inf. (DEI), Politec. di Milano, Milan, Italy","Design Automation Conference (DAC), 2013 50th ACM/EDAC/IEEE","20130718","2013","","","1","6","The automatic generation of hardware implementations for a given algorithm is generally a difficult task, especially when data dependencies span across multiple iterations such as in iterative stencil loops (ISLs). In this paper, we introduce an automatic design flow to extract parallelism from an ISL algorithm and perform a design space exploration to identify its best FPGA hardware implementation, in terms of both area and throughput. Experimental results show that the proposed methodology generates hardware designs whose performance is comparable to the one of manually-optimized solutions, and orders of magnitude higher than the implementations generated by commercial high-level synthesis tools.","0738-100X","","","","http://ieeexplore.ieee.org/stamp/stamp.jsp?arnumber=6560645","High Level Synthesis;Iterative stencil loops;Performance and Area Estimation;Symbolic Execution","Algorithm design and analysis;Computer architecture;Estimation;Field programmable gate arrays;Hardware;System-on-chip;Throughput","electronic design automation;field programmable gate arrays;iterative methods;logic design","FPGA device;automatic design flow;hardware designs;hardware implementations;high level synthesis flow;iterative stencil loop algorithms","","0","","","","","May 29 2013-June 7 2013","","IEEE","IEEE Conference Publications"
"The undetectable and unprovable hardware Trojan horse","Wei, Sheng; Potkonjak, Miodrag","Computer Science Department, University of California, Los Angeles (UCLA), 90095, USA","Design Automation Conference (DAC), 2013 50th ACM/EDAC/IEEE","20130718","2013","","","1","2","We have developed an approach for automatic embedding of customizable hardware Trojan horses (HTHs) into an arbitrary finite state machine. The HTH can be used to facilitate a variety of security attacks and does not require any additional gates, because it is morphed into the specified design. Even after the HTH induces provable damage, one is not capable of proving that any malicious circuitry is embedded into the design. The main ramification of the developed HTH is that hardware and system techniques should move from HTH detection toward synthesis for trusted systems.","0738-100X","","","","http://ieeexplore.ieee.org/stamp/stamp.jsp?arnumber=6560737","","Delays;Hardware;Integrated circuit modeling;Solid modeling;Trojan horses","","","","0","","","","","May 29 2013-June 7 2013","","IEEE","IEEE Conference Publications"
"Proactive circuit allocation in multiplane NoCs","Abousamra, A.; Jones, A.K.; Melhem, R.","Dept. of Comput. Sci., Univ. of Pittsburgh, Pittsburgh, PA, USA","Design Automation Conference (DAC), 2013 50th ACM/EDAC/IEEE","20130718","2013","","","1","10","This work explores a method for efficient pre-allocation of circuits in network-on-chip (NoC) to reduce communication latency and improve performance. Circuit pre-allocation eliminates the time cost of circuit establishment by using request messages to reserve the circuits for their anticipated reply messages. Requests reserve circuits in a priority order rather than for a particular time slot, avoiding delays or blocking even if the newly requested circuits conflict with previously reserved ones. Benchmark simulations show speedup in execution time of up to 16%, with an average of 8% for communication sensitive benchmarks, over a leading proposal in pre-configuring circuits.","0738-100X","","","","http://ieeexplore.ieee.org/stamp/stamp.jsp?arnumber=6560628","","Benchmark testing;Delays;Educational institutions;Ports (Computers);Resource management;Routing;Switching circuits","circuit switching;network routing;network-on-chip","circuit preallocation;communication latency;multiplaneNoC;network on chip;priority order;reply messages;request messages","","0","","","","","May 29 2013-June 7 2013","","IEEE","IEEE Conference Publications"
"Liveness evaluation of a Cyclo-Static DataFlow Graph","Benazouz, M.; Munier-Kordon, A.; Hujsa, T.; Bodin, B.","LIST, CEA, Gif-sur-Yvette, France","Design Automation Conference (DAC), 2013 50th ACM/EDAC/IEEE","20130718","2013","","","1","7","Cyclo-Static DataFlow Graphs (CSDFG in short) is a formalism commonly used to model parallel applications composed by actors communicating through buffers. The liveness of a CSDFG ensures that all actors can be executed infinitely often. This property is clearly fundamental for the design of embedded applications. This paper aims to present first an original sufficient condition of liveness for a CSDFG. Two algorithms of polynomial-time for checking the liveness are then derived and compared to a symbolic execution of the graph. An original method to compute close-to-optimal buffer capacities ensuring liveness is also presented and experimentally tested. The performance of our methods are comparable to those existing in the literature for industrial applications. However, they are far more effective on randomly generated instances, ensuring their scalability for future more complex applications and their possible implementation in a compiler.","0738-100X","","","","http://ieeexplore.ieee.org/stamp/stamp.jsp?arnumber=6560596","Cyclo-Static Dataflow Graphs;buffer sizing;liveness","Benchmark testing;Complexity theory;Context;Polynomials;Schedules;System recovery;Vectors","computational complexity;data flow graphs;directed graphs","CSDFG;actor communication;close-to-optimal buffer capacities;compilers;cyclo-static data flow graph liveness evaluation;directed graphs;polynomial-time algorithms;randomly generated instances;sufficient condition","","0","","","","","May 29 2013-June 7 2013","","IEEE","IEEE Conference Publications"
