"http://ieeexplore.ieee.org/search/searchresult.jsp?bulkSetSize=2000&queryText%3D.LB..QT.Publication+Title.QT.%3ADesign+Automation+Conference+.LB.DAC.RB.%2C+2013+50th+ACM%2FEDAC%2FIEEE.RB.",2015/07/17 18:49:50
"TinySPICE: A parallel SPICE simulator on GPU for massively repeated small circuit simulations","Lengfei Han; Xueqian Zhao; Zhuo Feng","Dept. of ECE, Michigan Tech. Univ., Houghton, MI, USA","Design Automation Conference (DAC), 2013 50th ACM/EDAC/IEEE","20130718","2013","","","1","8","In nowadays variation-aware IC designs, cell characterizations and SRAM memory yield analysis require many thousands or even millions of repeated SPICE simulations for relatively small nonlinear circuits. In this work, we present a massively parallel SPICE simulator on GPU, TinySPICE, for efficiently analyzing small nonlinear circuits, such as standard cell designs, SRAMs, etc. In order to gain high accuracy and efficiency, we present GPU-based parametric three-dimensional (3D) LUTs for fast device evaluations. A series of GPU-friendly data structures and algorithm flows have been proposed in TinySPICE to fully utilize the GPU hardware resources, and minimize data communications between the GPU and CPU. Our GPU implementation allows for a large number of small circuit simulations in GPU's shared memory that involves novel circuit linearization and matrix solution techniques, and eliminates most of the GPU device memory accesses during the Newton-Raphson (NR) iterations, which enables extremely high-throughput SPICE simulations on GPU. Compared with CPU-based TinySPICE simulator, GPU-based TinySPICE achieves up to 138X speedups for parametric SRAM yield analysis without loss of accuracy.","0738-100X","","","","http://ieeexplore.ieee.org/stamp/stamp.jsp?arnumber=6560682","GPU computing;SPICE simulation;Variation-aware analysis","Abstracts;Central Processing Unit;Educational institutions;Graphics processing units;Integrated circuit modeling;Mobile communication;Vectors","Newton-Raphson method;SPICE;SRAM chips;circuit simulation;data structures;graphics processing units;integrated circuit design","GPU;LUT;Newton-Raphson iterations;SRAM memory yield analysis;TinySPICE;cell characterizations;data structures;massively repeated small circuit simulations;nonlinear circuits;parallel SPICE simulator;variation-aware IC designs","","0","","","","","May 29 2013-June 7 2013","","IEEE","IEEE Conference Publications"
"Temperature aware thread block scheduling in GPGPUs","Nath, R.; Ayoub, R.; Rosing, T.S.","Univ. of California, San Diego, La Jolla, CA, USA","Design Automation Conference (DAC), 2013 50th ACM/EDAC/IEEE","20130718","2013","","","1","6","In this paper, we present a first general purpose GPU thermal management design that consists of both hardware architecture and OS scheduler changes. Our techniques schedule thread blocks from multiple computational kernels in spatial, temporal, and spatio-temporal ways depending on the thermal state of the system. We can reduce the computation slowdown by 60% on average relative to the state of the art techniques while meeting the thermal constraints. We also extend our work to multi GPGPU cards and show improvements of 44% on average relative to existing technique.","0738-100X","","","","http://ieeexplore.ieee.org/stamp/stamp.jsp?arnumber=6560770","","Abstracts;Graphics processing units;Handheld computers;Kernel;Support vector machines","graphics processing units;integrated circuit design;processor scheduling","GPGPU;OS scheduler;general purpose GPU thermal management design;hardware architecture;multiple-computational kernels;spatio-temporal scheduling;temperature-aware thread block scheduling;thermal constraint;thermal state","","1","","","","","May 29 2013-June 7 2013","","IEEE","IEEE Conference Publications"
"A field-programmable pin-constrained digital microfluidic biochip","Grissom, D.; Brisk, P.","Dept. of Comput. Sci. & Eng., Univ. of California, Riverside, Riverside, CA, USA","Design Automation Conference (DAC), 2013 50th ACM/EDAC/IEEE","20130718","2013","","","1","9","As digital microfluidic biochips (DMFBs) have matured over the last decade, efforts have been made to 1.) reduce the cost, and 2.) produce general-purpose chips. While work done to generalize DMFBs typically depends on the flexibility of individually controlled electrodes, such devices have high wiring complexity, which requires costly multi-layer printed circuit boards (PCBs). In contrast, pin-constrained DMFBs reduce the wiring complexity, but reduce the flexibility of droplet coordination. We present a field-programmable pin-constrained DMFB that leverages the cost-savings of pin-constrained designs, but is general-purpose, rather than assay-specific. We show that with just a few more pins than the state-of-the-art pin-constrained designs, we can execute arbitrary assays almost as fast as the most recent general-purpose DMFB designs.","0738-100X","","","","http://ieeexplore.ieee.org/stamp/stamp.jsp?arnumber=6560639","Digital Microfluidic Biochip (DMFB);Field-Programmable;Laboratory-on-Chip (LoC);Pin-Constrained","Arrays;Electrodes;Microfluidics;Pins;Reservoirs;Routing;Topology","biomedical electrodes;biomedical electronics;lab-on-a-chip;microelectrodes;microfluidics","cost reduction;droplet coordination flexibility reduction;field-programmable pin-constrained DMFB;field-programmable pin-constrained digital microfluidic biochip;general-purpose DMFB design;general-purpose chips;multilayer PCB;multilayer printed circuit boards;pin-constrained design;wiring complexity","","0","","","","","May 29 2013-June 7 2013","","IEEE","IEEE Conference Publications"
"Real-time use-aware adaptive MIMO RF receiver systems for energy efficiency under BER constraints","Banerjee, D.; Devarakond, S.; Sen, S.; Chatterjee, A.","Georgia Inst. of Technol., Atlanta, GA, USA","Design Automation Conference (DAC), 2013 50th ACM/EDAC/IEEE","20130718","2013","","","1","7","Modern MIMO RF transceiver systems are designed to operate reliably under diverse channel conditions leading to incorporation of significant performance margins in RF transceiver systems. In general, across dynamically varying channel conditions, the fidelity of the RF front end devices can be traded-off against power consumption without compromising system-level BER limits. In this work such a real-time performance vs. power consumption modulation of RF front-end devices in MIMO systems is demonstrated. Through a multi-dimensional optimization technique, power-optimal configuration of the frontend for varying channel conditions are created. Additionally multiple low-power operating modes for the MIMO system are proposed depending on the performance metric (data rate or energy-per-bit) that need to be optimized for different applications.","0738-100X","","","","http://ieeexplore.ieee.org/stamp/stamp.jsp?arnumber=6560649","Adaptive;Diversity;Low Power;MIMO;OFDM;Radio-Frequency;Receiver;Spatial Multiplexing","Indexes;Power demand;Receivers;Sensitivity;Signal to noise ratio;Throughput","MIMO communication;energy consumption;error statistics;optimisation;radio transceivers;wireless channels","BER constraint;RF front end device;diverse channel condition;dynamically varying channel condition;energy efficiency;multidimensional optimization technique;multiple input multiple output communication;multiple low-power operating mode;power consumption modulation;power-optimal configuration;real-time performance;real-time use-aware adaptive MIMO RF receiver system","","0","","","","","May 29 2013-June 7 2013","","IEEE","IEEE Conference Publications"
"Exploiting just-enough parallelism when mapping streaming applications in hard real-time systems","Zhai, J.T.; Bamakhrama, M.A.; Stefanov, T.","Leiden Inst. of Adv. Comput. Sci., Leiden Univ., Leiden, Netherlands","Design Automation Conference (DAC), 2013 50th ACM/EDAC/IEEE","20130718","2013","","","1","8","Embedded streaming applications specified using parallel Models of Computation (MoC) often contain ample amount of parallelism which can be exploited using Multi-Processor System-on-Chip (MPSoC) platforms. It has been shown that the various forms of parallelism in an application should be explored to achieve the maximum system performance. However, if more parallelism is revealed than needed, it will overload the underlying MPSoC platform. At the same time, the revealed parallelism should be sufficient such that the MPSoC platform is fully utilized. Therefore, the amount of revealed and exploited parallelism has to be just-enough with respect to the platform constraints. In this paper, we study the problem of exploiting just-enough parallelism by application task unfolding, when mapping streaming applications modeled using the Synchronous Data Flow (SDF) MoC onto MPSoC platforms in hard real-time systems. We show that our problem of simultaneously unfolding and allocating tasks under hard real-time scheduling has a bounded solution space and derive its upper bounds. Subsequently, we devise an efficient algorithm to solve the problem, while the obtained solution meets a pre-specified quality. The experiments on a set of real-life streaming applications demonstrate that our algorithm results, within reasonable amount of time, in a system specification with large performance gain. Finally, we show that our proposed algorithm is on average 100 times faster than one of the state-of-the-art meta-heuristics, i.e., NSGA-II genetic algorithm, while achieving the same quality of solutions.","0738-100X","","","","http://ieeexplore.ieee.org/stamp/stamp.jsp?arnumber=6560763","","Approximation algorithms;Benchmark testing;Parallel processing;Real-time systems;Resource management;Upper bound;Vectors","data flow graphs;embedded systems;processor scheduling;system-on-chip","MPSoC;embedded streaming applications;exploiting just-enough parallelism;hard real-time systems;multiprocessor system-on-chip;parallel models of computation;real-life streaming applications;streaming application mapping;synchronous data flow;tasks allocation","","0","","","","","May 29 2013-June 7 2013","","IEEE","IEEE Conference Publications"
"Distributed run-time resource management for malleable applications on many-core platforms","Anagnostopoulos, I.; Tsoutsouras, V.; Bartzas, A.; Soudris, D.","Sch. of Electr. & Comput. Eng., Nat. Tech. Univ. of Athens, Athens, Greece","Design Automation Conference (DAC), 2013 50th ACM/EDAC/IEEE","20130718","2013","","","1","6","Todays prevalent solutions for modern embedded systems and general computing employ many processing units connected by an on-chip network leaving behind complex superscalar architectures In this paper, we couple the concept of distributed computing with parallel applications and present a workload-aware distributed run-time framework for malleable applications on many-core platforms. The presented framework is responsible for serving in a distributed way and at run-time, the needs of malleable applications, maximizing resource utilization avoiding dominating effects and taking into account the type of processors supporting platform heterogeneity, while having a small overhead in overall inter-core communication. Our framework has been implemented as part of a C simulator and additionally as a runtime service on the Single-Chip Cloud Computer (SCC), an experimental processor created by Intel Labs, and we compared it against a state-of-art run-time resource manager. Experimental results showed that our framework has on average 70% less messages, 64% smaller message size and 20% application speed-up gain.","0738-100X","","","","http://ieeexplore.ieee.org/stamp/stamp.jsp?arnumber=6560761","","Abstracts;Availability;Computers;Program processors;Reactive power;Resource management;System-on-chip","C language;cloud computing;embedded systems;multiprocessing systems;parallel processing;resource allocation","C simulator;SCC;complex superscalar architecture;distributed computing;distributed run-time resource management;embedded system;malleable application;many-core platform;on-chip network;parallel application;resource utilization;single-chip cloud computer;workload-aware distributed run-time framework","","0","","","","","May 29 2013-June 7 2013","","IEEE","IEEE Conference Publications"
"HCI-Tolerant NoC router microarchitecture","Ancajas, D.M.; Nickerson, J.M.; Chakraborty, K.; Roy, S.","USU BRIDGE Lab., Utah State Univ., Logan, UT, USA","Design Automation Conference (DAC), 2013 50th ACM/EDAC/IEEE","20130718","2013","","","1","10","The trend towards massive parallel computing has necessitated the need for an On-Chip communication framework that can scale well with the increasing number of cores. At the same time, technology scaling has made transistors susceptible to a multitude of reliability issues (NBTI, HCI, TDDB). In this work, we propose an HCI-Tolerant microarchitecture for an NoC Router by manipulating the switching activity around the circuit. We find that most of the switching activity (the primary cause of HCI degradation) are only concentrated in a few parts of the circuit, severely degrading some portions more than others. Our techniques increase the lifetime of an NoC router by balancing this switching activity. Compared to an NoC without any reliability techniques, our best schemes improve the switching activity distribution, clock cycle degradation, system performance and energy delay product per flit by 19%, 26%, 11% and 17%, respectively, on an average.","0738-100X","","","","http://ieeexplore.ieee.org/stamp/stamp.jsp?arnumber=6560633","","Aging;Degradation;Human computer interaction;Logic gates;Switches;Switching circuits;Transistors","circuit reliability;circuit switching;hot carriers;network routing;network-on-chip","HCI tolerant microarchitecture;NoC Router;clock cycle degradation;energy delay product;on chip communication framework;parallel computing;reliability techniques;switching activity distribution;system performance;technology scaling","","0","","","","","May 29 2013-June 7 2013","","IEEE","IEEE Conference Publications"
"LEQA: Latency estimation for a quantum algorithm mapped to a quantum circuit fabric","Dousti, M.J.; Pedram, M.","Dept. of Electr. Eng., Univ. of Southern California, Los Angeles, CA, USA","Design Automation Conference (DAC), 2013 50th ACM/EDAC/IEEE","20130718","2013","","","1","7","This paper presents LEQA, a fast latency estimation tool for evaluating the performance of a quantum algorithm mapped to a quantum fabric. The actual quantum algorithm latency can be computed by performing detailed scheduling, placement and routing of the quantum instructions and qubits in a quantum operation dependency graph on a quantum circuit fabric. This is, however, a very expensive proposition that requires large amounts of processing time. Instead, LEQA, which is based on computing the neighborhood population counts of qubits, can produce estimates of the circuit latency with good accuracy (i.e., an average of less than 3% error) with up to two orders of magnitude speedup for mid-size benchmarks. This speedup is expected to increase superlinearly as a function of circuit size (operation count).","0738-100X","","","","http://ieeexplore.ieee.org/stamp/stamp.jsp?arnumber=6560635","CAD tool;Quantum computing;algorithm;latency estimation;quantum fabric","Equations;Estimation;Fabrics;Logic gates;Mathematical model;Quantum computing;Routing","CAD;instruction sets;quantum computing;scheduling","LEQA;latency estimation tool;quantum algorithm;quantum circuit fabric;quantum fabric;quantum instructions","","0","","","","","May 29 2013-June 7 2013","","IEEE","IEEE Conference Publications"
"Relax-and-Retime: A methodology for energy-efficient recovery based design","Ramasubramanian, S.G.; Venkataramani, S.; Parandhaman, A.; Raghunathan, A.","Sch. of Electr. & Comput. Eng., Purdue Univ., West Lafayette, IN, USA","Design Automation Conference (DAC), 2013 50th ACM/EDAC/IEEE","20130718","2013","","","1","6","Recovery based design (RBD) is a promising approach for the design of energy-efficient circuits under variations. RBD instruments circuits with mechanisms to identify and correct timing violations, thereby allowing reduced guard bands or design margins. In addition, RBD enables aggressive voltage overscaling to a point where timing errors occur even under nominal conditions. A major barrier to the widespread adoption of RBD is that traditional design practices and synthesis tools result in circuits with so-called“path walls”, leading to an explosion in the number of timing errors beyond a certain critical operating voltage. To alleviate this effect, previous techniques focused on combinational circuit optimizations such as sizing, use of dual Vt,, cells, re-structuring, etc. to favorably reshape the path delay distribution. However, these techniques are limited by the inherent sequential structure of the circuit, which defines the boundaries of the combinational logic. In this work, we explore a completely different approach to synthesize circuits for RBD. We propose the use of retiming, a well-known and powerful sequential optimization technique to redefine the boundaries of combinational logic, thereby creating new opportunities for RBD that cannot be explored by previous techniques. We make the key observation that, in retiming circuits with RBD (unlike classical retiming), it is acceptable for a few paths in the circuit to exceed the clock period. Using this insight, we propose a synthesis methodology, Relax-and-Retire, wherein the original circuit is relaxed by ignoring timing constraints on selected paths that are bottlenecks to retiming. When classical minimum period retiming is employed on this relaxed circuit, the path wall is shifted to a lower delay, thus allowing additional voltage overscaling. The Relax-and-Retire methodology judiciously selects bottleneck paths by trading off recovery overheads caused by timing errors due to these path- with the opportunities for retiming. We utilize the proposed methodology to synthesize a wide range of benchmarks including arithmetic circuits, ISCAS89 benchmarks and modules from the UltraSPARC T1 processor. Our results demonstrate 9-25% (average of 15.3%) improvement in overall energy compared to a well-optimized baseline with RBD.","0738-100X","","","","http://ieeexplore.ieee.org/stamp/stamp.jsp?arnumber=6560704","Low Power Design;Recovery Based Design;Retiming","Clocks;Delays;Error analysis;Logic gates;Registers;Sequential circuits","benchmark testing;circuit optimisation;clocks;combinational circuits;digital arithmetic;logic design;microprocessor chips;power aware computing;timing circuits","ISCAS89 benchmarks;RBD;UltraSPARC T1 processor;aggressive voltage overscaling;arithmetic circuits;circuit synthesis;clock period;combinational logic;critical operating voltage;energy efficient circuit design;energy efficient recovery-based design;minimum period retiming;path delay distribution;path walls;recovery overheads;relax-and-retime methodology;relaxed circuit;retiming circuits;sequential optimization technique;timing constraints;timing errors;timing violation correction;timing violation identification","","0","","","","","May 29 2013-June 7 2013","","IEEE","IEEE Conference Publications"
"netShip: A networked virtual platform for large-scale heterogeneous distributed embedded systems","YoungHoon Jung; Jinhyung Park; Petracca, M.; Carloni, L.P.","Dept. of Comput. Sci., Columbia Univ., New York, NY, USA","Design Automation Conference (DAC), 2013 50th ACM/EDAC/IEEE","20130718","2013","","","1","10","From a single SoC to a network of embedded devices communicating with a backend cloud-computing server, emerging classes of embedded systems feature an increasing number of heterogeneous components that operate concurrently in a distributed environment. As the scale and complexity of these systems continues to grow, there is a critical need for scalable and efficient simulators. We propose a networked virtual platform as a scalable environment for modeling and simulation. The goal is to support the development and optimization of embedded computing applications by handling heterogeneity at the chip, node, and network level. To illustrate the properties of our approach, we present two very different case studies: the design of an Open MPI scheduler for a heterogeneous distributed embedded system and the development of an application for crowd estimation through the analysis of pictures uploaded from mobile phones.","0738-100X","","","","http://ieeexplore.ieee.org/stamp/stamp.jsp?arnumber=6560762","Android;Embedded Systems;MPI;OVP;OpenCV;QEMU;Simulation;System Design;Virtual Platform","Computational modeling;Hardware;Ports (Computers);Scalability;Servers;Software;Synchronization","circuit complexity;circuit simulation;cloud computing;electronic engineering computing;embedded systems;integrated circuit modelling;message passing;scheduling;system-on-chip","Open MPI scheduler design;SoC;backend cloud-computing server;chip level;crowd estimation;distributed environment;embedded computing application;embedded device;heterogeneity handling;heterogeneous component;large-scale heterogeneous distributed embedded system;mobile phone;modeling;netShip;network level;networked virtual platform;node level;simulation;system complexity;system scale","","0","","","","","May 29 2013-June 7 2013","","IEEE","IEEE Conference Publications"
"Ripple 2.0: High quality routability-driven placement via global router integration","Xu He; Tao Huang; Wing-Kai Chow; Jian Kuang; Ka-Chun Lam; Wenzan Cai; Young, E.F.Y.","Dept. of Comput. Sci. & Eng., Chinese Univ. of Hong Kong, Shatin, China","Design Automation Conference (DAC), 2013 50th ACM/EDAC/IEEE","20130718","2013","","","1","6","Due to a significant mismatch between the objectives of wirelength and routing congestion, the routability issue is becoming more and more important in VLSI design. In this paper, we present a high quality placer Ripple 2.0 to solve the routability-driven placement problem. We will study how to make use of the routing path information in cell spreading and relieve congestion with tangled logic in detail. Several techniques are proposed, including (1) lookahead routing analysis with pin density consideration, (2) routing path-based cell inflation and spreading and (3) robust optimization on congested cluster. With the official evaluation protocol, Ripple 2.0 outperforms the top contestants on the ICCAD 2012 Contest benchmark suite.","0738-100X","","","","http://ieeexplore.ieee.org/stamp/stamp.jsp?arnumber=6560745","","Equations;Layout;Metals;Optimization;Routing;Upper bound;Wires","VLSI;integration;network routing;optimisation","ICCAD 2012 Contest benchmark suite;VLSI design;global router integration;high quality placer Ripple 2.0;high quality routability-driven placement;lookahead routing analysis;pin density consideration;robust optimization;routing congestion;routing path-based cell inflation;tangled logic;wirelength congestion","","0","","","","","May 29 2013-June 7 2013","","IEEE","IEEE Conference Publications"
"Throughput-oriented kernel porting onto FPGAs","Papakonstantinou, A.; Deming Chen; Wen-mei Hwu; Cong, J.; Yun Liang","ECE Dept., Univ. of Illinois, Urbana, IL, USA","Design Automation Conference (DAC), 2013 50th ACM/EDAC/IEEE","20130718","2013","","","1","10","Reconfigurable devices are often employed in heterogeneous systems due to their low power and parallel processing advantages. An important usability requirement is the support of a homogeneous programming interface. Nevertheless, homogeneous programming interfaces do not eliminate the need for code tweaking to enable efficient mapping of the computation across heterogeneous architectures. In this work we propose a code optimization framework which analyzes and restructures CUDA kernels that are optimized for GPU devices in order to facilitate synthesis of high-throughput custom accelerators on FPGAs. The proposed framework enables efficient performance porting without manual code tweaking or annotation by the user. A hierarchical region graph in tandem with code motions and graph coloring of array variables is employed to restructure the kernel for high throughput execution on FPGAs.","0738-100X","","","","http://ieeexplore.ieee.org/stamp/stamp.jsp?arnumber=6560604","","Field programmable gate arrays;Graphics processing units;Kernel;Optimization;Resource management;Synchronization;Throughput","field programmable gate arrays;graph theory;optimising compilers;parallel architectures","CUDA kernels;FPGA;GPU devices;array variables;code motions;code optimization framework;graph coloring;heterogeneous systems;hierarchical region graph;high throughput execution;high-throughput custom accelerators;homogehomogeneous programming interface;parallel processing advantages;performance porting;reconfigurable devices;throughput-oriented kernel porting;usability requirement","","0","","","","","May 29 2013-June 7 2013","","IEEE","IEEE Conference Publications"
