"http://ieeexplore.ieee.org/search/searchresult.jsp?bulkSetSize=2000&refinements%3D4294967269%26matchBoolean%3Dtrue%26searchField%3DSearch_All%26queryText%3D%28%28Design+Automation+Conference+.LB.DAC.RB.%29+AND+2011%29",2015/06/23 14:46:50
"Rethinking thermal via planning with timing-power-temperature dependence for 3D ICs","Kan Wang; Yuchun Ma; Sheqin Dong; Yu Wang; Xianlong Hong; Cong, J.","Dept. of Comput. Sci. & Technol., Tsinghua Univ., Beijing, China","Design Automation Conference (ASP-DAC), 2011 16th Asia and South Pacific","20110303","2011","","","261","266","Due to the increased power density and lower thermal conductivity, 3D is faced with heat dissipation and temperature problem seriously. Previous researches show that leakage power and delay are both relevant to temperature. The timing-power-temperature dependence will potentially negate the performance improvement of 3D designs. TSV (Through-Silicon-Vias) has been shown as an effective way to help heat removal, but they create routing congestions. Therefore, how to reach the trade-off between temperature, via number and delay is required to be solved. Different from previous works on TSV planning which ignored the effects of leakage power, in this paper, we integrate temperature-leakage-timing dependence into thermal via planning of 3D ICs. A weighted via insertion approach, considering both performance and heat dissipation with resource constraint, is proposed to achieve the best balance among delay, via number and temperature. Experiment results show that, with leakage power and resource constraint considered the temperature and via number required can be quite different, and weighted TSV insertion approach can improve thermal via number, by about 5.6%.","2153-6961","978-1-4244-7515-5","","10.1109/ASPDAC.2011.5722195","http://ieeexplore.ieee.org/stamp/stamp.jsp?arnumber=5722195","","Delay;Heating;Planning;Temperature dependence;Three dimensional displays;Through-silicon vias;Tiles","cooling;leakage currents;thermal conductivity;thermal management (packaging);three-dimensional integrated circuits","3D IC;3D designs;TSV insertion approach;TSV planning;heat dissipation;heat removal;leakage delay;leakage power;performance improvement;power density;resource constraint;routing congestions;temperature-leakage-timing dependence;thermal conductivity;thermal via number;thermal via planning;through-silicon-vias;timing-power-temperature dependence;via insertion approach","","3","","18","","","25-28 Jan. 2011","","IEEE","IEEE Conference Publications"
"General chair's message","Stok, Leon","IBM Corp., 2070 Rte. 52, Hopewell Jct., NY 12533, USA","Design Automation Conference (DAC), 2011 48th ACM/EDAC/IEEE","20110811","2011","","","i","i","It is a great pleasure to welcome you to the 48<sup>th</sup> edition of the Design Automation Conference in San Diego. In the age of web-conferencing DAC is changing its format to provide the maximum opportunity for multi-way interaction at the conference. In addition to the kickoff reception on Sunday, DAC will feature a reception at the end of each day to stimulate intermingling of all DAC participants from the exhibit floor to the technical sessions. In the technical program, all paper presentations are shortened and immediately followed by a poster session where a dialogue can take place between the author and the audience. At the Wednesday reception the Work In Progress (WIP) session will take place. This new initiative will provide a forum for new ideas, not yet fully ready for a publication, to be exchanged with other experts in the field.","0738-100x","978-1-4503-0636-2","","","http://ieeexplore.ieee.org/stamp/stamp.jsp?arnumber=5981904","","","","","","0","","","","","5-9 June 2011","","IEEE","IEEE Conference Publications"
"Reviewers","","","Design Automation Conference (DAC), 2011 48th ACM/EDAC/IEEE","20110811","2011","","","xxiv","xxviii","A total of 690 manuscripts were submitted to the 48th DAC. The Technical Program Committee, together with the help of invited expert and external reviewers, selected 156 papers for presentation at the conference. The Conference Executive and Technical Program Committees wish to acknowledge the time and effort spent by the following people who reviewed these manuscripts. Our thanks to all of those who participated and contributed to the success of the conference.","0738-100x","978-1-4503-0636-2","","","http://ieeexplore.ieee.org/stamp/stamp.jsp?arnumber=5981912","","","","","","0","","","","","5-9 June 2011","","IEEE","IEEE Conference Publications"
"Customer-aware task allocation and scheduling for multi-mode MPSoCs","Lin Huang; Rong Ye; Qiang Xu","Dept. of Comput. Sci. & Eng., Chinese Univ. of Hong Kong, Hong Kong, China","Design Automation Conference (DAC), 2011 48th ACM/EDAC/IEEE","20110811","2011","","","387","392","Today's multiprocessor system-on-a-chip (MPSoC) products typically have multiple execution modes, and for each mode, all the products utilize the same task allocation and schedule strategy determined at design stage. As these products experience different usages by customers, such unified solution can at best be optimized for a hypothetical common case. It is hence likely that the product is not reliable or energy-efficient from particular customers' point of view. To tackle this problem, we propose a novel customer-aware task allocation and scheduling technique, wherein we generate an initial task schedule for each execution mode at design stage and then perform online adjustment at regular intervals for lifetime reliability improvement and/or energy reduction according to the specific usage strategy of individual products. Experimental results on several hypothetical MPSoCs with various task graphs demonstrate the effectiveness of the proposed personalized solution.","0738-100x","978-1-4503-0636-2","","","http://ieeexplore.ieee.org/stamp/stamp.jsp?arnumber=5981769","Lifetime reliability;Online adjustment;Task allocation and scheduling","Aging;Embedded systems;Energy consumption;Reliability engineering;Resource management;Schedules","multiprocessing systems;reliability;scheduling;system-on-chip;task analysis","customer-aware task allocation;energy reduction;lifetime reliability improvement;multimode MPSoC;multiprocessor system-on-a-chip;scheduling for","","0","","17","","","5-9 June 2011","","IEEE","IEEE Conference Publications"
"Lithography at 14nm and beyond: Choices and challenges","Singh, Vivek","Intel Corp. (USA), Hillsboro, OR, USA","Design Automation Conference (DAC), 2011 48th ACM/EDAC/IEEE","20110811","2011","","","459","459","As the gap between the lithography wavelength and critical feature size has continued to increase, the semiconductor industry has had to adjust. Previously, scaling along Moore's Law had relied on improvement in lithography equipment, occasionally by reducing the wavelength and frequently by improving the effective numerical aperture. The wavelength used to define critical dimensions during much of the nineties was 248nm, with the industry switching to 193nm in the following decade. After 157nm technology failed to materialize due to technological challenges, the focus of next generation lithography (NGL) research shifted to EUV. Meanwhile, 193nm continued to be the workhorse for the continuation of Moore's Law. The next big equipment advancement came with immersion steppers, which “increased” the effective aperture of the lens, thereby capturing more of the diffraction orders in the imaging process. Moore's Law, however requires a significant innovation every two years! With optical lithography wavelength and effective lens aperture stretched to these limits, double patterning came to the rescue. By splitting the pattern into two, the burden on each mask was somewhat reduced, allowing a “stitched” pattern to scale. All through these changes, continued scaling also required a tighter co-optimization between process and design. As the image quality became generally weaker, greater restrictions were placed on the diversity of features that could be robustly patterned, leading to the proverbial increase in the heft of design rule manuals. All through these heroic efforts to continue Moore's Law, in order to reap the resulting benefits to the electronics industry, a relatively new field called Computational Lithography has been providing a helping hand. Computational Lithography comprises a broad set of techniques that use physics-based calculations to eke out greater lithographic performance from a given generation of steppers. This- fertile field has recently introduced two advanced features: inverse lithography, and source-mask optimization. Such techniques have helped extend the life of optical lithography beyond previously forecast durations. At the same time, as other lithography technologies become more mature, much of the computational infrastructure developed to extend optical lithography will likely be used to optimize the newer technologies. This paper will provide some examples of how Computational Lithography is creating novel and affordable solutions to sustain the scaling trend.","0738-100x","978-1-4503-0636-2","","","http://ieeexplore.ieee.org/stamp/stamp.jsp?arnumber=5981847","Lithography","Apertures;Electronics industry;Lithography;Optical imaging","lithography;semiconductor industry","Computational Lithography;EUV;Moore law;NGL;next generation optical lithography wavelength;physics-based calculations;semiconductor industry;size 14 nm;source-mask optimization","","0","","","","","5-9 June 2011","","IEEE","IEEE Conference Publications"
"Threadmill: A post-silicon exerciser for multi-threaded processors","Adir, A.; Golubev, M.; Landa, S.; Nahir, A.; Shurek, G.; Sokhin, V.; Ziv, A.","IBM Res. - Haifa, Haifa, Israel","Design Automation Conference (DAC), 2011 48th ACM/EDAC/IEEE","20110811","2011","","","860","865","Post-silicon validation poses unique challenges that bring-up tools must face, such as the lack of observability into the design, the typical instability of silicon bring-up platforms and the absence of supporting software (like an OS or debuggers). These challenges and the need to reach an optimal utilization of the expensive but very fast silicon platforms lead to unique design considerations - like the need to keep the tool simple and to perform most of its operation on platform without interaction with the environment. In this paper we describe a variety of novel techniques optimized for the unique characteristics of the silicon platform. These techniques are implemented in Threadmill - a bare-metal exerciser targeting multi-threaded processors. Threadmill was used in the verification of the POWER7 processor with encouraging results.","0738-100x","978-1-4503-0636-2","","","http://ieeexplore.ieee.org/stamp/stamp.jsp?arnumber=5981876","Functional Verification;Multi-Threading;Post-Silicon Validation;Stimuli Generation","Computer bugs;Debugging;Generators;Instruction sets;Joints;Registers;Silicon","formal verification;multi-threading;multiprocessing systems","POWER7 processor verification;bare-metal exerciser targeting multithreaded processors;postsilicon exerciser;postsilicon validation;threadmill","","2","","17","","","5-9 June 2011","","IEEE","IEEE Conference Publications"
"Formal hardware/software co-verification by interval property checking with abstraction","Nguyen, M.D.; Wedler, M.; Stoffel, D.; Kunz, W.","Electron. Design Autom. Group, Univ. of Kaiserslautern, Kaiserslautern, Germany","Design Automation Conference (DAC), 2011 48th ACM/EDAC/IEEE","20110811","2011","","","510","515","Ensuring functional correctness of hardware and software is a bottleneck in every design process of Embedded Systems. This paper proposes an approach to formally verify low-level software in conjunction with the hardware. The proposed approach is based on Interval Property Checking (IPC) that has proved successful on large industrial hardware designs. In this paper, IPC is extended by a specific abstraction technique that makes it tractable for hardware/ software co-verification on realistic industrial designs. In the proposed methodology sets of finite state sequences of the system are abstracted by interval properties. This allows us to handle long sequences of state transitions in the hardware as they occur when running programs. We demonstrate the feasibility of our approach using the example of an industrial LIN software running on a public domain microprocessor platform.","0738-100x","978-1-4503-0636-2","","","http://ieeexplore.ieee.org/stamp/stamp.jsp?arnumber=5981972","Abstraction;Embedded System;Formal Verification;Hardware/Software","Computational modeling;Concrete;Embedded systems;Hardware;Integrated circuit modeling;Random access memory","embedded systems;formal verification","abstraction technique;embedded systems;finite state sequences;formal hardware-software coverification;industrial LIN software;interval property checking;microprocessor platform","","2","","18","","","5-9 June 2011","","IEEE","IEEE Conference Publications"
"Learning microarchitectural behaviors to improve stimuli generation quality","Katz, Y.; Rimon, M.; Ziv, A.; Shaked, G.","IBM Res. - Haifa, Haifa, Israel","Design Automation Conference (DAC), 2011 48th ACM/EDAC/IEEE","20110811","2011","","","848","853","Microarchitectural information regarding various aspects of instruction execution can help processor-level stimuli generators more easily reach verification goals. While many such aspects are based on common microarchitectural concepts, their specific manifestations are highly design-specific. We propose using an automatic method for acquiring such microarchitectural knowledge and integrating it into the stimuli generator. We start by extracting microarchitectural data from simulation traces. This data is fed to a decision tree learning algorithm that produces rules for microarchitectural behavior of instructions; these rules are then integrated into the testing knowledge of the stimuli generator. This testing knowledge can provide users with the ability to better control the microarchitectural behavior of generated instructions, leading to higher quality test cases. Experimental results on the POWER7 processor showed that our proposed method can improve the microarchitectural cover-age of the design.","0738-100x","978-1-4503-0636-2","","","http://ieeexplore.ieee.org/stamp/stamp.jsp?arnumber=5982005","Functional Verification;Machine Learning;Microarchitecture;Stimuli Generation","Decision trees;Engines;Feature extraction;Generators;Microarchitecture;Registers;Testing","decision trees;formal verification;instruction sets","POWER7 processor;decision tree learning algorithm;instruction execution;microarchitectural behavior learning;processor-level stimuli generators;stimuli generation quality improvement;verification goals","","1","","13","","","5-9 June 2011","","IEEE","IEEE Conference Publications"
"Cool shapers: Shaping real-time tasks for improved thermal guarantees","Kumar, P.; Thiele, L.","Comput. Eng. & Networks Lab., ETH Zurich, Zurich, Switzerland","Design Automation Conference (DAC), 2011 48th ACM/EDAC/IEEE","20110811","2011","","","468","473","With increasing power densities, managing on-chip temperatures has become an important design challenge. We propose a novel approach to this problem with the use of shapers to dynamically and selectively insert idle times during the execution of hard real-time jobs on a single speed processor. For the class of leaky bucket shapers which have a light-weight implementation, we derive the shaper such that no job misses its real-time deadline and the peak temperature is optimally reduced. The analysis and design of such shapers allows for dynamically variable streams of jobs; for instance, periodic streams with jitter. We extend our results to consider non-zero power and timing overhead in transitioning to the idle mode. With experimental results, we demonstrate that the proposed approach provides a large improvement: on average 8K peak temperature reduction or 40% increase in utilization for a given peak temperature.","0738-100x","978-1-4503-0636-2","","","http://ieeexplore.ieee.org/stamp/stamp.jsp?arnumber=5981848","Real-Time Systems;Shapers;Thermal Management","Delay;Hardware;Mathematical model;Optical wavelength conversion;Real time systems;System-on-a-chip","electronics packaging;real-time systems;system-on-chip","Cool Shaper;on-chip temperatures management;power density;real time tasks;single speed processor;thermal guarantee","","2","","13","","","5-9 June 2011","","IEEE","IEEE Conference Publications"
"Simultaneous functional and timing ECO","Hua-Yu Chang; Jiang, I.H.-R.; Yao-Wen Chang","Grad. Inst. of Electron. Eng., Nat. Taiwan Univ., Taipei, Taiwan","Design Automation Conference (DAC), 2011 48th ACM/EDAC/IEEE","20110811","2011","","","140","145","Metal-only ECO is prevalent at design houses to perform incremental design changes to resolve last found functional and/or timing failures. However, it is hard to perform mixed functional and timing changes manually. Prior endeavors focus on functional or timing ECO alone, but we observe that separating them may fail to fix all timing violations. Consequently, this paper presents the first work to perform simultaneous functional and timing ECO. We use an augmented bipartite graph to model both types of ECO. In addition, through comprehensive constant insertion and bridging, the functional capability of each spare cell is enhanced, thus facilitating spare cell selection. Experimental results show that our simultaneous functional and timing ECO engine can successfully resolve mixed functional and timing ECO that is unsolvable by the sequential scheme. Moreover, our engine outperforms the state-of-the-art works for timing ECO with a 117X speedup, and for functional ECO with 6-15% wirelength reductions.","0738-100x","978-1-4503-0636-2","","","http://ieeexplore.ieee.org/stamp/stamp.jsp?arnumber=5981928","Engineering change order;spare cells;technology remapping","Delay;Engines;Libraries;Loading;Logic gates;Wires","masks;semiconductor technology","augmented bipartite graph;metal-layer masks;simultaneous functional;spare cell selection;timing ECO","","2","","18","","","5-9 June 2011","","IEEE","IEEE Conference Publications"
"CIRUS: A scalable modular architecture for reusable drivers","Saha, B.","Principal Engineer and Manager, SW Reuse and Convergence, SoC Enabling Group, Intel Corporation, USA","Design Automation Conference (DAC), 2011 48th ACM/EDAC/IEEE","20110811","2011","","","260","261","The system on a chip (SoC) market segment is driven by rapid TTM (time to market), OS scalability, and efficiency. This requires the SW stack to be designed with TTM, scalability and efficiency as first order design constraints. In this paper we propose a layered modular architecture for SoC drivers to enable aggressive driver code reuse between OSes and platforms. This cuts SW development, validation, integration, and maintenance effort. We then discuss the implementation of such an architecture in a media driver that is highly reusable across SoCs in different market segments and operating systems.","0738-100x","978-1-4503-0636-2","","","http://ieeexplore.ieee.org/stamp/stamp.jsp?arnumber=5981943","System-on-a-chip;architecture;drivers;modular;reusable","Computer architecture;Maintenance engineering;Media;Operating systems;Scalability;System-on-a-chip","driver circuits;system-on-chip","CIRUS;OS scalability;SoC drivers;aggressive driver code reuse;layered modular architecture;market segment;rapid TTM;reusable drivers;scalable modular architecture;system on a chip;time to market","","0","","8","","","5-9 June 2011","","IEEE","IEEE Conference Publications"
"Complexity and the challenges of securing SoCs","Kocher, P.","Cryptography Res., Inc., San Francisco, CA, USA","Design Automation Conference (DAC), 2011 48th ACM/EDAC/IEEE","20110811","2011","","","328","331","There is a growing need to secure cryptographic keys and other secrets on SoCs and other large ASICs. For designers, smaller geometries make it more difficult to predict the precise physical and analog properties of digital logic blocks. In addition, high mask costs make it difficult to tune designs and raise the consequences of failure. For example, side channel attacks such as differential cryptanalysis can easily and noninvasively extract secrets from unprotected SoCs. Vulnerabilities can be difficult to anticipate, since common design and verification tools do not necessarily provide clear visibility into how devices will fail when pushed outside of its normal operational conditions. The security challenges facing the semiconductor industry are also in part educational; while security training is common for software developers, relatively few hardware engineers have specialized security knowledge. Some of these challenges can be mitigated at the architectural level, for example by using cryptographic constructions that provide inherent side-channel resistance irrespective of a device's underlying analog properties.","0738-100x","978-1-4503-0636-2","","","http://ieeexplore.ieee.org/stamp/stamp.jsp?arnumber=5981953","Security;antitamper;differential power analysis;hardware security;side channel attack;tamper evidence;tamper resistance","Complexity theory;Encryption;Hardware;Power measurement;System-on-a-chip","cryptography;logic circuits;system-on-chip","ASIC;SoC;cryptographic keys;differential cryptanalysis;digital logic blocks;security training;side-channel resistance","","0","","3","","","5-9 June 2011","","IEEE","IEEE Conference Publications"
"Technical panel abstracts","","","Design Automation Conference (DAC), 2011 48th ACM/EDAC/IEEE","20110811","2011","","","xxix","xxxiv","Presents abstracts of Technical panel discussions from the conference proceedings.","0738-100x","978-1-4503-0636-2","","","http://ieeexplore.ieee.org/stamp/stamp.jsp?arnumber=5981914","","","","","","0","","","","","5-9 June 2011","","IEEE","IEEE Conference Publications"
"Power grid correction using sensitivity analysis under an RC model","Al Haddad, P.; Najm, F.N.","Dept. of ECE, Univ. of Toronto, Toronto, ON, Canada","Design Automation Conference (DAC), 2011 48th ACM/EDAC/IEEE","20110811","2011","","","688","693","Verifying an RC model of the power grid requires one to check if the steady state voltage drops on all the nodes of the grid do not exceed a certain threshold. We propose an approach to correct the grid, in case some voltage drops violate the threshold condition, by making minor changes to the original design. Previous work has been done in on the DC model of the grid and this paper deals with the transient model. Rather than directly reducing the steady state voltage drops below the threshold we work on reducing the first time step voltage drops. The method uses current constraints proposed in to find the first time step voltage drop whose distance to the corresponding threshold is the largest. It then tries to estimate it as a function of the metal widths on the grid. A non-linear optimization problem is then formulated and the required metal line width changes that reduce the first time step voltage drops by a sufficient amount are then determined. The reduction of the first time step voltage drop by that amount will make the steady state voltage drops of all the nodes less than the threshold.","0738-100x","978-1-4503-0636-2","","","http://ieeexplore.ieee.org/stamp/stamp.jsp?arnumber=5981989","Power Grid;sensitivity;voltage drop","Metals;Power grids;Robustness;Safety;Steady-state;Threshold voltage;Upper bound","nonlinear programming;power grids;sensitivity analysis","RC model;nonlinear optimization problem;power grid correction;sensitivity analysis;transient model","","0","","10","","","5-9 June 2011","","IEEE","IEEE Conference Publications"
"An energy-efficient heterogeneous CMP based on hybrid TFET-CMOS cores","Saripalli, V.; Mishra, A.; Datta, S.; Narayanan, V.","Pennsylvania State Univ., University Park, PA, USA","Design Automation Conference (DAC), 2011 48th ACM/EDAC/IEEE","20110811","2011","","","729","734","The steep sub-threshold characteristics of inter-band tunneling FETs (TFETs) make an attractive choice for low voltage operations. In this work, we propose a hybrid TFET-CMOS chip multiprocessor (CMP) that uses CMOS cores for higher voltages and TFETs for lower voltages by exploiting differences in application characteristics. Building from the device characterization to design and simulation of TFET based circuits, our work culminates with a workload evaluation of various single/multi-threaded applications. Our evaluation shows the promise of a new dimension to heterogeneous CMPs to achieve significant energy efficiencies (upto 50% energy benefit and 25% ED benefit with single-threaded applications, and 55% ED benefit with multi-threaded applications).","0738-100x","978-1-4503-0636-2","","","http://ieeexplore.ieee.org/stamp/stamp.jsp?arnumber=5981994","Heterogeneous Multi-Core;Tunnel FETs","CMOS integrated circuits;Delay;FETs;Integrated circuit modeling;Logic gates;Program processors;Tunneling","CMOS integrated circuits;field effect transistors;microprocessor chips;multiprocessing systems;tunnel transistors","CMOS cores;hybrid TFET-CMOS chip multiprocessor;inter-band tunneling FET","","3","","18","","","5-9 June 2011","","IEEE","IEEE Conference Publications"
