"http://ieeexplore.ieee.org/search/searchresult.jsp?bulkSetSize=2000&refinements%3D4294967269%26matchBoolean%3Dtrue%26searchField%3DSearch_All%26queryText%3D%28%28Design+Automation+Conference+.LB.DAC.RB.%29+AND+2011%29",2015/06/23 14:46:50
"MUSTARD: A coupled, stochastic/deterministic, discrete/continuous technique for predicting the impact of Random Telegraph Noise on SRAMs and DRAMs","Aadithya, K.; Venogopalan, S.; Demir, A.; Roychowdhury, J.","Dept. of Electr. Eng. & Comput. Sci., Univ. of California, Berkeley, CA, USA","Design Automation Conference (DAC), 2011 48th ACM/EDAC/IEEE","20110811","2011","","","292","297","With aggressive technology scaling and heightened variability, SRAMs and DRAMs have become vulnerable to Random Telegraph Noise (RTN). The bias-dependent, random temporal nature of RTN presents significant challenges to understanding its effects on circuits. In this paper, we propose MUSTARD, a technique and tool for predicting the impact of RTN on SRAMs/DRAMs in the presence of variability. MUSTARD enables accurate, non-stationary, two-way-coupled, discrete stochastic RTN simulation seamlessly integrated with deterministic, continuous circuit simulation. Using MUSTARD, we are able to predict experimentally observed RTNinduced failures in SRAMs, and generate statistical characterisations of bit errors in SRAMs and DRAMs. We also present MUSTARD-generated results showing the effect of RTN on DRAM retention times.","0738-100x","978-1-4503-0636-2","","","http://ieeexplore.ieee.org/stamp/stamp.jsp?arnumber=5981763","Circuit Simulation;Random Telegraph Noise;SRAM/DRAM design","Electron traps;Hypercubes;Integrated circuit modeling;Markov processes;Noise;Random access memory;Transistors","circuit simulation;random noise","MUSTARD;circuit simulation;random telegraph noise;random temporal nature","","1","","27","","","5-9 June 2011","","IEEE","IEEE Conference Publications"
"Progressive network-flow based power-aware broadcast addressing for pin-constrained digital microfluidic biochips","Tsung-Wei Huang; Hong-Yan Su; Tsung-Yi Ho","Dept. of Comput. Sci. & Inf. Eng., Nat. Cheng Kung Univ., Tainan, Taiwan","Design Automation Conference (DAC), 2011 48th ACM/EDAC/IEEE","20110811","2011","","","741","746","In recent emerging marketplace, designs for pin-constrained digital microfluidic biochips (PDMFBs) have received much attention due to the large impact on packaging and product cost. One of the major approaches, broadcast addressing, reduces the pin count by assigning a single control pin to multiple electrodes with mutually-compatible control signals. Prior works utilize this addressing scheme by minimally grouping electrode sets with non-conflict signal merging. However, merging control signals also introduces redundant actuations, which potentially cause a high power-consumption problem. Recent studies on PDMFBs have indicated that high power consumption not only decreases the product lifetime but also degrades the system reliability. Unfortunately, this power-aware design concern is still not readily available among current design automations of PDMFBs. To cope with these issues, we propose in this paper the first power-aware broadcast addressing for PDMFBs. Our algorithm simultaneously takes pin-count reduction and power-consumption minimization into consideration, thereby achieving higher integration and better design performance. Experimental results demonstrate the effectiveness of our algorithm.","0738-100x","978-1-4503-0636-2","","","http://ieeexplore.ieee.org/stamp/stamp.jsp?arnumber=5981868","Digital microfluidics;electrode addressing;power","Algorithm design and analysis;Complexity theory;Electrodes;Merging;Optical detectors;Pins;Power demand","bioMEMS;biology computing;electronic design automation;electronics packaging;lab-on-a-chip;microfluidics;minimisation;power aware computing","PDMFB;design automation;merging control signals;multiple electrodes;mutually-compatible control signals;packaging;pin-constrained digital microfluidic biochips;pin-count reduction;power-consumption minimization;product cost;product lifetime;progressive network-flow based power-aware broadcast addressing;redundant actuation;single control pin;system reliability","","4","","15","","","5-9 June 2011","","IEEE","IEEE Conference Publications"
"Interpolation-based incremental ECO synthesis for multi-error logic rectification","Kai-Fu Tang; Chi-An Wu; Po-Kai Huang; Chung-Yang Huang","Grad. Inst. of Electron. Eng., Nat. Taiwan Univ., Taipei, Taiwan","Design Automation Conference (DAC), 2011 48th ACM/EDAC/IEEE","20110811","2011","","","146","151","To cope with last-minute design bugs and specification changes, engineering change order (ECO) is usually performed toward the end of the design process. This paper proposes an automatic ECO synthesis algorithm by interpolation. In particular, we tackle the problem by a series of partial rectifications. At each step, partial rectification can reduce the functional difference between an old implementation and a new specification. Our algorithm is especially effective for multiple error circuits. Experimental results show the proposed method is far superior to the most recent work and scales well on a set of large circuits.","0738-100x","978-1-4503-0636-2","","","http://ieeexplore.ieee.org/stamp/stamp.jsp?arnumber=5981929","Logic rectification;engineering change order;interpolation;satisfiability","Algorithm design and analysis;Boolean functions;Circuit faults;Integrated circuit modeling;Interpolation;Logic gates;Runtime","integrated circuit design;interpolation;logic circuits;logic design;rectification","automatic ECO synthesis algorithm;design bugs;engineering change order;interpolation-based incremental ECO synthesis;multierror logic rectification;multiple error circuits;partial rectification","","0","","22","","","5-9 June 2011","","IEEE","IEEE Conference Publications"
"Are logic synthesis tools robust?","Puggelli, A.; Welp, T.; Kuehlmann, A.; Sangiovanni-Vincentelli, A.","Dept. of Electr. Eng. & Comput. Sci., Univ. of California - Berkeley, Berkeley, CA, USA","Design Automation Conference (DAC), 2011 48th ACM/EDAC/IEEE","20110811","2011","","","633","638","A systematic investigation is presented about the robustness of logic synthesis tools to equivalence-preserving transformations of the input Verilog file. We have developed a framework that: 1) parses Verilog behavioral models into an abstract syntax tree; 2) generates random equivalence-preserving transformations on the syntax tree, and; 3) writes the transformed design back in Verilog format. The original and the transformed Verilog descriptions are then checked for equivalence and synthesized. Results show that average (peak) improvements in area of 2:5%(11%) and length of the critical path of 4%(13%) are achievable. Indeed these figures are comparable to recent advancements in logic synthesis (achieve 4:9%(23%) 5%(24%) improvements area-wise, respectively), signaling a relevant lack of robustness in synthesis tools. This lack of robustness suggests that new synthesis algorithms should be evaluated by measuring the average improvement on several transformed files to assess their real contributions to the quality of the results.","0738-100x","978-1-4503-0636-2","","","http://ieeexplore.ieee.org/stamp/stamp.jsp?arnumber=5981984","Logic Synthesis;Robustness;Verilog","Algorithm design and analysis;Benchmark testing;Data structures;Hardware design languages;Reduced instruction set computing;Robustness;Synthesizers","hardware description languages;logic design;network synthesis","Verilog behavioral models;Verilog file;abstract syntax tree;logic synthesis tools;random equivalence-preserving transformation generation","","0","","18","","","5-9 June 2011","","IEEE","IEEE Conference Publications"
"An optimal algorithm for layer assignment of bus escape routing on PCBs","Qiang Ma; Young, E.F.Y.; Wong, M.D.F.","Dept. of Electr. & Comput. Eng., Univ. of Illinois at Urbana-Champaign, Urbana, IL, USA","Design Automation Conference (DAC), 2011 48th ACM/EDAC/IEEE","20110811","2011","","","176","181","Bus escape routing is a critical problem in modern PCB design. Due to the huge pin count and high density of the pin array, it usually requires multiple layers to route the buses without any conflict. How to assign the escape routing of buses to different layers becomes an important issue. In addition, some buses are required to be assigned on consecutive layers, which adds more difficulties to the layer assignment problem. In this paper, we propose a branch-and-bound based algorithm that optimally solves the layer assignment problem of bus escape routing. Our algorithm guarantees to produce a feasible layer assignment of the buses with a minimum number of layers. We applied our algorithm on industrial data and the experimental results validate our approach.","0738-100x","978-1-4503-0636-2","","","http://ieeexplore.ieee.org/stamp/stamp.jsp?arnumber=5981933","Branch-and-bound;Escape routing;Optimal layer assignment","Algorithm design and analysis;Arrays;Clocks;Pins;Routing;Search problems;Upper bound","network routing;printed circuit design","PCB design;branch-and-bound;bus escape routing;layer assignment;optimal algorithm;pin array;pin count","","1","","9","","","5-9 June 2011","","IEEE","IEEE Conference Publications"
"Efficient SRAM failure rate prediction via Gibbs sampling","Changdao Dong; Xin Li","Electr. & Comput. Eng. Dept., Carnegie Mellon Univ., Pittsburgh, PA, USA","Design Automation Conference (DAC), 2011 48th ACM/EDAC/IEEE","20110811","2011","","","200","205","Statistical analysis of SRAM has emerged as a challenging issue because the failure rate of SRAM cells is extremely small. In this paper, we develop an efficient importance sampling algorithm to capture the rare failure event of SRAM cells. In particular, we adapt the Gibbs sampling technique from the statistics community to find the optimal probability distribution for importance sampling with minimum computational cost (i.e., a small number of transistor-level simulations). The proposed Gibbs sampling method applies an integrated optimization engine to adaptively explore the failure region by sampling a sequence of one-dimensional probability distributions. Several implementation issues such as one-dimensional random sampling and starting point selection are carefully studied to make the Gibbs sampling method efficient and accurate for SRAM failure rate prediction. Our experimental results of a commercial 65nm SRAM cell demonstrate that the proposed Gibbs sampling method achieves 3-10× runtime speed-up over other state-of-the-art techniques without surrendering any accuracy.","0738-100x","978-1-4503-0636-2","","","http://ieeexplore.ieee.org/stamp/stamp.jsp?arnumber=5981754","Integrated Circuit;Memory;Process Variation","Algorithm design and analysis;Gaussian distribution;Monte Carlo methods;Optimization;Random access memory;Random variables;Sampling methods","SRAM chips;integrated circuit design;probability;statistical analysis","1D random sampling;Gibbs sampling method;SRAM cell;SRAM cells;SRAM design;SRAM failure rate prediction;SRAM statistical analysis;integrated optimization engine;optimal probability distribution;starting point selection;statistics community;transistor-level simulations","","2","","15","","","5-9 June 2011","","IEEE","IEEE Conference Publications"
"Plugging versus logging: A new approach to write buffer management for solid-state disks","Li-Pin Chang; You-Chiuan Su","Dept. of Comput. Sci., Nat. Chiao-Tung Univ., Hsinchu, Taiwan","Design Automation Conference (DAC), 2011 48th ACM/EDAC/IEEE","20110811","2011","","","23","28","Using device write buffers is a promising technique to improve the write performance of solid-state disks. The write buffer not only reduces the write traffic to the flash but also produces large and sequential write bursts to the underlying flash translation layer. This study proposes a new buffer design consisting of a replacement policy and a write-back policy. This buffer monitors how the host workload stresses the flash translation layer upon garbage collection, and dynamically adjusts its replacement and write-back strategies for a good balance between write sequentiality and traffic reduction. Experimental results show that the proposed buffer design outperformed existing approaches by up to 20% under various workloads and flash translation algorithms.","0738-100x","978-1-4503-0636-2","","","http://ieeexplore.ieee.org/stamp/stamp.jsp?arnumber=5981917","Solid-state disks;flash memory;write buffer","Algorithm design and analysis;Equations;Mathematical model;Performance evaluation;Plugs;Switches;Writing","buffer storage","flash translation layer;garbage collection;replacement policy;solid-state disks;write buffer management;write-back policy","","0","","8","","","5-9 June 2011","","IEEE","IEEE Conference Publications"
"Efficient incremental analysis of on-chip power grid via sparse approximation","Pei Sun; Xin Li; Ming-Yuan Ting","ECE Dept., Carnegie Mellon Univ., Pittsburgh, PA, USA","Design Automation Conference (DAC), 2011 48th ACM/EDAC/IEEE","20110811","2011","","","676","681","In this paper, a new sparse approximation technique is proposed for incremental power grid analysis. Our proposed method is motivated by the observation that when a power grid network is locally updated during circuit design, its response changes locally and, hence, the incremental “change” of the power grid voltage is almost zero at many internal nodes, resulting in a unique sparse pattern. An efficient Orthogonal Matching Pursuit (OMP) algorithm is adopted to solve the proposed sparse approximation problem. In addition, several numerical techniques are proposed to improve the numerical stability of the proposed solver, while simultaneously maintaining its high efficiency. Several industrial circuit examples demonstrate that when applied to incremental power grid analysis, our proposed approach achieves up to 130× runtime speed-up over the traditional Algebraic Multi-Grid (AMG) method, without surrendering any accuracy.","0738-100x","978-1-4503-0636-2","","","http://ieeexplore.ieee.org/stamp/stamp.jsp?arnumber=5981988","Incremental Analysis;Integrated Circuit;Power Grid","Algorithm design and analysis;Equations;Fitting;Matching pursuit algorithms;Mathematical model;Matrix decomposition;Power grids","integrated circuit design;iterative methods;power integrated circuits;sparse matrices","algebraic multi-grid method;incremental analysis;numerical stability;on-chip power grid;orthogonal matching pursuit algorithm;sparse approximation","","0","","21","","","5-9 June 2011","","IEEE","IEEE Conference Publications"
"Optimal multi-domain clock skew scheduling","Li Li; Yinghai Lu; Hai Zhou","","Design Automation Conference (DAC), 2011 48th ACM/EDAC/IEEE","20110811","2011","","","152","157","Clock skew scheduling is an effective technique to improve the performance of sequential circuits. However, with process variations, it becomes more difficult to implement a large number of clock delays in a precise manner. Multi-domain clock skew scheduling is one way to overcome this limitation. In this paper, we prove the NP-completeness of multi-domain clock scheduling problem, and design a practical optimal algorithm to solve it. Given the domain number, we bound the number of all possible skew assignments and develop an optimal algorithm with efficient pruning techniques. Experiment results on ISCAS89 sequential benchmarks show the optimality and efficiency of our method compared with existing approaches.","0738-100x","978-1-4503-0636-2","","","http://ieeexplore.ieee.org/stamp/stamp.jsp?arnumber=5981710","Clock Skew;Multi-Domain;Optimization","Algorithm design and analysis;Clocks;Clustering algorithms;Delay;Heuristic algorithms;Registers;Sequential circuits","clocks;computational complexity;logic design;network synthesis;scheduling;sequential circuits","NP-completeness;clock delays;optimal multidomain clock skew scheduling;performance improvement;process variations;pruning techniques;sequential circuits","","0","","15","","","5-9 June 2011","","IEEE","IEEE Conference Publications"
"Applications driving 3D integration and 1 corresponding manufacturing challenges","Topaloglu, R.","GLOBALFOUNDRIES, Milpitas, CA, USA","Design Automation Conference (DAC), 2011 48th ACM/EDAC/IEEE","20110811","2011","","","220","223","Three dimensional (3D) semiconductor circuit integration has been an active area of research recently. Part of the driving force behind this interest has been applications. In this paper, we identify applications that drive 3D integration and point out the challenges they bring. In particular, we focus on through silicon via-based (TSV-based) 3D integration. TSV-based 3D integration opens up a new genre, and new opportunities for semiconductor integrated circuits. After a brief overview of TSV-based 3D technology overview, we identify driver applications that are dominant in this transition. We then point out challenges in the manufacturing area, i.e., thermal, reliability, EDA, cost, and test.","0738-100x","978-1-4503-0636-2","","","http://ieeexplore.ieee.org/stamp/stamp.jsp?arnumber=5981938","3D;MEMS;RF;applications;architecture;bonding;challenges EDA;cost;integration;manufacturing;optical;reliability;technology;testing;thermal","Algorithm design and analysis;Bonding;CMOS integrated circuits;Face;Reliability;Silicon;Three dimensional displays","electronic design automation;integrated circuit reliability;three-dimensional integrated circuits","EDA;TSV-based 3D integration;driver applications;driving force;manufacturing challenges;reliability;semiconductor integrated circuits;three dimensional semiconductor circuit integration;through silicon via","","1","","13","","","5-9 June 2011","","IEEE","IEEE Conference Publications"
"EFFEX: An embedded processor for computer vision based feature extraction","Clemons, J.; Jones, A.; Perricone, R.; Savarese, S.; Austin, T.","Dept. of Electr. Eng. & Comput. Sci., Univ. of Michigan, Ann Arbor, MI, USA","Design Automation Conference (DAC), 2011 48th ACM/EDAC/IEEE","20110811","2011","","","1020","1025","The deployment of computer vision algorithms in mobile applications is growing at a rapid pace. A primary component of the computer vision software pipeline is feature extraction, which identifies and encodes relevant image features. We present an embedded heterogeneous multicore design named EFFEX that incorporates novel functional units and memory architecture support, making it capable of increasing mobile vision performance while balancing power and area. We demonstrate this architecture running three common feature extraction algorithms, and show that it is capable of providing significant speedups at low cost. Our simulations show a speedup of as much as 14× for feature extraction with a decrease in energy of 40× for memory accesses.","0738-100x","978-1-4503-0636-2","","","http://ieeexplore.ieee.org/stamp/stamp.jsp?arnumber=5982022","EFFEX;Feature extraction;Heterogenous Architecture","Algorithm design and analysis;Computer vision;Feature extraction;Mobile communication;Multicore processing;Random access memory","computer vision;feature extraction;memory architecture;mobile computing;multiprocessing systems","EFFEX;computer vision software pipeline algorithm;embedded heterogeneous multicore processor;feature extraction algorithms;memory architecture;mobile applications;mobile vision performance","","4","","26","","","5-9 June 2011","","IEEE","IEEE Conference Publications"
"Global convergence analysis of mixed-signal systems","Sangho Youn; Jaeha Kim; Horowitz, M.","Inter-Univ. Semicond. Res. Center, Seoul Nat. Univ., Seoul, South Korea","Design Automation Conference (DAC), 2011 48th ACM/EDAC/IEEE","20110811","2011","","","498","503","This paper proposes two practical approaches to address global convergence failures, commonly encountered in mixed-signal systems in which analog and digital components closely interact. That is, a nominally-working system may fail intermittently depending on its initial conditions upon start-up. The first approach uses a data clustering analysis and verifies global convergence with randomly-selected pilot simulations. The second approach adopts the practice of representing indeterminate states with X by defining its equivalent concept for analog based on entropy. With oscillator and phase-locked loop examples, it is demonstrated that the proposed approaches can effectively detect the failures and guide designers where to add more resets to prevent them.","0738-100x","978-1-4503-0636-2","","","http://ieeexplore.ieee.org/stamp/stamp.jsp?arnumber=5981971","Analog/Mixed-Signal Systems;Formal Verification;Global Convergence Analysis","Algorithm design and analysis;Clustering algorithms;Convergence;Entropy;Oscillators;Phase frequency detector;Phase locked loops","mixed analogue-digital integrated circuits;oscillators;phase locked loops;statistical analysis","data clustering analysis;global convergence analysis;mixed-signal systems;oscillator;phase-locked loop;randomly-selected pilot simulations","","0","","10","","","5-9 June 2011","","IEEE","IEEE Conference Publications"
"Shared reconfigurable fabric for multi-core customization","Liang Chen; Mitra, T.","Dept. of Comput. Sci., Nat. Univ. of Singapore, Singapore, Singapore","Design Automation Conference (DAC), 2011 48th ACM/EDAC/IEEE","20110811","2011","","","830","835","Processor customization in the form of application specific instructions can provide significant power and performance boost to an embedded application while maintaining high flexibility. The emergence of multi-core architectures opens up the possibility of creating an application-specific heterogeneous computing platform by customizing a set of homogeneous cores. We propose a multi-core architecture where the cores share a reconfigurable fabric that accommodates the custom instructions. We develop an efficient algorithm that exploits this shared fabric through customization and runtime reconfiguration to minimize the execution time of multi-threaded applications. Experimental results reveal that shared reconfigurable fabric helps applications achieve substantial speedup compared to per-core private fabrics.","0738-100x","978-1-4503-0636-2","","","http://ieeexplore.ieee.org/stamp/stamp.jsp?arnumber=5982003","Shared reconfigurable logic;multi-core","Algorithm design and analysis;Fabrics;Instruction sets;Multicore processing;Partitioning algorithms;Radio frequency","microprocessor chips;multiprocessing systems;parallel architectures;reconfigurable architectures;system-on-chip","MPSoC;application-specific heterogeneous computing platform;multicore architectures;multicore chip;multicore customization;multiprocessor system-on- chip;parallel architectures;processor customization;runtime reconfiguration;shared reconfigurable fabric","","0","","10","","","5-9 June 2011","","IEEE","IEEE Conference Publications"
"Dynamic binary translation to a reconfigurable target for on-the-fly acceleration","Kinsman, P.; Nicolici, N.","McMaster Univ., Hamilton, ON, Canada","Design Automation Conference (DAC), 2011 48th ACM/EDAC/IEEE","20110811","2011","","","286","287","Dynamic binary translation has been extensively used in porting applications from one platform to another at runtime. At the same time, reconfigurable computing has been commonly employed for hardware acceleration for compute-intensive applications. In this paper we attempt to understand the technical challenges of applying dynamic binary translation to a reconfigurable computing environment, when the translation focus is on-the-fly acceleration.","0738-100x","978-1-4503-0636-2","","","http://ieeexplore.ieee.org/stamp/stamp.jsp?arnumber=5981762","Dynamic Binary Translation;On-the-fly Acceleration","Acceleration;Algorithm design and analysis;Computer architecture;Field programmable gate arrays;Heuristic algorithms;Pattern matching;Real time systems","reconfigurable architectures;software portability","compute-intensive applications;dynamic binary translation;hardware acceleration;on-the-fly acceleration;reconfigurable computing","","0","","2","","","5-9 June 2011","","IEEE","IEEE Conference Publications"
"Virtualization of heterogeneous machines","Auerbach, J.; Bacon, D.F.; Cheng, P.; Rabbah, R.; Shukla, S.","","Design Automation Conference (DAC), 2011 48th ACM/EDAC/IEEE","20110811","2011","","","890","894","Lime is a new Java-compatible and object-oriented language designed to make programming of reconfigurable hardware significantly more accessible to skilled software developers. Lime programs may run either in software (via Java bytecodes) or in hardware (via behavioral and logic synthesis). This paper illustrates the salient synthesis-oriented features of the language using a photomosaic algorithm with inherent bit, pipeline, and data parallelism. The result is a virtual machine abstraction that extends across a heterogeneous architecture comprising a CPU, FPGA, and other computational structures.","0738-100x","978-1-4503-0636-2","","","http://ieeexplore.ieee.org/stamp/stamp.jsp?arnumber=5982009","FPGA;functional programming;high level synthesis;object oriented;reconfigurable architecture;streaming;value type","Field programmable gate arrays;Hardware;Hardware design languages;Libraries;Parallel processing;Reactive power;Tiles","Java;field programmable gate arrays;reconfigurable architectures;virtual machines","CPU;FPGA;Java-compatible;Lime programs;heterogeneous machine virtualization;object-oriented language;photomosaic algorithm;reconfigurable hardware;virtual machine abstraction","","0","","8","","","5-9 June 2011","","IEEE","IEEE Conference Publications"
