"http://ieeexplore.ieee.org/search/searchresult.jsp?bulkSetSize=2000&refinements%3D4294967269%26matchBoolean%3Dtrue%26searchField%3DSearch_All%26queryText%3D%28%28Design+Automation+Conference+.LB.DAC.RB.%29+AND+1996%29",2015/06/23 14:39:58
"Global stacking for analog circuits","Arsintescu, B.G.; Spanoche, S.A.","Delft Univ. of Technol., Netherlands","Design Automation Conference, 1996, with EURO-VHDL '96 and Exhibition, Proceedings EURO-DAC '96, European","20020806","1996","","","392","397","A flexible and efficient method for analog circuit partitioning and transistor stacking is presented. The method is based on a novel algorithm dealing with analog specific constraints and on a set of heuristics for stack generation using a pattern database. An enhanced set of stacks is obtained with respect to placement constraints. Experimental results show the effectiveness of the methods described","","0-8186-7573-X","","10.1109/EURDAC.1996.558234","http://ieeexplore.ieee.org/stamp/stamp.jsp?arnumber=558234","","Analog circuits;CMOS analog integrated circuits;Data mining;Merging;Mesh generation;Minimization methods;Mirrors;Parasitic capacitance;Partitioning algorithms;Stacking","MOS analogue integrated circuits;MOSFET;circuit CAD;transistors","analog circuit partitioning;analog specific constraints;global stacking;heuristics;novel algorithm;pattern database;placement constraints;stack generation;transistor stacking","","2","1","10","","","16-20 Sep 1996","16 Sep 1996-20 Sep 1996","IEEE","IEEE Conference Publications"
"Specification and management of timing constraints in behavioral VHDL","Curatelli, F.; Mangeruca, L.; Chirico, M.","Microelectron. Lab., Genoa Univ., Italy","Design Automation Conference, 1996, with EURO-VHDL '96 and Exhibition, Proceedings EURO-DAC '96, European","20020806","1996","","","522","527","In this paper a suitable way to specify and manage timing constraints in behavioral VHDL is described. The problem of timing semantics coherency is addressed and a suitable set of procedures is defined to add timing constraint specification in behavioral VHDL for system synthesis. Then, a proper semantics is described which is able to provide a powerful and flexible management of timing constraints","","0-8186-7573-X","","10.1109/EURDAC.1996.558253","http://ieeexplore.ieee.org/stamp/stamp.jsp?arnumber=558253","","Control system synthesis;Energy management;Hardware;Power system management;Process control;Real time systems;Signal processing;Signal synthesis;Specification languages;Timing","formal specification;hardware description languages;high level synthesis;logic CAD;real-time systems;timing","behavioral VHDL;system synthesis;timing constraint specification;timing constraints;timing semantics coherency","","1","1","17","","","16-20 Sep 1996","16 Sep 1996-20 Sep 1996","IEEE","IEEE Conference Publications"
"Efficient random testing with global weights","Kunzmann, A.","Forschungszentrum Inf., Germany","Design Automation Conference, 1996, with EURO-VHDL '96 and Exhibition, Proceedings EURO-DAC '96, European","20020806","1996","","","227","232","This paper describes a new and highly efficient approach for weighted random pattern generation. In contrast to the state-of-the-art approaches, where input specific weights are computed, the proposed method is based on the computation of global weights. This set of a very few weights (e.g., 4 or 8) is pattern oriented and therefore, with each weight the generation of the related random patterns is uniquely specified. Starting with a deterministic test pattern set and the inherent pattern specific weights, columns or rows can be inverted such that the initial weights are maximized in order to minimize the number of random patterns. Our experiments with the prototype system POWER-TEST (Pattern Oriented WEighted Random TESTing) show that very high fault coverage can be achieved with low computation and implementation effort at low self-test hardware costs","","0-8186-7573-X","","10.1109/EURDAC.1996.558209","http://ieeexplore.ieee.org/stamp/stamp.jsp?arnumber=558209","","Automatic testing;Built-in self-test;Circuit faults;Circuit testing;Costs;Hardware;Prototypes;System testing;Test pattern generators;Wire","logic testing;random number generation","POWER-TEST;Pattern Oriented WEighted Random TESTing;deterministic test pattern set;fault coverage;global weights;inherent pattern specific weights;random testing;weighted random pattern generation","","2","1","17","","","16-20 Sep 1996","16 Sep 1996-20 Sep 1996","IEEE","IEEE Conference Publications"
"Mapping statechart models onto an FPGA-based ASIP architecture","Buchenrieder, Klaus; Pyttel, A.; Veith, C.","Corp. Res. & Dev., Siemens AG, Munich, Germany","Design Automation Conference, 1996, with EURO-VHDL '96 and Exhibition, Proceedings EURO-DAC '96, European","20020806","1996","","","184","189","In this paper, we describe a system to map hardware-software systems specified with statechart models on an ASIP architecture based on FPGAs. The architecture consists of a reusable CPU core with enhancements to execute the behavior of statecharts correctly. Our codesign system generates an application-specific hardware control block, an application-specific set of registers, and an instruction stream. The instruction stream consists of a static set of core instructions, and a set of custom instructions for performance enhancements. In contrast to previous approaches, the presented method supports extended statecharts. The system also assists designers during space/time tradeoff optimizations. The benefits of the approach are demonstrated with an industrial control application comparing two different timing schemes","","0-8186-7573-X","","10.1109/EURDAC.1996.558203","http://ieeexplore.ieee.org/stamp/stamp.jsp?arnumber=558203","","Application specific processors;Computer languages;Instruction sets;Kernel;Object oriented databases;Object oriented modeling;Operating systems;Process control;Real time systems;Timing","application specific integrated circuits;field programmable gate arrays;logic CAD;multiprocessing systems","ASIP architecture;application-specific hardware control;codesign system;space/time tradeoff optimizations;statechart models","","4","1","19","","","16-20 Sep 1996","16 Sep 1996-20 Sep 1996","IEEE","IEEE Conference Publications"
"MORE: an alternative implementation of BDD packages by multi-operand synthesis","Hett, A.; Drechsler, R.; Becker, B.","Inst. of Comput. Sci., Albert-Ludwigs-Univ., Freiburg, Germany","Design Automation Conference, 1996, with EURO-VHDL '96 and Exhibition, Proceedings EURO-DAC '96, European","20020806","1996","","","164","169","In this paper we present a new approach for the realization of a BDD package. This approach does not depend on recursive synthesis operations, i.e. the ternary If-Then-Else-operator (ITE), to perform manipulations of Boolean functions; instead our basic operation MORE is based on exchanges of neighbouring variables and existential quantification. It is capable of combining an arbitrary number of Boolean functions in parallel. We discuss the difference between MORE and ITE and give experimental results to show the advantages of our implementation approach with respect to size and runtime","","0-8186-7573-X","","10.1109/EURDAC.1996.558200","http://ieeexplore.ieee.org/stamp/stamp.jsp?arnumber=558200","","Binary decision diagrams;Boolean functions;Circuit synthesis;Packaging","Boolean functions;circuit CAD","BDD packages;Boolean functions;MORE;existential quantification;multi-operand synthesis;neighbouring variables","","13","1","16","","","16-20 Sep 1996","16 Sep 1996-20 Sep 1996","IEEE","IEEE Conference Publications"
"Hardware/software partitioning of VHDL system specifications","Eles, P.; Zebo Peng; Kuchcinski, K.; Doboli, A.","Dept. of Comput. & Inf. Sci., Linkoping Univ., Sweden","Design Automation Conference, 1996, with EURO-VHDL '96 and Exhibition, Proceedings EURO-DAC '96, European","20020806","1996","","","434","439","This paper presents an approach far system level specification and hardware/software partitioning with VHDL. The implications of using VHDL as a specification language are discussed and a message passing mechanism is proposed for process interaction. We define the metric values for partitioning and develop a cost function that guides our heuristics towards performance optimization under hardware and software cost constraints. Experimental results are presented","","0-8186-7573-X","","10.1109/EURDAC.1996.558240","http://ieeexplore.ieee.org/stamp/stamp.jsp?arnumber=558240","","Communication system software;Coprocessors;Costs;Hardware;High level synthesis;Microprocessors;Partitioning algorithms;Signal synthesis;Simulated annealing;Specification languages","circuit layout CAD;hardware description languages;high level synthesis;message passing;simulated annealing;systems analysis","VHDL system specifications;cost function;hardware/software partitioning;message passing mechanism;metric values;partitioning;performance optimization;process interaction;specification language;system level specification","","4","1","18","","","16-20 Sep 1996","16 Sep 1996-20 Sep 1996","IEEE","IEEE Conference Publications"
"Instruction selection for embedded DSPs with complex instructions","Leupers, R.; Marwedel, P.","Dept. of Comput. Sci., Dortmund Univ., Germany","Design Automation Conference, 1996, with EURO-VHDL '96 and Exhibition, Proceedings EURO-DAC '96, European","20020806","1996","","","200","205","We address the problem of instruction selection in code generation for embedded digital signal processors. Recent work has shown that this task can be efficiently solved by tree covering with dynamic programming, even in combination with the task of register allocation. However, performing instruction selection by tree covering only does not exploit available instruction level parallelism, for instance in form of multiply-accumulate instructions or parallel data moves. In this paper we investigate how such complex instructions may affect detection of optimal tree covers, and we present a two-phase scheme for instruction selection which exploits available instruction-level parallelism. At the expense of higher compilation time, this technique may significantly increase the code quality compared to previous work, which is demonstrated for a widespread DSP","","0-8186-7573-X","","10.1109/EURDAC.1996.558205","http://ieeexplore.ieee.org/stamp/stamp.jsp?arnumber=558205","","Compaction;Costs;Digital signal processing;Dynamic programming;Embedded computing;Embedded system;Pattern matching;Processor scheduling;Read only memory;Registers","digital signal processing chips;dynamic programming;instruction sets;real-time systems;resource allocation","code generation;complex instructions;embedded DSPs;embedded digital signal processors;instruction selection;instruction-level parallelism;optimal tree covers;register allocation;tree covering","","10","","12","","","16-20 Sep 1996","16 Sep 1996-20 Sep 1996","IEEE","IEEE Conference Publications"
"New approach in gate-level glitch modelling","Rabe, D.; Nebel, W.","Dept. of Comput. Sci., Carl von Ossietzky Univ. Oldenburg, Germany","Design Automation Conference, 1996, with EURO-VHDL '96 and Exhibition, Proceedings EURO-DAC '96, European","20020806","1996","","","66","71","An enhanced gate-level glitch model for logic simulation is presented. This new approach can be used to enhance logic simulation accuracy and power estimation at little additional computation costs. The simulation algorithm is compatible with common event driven simulation models for glitch-free cases. Only if a possible glitch is detected the simulation is modified by our model. The model is based on common timing characterization data and a few additional constant values. The features of the model an enhanced scheduling of glitch events and prediction of glitch peak voltages, which are essential for precise power estimation","","0-8186-7573-X","","10.1109/EURDAC.1996.558079","http://ieeexplore.ieee.org/stamp/stamp.jsp?arnumber=558079","","Circuits;Delay;Dynamic scheduling;Energy consumption;Equations;Logic;Predictive models;Semiconductor device modeling;Threshold voltage;Variable structure systems","circuit analysis computing;digital simulation;logic CAD;logic circuits","accuracy;common timing characterization;event driven simulation;gate-level glitch model;logic simulation;power estimation;precise power estimation","","10","","12","","","16-20 Sep 1996","16 Sep 1996-20 Sep 1996","IEEE","IEEE Conference Publications"
"A refinement calculus for VHDL","Breuer, P.T.; Madrid, N.M.; Kloos, C.D.; Marin, A.; Sanchez, L.","ETSI Telecomunicacion, Univ. Politecnica de Madrid, Spain","Design Automation Conference, 1996, with EURO-VHDL '96 and Exhibition, Proceedings EURO-DAC '96, European","20020806","1996","","","482","487","A refinement calculus for the specification of real-time systems and their refinement to a VHDL behavioural description is set out here. The specification format is a logical triple with the look of a Z or VDM schema. Choices from a short menu of refinement operations gradually convert an initial specification to VHDL code through a series of mixed mode intermediates. The calculus is complete in the sense that if there is a code of the VHDL subset considered here (unit-delay waits and signal assignments but no delta delays) satisfying the specification, then it can be obtained by applying some sequence of the refinement operations. The result is “correct by construction”","","0-8186-7573-X","","10.1109/EURDAC.1996.558247","http://ieeexplore.ieee.org/stamp/stamp.jsp?arnumber=558247","","Calculus;Concrete;Delay;Formal languages;Hardware;Oscillators;Signal processing;Specification languages","formal specification;hardware description languages;real-time systems;refinement calculus","VDM schema;VHDL behavioural description;Z schema;delta delays;mixed mode intermediates;real-time systems;refinement calculus;refinement operations;signal assignments;specification format;unit-delay waits","","0","","11","","","16-20 Sep 1996","16 Sep 1996-20 Sep 1996","IEEE","IEEE Conference Publications"
"A practical clock router that accounts for the capacitance derived from parallel and cross segments","Seki, M.; Kobayashi, S.; Kato, K.; Tsurusaki, K.","Semicond. Integrated Circuit Div., Hitachi Ltd., Tokyo, Japan","Design Automation Conference, 1996, with EURO-VHDL '96 and Exhibition, Proceedings EURO-DAC '96, European","20020806","1996","","","362","367","We propose a practical clock router that takes the capacitance caused by parallel and cross segments into account. In a conventional dock router that doesn't consider this capacitance, clock skew calculated by SPICE after layout was 220-650 ps, which was 20-100 times greater than the reported skew of the router. In our router, skew in SPICE was reduced to 20-240 ps and only 2-4 times greater than our router's report","","0-8186-7573-X","","10.1109/EURDAC.1996.558230","http://ieeexplore.ieee.org/stamp/stamp.jsp?arnumber=558230","","Capacitance;Clocks;Crosstalk;Delay;Frequency;Large scale integration;Logic;Minimization methods;Routing;SPICE","SPICE;capacitance;clocks;large scale integration","SPICE;capacitance;cross segments;practical clock router;skew","","0","1","13","","","16-20 Sep 1996","16 Sep 1996-20 Sep 1996","IEEE","IEEE Conference Publications"
"Decomposed symbolic forward traversals of large finite state machines","Quer, S.; Cabodi, G.; Camurati, P.","Dipartimento di Autom. e Inf., Politecnico di Torino, Italy","Design Automation Conference, 1996, with EURO-VHDL '96 and Exhibition, Proceedings EURO-DAC '96, European","20020806","1996","","","170","175","BDD-based symbolic traversals are the state-of-the-art technique for reachability analysis of finite state machines. They are currently limited to medium-small circuits for two reasons: BDD peak size during image computation and BDD explosion for state space representation. Starting from these limits, this paper presents a technique that decomposes the search space decreasing the BDD peak size and the number of page faults during image computation. Results of intermediate computations and large BDDs are efficiently stored in the secondary memory. A decomposed traversal that allows exact explorations of state spaces is obtained. Experimental results show that this approach is particularly effective on the larger MCNC, ISCAS'89, and ISCAS'89-addendum circuits","","0-8186-7573-X","","10.1109/EURDAC.1996.558201","http://ieeexplore.ieee.org/stamp/stamp.jsp?arnumber=558201","","Automata;Binary decision diagrams;Boolean functions;Central Processing Unit;Circuit faults;Computational efficiency;Data structures;Image coding;Reachability analysis;State-space methods","finite state machines;reachability analysis","BDD-based symbolic traversals;decomposed symbolic forward traversals;finite state machines;image computation;large finite state machines;reachability analysis;search space;state space representation","","3","1","8","","","16-20 Sep 1996","16 Sep 1996-20 Sep 1996","IEEE","IEEE Conference Publications"
"A new concept for accurate modeling of VLSI interconnections and its application for timing simulation","Wunder, B.; Lehmann, G.; Muller-Glaser, K.D.","Inst. fur Tech. der Inf., Karlsruhe Univ., Germany","Design Automation Conference, 1996, with EURO-VHDL '96 and Exhibition, Proceedings EURO-DAC '96, European","20020806","1996","","","72","77","This paper presents a new concept for accurately modeling the timing behavior of VLSI interconnections using frequency domain methods and taking into consideration distributed parasitics as well as lumped elements and contact holes. A piecewise linear signal representation is used to catch the waveform dependencies of submicron structures. The models are applied in an analysis tool for clock trees and in a concept for accurate post-layout timing simulation","","0-8186-7573-X","","10.1109/EURDAC.1996.558186","http://ieeexplore.ieee.org/stamp/stamp.jsp?arnumber=558186","","Clocks;Delay estimation;Frequency domain analysis;Integrated circuit interconnections;Logic;Parasitic capacitance;Propagation delay;Switching circuits;Timing;Very large scale integration","VLSI;circuit CAD;circuit analysis computing;integrated circuit interconnections;timing","VLSI interconnections;distributed parasitics;frequency domain methods;piecewise linear signal representation;post-layout timing simulation;timing simulation","","0","1","16","","","16-20 Sep 1996","16 Sep 1996-20 Sep 1996","IEEE","IEEE Conference Publications"
"Timing optimization by an improved redundancy addition and removal technique","Entrena, L.A.; Espejo, J.A.; Olias, E.; Uceda, J.","Area de Tecnologia Electron., Univ. Carolos III de Madrid, Spain","Design Automation Conference, 1996, with EURO-VHDL '96 and Exhibition, Proceedings EURO-DAC '96, European","20020806","1996","","","342","347","Redundancy addition and removal (RAR) uses automatic test pattern generation (ATPG) techniques to identify logic optimization transforms. It has been applied successfully to combinational and sequential logic optimization and to layout driven logic synthesis for FPGAs. We present an improved RAR technique that allows to one to identify new types of optimization transforms and it is more efficient because it reduces the number of ATPG runs required. Also, we apply the RAR method to timing optimization. The experimental results show that this improved RAR technique produces significant timing optimization with very little area cost","","0-8186-7573-X","","10.1109/EURDAC.1996.558227","http://ieeexplore.ieee.org/stamp/stamp.jsp?arnumber=558227","","Automatic logic units;Automatic test pattern generation;Automatic testing;Circuit faults;Circuit testing;Logic testing;Optimization methods;Redundancy;Timing;Wire","automatic test software;field programmable gate arrays;logic CAD;logic testing","ATPG runs;FPGAs;automatic test pattern generation;improved RAR technique;layout driven logic synthesis;logic optimization transforms;optimization transforms;redundancy addition and removal technique;timing optimization","","14","","12","","","16-20 Sep 1996","16 Sep 1996-20 Sep 1996","IEEE","IEEE Conference Publications"
"Storage optimization by replacing some flip-flops with latches","Wu, A.C.-H.; Youn-Long Lin","Dept. of Comput. Sci., Tsing Hua Univ., Hsin-Chu, Taiwan","Design Automation Conference, 1996, with EURO-VHDL '96 and Exhibition, Proceedings EURO-DAC '96, European","20020806","1996","","","296","301","Conventionally, when a synchronous sequential circuit is synthesized, storage units are implemented in either edge-triggered flip-flops or level-sensitive latches, but not both, depending on the clocking scheme (one- or two-phase) used. We propose that, in the former case, some of the flip-flops can be replaced with latches. Since a latch is generally smaller, faster and less power-consuming than a flip-flop, this replacement leads to improvements in circuit area, performance and power consumption. Whether a flip-flop can be replaced with a latch depends on not only its structural context but also its temporal behavior. We first present conditions under which a straightforward replacement can be made; then, we propose two retiming-based transformations that increase the number of replaceable flip-flops. We have implemented the proposed idea in a software called FF2Latch. Experimental results on a set of control-dominated circuits from the high-level synthesis benchmark set show that a large number of the flip-flops can be replaced with latches. Up to 22% reduction in the circuit area and up to 73% reduction in the power consumption have been achieved","","0-8186-7573-X","","10.1109/EURDAC.1996.558220","http://ieeexplore.ieee.org/stamp/stamp.jsp?arnumber=558220","","Automatic control;Circuit synthesis;Clocks;Energy consumption;Flip-flops;High level synthesis;Latches;Network synthesis;Synthesizers;Timing","circuit optimisation;flip-flops;high level synthesis;logic CAD;sequential circuits;storage units;timing","FF2Latch;circuit area;circuit optimization;circuit performance;clocking scheme;control-dominated circuits;edge-triggered flip-flops;flip-flops;high-level synthesis;latches;level-sensitive latches;power consumption;storage optimization;synchronous sequential circuit synthesis","","3","3","19","","","16-20 Sep 1996","16 Sep 1996-20 Sep 1996","IEEE","IEEE Conference Publications"
"Compilation of optimized OBDD-algorithms","Horeth, S.","Dept. of Electr. Eng., Tech. Univ. Darmstadt, Germany","Design Automation Conference, 1996, with EURO-VHDL '96 and Exhibition, Proceedings EURO-DAC '96, European","20020806","1996","","","152","157","According to Bryant there exist basically two OBDD construction methods, namely Apply- and Compose-based approaches. In this paper we describe a compilation method that generates an optimized Apply-based OBDD-algorithm from a given combinational circuit description. The method is particularly useful in library-based synthesis- and verification environments. We also present a concise, machine independent measure for the efficiency of OBDD-construction methods. Experiments with our new method indicate a speedup of up to a factor 19 in the construction time for OBDDs while the maximum memory requirements are typically slightly smaller in comparison to conventional approaches","","0-8186-7573-X","","10.1109/EURDAC.1996.558198","http://ieeexplore.ieee.org/stamp/stamp.jsp?arnumber=558198","","Assembly;Circuit synthesis;Combinational circuits;Input variables;Microprocessors;Registers;Size measurement;Tail;Time measurement;Tree data structures","circuit layout CAD;formal verification","Apply-based approach;Compose-based approach;combinational circuit description;compilation method;library-based synthesis;memory requirements;optimized OBDD-algorithms;verification environments","","1","","21","","","16-20 Sep 1996","16 Sep 1996-20 Sep 1996","IEEE","IEEE Conference Publications"
"The maximal VHDL subset with a cycle-level abstraction","Barker, W.C.; Newton, A.R.","Dept. of Electr. Eng. & Comput. Sci., California Univ., Berkeley, CA, USA","Design Automation Conference, 1996, with EURO-VHDL '96 and Exhibition, Proceedings EURO-DAC '96, European","20020806","1996","","","470","475","The maximal VHDL subset with a cycle-level abstraction is defined. This subset requires that the description have three semantic properties: responsiveness modularity and causality, bur full VHDL is neither modular nor causal. Synchronous VHDL is the responsive, modular and causal subset of VHDL. The compiler uses modularity-checking and causality-checking to identify admissible programs","","0-8186-7573-X","","10.1109/EURDAC.1996.558245","http://ieeexplore.ieee.org/stamp/stamp.jsp?arnumber=558245","","Automata;Computational modeling;Guidelines;Proposals;Tellurium","finite state machines;hardware description languages","admissible programs;causality-checking;compiler;cycle-level abstraction;maximal VHDL subset;modularity-checking;responsiveness modularity;semantic properties","","0","","28","","","16-20 Sep 1996","16 Sep 1996-20 Sep 1996","IEEE","IEEE Conference Publications"
