"http://ieeexplore.ieee.org/search/searchresult.jsp?bulkSetSize=2000&refinements%3D4294967269%26matchBoolean%3Dtrue%26searchField%3DSearch_All%26queryText%3D%28%28Design+Automation+Conference+.LB.DAC.RB.%29+AND+1996%29",2015/06/23 14:39:58
"MILP based task mapping for heterogeneous multiprocessor systems","Bender, A.","Fac. for Math. & Comput. Sci., Passau Univ., Germany","Design Automation Conference, 1996, with EURO-VHDL '96 and Exhibition, Proceedings EURO-DAC '96, European","20020806","1996","","","190","197","CAD-systems supporting hardware/software codesign map different tasks of an algorithm onto processors. Some of the processors are programmable and others are application specific. We propose a new MILP (mixed integer linear program) model that allows to determine a mapping optimizing a trade off function between execution time, processor and communication cost. The mapping also guarantees that all specified execution deadlines are met. We demonstrate the efficient with practical examples","","0-8186-7573-X","","10.1109/EURDAC.1996.558204","http://ieeexplore.ieee.org/stamp/stamp.jsp?arnumber=558204","","Algorithm design and analysis;Application software;Costs;Hardware;Multiprocessing systems;Partitioning algorithms;Real time systems;Signal processing;Signal processing algorithms;Software algorithms","computer aided software engineering;logic CAD;multiprocessing systems;processor scheduling;real-time systems","MILP;hardware/software codesign;heterogeneous multiprocessor systems;mixed integer linear program;task mapping;trade off function","","21","","20","","","16-20 Sep 1996","16 Sep 1996-20 Sep 1996","IEEE","IEEE Conference Publications"
"A heuristic covering technique for optimizing average-case delay in the technology mapping of asynchronous burst-mode circuits","Beerel, P.A.; Yun, K.Y.; Wei-Chun Chou","Dept. of Electr. Eng. Syst., Univ. of Southern California, Los Angeles, CA, USA","Design Automation Conference, 1996, with EURO-VHDL '96 and Exhibition, Proceedings EURO-DAC '96, European","20020806","1996","","","284","289","Presents a covering technique for optimizing the average-case delay of asynchronous burst-mode control circuits during technology mapping. The specification and the NAND-decomposed unmapped network of these circuits are first preprocessed using stochastic techniques to determine the relative frequency of occurrence of each state transition and the corresponding sensitized paths through the NAND-decomposed network. We minimize the sum of the implementation's cycle times of the state transitions, weighted by their relative frequencies, thereby optimizing for average-case performance. Our results demonstrate that a 10-15% improvement in performance con be achieved with run-times comparable to synchronous techniques","","0-8186-7573-X","","10.1109/EURDAC.1996.558218","http://ieeexplore.ieee.org/stamp/stamp.jsp?arnumber=558218","","Asynchronous circuits;Delay;Design methodology;Engineering profession;Force control;Frequency;Libraries;Power engineering and energy;Runtime;Stochastic processes","NAND circuits;asynchronous circuits;delays;heuristic programming;minimisation of switching nets","NAND-decomposed unmapped network;asynchronous burst-mode circuits;average-case delay optimization;circuit specification;control circuits;heuristic covering technique;implementation's cycle times;performance;relative occurrence frequency;run-times;sensitized paths;state transition;stochastic preprocessing;technology mapping","","2","","14","","","16-20 Sep 1996","16 Sep 1996-20 Sep 1996","IEEE","IEEE Conference Publications"
"Module assignment for low power","Jui-Ming Chang; Pedram, M.","Dept. of Electr. Eng. Syst., Univ. of Southern California, Los Angeles, CA, USA","Design Automation Conference, 1996, with EURO-VHDL '96 and Exhibition, Proceedings EURO-DAC '96, European","20020806","1996","","","376","381","We investigate the problem of minimizing the total power consumption during the binding of operations to functional units in a scheduled data path with functional pipelining and conditional branching for data intensive applications. We first present a technique to estimate the power consumption in a functionally pipelined data path and then formulate the power optimization problem as a max cost multi commodity flow problem and solve it optimally. Our proposed method can augment most high level synthesis algorithms as a post processing step for reducing power after the optimizations for area or speed have been completed. An average power savings of 28% has been observed after we apply our method to pipelined designs that have been optimized using conventional techniques","","0-8186-7573-X","","10.1109/EURDAC.1996.558232","http://ieeexplore.ieee.org/stamp/stamp.jsp?arnumber=558232","","Circuits;Costs;Delay;Design optimization;Energy consumption;Flow graphs;Hardware;Pipeline processing;Power dissipation;Scheduling algorithm","high level synthesis;logic CAD;optimisation;pipeline processing;power consumption;processor scheduling","average power savings;conditional branching;data intensive applications;functional pipelining;functional units;functionally pipelined data path;high level synthesis algorithms;max cost multi commodity flow problem;module assignment;pipelined designs;post processing step;power consumption;power optimization problem;scheduled data path;total power consumption minimisation","","29","","21","","","16-20 Sep 1996","16 Sep 1996-20 Sep 1996","IEEE","IEEE Conference Publications"
"Describing space-continuous models of microelectromechanical devices for behavioural simulation","Mrcarica, Z.; Litovski, V.B.; Glozic, D.; Detter, H.","Inst. for Precision Eng., Tech. Univ. of Vienna, Austria","Design Automation Conference, 1996, with EURO-VHDL '96 and Exhibition, Proceedings EURO-DAC '96, European","20020806","1996","","","316","321","Modern behavioural simulators and their hardware description languages enable the description of time-continuous and time-discrete models. In this work, a modelling technique is developed for the description of space-continuous models, where partial differential equations are used. A hierarchical library of partial differential equations and boundary conditions for microelectromechanical device modelling is created. Mechanically complex devices have been modelled for system-level simulation using this technique","","0-8186-7573-X","","10.1109/EURDAC.1996.558223","http://ieeexplore.ieee.org/stamp/stamp.jsp?arnumber=558223","","Biomembranes;Boundary conditions;Circuit simulation;Engines;Hardware design languages;Libraries;Microelectromechanical systems;Micromechanical devices;Partial differential equations;SPICE","circuit analysis computing;digital simulation;hardware description languages;mechanical engineering computing;micromechanical devices;partial differential equations;software libraries","behavioural simulation;boundary conditions;hardware description languages;hierarchical library;mechanically complex devices;microelectromechanical device modelling;partial differential equations;space-continuous models;system-level simulation;time-continuous models;time-discrete models","","0","","10","","","16-20 Sep 1996","16 Sep 1996-20 Sep 1996","IEEE","IEEE Conference Publications"
"Assignment of storage values to sequential read-write memories","Gerez, S.H.; Woutersen, E.G.","Dept. of Electr. Eng., Twente Univ., Enschede, Netherlands","Design Automation Conference, 1996, with EURO-VHDL '96 and Exhibition, Proceedings EURO-DAC '96, European","20020806","1996","","","302","308","Sequential read-write memories (SRWMs) are RAMs without an address decoder. A shift register is used instead to point at subsequent memory locations. SRWMs consume less power than RAMs of the same size. Algorithms are presented to check whether a set of storage values fits in a single SRWM and to automatically map storage values in as few SRWMs as possible. Benchmark results show that good assignments can be obtained in spite of the limited addressing capabilities","","0-8186-7573-X","","10.1109/EURDAC.1996.558221","http://ieeexplore.ieee.org/stamp/stamp.jsp?arnumber=558221","","Data visualization;Decoding;High level synthesis;Processor scheduling;Random access memory;Read-write memory;Scheduling algorithm;Shift registers;Storage automation;Writing","high level synthesis;logic CAD;performance evaluation;random-access storage;shift registers;storage allocation","RAM;SRWM;address decoder;addressing;benchmark results;high level synthesis;memory locations;power consumption;random access storage;sequential read-write memories;shift register;storage value assignment","","14","","19","","","16-20 Sep 1996","16 Sep 1996-20 Sep 1996","IEEE","IEEE Conference Publications"
"Towards maximising the use of structural VHDL for synthesis","O'Brien, K.; Robert, A.; Maginot, S.","LEDA S.A., Meylan, France","Design Automation Conference, 1996, with EURO-VHDL '96 and Exhibition, Proceedings EURO-DAC '96, European","20020806","1996","","","528","533","In this paper we show that by performing some VHDL elaboration transformations before synthesis we can extend the synthesis subset to include complex structural and hierarchical statements. This in turn means that: design, debug and simulation times are reduced; designs are more accessible (readable, modifiable, portable, reusable); design prototyping can be speeded up. All of this can be achieved without the need to modify existing synthesis tools","","0-8186-7573-X","","10.1109/EURDAC.1996.558254","http://ieeexplore.ieee.org/stamp/stamp.jsp?arnumber=558254","","Circuit synthesis;Hardware;High level synthesis;Logic;Manufacturing;Prototypes;Registers;Standards development;Virtual prototyping;Writing","hardware description languages;high level synthesis;logic CAD","VHDL elaboration transformations;complex structural statements;debug times;design prototyping;hierarchical statements;simulation times;structural VHDL","","0","","10","","","16-20 Sep 1996","16 Sep 1996-20 Sep 1996","IEEE","IEEE Conference Publications"
"Beyond VHDL: textual formalisms, visual techniques, or both?","Rammig, F.J.","Heinz Nixdorf Inst., Univ. Gesamthochschule Paderborn, Germany","Design Automation Conference, 1996, with EURO-VHDL '96 and Exhibition, Proceedings EURO-DAC '96, European","20020806","1996","","","420","427","Since a couple of years VHDL is the dominating hardware description language. There are very good reasons far this and simply the existence of VHDL as standardized language had a major impact on the advance of high level design techniques. In this paper some ideas about specification and modelling techniques beyond VHDL currently carried out in the author's research group are discussed. One approach is to integrate formal specification techniques like evolving algebras (EA) and Z into a VHDL-oriented design environment. Other approaches concentrate on the potential of visual modelling techniques. Here techniques based on parallel logic programming like Pictorial Janus (PJ) or such ones based on higher order Petri Nets are under investigation","","0-8186-7573-X","","10.1109/EURDAC.1996.558238","http://ieeexplore.ieee.org/stamp/stamp.jsp?arnumber=558238","","Calculus;Embedded system;Hardware;Kernel;Real time systems;Set theory;Specification languages;Tail","formal specification;hardware description languages;logic programming;parallel programming","Pictorial Janus;VHDL;VHDL-oriented design environment;Z;evolving algebras;formal specification;hardware description language;higher order Petri Nets;parallel logic programming;textual formalisms;visual modelling;visual techniques","","0","1","19","","","16-20 Sep 1996","16 Sep 1996-20 Sep 1996","IEEE","IEEE Conference Publications"
"Hierarchical behavioral partitioning for multicomponent synthesis","Kumar, N.; Srinivasan, V.; Vemuri, R.","Triquest Design Autom., San Jose, CA, USA","Design Automation Conference, 1996, with EURO-VHDL '96 and Exhibition, Proceedings EURO-DAC '96, European","20020806","1996","","","212","217","Packaging technology has tremendously improved over the last decade. Various packaging options such as ASICs, MCMs, boards, etc. should be well explored at early stages of the system-synthesis cycle. In this paper we present a hierarchical behavioral partitioning algorithm which partitions the input behavioral specification into a hierarchical structure and binds all elements of the structure to appropriate packages from a given package library. As an application to our partitioner, we integrated the partitioner with a high level synthesis tool to create an environment for multicomponent synthesis and hierarchical package design. We provide detailed partitioning algorithms and experimental results","","0-8186-7573-X","","10.1109/EURDAC.1996.558207","http://ieeexplore.ieee.org/stamp/stamp.jsp?arnumber=558207","","Aging;Clocks;Costs;High level synthesis;Integrated circuit packaging;Libraries;Partitioning algorithms;Pins","high level synthesis;logic CAD;logic partitioning;packaging","behavioral partitioning;behavioral specification;hierarchical structure;high level synthesis tool;multicomponent synthesis;package library;packaging options","","5","6","16","","","16-20 Sep 1996","16 Sep 1996-20 Sep 1996","IEEE","IEEE Conference Publications"
"Index of authors","","","Design Automation Conference, 1996, with EURO-VHDL '96 and Exhibition, Proceedings EURO-DAC '96, European","20020806","1996","","","577","579","Presents an index of the authors whose papers are published in the conference.","","0-8186-7573-X","","10.1109/EURDAC.1996.558261","http://ieeexplore.ieee.org/stamp/stamp.jsp?arnumber=558261","","","","","","0","","","","","16-20 Sept. 1996","","IEEE","IEEE Conference Publications"
"Automatic synthesis of extended burst-mode circuits using generalized C-elements","Yun, K.Y.","Dept. of Electr. & Comput. Eng., California Univ., San Diego, La Jolla, CA, USA","Design Automation Conference, 1996, with EURO-VHDL '96 and Exhibition, Proceedings EURO-DAC '96, European","20020806","1996","","","290","295","Presents a new automatic synthesis technique for extended burst-mode circuits, a class of asynchronous circuits that allows multiple input changes between state transitions and a choice of next states based on input signal levels. The target implementation is a pseudo-static asymmetric CMOS complex gate for each output, known as a generalized C-element. The synthesis algorithm generates hazard-free covers for the set and reset functions of each output using Nowick and Dill's (1995) exact hazard-free logic minimization algorithm. Each output circuit is formed by mapping its set and reset logic to N and P stacks of an asymmetric CMOS gate connected to a sustainer; long-series stacks are decomposed into static gates followed by short stacks. A simple heuristic is used to ensure that no short-circuit paths exist from V<sub>dd</sub> to ground. The resulting circuits for small- to medium-size extended burst-mode specifications are 40% smaller and 30% faster than the two-level circuits generated by a 3D synthesis tool, and significantly smaller and faster than the complex-gate circuits generated by the method of Kudva et al. (1996)","","0-8186-7573-X","","10.1109/EURDAC.1996.558219","http://ieeexplore.ieee.org/stamp/stamp.jsp?arnumber=558219","","Asynchronous circuits;CMOS logic circuits;Circuit synthesis;Clocks;Drives;Energy management;Hazards;Microprocessors;Power dissipation;Signal synthesis","CMOS digital integrated circuits;asynchronous circuits;circuit CAD;hazards and race conditions;logic gates","asynchronous circuits;automatic synthesis technique;circuit specifications;exact hazard-free logic minimization algorithm;extended burst-mode circuits;generalized C-elements;hazard-free covers;input signal levels;long-series stacks;multiple input changes;next states;output circuit;pseudo-static asymmetric CMOS complex gate;reset function;set function;short stacks;short-circuit paths;state transitions;static gates;sustainer","","13","1","20","","","16-20 Sep 1996","16 Sep 1996-20 Sep 1996","IEEE","IEEE Conference Publications"
"Analysis of different protocol description styles in VHDL for high-level synthesis","Pirmez, L.; Pedroza, A.; Rahmouni, M.; Mesquita, A.; Kission, P.; Jerraya, A.A.","","Design Automation Conference, 1996, with EURO-VHDL '96 and Exhibition, Proceedings EURO-DAC '96, European","20020806","1996","","","490","495","When synthesizing control-flow dominated descriptions based on VHDL, different styles of semantically equivalent descriptions may differ significantly in quality. This paper discusses the effect of the input description on High-Level Synthesis when using VBDL. In order to show this effect, a high speed protocol based on the ISO reference protocol Abracadabra is used. Five VHDL descriptions styles of the same protocol have been synthesized using AMICAL, a VHDL based behavioral synthesis tool. Discussions of the different results leads to a VHDL based methodology for protocol modelling in order to produce efficient designs","","0-8186-7573-X","","10.1109/EURDAC.1996.558248","http://ieeexplore.ieee.org/stamp/stamp.jsp?arnumber=558248","","Arithmetic;Circuits;Computational efficiency;Dynamic scheduling;Flow graphs;High level synthesis;Process control;Processor scheduling;Protocols;Scheduling algorithm","finite state machines;hardware description languages;high level synthesis;logic CAD;transport protocols","AMICAL;Abracadabra;ISO reference protocol;VHDL;VHDL based behavioral synthesis tool;control-flow dominated descriptions;high speed protocol;high-level synthesis;protocol description styles;protocol modeling;semantically equivalent descriptions","","3","","13","","","16-20 Sep 1996","16 Sep 1996-20 Sep 1996","IEEE","IEEE Conference Publications"
"Fault behavior observation of a microprocessor system through a VHDL simulation-based fault injection experiment","Amendola, A.M.; Benso, A.; Corno, F.; Impagliazzo, L.; Marmo, P.; Prinetto, P.; Rebaudengo, M.; Reorda, M.S.","CRIS, Napoli, Italy","Design Automation Conference, 1996, with EURO-VHDL '96 and Exhibition, Proceedings EURO-DAC '96, European","20020806","1996","","","536","541","Evaluating and possibly improving the fault tolerance and error detecting mechanisms is becoming a key issue when designing safety-critical electronic systems. The proposed approach is based on simulation-based fault injection and allows the analysis of the system behavior when faults occur. The paper describes how a microprocessor board employed in an automated light-metro control system has been modeled in VHDL and a Fault Injection Environment has been set up using a commercial simulator. Preliminary results about the effectiveness of the hardware fault-detection mechanisms are also reported. Such results will address the activity of experimental evaluation in subsequent phases of the validation process","","0-8186-7573-X","","10.1109/EURDAC.1996.558255","http://ieeexplore.ieee.org/stamp/stamp.jsp?arnumber=558255","","Analytical models;Application software;Computer errors;Delay;Fault detection;Fault tolerant systems;Hardware;Microprocessors;Real time systems;Telecommunication computing","fault location;fault tolerant computing;hardware description languages;microprocessor chips","Fault Injection Environment;VHDL;error detecting mechanisms;fault behavior observation;fault injection experiment;fault tolerance;microprocessor system;safety-critical electronic systems","","12","2","13","","","16-20 Sep 1996","16 Sep 1996-20 Sep 1996","IEEE","IEEE Conference Publications"
"BRASIL: the Braunschweig mixed-mode-simulator for integrated circuits","Bretthauer, U.; Horneber, E.-H.","Inst. for Network Theory & Circuit Design, Tech. Univ. of Braunschweig, Germany","Design Automation Conference, 1996, with EURO-VHDL '96 and Exhibition, Proceedings EURO-DAC '96, European","20020806","1996","","","10","14","BRASIL consists of a timing simulator for digital MOS circuits coupled with an algorithm for circuit simulation. The timing simulation is based upon a fast macromodelling approach and the calculation of time-variant RC networks. The circuit simulator takes advantage out of structuring the system of nodal equations. With BRASIL a fast simulation of large circuits, with special regards to systems with the need of higher accuracy, is possible","","0-8186-7573-X","","10.1109/EURDAC.1996.558016","http://ieeexplore.ieee.org/stamp/stamp.jsp?arnumber=558016","","CMOS technology;Capacitance;Circuits;Delay effects;Inverters;MOS devices;Narrowband;Semiconductor device modeling;Tin;Voltage","MOS integrated circuits;circuit analysis computing;integrated circuit modelling;mixed analogue-digital integrated circuits;timing","BRASIL;Braunschweig mixed-mode-simulator;circuit simulation;digital MOS circuits;fast macromodelling approach;integrated circuits;nodal equations;time-variant RC networks;timing simulator","","0","1","5","","","16-20 Sep 1996","16 Sep 1996-20 Sep 1996","IEEE","IEEE Conference Publications"
"Library based technology mapping using multiple domain representations","Bullmann, J.; Schubert, E.; Kebschull, U.; Rosenstiel, W.","Tubingen Univ., Germany","Design Automation Conference, 1996, with EURO-VHDL '96 and Exhibition, Proceedings EURO-DAC '96, European","20020806","1996","","","146","150","The use of signatures as efficient filters in Boolean matching is a crucial step in technology mapping and/or formal verification. In this work we combine well known representations of Boolean functions, the binary decision diagrams with those in the spectral domain, the functional decision diagrams and the equivalence decision diagrams. We obtain signatures of Boolean functions and their variables, which are easy to compute but can reduce the problem of aliases though","","0-8186-7573-X","","10.1109/EURDAC.1996.558197","http://ieeexplore.ieee.org/stamp/stamp.jsp?arnumber=558197","","Boolean functions;Data preprocessing;Data structures;Filters;Formal verification;Genetic mutations;Libraries;Logic testing;Performance evaluation;Space technology","Boolean functions;formal verification","Boolean functions;Boolean matching;binary decision diagrams;equivalence decision diagrams;filters;formal verification;functional decision diagrams;library based technology mapping;multiple domain representations;signatures","","0","","12","","","16-20 Sep 1996","16 Sep 1996-20 Sep 1996","IEEE","IEEE Conference Publications"
"Power analysis for sequential circuits at logic level","Schneider, P.H.; Senn, M.A.; Wurth, B.","Siemens AG, Munich, Germany","Design Automation Conference, 1996, with EURO-VHDL '96 and Exhibition, Proceedings EURO-DAC '96, European","20020806","1996","","","22","27","This paper introduces a novel technique to determine the transition probabilities of internal signals for sequential circuits. We account for temporal correlations of primary inputs and internal signals, sequential correlations, and spatial correlations of internal signals. For this purpose, we exploit and combine concepts of unrolling reconvergence analysis, decomposing packers of temporally correlated variables, and Markov chains. Experimental results demonstrate the high accuracy and efficiency of our technique","","0-8186-7573-X","","10.1109/EURDAC.1996.558047","http://ieeexplore.ieee.org/stamp/stamp.jsp?arnumber=558047","","Circuit analysis;Circuit simulation;Computational modeling;Counting circuits;Logic circuits;Monte Carlo methods;Nonlinear equations;Sequential circuits;Switches;Vectors","CMOS logic circuits;Markov processes;circuit analysis computing;logic CAD;logic testing;sequential circuits","Markov chains;decomposing packers;internal signals;primary inputs;sequential circuits;sequential correlations;spatial correlations;temporal correlations;temporally correlated variables;transition probabilities;unrolling reconvergence analysis","","1","1","17","","","16-20 Sep 1996","16 Sep 1996-20 Sep 1996","IEEE","IEEE Conference Publications"
"Testable path delay fault cover for sequential circuits","Krstic, A.; Chakradhar, S.T.; Kwang-Ting Cheng","Dept. of Electr. & Comput. Eng., California Univ., Santa Barbara, CA, USA","Design Automation Conference, 1996, with EURO-VHDL '96 and Exhibition, Proceedings EURO-DAC '96, European","20020806","1996","","","220","226","We present an algorithm for identifying a set of faults that do not have to be targeted by a sequential delay test generator. These faults either cannot independently affect the performance of the circuit or no test can be generated for them. To find such faults, our methodology takes advantage of the sequential behavior of the circuit as well as of the information about uncontrollable signals in the sequential circuit. It can handle sequential circuits described as two- or multi-level netlists. The outcome of applying our methodology is reduced delay test generation effort and smaller test set. We present experimental results on several ISCAS 89 benchmark circuits demonstrating that a large number of path delay faults in these circuits either cannot or does not have to be examined for delay defects","","0-8186-7573-X","","10.1109/EURDAC.1996.558208","http://ieeexplore.ieee.org/stamp/stamp.jsp?arnumber=558208","","Circuit faults;Circuit testing;Combinational circuits;Delay;Electrical fault detection;Fault detection;Fault diagnosis;Manufacturing;Sequential analysis;Sequential circuits","fault diagnosis;logic testing;sequential circuits","ISCAS 89 benchmark circuits;delay defects;path delay fault cover;path delay faults;sequential behavior;sequential circuits;test generation;uncontrollable signals","","14","","15","","","16-20 Sep 1996","16 Sep 1996-20 Sep 1996","IEEE","IEEE Conference Publications"
