"http://ieeexplore.ieee.org/search/searchresult.jsp?bulkSetSize=2000&refinements%3D4294967269%26matchBoolean%3Dtrue%26searchField%3DSearch_All%26queryText%3D%28%28Design+Automation+Conference+.LB.DAC.RB.%29+AND+1996%29",2015/06/23 14:39:58
"A fault model for VHDL descriptions at the register transfer level","Riesgo, T.; Uceda, J.","Div. de Ingenieria Electron., Univ. Politecnica de Madrid, Spain","Design Automation Conference, 1996, with EURO-VHDL '96 and Exhibition, Proceedings EURO-DAC '96, European","20020806","1996","","","462","467","This paper presents a fault model for VHDL descriptions at the register transfer level and its evaluation with respect to a logic level fault model (single-stuck-at). The proposed fault model may be used for early estimations of the fault coverage before the synthesis is made in the design process of an integrated circuit. The obtained results show a high correlation between the fault coverages achieved with the proposed fault model and logic fault models on a set of examples. The main contribution of this work is the proposal of a new fault model for VHD/RT descriptions and the demonstration of its usefulness for estimating the achieved fault coverage with a set of test vectors in design phases previous to synthesis","","0-8186-7573-X","","10.1109/EURDAC.1996.558244","http://ieeexplore.ieee.org/stamp/stamp.jsp?arnumber=558244","","Algorithm design and analysis;Circuit faults;Circuit testing;Electrical fault detection;Fault detection;Integrated circuit modeling;Integrated circuit synthesis;Logic gates;Logic testing;Process design","fault diagnosis;hardware description languages;logic testing","VHD/RT descriptions;VHDL descriptions;design phases;fault coverage;fault model;logic fault models;logic level fault model;register transfer level;single-stuck-at fault;test vectors","","8","","9","","","16-20 Sep 1996","16 Sep 1996-20 Sep 1996","IEEE","IEEE Conference Publications"
"Automatic workflow generation","Shepelev, V.A.; Director, S.W.","Res. Inst. for VLSI CAD Syst., Acad. of Sci., Moscow, Russia","Design Automation Conference, 1996, with EURO-VHDL '96 and Exhibition, Proceedings EURO-DAC '96, European","20020806","1996","","","104","109","As the number and diversity of computer-aided VLSI design tools grows, there is an increasing interest in workflow management. In this paper we describe an enhancement to the task schema approach to workflow management that allows for the automatic generation of workflows. Such a capability can significantly enhance designer productivity. It has been implemented in the Dedal program","","0-8186-7573-X","","10.1109/EURDAC.1996.558191","http://ieeexplore.ieee.org/stamp/stamp.jsp?arnumber=558191","","Automatic control;Circuits;Computerized monitoring;Data mining;Design automation;Encapsulation;Engineering management;Process design;Productivity;Very large scale integration","VLSI;circuit CAD;scheduling","Dedal program;automatic generation of workflows;computer-aided VLSI design tools;designer productivity;task schema;workflow management","","2","1","10","","","16-20 Sep 1996","16 Sep 1996-20 Sep 1996","IEEE","IEEE Conference Publications"
"VHDL 1076.1-analog and mixed-signal extensions to VHDL","Christen, E.; Bakalar, K.","Analogy Inc., Beaverton, OR, USA","Design Automation Conference, 1996, with EURO-VHDL '96 and Exhibition, Proceedings EURO-DAC '96, European","20020806","1996","","","556","561","This presentation provides an overview of the 1076.1 effort to extend the well established VHDL language to support the description and simulation of continuous and mixed continuous/discrete systems. It begins with a brief history of the effort. That is followed by an overview of the foundations: the design objectives, the base VHDL 1076 language, and the applicable mathematical theory. The body of the presentation describes the elements of the extended language. Each language element is described in the context of the 1076.1 language architecture and illustrated by a brief example. The presentation ends with selected examples illustrating the use of the language for analog and mixed-signal applications","","0-8186-7573-X","","10.1109/EURDAC.1996.558258","http://ieeexplore.ieee.org/stamp/stamp.jsp?arnumber=558258","","Design automation;Differential algebraic equations;Differential equations;Digital systems;Hardware design languages;History;Very high speed integrated circuits","hardware description languages;mixed analogue-digital integrated circuits","VHDL;VHDL 1076.1;analog and mixed-signal extensions;mixed continuous/discrete systems","","3","3","4","","","16-20 Sep 1996","16 Sep 1996-20 Sep 1996","IEEE","IEEE Conference Publications"
"Modeling ASIC memories in VHDL","Balaji, E.; Krishnamurthy, P.","LSI Logic Corp., Milpitas, CA, USA","Design Automation Conference, 1996, with EURO-VHDL '96 and Exhibition, Proceedings EURO-DAC '96, European","20020806","1996","","","502","508","Memories are all important component in ASIC designs. With increasing design complexities, there is need to model memory devices with a high level of accuracy and simulation efficiency. This paper describes the functional/timing aspects of VHDL memory models, their implementation, and various issues involved. The paper also presents a generic interface package used in the development of memory models","","0-8186-7573-X","","10.1109/EURDAC.1996.558250","http://ieeexplore.ieee.org/stamp/stamp.jsp?arnumber=558250","","Application specific integrated circuits;Clocks;Design engineering;Electrooptic devices;Flip-flops;Hardware design languages;Large scale integration;Memory architecture;Random access memory;Read-write memory","SRAM chips;application specific integrated circuits;circuit analysis computing;flip-flops;hardware description languages;integrated circuit design;integrated circuit modelling;logic CAD;memory architecture;read-only storage;timing","ASIC designs;ASIC memories;ROM;VHDL memory models;functional aspects;generic interface package;simulation efficiency;static RAM;timing aspects","","0","4","3","","","16-20 Sep 1996","16 Sep 1996-20 Sep 1996","IEEE","IEEE Conference Publications"
"A system for compiling and debugging structured data processing controllers","Seawright, A.; Holtmann, U.; Meyer, W.; Pangrle, B.; Verbrugghe, R.; Buck, J.","Synopsys Inc., Moutain View, CA, USA","Design Automation Conference, 1996, with EURO-VHDL '96 and Exhibition, Proceedings EURO-DAC '96, European","20020806","1996","","","86","91","This paper describes a system for designing and implementing controllers for structured data processing. A graphical input style describes the format of the data to be processed along with the necessary control actions. Advantages over FSM approaches include: (1) ease of design changes, (2) ease of debugging, and (3) a shorter design cycle","","0-8186-7573-X","","10.1109/EURDAC.1996.558188","http://ieeexplore.ieee.org/stamp/stamp.jsp?arnumber=558188","","Control systems;Data processing;Debugging;Explosions;Logic design;Payloads;Process control;Protocols;Telecommunication control;Transform coding","circuit layout CAD;high level synthesis;logic CAD;program debugging","Dali;compiling;debugging;graphical input style;structured data processing","","22","2","9","","","16-20 Sep 1996","16 Sep 1996-20 Sep 1996","IEEE","IEEE Conference Publications"
"A hierarchical approach to the analog behavioral modeling of neural networks using HDL-A","Ahmed, M.M.; Ragaie, H.F.; Haddara, H.","Dept. of Electron. & Comput. Eng., Ain Shams Univ., Cairo, Egypt","Design Automation Conference, 1996, with EURO-VHDL '96 and Exhibition, Proceedings EURO-DAC '96, European","20020806","1996","","","2","9","A hierarchical methodology for analog behavioral modeling of the basic building blocks of neural networks is presented using HDL-A. This hierarchy is formed of three levels in order to satisfy the different requirements of the CAD tools which may incorporate the models. The presented models include all the nonidealities present in the actual circuit in addition to being flexible and consuming shorter simulation time. This improvement in simulation time is verified through examples at both the circuit and system levels","","0-8186-7573-X","","10.1109/EURDAC.1996.558015","http://ieeexplore.ieee.org/stamp/stamp.jsp?arnumber=558015","","Artificial neural networks;Circuit simulation;Circuits and systems;Design automation;Digital circuits;Flexible printed circuits;Hardware;Libraries;Neural networks;Very large scale integration","VLSI;analogue integrated circuits;analogue processing circuits;circuit CAD;circuit analysis computing;hardware description languages;integrated circuit design;integrated circuit modelling;neural chips","CAD tools;HDL-A;analog behavioral modeling;hierarchical approach;neural networks;simulation time","","1","","21","","","16-20 Sep 1996","16 Sep 1996-20 Sep 1996","IEEE","IEEE Conference Publications"
"Entity overloading for mixed-signal abstraction in VHDL","Shi, C.-J.R.","Dept. of Electr. & Comput. Eng., Iowa Univ., Iowa City, IA, USA","Design Automation Conference, 1996, with EURO-VHDL '96 and Exhibition, Proceedings EURO-DAC '96, European","20020806","1996","","","562","567","In this paper we propose to extend VHDL with entity overloading. With a minimal change to existing VHDL, entity overloading provides a strong support for mixed-signal, mixed-level, and mixed-domain abstractions. It is particularly promising in resolving some issues in VHDL-A language design. Furthermore, we illustrate that, entity overloading can be combined with certain modeling rules to achieve polymorphic netlist","","0-8186-7573-X","","10.1109/EURDAC.1996.558259","http://ieeexplore.ieee.org/stamp/stamp.jsp?arnumber=558259","","Analog computers;Circuit synthesis;Cities and towns;Communications technology;Consumer electronics;Digital circuits;Hardware design languages;Object oriented modeling;Signal design;Signal resolution","hardware description languages;logic CAD;mixed analogue-digital integrated circuits","VHDL;VHDL-A;entity overloading;mixed-domain;mixed-signal abstraction;polymorphic netlist","","0","","12","","","16-20 Sep 1996","16 Sep 1996-20 Sep 1996","IEEE","IEEE Conference Publications"
"TINA: analog placement using enumerative techniques capable of optimizing both area and net length","Abthoff, T.H.; Johannes, F.M.","Inst. of Electron. Design Autom., Tech. Univ. of Munich, Germany","Design Automation Conference, 1996, with EURO-VHDL '96 and Exhibition, Proceedings EURO-DAC '96, European","20020806","1996","","","398","403","In this paper a new enumerative algorithm called TINA is introduced that generates slicing placements optimal in both area and overall net length. It is designed to automate the task of placement for analog circuits given a set of modules with multiple realizations, a corresponding net list, and neighborhood relations. TINA reduces the overall net length to nearly one-fifth compared to a net length unaware enumeration algorithm while using only 1.6% more area and twice the CPU-time. TINA is based on enhanced shape functions that are capable of carrying net length information. TINA can be used either as a fully automatic analog placement tool, or as an interactive tool for creating extremely dense placements from a loose placement provided by the designer to establish neighborhood relations. In the first case another tool, e.g. PLACEBO, is used to compute neighborhood relations TINA is able to handle all major analog constraints like clustering framing, fixed orientations, fixed realizations, and symmetries","","0-8186-7573-X","","10.1109/EURDAC.1996.558235","http://ieeexplore.ieee.org/stamp/stamp.jsp?arnumber=558235","","Analog circuits;Analog computers;BiCMOS integrated circuits;Electronic design automation and methodology;Humans;Routing;Shape;Wiring","analogue circuits;circuit layout CAD;modules","PLACEBO;TINA;analog placement;area optimisation;clustering framing;enhanced shape functions;enumerative algorithm;enumerative techniques;fixed orientations;fixed realizations;multiple realizations;neighborhood relations;net length;net list;slicing placements;symmetries","","2","1","9","","","16-20 Sep 1996","16 Sep 1996-20 Sep 1996","IEEE","IEEE Conference Publications"
"Controller optimization for protocol intensive applications","Crews, A.; Brewer, F.","Dept. of Electr. & Comput. Eng., California Univ., Santa Barbara, CA, USA","Design Automation Conference, 1996, with EURO-VHDL '96 and Exhibition, Proceedings EURO-DAC '96, European","20020806","1996","","","140","145","Applications implementing complex protocols tax the capabilities of conventional finite state machine synthesis techniques. In this paper, we present sequential optimization techniques whose complexity scales with the number of state bits rather than the number of states. These techniques create designs which are comparable or superior to those synthesized by conventional state-based optimization and assignment. Furthermore, they provide viable synthesis techniques for designs which are too large for synthesis with the conventional method","","0-8186-7573-X","","10.1109/EURDAC.1996.558196","http://ieeexplore.ieee.org/stamp/stamp.jsp?arnumber=558196","","Application software;Automata;Circuit synthesis;Design optimization;Encoding;Explosives;Hardware design languages;Programmable logic arrays;Protocols;Tree graphs","computational complexity;finite state machines;optimisation;protocols","complexity;controller optimization;finite state machine synthesis;protocol intensive applications;sequential optimization techniques;state bits;state-based optimization","","6","2","11","","","16-20 Sep 1996","16 Sep 1996-20 Sep 1996","IEEE","IEEE Conference Publications"
"COMET: a hardware-software codesign methodology","Knieser, M.J.; Papachriston, C.A.","Dept. of Comput. Eng., Case Western Reserve Univ., Cleveland, OH, USA","Design Automation Conference, 1996, with EURO-VHDL '96 and Exhibition, Proceedings EURO-DAC '96, European","20020806","1996","","","178","183","COMET is a system-level C and VHDL hardware/software codesign methodology. This process is made possible through the use of a rules file which adds timing and area constraints to the C and VHDL descriptions that the languages do not support. The methodology of COMET is functional and has been tested. A neural network program has been implemented to perform automated hardware/software partitioning","","0-8186-7573-X","","10.1109/EURDAC.1996.558202","http://ieeexplore.ieee.org/stamp/stamp.jsp?arnumber=558202","","Costs;Hardware design languages;Iterative methods;Logic;Neural networks;Software performance;Software standards;Software tools;Synchronous generators;Timing","circuit layout CAD;hardware description languages;logic design;neural nets;systems analysis","COMET;VHDL hardware/software codesign methodology;area constraints;automated hardware/software partitioning;hardware-software codesign methodology;neural network program;system-level C;timing constraint","","2","2","11","","","16-20 Sep 1996","16 Sep 1996-20 Sep 1996","IEEE","IEEE Conference Publications"
"VHDL fault simulation for defect-oriented test and diagnosis of digital ICs","Celeiro, F.; Dias, L.; Ferreira, J.; Santos, M.B.; Teixeira, J.P.","INESC, Lisbon, Portugal","Design Automation Conference, 1996, with EURO-VHDL '96 and Exhibition, Proceedings EURO-DAC '96, European","20020806","1996","","","450","455","For high quality VLSI products, exhibiting very low escape rates, defect-oriented testing becomes mandatory. The design activity is more and more supported by hardware description languages, like VHDL; hence, the testing activity needs to follow this trend. In this paper, a VHDL-based methodology for test preparation of digital ICs is proposed and a new set of tools for defect-oriented VHDL fault simulation are presented, using a commercial VHDL simulator. The proposed methodology is also shown to be effective in supporting realistic fault diagnosis. Simulation results for benchmark circuits are presented","","0-8186-7573-X","","10.1109/EURDAC.1996.558242","http://ieeexplore.ieee.org/stamp/stamp.jsp?arnumber=558242","","CMOS technology;Circuit faults;Circuit simulation;Circuit testing;Fault diagnosis;Hardware design languages;Integrated circuit modeling;Integrated circuit testing;Semiconductor device modeling;Very large scale integration","VLSI;circuit analysis computing;digital integrated circuits;fault diagnosis;hardware description languages;integrated circuit testing","VHDL;VHDL fault simulation;benchmark circuits;defect-oriented test and diagnosis;defect-oriented testing;digital ICs;fault simulation;hardware description languages;realistic fault diagnosis","","2","","21","","","16-20 Sep 1996","16 Sep 1996-20 Sep 1996","IEEE","IEEE Conference Publications"
"Stepwise refinement of behavioral VHDL specifications by separation of synchronization and functionality","Schneider, C.; Ecker, W.","Corp. Res. & Dev., Siemens AG, Munich, Germany","Design Automation Conference, 1996, with EURO-VHDL '96 and Exhibition, Proceedings EURO-DAC '96, European","20020806","1996","","","509","514","We present a new method of behavioral modeling consisting of separation of synchronization and functionality. In this way incomplete specification and incremental refinement can be performed to reduce the modeling effort in early design stages. Compared to known methods our approach allows early cycle based analysis to select appropriate architectures and to perform parallel/serial tradeoff. Due to the separation of synchronization and functionality the datapath can be developed independently of the controller and thus enables concurrent engineering. Another important characteristic is the reuse friendly architecture proposed in this paper","","0-8186-7573-X","","10.1109/EURDAC.1996.558251","http://ieeexplore.ieee.org/stamp/stamp.jsp?arnumber=558251","","Algorithms;Application software;Clocks;Concurrent engineering;Design methodology;Natural languages;Performance analysis;Research and development;Synchronization;Timing","concurrent engineering;formal specification;hardware description languages;high level synthesis;logic CAD","behavioral VHDL specifications;behavioral modeling;concurrent engineering;cycle based analysis;functionality;incomplete specification;incremental refinement;reuse friendly architecture;stepwise refinement;synchronization","","5","","17","","","16-20 Sep 1996","16 Sep 1996-20 Sep 1996","IEEE","IEEE Conference Publications"
"KIR-a graph-based model for description of mixed analog/digital systems","Grimm, C.; Waldschmidt, K.","Dept. of Tech. Inf., Frankfurt Univ., Germany","Design Automation Conference, 1996, with EURO-VHDL '96 and Exhibition, Proceedings EURO-DAC '96, European","20020806","1996","","","568","573","Systems can be described in different time models and on various levels of abstraction. We can distinguish between models in discrete-event, discrete and continuous time. Graph-based formal models allow us to use either discrete event/discrete time models or continuous time models. The combined use of all three time models in one system is the main problem when modeling mixed analog/digital systems. In this paper a graph-based model is presented that supports the use of all three time models in different parts of a graph. This allows digital, discrete-time systems to be modeled together with their analog, physical environment","","0-8186-7573-X","","10.1109/EURDAC.1996.558260","http://ieeexplore.ieee.org/stamp/stamp.jsp?arnumber=558260","","Automata;Continuous time systems;Design automation;Difference equations;Differential equations;Digital systems;Discrete time systems;Formal specifications;Sections","Petri nets;data flow graphs;formal specification;logic CAD","KIR;continuous time;continuous time models;discrete time models;discrete-event;graph-based model;mixed analog/digital systems","","2","","13","","","16-20 Sep 1996","16 Sep 1996-20 Sep 1996","IEEE","IEEE Conference Publications"
"A new HW/SW partitioning algorithm for synthesizing the highest performance pipelined ASIPs with multiple identical FUs","Binh, N.N.; Imai, M.; Shiomi, A.","Dept. of Inf. & Comput. Sci., Osaka Univ., Japan","Design Automation Conference, 1996, with EURO-VHDL '96 and Exhibition, Proceedings EURO-DAC '96, European","20020806","1996","","","126","131","This paper introduces a new HW/SW partitioning algorithm for automatic synthesis of a pipelined CPU architecture with multiple identical functional units (MIFUs) of each type in designing ASIPs (Application Specific Integrated Processors). The partitioning problem is formalized as a combinatorial optimization problem that partitions the operations into hardware and software so that the performance of the designed ASIP is maximized under given gate count and power consumption constraints, regarding the optimal selection of needed FUs of each type. A branch-and-bound algorithm with proposed lower bound function is used to solve the formalized problem. The experimental results show that the proposed algorithm is found to be effective and efficient","","0-8186-7573-X","","10.1109/EURDAC.1996.558194","http://ieeexplore.ieee.org/stamp/stamp.jsp?arnumber=558194","","Algorithm design and analysis;Application software;Application specific processors;Computer architecture;Constraint optimization;Design optimization;Energy consumption;Hardware;Partitioning algorithms;Software performance","application specific integrated circuits;circuit layout CAD;combinatorial mathematics;logic CAD;real-time systems;systems analysis","HW/SW partitioning algorithm;application specific integrated processors;branch-and-bound algorithm;combinatorial optimization problem;functional units;highest performance pipelined ASIPs;multiple identical FUs;partitioning problem;pipelined CPU architecture","","8","","18","","","16-20 Sep 1996","16 Sep 1996-20 Sep 1996","IEEE","IEEE Conference Publications"
"Component selection in resource shared and pipelined DSP applications","Bakshi, S.; Gajski, D.D.; Hsiao-Ping Juan","Dept. of Inf. & Comput. Sci., California Univ., Irvine, CA, USA","Design Automation Conference, 1996, with EURO-VHDL '96 and Exhibition, Proceedings EURO-DAC '96, European","20020806","1996","","","370","375","In general, high performance DSP designs are heavily pipelined and, in order to reduce the pipeline cost, these designs employ techniques such as component selection and resource sharing to select the appropriate number and type of components. We present an algorithm to perform the three tasks of pipelining, resource sharing and component selection, so as to minimize design cost for a given throughput constraint. Experiments conducted on several examples demonstrate the superiority of performing all three tasks, rather than just a combination of any two of these tasks, as done in previously published algorithms","","0-8186-7573-X","","10.1109/EURDAC.1996.558231","http://ieeexplore.ieee.org/stamp/stamp.jsp?arnumber=558231","","Algorithm design and analysis;Clocks;Concurrent computing;Costs;Delay;Digital signal processing;Pipeline processing;Resource management;Scheduling;Throughput","pipeline processing;processor scheduling;resource allocation;signal processing","component selection;high performance DSP designs;pipeline cost;pipelined DSP applications;pipelining;resource shared DSP applications;resource sharing;throughput constraint","","5","","11","","","16-20 Sep 1996","16 Sep 1996-20 Sep 1996","IEEE","IEEE Conference Publications"
"An integrated approach to engineering computer systems","Morris, D.; Evans, D.G.; Green, P.N.","Dept. of Comput., Univ. of Manchester Inst. of Sci. & Technol., UK","Design Automation Conference, 1996, with EURO-VHDL '96 and Exhibition, Proceedings EURO-DAC '96, European","20020806","1996","","","264","269","The paper describes MOOSE a full lifecycle, model based approach to the engineering of computer systems. It describes how early lifecycle models that represent the logical behaviour and architecture of a system can be transformed into representations that allow implementation source for both hardware and software to be synthesised","","0-8186-7573-X","","10.1109/EURDAC.1996.558215","http://ieeexplore.ieee.org/stamp/stamp.jsp?arnumber=558215","","Application software;Communication system control;Control systems;Design engineering;Hardware;Home appliances;Object oriented modeling;Power system modeling;Software performance;Systems engineering and theory","object-oriented programming;virtual machines","MOOSE;Model-based Object Oriented System Engineering;computer systems engineering;early lifecycle models;implementation source synthesis;integrated approach;logical behaviour;model based approach;object oriented programming","","0","","9","","","16-20 Sep 1996","16 Sep 1996-20 Sep 1996","IEEE","IEEE Conference Publications"
