"http://ieeexplore.ieee.org/search/searchresult.jsp?bulkSetSize=2000&queryText%3D.LB..LB.Micro+Electro+Mechanical+Systems%2C+2013.+MEMS+2013..RB.+AND+IEEE+26th+International+Conference+on.RB.",2015/06/23 16:27:09
"Electrokinetically integrated microfluidic isolation and amplification of biomolecule-and cell-binding nucleic acids","Kim, J.; Hilton, J.P.; Yang, K.A.; Pei, R.; Zhu, J.; Stojanovic, M.; Lin, Q.","Dept. of Mech. Eng., Columbia Univ., New York, NY, USA","Micro Electro Mechanical Systems (MEMS), 2013 IEEE 26th International Conference on","20130307","2013","","","1007","1010","This paper presents electrokinetically based microfluidic integration of isolation and amplification of target-binding nucleic acids. A microfluidic device is used that consists of two microchambers for nucleic acid isolation and amplification connected by a microchannel filled with agarose gel. In the device, target-binding DNA strands are isolated and amplified on surfaces while gel-based electrophoresis is used to transfer the strands between chambers, eliminating the need for complicated flow control components. Experimental results show that the device has the potential to rapidly isolate and amplify nucleic acids in random mixtures against a variety of biological targets, such as biomolecules and cells, with increased binding affinity.","1084-6999","978-1-4673-5654-1","","10.1109/MEMSYS.2013.6474418","http://ieeexplore.ieee.org/stamp/stamp.jsp?arnumber=6474418","","DNA;Fluorescence;Heating;Humans;Microfluidics;Proteins;Temperature sensors","DNA;bioMEMS;cellular biophysics;electrophoresis;microchannel flow;mixtures;molecular biophysics;polymer gels","agarose gel;binding affinity;biological targets;biomolecule-binding nucleic acids;cell-binding nucleic acids;complicated flow control components;electrokinetically integrated microfluidic amplification;electrokinetically integrated microfluidic isolation;gel-based electrophoresis;microchambers;microchannel;microfluidic device;random mixtures;target-binding DNA strands;target-binding nucleic acids","","1","","4","","","20-24 Jan. 2013","","IEEE","IEEE Conference Publications"
"Two-port filters and resonators on AlN/3C-SiC plates utilizing high-order Lamb wave modes","Chih-Ming Lin; Yung-Yu Chen; Felmetsge, V.V.; Senesky, D.G.; Pisano, A.P.","Berkeley Sensor & Actuator Center, Univ. of California, Berkeley, Berkeley, CA, USA","Micro Electro Mechanical Systems (MEMS), 2013 IEEE 26th International Conference on","20130307","2013","","","789","792","A composite plate composed of aluminum nitride (AlN) and cubic silicon carbide (3C-SiC) is a promising mechanical structure that enables high-frequency Lamb wave devices since the 3C-SiC plate can effectively increase coupling of high-order Lamb wave modes and reduce steep phase velocity dispersion simultaneously. In this study, two-port filters and resonators utilizing various Lamb wave modes in the AlN/3C-SiC composite plate are microfabricated on 2.5-μm-thick AlN films deposited on various thicknesses of 3C-SiC layers. Intriguingly, the experimental results show that some Lamb wave modes are suitable for two-port resonator topology whereas some others are applicable for two-port filter topology due to different wave propagation characteristics.","1084-6999","978-1-4673-5654-1","","10.1109/MEMSYS.2013.6474361","http://ieeexplore.ieee.org/stamp/stamp.jsp?arnumber=6474361","","Acoustic waves;Aluminum nitride;Films;Frequency measurement;Resonator filters;Silicon;Topology","III-V semiconductors;aluminium compounds;composite materials;microfabrication;network topology;silicon compounds;surface acoustic wave resonator filters;thick film circuits;two-port networks;wide band gap semiconductors","AlN-SiC;composite plate;high-order Lamb wave mode;mechanical structure;microfabrication;size 2.5 mum;steep phase velocity dispersion reduction;thick film deposition;two-port filter;two-port resonator topology;wave propagation characteristics","","3","","14","","","20-24 Jan. 2013","","IEEE","IEEE Conference Publications"
"Quantitative evaluation of the influence of dopaminergic neuron on flapping locomotion","Azuma, K.; Takahashi, H.; Kan, T.; Tanimura, J.; Ito, K.; Matsumoto, K.; Shimoyama, I.","Univ. of Tokyo, Tokyo, Japan","Micro Electro Mechanical Systems (MEMS), 2013 IEEE 26th International Conference on","20130307","2013","","","5","8","This paper reports on quantitative evaluation of influence of dopamine neurons on the flight locomotion of a fruit fly (Drosophila menanogaster). The aerodynamic force was measured by MEMS triaxial forcesensor. We compared the aerodynamic force of the genetically modified flies whose dopamine neurons (DDCII) are functionally blocked with that of the wild type ones. The peak aerodynamic force generated by wild type flies was controlled smoothly. By contrast, the peak aerodynamic force generated by genetically modified flies showed rough fluctuation. The Peak variability of the wild type flies and genetically modified flies were 0.06 ± 0.04 and 0.18 ± 0.14 [-] (Average ± S.D.), respectively. The result indicated that the DDCII-expressing dopamine neurons were necessary to control their flapping flight.","1084-6999","978-1-4673-5654-1","","10.1109/MEMSYS.2013.6474162","http://ieeexplore.ieee.org/stamp/stamp.jsp?arnumber=6474162","","Aerodynamics;Force;Force measurement;Force sensors;Neurons;Probes;Silicon","aerodynamics;bioMEMS;biomimetics;brain;force measurement;force sensors;neurophysiology","DDCII-expressing dopamine neurons;Drosophila menanogaster;MEMS triaxial forcesensor;aerodynamic force;flapping flight;flapping locomotion;flight locomotion;fruit fly;genetically modified flies;quantitative evaluation;rough fluctuation;wild type flies","","0","","6","","","20-24 Jan. 2013","","IEEE","IEEE Conference Publications"
"Anterior and posterior tongue activity sensor based on triaxial force sensor","Takei, Y.; Noda, K.; Kawai, T.; Tachimura, T.; Toyama, Y.; Takai, M.; Matsumoto, K.; Shimoyama, I.","Univ. of Tokyo, Tokyo, Japan","Micro Electro Mechanical Systems (MEMS), 2013 IEEE 26th International Conference on","20130307","2013","","","1093","1096","In this research, we fabricated triaxial force sensors which can measure tongue activities. In order to analyze the role of tongue activity of front part (anterior tongue) and back part (posterior) of the tongue, we fixed two triaxial force sensors to the palate. Our triaxial force sensors also have temperature sensors, which can measure the temperature change in the mouth so that temperature drift of the force sensors output can be compensated. In the liquid-swallowing experiment, pressure and shear force distributions were observed to clarify tongue motion. We measured and calculated anterior and posterior tongue activities during swallowing, and found that anterior tongue activity was larger than posterior tongue activity. These results indicated that the anterior tongue works as an anchor and the posterior tongue works as an actuator which transports the food or liquid to the throat.","1084-6999","978-1-4673-5654-1","","10.1109/MEMSYS.2013.6474440","http://ieeexplore.ieee.org/stamp/stamp.jsp?arnumber=6474440","","Force sensors;Liquids;Temperature measurement;Temperature sensors;Tongue;Viscosity;Wiring","biomedical measurement;biotransport;force measurement;force sensors;muscle;temperature measurement;temperature sensors","actuator;anterior tongue activity sensor;food;liquid-swallowing experiment;mouth;posterior tongue activity sensor;pressure force distributions;shear force distributions;temperature sensors;throat;tongue activity measurement;tongue motion;triaxial force sensor","","1","","15","","","20-24 Jan. 2013","","IEEE","IEEE Conference Publications"
"A new pathogen detection system by utlizing nanogold modified specific probe and vancomycin coated magnetic beads on an integrated microfluidic device","Chih-Hung Wang; Chia-Jung Chang; Jiunn-Jong Wu; Gwo-Bin Lee","Dept. of Power Mech. Eng., Nat. Tsing Hua Univ., Hsinchu, Taiwan","Micro Electro Mechanical Systems (MEMS), 2013 IEEE 26th International Conference on","20130307","2013","","","94","97","A simple, novel assay for pathogen diagnosis was implemented on a new integrated microfluidic system using a nanogold modified DNA probe and vancomycin conjugated magnetic beads. The developed microfluidic device was fabricated by microfluidic technology and composed of many micro-modules. The pneumatically-driven, suction-type micropump, microvalves, microchannels and loading chambers were integrated on a single chip to automate the entire diagnosis process. The bacteria were captured by vancomycin conjugated magnetic beads and hybridized with specific nanogold probe. The diagnostic results were determined simply with color change of nanogold by visually bare-eye observation and may be detected optically if necessary. The whole analytic processes only need 25 min from sample and reagent added to results obtained. The developed platform may provide a promising tool for fast diagnosis of bacterial infections.","1084-6999","978-1-4673-5654-1","","10.1109/MEMSYS.2013.6474185","http://ieeexplore.ieee.org/stamp/stamp.jsp?arnumber=6474185","","Color;DNA;Microfluidics;Microorganisms;Nanobioscience;Pathogens;Probes","DNA;bioMEMS;biomedical equipment;cellular biophysics;drugs;microchannel flow;microfabrication;microorganisms;micropumps;microvalves;molecular biophysics;nanomedicine;patient diagnosis","bacterial infections;hybridization;integrated microfluidic device;microchannel chambers;microfabrication;micropump;microvalve;nanogold modified DNA probe;optical detection;pathogen detection system;pathogen diagnosis;pneumatically-driven chambers;suction-type chambers;time 25 min;vancomycin coated magnetic beads;vancomycin conjugated magnetic beads;visually bare-eye observation","","0","","5","","","20-24 Jan. 2013","","IEEE","IEEE Conference Publications"
"Methods for the microfabrication of magnesium","Tsang, M.; Herrault, F.; Shafer, R.H.; Allen, M.G.","Sch. of Biomed. Eng., Georgia Inst. of Technol., Atlanta, GA, USA","Micro Electro Mechanical Systems (MEMS), 2013 IEEE 26th International Conference on","20130307","2013","","","347","350","The mechanical and electrochemical properties of magnesium are favorable for biomedical and energy storage applications. However, magnesium microfabrication has been limited to sub-micron-thick film technologies (i.e., sputtering or evaporation). This paper presents three magnesium microfabrication approaches for thicknesses greater than 10 μm: 1) laser-cutting and 2) chemical etching of 70-μm-thick commercial magnesium foil; and 3) through-mold electroplating of magnesium from non-aqueous solution. The fabrication technologies are compared on minimum feature size, morphology, uniformity, composition and electrical resistivity. Preliminary results confirmed that the 50-μm-thick electroplated material composition compared favorably with commercial magnesium foil. The measured electrical resistivities of commercial and electrodeposited magnesium were 5.3 μΩ·cm and 8.7 μΩ·cm, respectively. Thick magnesium microstructures can be fabricated through several means to serve a broad range of MEMS-based applications.","1084-6999","978-1-4673-5654-1","","10.1109/MEMSYS.2013.6474249","http://ieeexplore.ieee.org/stamp/stamp.jsp?arnumber=6474249","","Chemical lasers;Chemicals;Etching;Magnesium;Microstructure;Surface morphology","electrical resistivity;electroplating;etching;laser beam cutting;magnesium;microfabrication;micromechanical devices","MEMS-based applications;Mg;biomedical application;chemical etching;electrical resistivity;electrochemical properties;electroplated material composition;energy storage application;evaporation;feature size;laser-cutting;magnesium foil;magnesium microfabrication method;magnesium microstructures;mechanical properties;morphology;nonaqueous solution;size 50 mum;size 70 mum;sputtering;submicron-thick film technologies;through-mold electroplating","","3","","13","","","20-24 Jan. 2013","","IEEE","IEEE Conference Publications"
"Metal/silicon dioxide microtube improves optical and electrical properties of neuroprobe","Nakamura, T.; Sakata, M.; Goryu, A.; Ishida, M.; Kawano, T.","Dept. of Electr. & Electron. Inf. Eng., Toyohashi Univ. of Technol., Toyohashi, Japan","Micro Electro Mechanical Systems (MEMS), 2013 IEEE 26th International Conference on","20130307","2013","","","1097","1100","Here we report vertical metal/silicon dioxide (SiO<sub>2</sub>) multiwalled microtube arrays as electrical and optical neuroprobes for “optogenetic”. Three-dimensional metal/SiO<sub>2</sub>-microtube arrays can be fabricated by vapor-liquid-solid (VLS) growth of silicon-wire, followed by the SiO<sub>2</sub>/metal depositions and the core-silicon etching. As the inside metal, we use iridium (Ir) with a low electrical electrolyte/electrode interfacial impedance in saline. An optical propagation through the Ir/SiO<sub>2</sub>-tube calculated by finite-difference time-domain (FDTD) method clearly indicates the effect of the inside Ir on the improved locality of light stimuli with the spot diameter of <; 3 μm. These results suggest that the Ir/SiO<sub>2</sub>-microtube array provides the low-impedance electrode and local optical stimuli with a same alignment, promising a new class of multifunctional neuroprobes for optogenetic.","1084-6999","978-1-4673-5654-1","","10.1109/MEMSYS.2013.6474441","http://ieeexplore.ieee.org/stamp/stamp.jsp?arnumber=6474441","","Electron tubes;Impedance;Metals;Optical device fabrication;Optical propagation;Optical recording;Stimulated emission","bio-optics;bioMEMS;bioelectric phenomena;biomedical electrodes;electrolytes;etching;finite difference time-domain analysis;genetics;iridium;liquid phase deposition;microelectrodes;microfabrication;neurophysiology;silicon compounds","FDTD;Ir-SiO<sub>2</sub>;core-silicon etching;electrical electrolyte-electrode interfacial impedance;electrical properties;finite-difference time-domain method;light stimuli;local optical stimuli;low-impedance electrode;multifunctional neuroprobes;optical propagation;optical properties;optogenetics;saline;spot diameter;three-dimensional metal-silicon dioxide-microtube arrays;vapor-liquid-solid growth;vertical metal-silicon dioxide multiwalled microtube arrays","","0","","7","","","20-24 Jan. 2013","","IEEE","IEEE Conference Publications"
"Microassembly of MEMS actuators and sensors via micro-masonry","Zhang, Y.; Keum, H.; Kim, S.","Univ. of Illinois at Urbana-Champaign, Champaign, IL, USA","Micro Electro Mechanical Systems (MEMS), 2013 IEEE 26th International Conference on","20130307","2013","","","283","286","Micro-masonry is a microassembly technique that is based on transfer printing and direct bonding. This paper presents the assembly of MEMS mechanical sensors and actuators based on this micro-masonry technique. Microfabrication processes for retrievable MEMS components (e.g., combs, flexure beams, and metal pads) are developed. As manipulation tools, elastomeric microtipped stamps with switchable dry adhesion are also designed and fabricated to pick up and place those components. After the assembly, the components are permanently bonded together via rapid thermal annealing. The sensing and actuating capabilities of the assembled MEMS devices are characterized.","1084-6999","978-1-4673-5654-1","","10.1109/MEMSYS.2013.6474233","http://ieeexplore.ieee.org/stamp/stamp.jsp?arnumber=6474233","","Adhesives;Assembly;Fingers;Gold;Micromechanical devices;Resists;Substrates","bonding processes;microactuators;microassembling;microfabrication;microsensors;rapid thermal annealing","MEMS devices;MEMS mechanical actuators;MEMS mechanical sensors;direct bonding;elastomeric microtipped stamps;manipulation tool;microassembly technique;microfabrication process;micromasonry technique;rapid thermal annealing;retrievable MEMS components;switchable dry adhesion;transfer printing","","0","","17","","","20-24 Jan. 2013","","IEEE","IEEE Conference Publications"
"Horizontal lipid bilayers formed by droplets contact method on patterned micro-droplets","Tonooka, T.; Sato, K.; Kawano, R.; Osaki, T.; Takeuchi, S.","Inst. of Ind. Sci., Univ. of Tokyo, Tokyo, Japan","Micro Electro Mechanical Systems (MEMS), 2013 IEEE 26th International Conference on","20130307","2013","","","1015","1016","We developed horizontal lipid bilayers by the Droplets Contact Method (DCM). DCM is the easiest and most efficient method to form lipid bilayers. However, the lipid bilayers formed by our previous method could not be used for simultaneous electrophysiological and optical measurements because the bilayers are vertically oriented and therefore optically invisible. We performed DCM on patterned micro-droplets, so that the horizontal lipid bilayers were obtained. We visualized the lipid bilayer formation by an optical microscope and detected the current signals of the pore-forming membrane protein, α-hemolysin.","1084-6999","978-1-4673-5654-1","","10.1109/MEMSYS.2013.6474420","http://ieeexplore.ieee.org/stamp/stamp.jsp?arnumber=6474420","","Aluminum;Electrodes;Glass;Gold;Lipidomics;Proteins;Substrates","bioelectric phenomena;biotechnology;drops;lab-on-a-chip;lipid bilayers;molecular biophysics;optical microscopy;proteins","α-hemolysin;current signal detection;droplet contact method;electrophysiological measurements;horizontal lipid bilayers;optical measurements;optical microscopy;patterned microdroplets;pore-forming membrane protein","","0","","4","","","20-24 Jan. 2013","","IEEE","IEEE Conference Publications"
"An electromagnetic energy harvester for low frequency and low-g vibrations with a modified frequency up conversion method","Zorlu, O.; Turkyilmaz, S.; Muhtaroglu, A.; Kulah, H.","METU MEMS Center, Middle East Tech. Univ., Ankara, Turkey","Micro Electro Mechanical Systems (MEMS), 2013 IEEE 26th International Conference on","20130307","2013","","","805","808","This paper presents a MEMS-based electromagnetic (EM) energy harvester for low frequency and low acceleration vibrations. The harvester is an improved version of [1], which operates with the frequency up conversion (FupC) principle. The former structure was composed of a low-frequency diaphragm carrying a magnet and 16 high-frequency cantilevers with coils. In this work, the phase difference between the coil outputs, leading to voltage cancellation in serial connection, has been eliminated by using a single coil placed on a diaphragm. Furthermore, the placement and the volume of the magnetic film have been modified for better magnetic coupling. The RMS values of the generated voltage and delivered power to an equivalent resistive load have been measured as 6.94 mV and 1.2 nW, respectively with 10 Hz, 3 mm peak to peak vibrations (0.6 g acceleration). About 32-fold increase in the peak power output has been demonstrated with the presented energy harvester with respect to the previous work.","1084-6999","978-1-4673-5654-1","","10.1109/MEMSYS.2013.6474365","http://ieeexplore.ieee.org/stamp/stamp.jsp?arnumber=6474365","","Coils;Magnetic films;Magnetic flux;Magnetic resonance;Nickel;Vibrations","cantilevers;coils;electromagnetic waves;energy harvesting;micromechanical devices;vibrations","FupC principle;MEMS-based electromagnetic energy harvester;RMS values;acceleration vibrations;electromagnetic energy harvester;frequency 10 Hz;frequency up conversion principle;high-frequency cantilevers;low-G vibrations;low-frequency diaphragm;magnetic coupling;magnetic film;modified frequency up conversion method;power 1.2 nW;serial connection;voltage 6.94 mV;voltage cancellation;wavelength 3 mm","","0","","7","","","20-24 Jan. 2013","","IEEE","IEEE Conference Publications"
"Linear actuation piezoelectric microcantilever using tetragonal composition PZT thin films","Kobayashi, T.; Makimoto, N.; Oikawa, T.; Wada, A.; Funakubo, H.; Maeda, R.","Nat. Inst. of Adv. Ind. Sci. & Technol. (AIST), Tsukuba, Japan","Micro Electro Mechanical Systems (MEMS), 2013 IEEE 26th International Conference on","20130307","2013","","","413","416","We have fabricated piezoelectric microcantilevers using tetragonal composition Pb(Zr<sub>0.3</sub>, Ti<sub>0.7</sub>)O<sub>3</sub> (tetra-PZT) thin films and characterized their displacement-voltage behavior under AC actuation condition. The remnant polarization, coercive voltage and piezoelectric constant d<sub>31</sub> of the tetra-PZT thin films have increased to 65.5 μC/Cm<sup>2</sup>, 20 V, and -42 pm/V by applying AC voltage of 80 V as ""wakeup"" treatment. The fabricated piezoelectric microcantilevers using tetra-PZT thin films have successfully demonstrated linear displacement-voltage behavior under AC actuation condition between -15 V to 15 V.","1084-6999","978-1-4673-5654-1","","10.1109/MEMSYS.2013.6474266","http://ieeexplore.ieee.org/stamp/stamp.jsp?arnumber=6474266","","Decision support systems","cantilevers;microfabrication;micromechanical devices;piezoelectric devices;thin films","AC actuation condition;coercive voltage;linear actuation piezoelectric microcantilever fabrication;linear displacement-voltage behavior;piezoelectric constant;remnant polarization;tetra-PZT thin films;tetragonal composition PZT thin films;voltage 20 V;voltage 80 V","","0","","8","","","20-24 Jan. 2013","","IEEE","IEEE Conference Publications"
"Cell detection using a CMOS image sensor with modified pixel structure suitable for bio-chemical surface activation","Musayev, J.; Adiguzel, Y.; Kulah, H.; Eminoglu, S.; Akin, T.","METU-MEMS Res. & Applic. Center, Ankara, Turkey","Micro Electro Mechanical Systems (MEMS), 2013 IEEE 26th International Conference on","20130307","2013","","","941","944","This paper presents a CMOS image sensor with a 32 × 32 pixel array suitable for cell capture, detection, and quantification. Pixels measuring 15 μm × 15 μm have a modified structure, suitable for post-CMOS electroless gold plating, which enables surface activation for cell capture without the need for any intermediate layer. This structure also increases the detection probability of captured cells as opposed to non-captured ones, owing to a special light mask (metal shield) implemented on pixels. The light mask enables detection of cells as small as 3 μm in diameter despite the larger pixel size. The proof of concept is demonstrated in this work by imaging yeast cells adsorbed on the sensor surface.","1084-6999","978-1-4673-5654-1","","10.1109/MEMSYS.2013.6474400","http://ieeexplore.ieee.org/stamp/stamp.jsp?arnumber=6474400","","Arrays;Gold;Imaging;Lighting;Noise;Photonics","CMOS image sensors;adsorption;biochemistry;biomedical engineering;cellular biophysics;microorganisms","CMOS image sensor;biochemical surface activation;cell capture;cell detection;cell quantification;postCMOS electroless gold plating;size 3 mum;surface activation;yeast cell adsorption imaging","","0","","6","","","20-24 Jan. 2013","","IEEE","IEEE Conference Publications"
"Design, fabrication and characterization of a suspended plate mechano-optical modulator","Nawazuddin, M.B.S.; De Boer, M.; Berenschot, J.W.; Ma, K.C.; Elwenspoek, M.; Wiegerink, R.J.","MESA+ Inst. for Nanotechnol., Univ. of Twente, Enschede, Netherlands","Micro Electro Mechanical Systems (MEMS), 2013 IEEE 26th International Conference on","20130307","2013","","","560","563","A mechano-optical modulator is presented based on the Integrated Optical Nano-Mechanical (IONM) effect [1]. It consists of a light-weight, rigid silicon-nitride suspended plate structure with strengthening ridges and bi-directional electrostatic actuation to maximize switching speed. The mechanical structure and optical waveguide are realized on separate chips and then assembled together resulting in hybrid integration. The latter is made possible by using a self-alignment technique which results in a misalignment error of at most 2 μm.","1084-6999","978-1-4673-5654-1","","10.1109/MEMSYS.2013.6474303","http://ieeexplore.ieee.org/stamp/stamp.jsp?arnumber=6474303","","Optical device fabrication;Optical filters;Optical modulation;Optical sensors;Optical surface waves;Optical waveguides","electrostatic actuators;nanoelectromechanical devices;optical waveguides;silicon compounds","IONM effect;SiN;bi-directional electrostatic actuation;hybrid integration;integrated optical nanomechanical effect;light-weight suspended plate structure;mechanical structure;mechano-optical modulator;optical waveguide;rigid silicon-nitride suspended plate structure;separate chips;strengthening ridges;switching speed","","0","","8","","","20-24 Jan. 2013","","IEEE","IEEE Conference Publications"
