"http://ieeexplore.ieee.org/search/searchresult.jsp?bulkSetSize=2000&queryText%3D.LB..LB.Micro+Electro+Mechanical+Systems%2C+2013.+MEMS+2013..RB.+AND+IEEE+26th+International+Conference+on.RB.",2015/06/23 16:27:09
"Endoscopic optical probes for linear and rotational scanning","Weber, N.; Zappe, H.; Seifert, A.","Dept. of Microsyst. Eng., Univ. of Freiburg, Freiburg, Germany","Micro Electro Mechanical Systems (MEMS), 2013 IEEE 26th International Conference on","20130307","2013","","","1065","1068","Two fully integrated optical microprobes, based on an advanced silicon optical bench (SiOB) technology, are developed for endoscopic OCT (optical coherence tomography). The probes incorporate diverse optical components and scan mechanics, such as magnetostatic micromirrors and rotating prisms, to realize linear side-looking and rotational scanning. The outer diameter of the assembled systems is below 2.75 mm allowing integration into the 3mm working channels of commercial endoscopes.","1084-6999","978-1-4673-5654-1","","10.1109/MEMSYS.2013.6474433","http://ieeexplore.ieee.org/stamp/stamp.jsp?arnumber=6474433","","Magnetic resonance imaging;Magnetostatics;Optical device fabrication;Optical imaging;Probes;Silicon","biomedical optical imaging;elemental semiconductors;endoscopes;integrated optics;micromirrors;optical prisms;optical tomography;silicon","Si;advanced silicon optical bench technology;assembled systems;commercial endoscopes;diverse optical components;endoscopic OCT;endoscopic optical probes;fully integrated optical microprobes;linear scanning;linear side-looking;magnetostatic micromirrors;optical coherence tomography;rotating prisms;rotational scanning;scan mechanics;size 3 mm;working channels","","1","","3","","","20-24 Jan. 2013","","IEEE","IEEE Conference Publications"
"Different optical images for optically-induced electroporation of multiple gene transfection","You-Hsun Lee; Chih-Hung Wang; Gwo-Bin Lee","Dept. of Power Mech. Eng., Nat. Tsing Hua Univ., Hsinchu, Taiwan","Micro Electro Mechanical Systems (MEMS), 2013 IEEE 26th International Conference on","20130307","2013","","","907","910","Gene transfection plays an important role in biological researches, especially in the development of induced pluripotent stem cells (iPS). In this work, an optically-induced electroporation method for gene transfection by using a microfluidic platform was presented. Electroporation can be induced by illuminating an optical image on a photoconductive layer when the top and the bottom substrates were applied with an electric field. One of the most important factors that affected efficiency of optically-induced gene transfection was the optical patterns illuminating on the chip. Therefore, a series of various optical patterns, including multiple circles, squares, and triangles, were tested in order to enhance the efficiency of gene transfection. Consequently, the pattern of multiple triangular spots was experimentally confirmed to have the highest efficiency of gene transfection. In addition, three fluorescence carried plasmids could be successfully transfected into different types of cells by using the developed optically-induced electroporation platform at the same time. The developed microfluidic system may be promising for iPS research.","1084-6999","978-1-4673-5654-1","","10.1109/MEMSYS.2013.6474391","http://ieeexplore.ieee.org/stamp/stamp.jsp?arnumber=6474391","","Biomedical optical imaging;Cells (biology);DNA;Electric fields;Indium tin oxide;Microfluidics;Optical imaging","bioMEMS;biomedical optical imaging;cellular biophysics;fluorescence;genetics;microfluidics","biological researches;bottom substrates;fluorescence;iPS research;induced pluripotent stem cells;microfluidic platform;multiple gene transfection;multiple triangular spots;optical images;optical pattern illumination;optically-induced electroporation method;photoconductive layer;plasmids;top substrates","","0","","3","","","20-24 Jan. 2013","","IEEE","IEEE Conference Publications"
"Monolithically-fabricated laminated inductors with electrodeposited silver windings","Minsoo Kim; Herrault, F.; Jooncheol Kim; Allen, M.G.","Sch. of Electr. & Comput. Eng., Georgia Inst. of Technol., Atlanta, GA, USA","Micro Electro Mechanical Systems (MEMS), 2013 IEEE 26th International Conference on","20130307","2013","","","873","876","This paper presents batch microfabrication and experimental characterization of solenoid inductors with electrodeposited silver windings and laminated core. To enable high-frequency operation, the metallic magnetic core consists of multiple air-insulated, electroplated micron-thick permalloy (Ni<sub>80</sub>Fe<sub>20</sub>) laminations, with total core thicknesses up to tens of microns. The core is achieved by sequential electrodeposition of permalloy and copper, followed by selective removal of the copper, thereby releasing the core laminations. Electroplated silver is selected as winding material for its low resistivity and to withstand the copper etching required during core release. Release of the core laminations is the final inductor fabrication step, reducing potential process-induced damage to the core. Two inductors sharing one laminated core in a transformer geometry are fabricated, and exhibit inductances of approximately 100 nH at 5 MHz, resulting in an inductance density of 29 nH/mm<sup>2</sup>. This process demonstrates processing compatibility of using silver windings with highly-laminated, fully-integrated magnetics.","1084-6999","978-1-4673-5654-1","","10.1109/MEMSYS.2013.6474382","http://ieeexplore.ieee.org/stamp/stamp.jsp?arnumber=6474382","","Conductors;Copper;Fabrication;Inductors;Magnetic cores;Silver;Windings","Permalloy;copper;electrodeposition;etching;inductors;laminations;microfabrication;silver;solenoids;transformer cores","batch microfabrication;copper etching;copper selective removal;core lamination release;core thicknesses;electrodeposited silver windings;electroplated micron-thick permalloy lamination;electroplated silver;frequency 5 MHz;high-frequency operation;highly-laminated fully-integrated magnetics;inductance density;inductor fabrication step;metallic magnetic core;monolithically-fabricated laminated inductors;multiple-air-insulated lamination;permalloy-copper sequential electrodeposition;potential process-induced damage;processing compatibility;silver windings;solenoid inductors;transformer geometry;winding material","","2","","10","","","20-24 Jan. 2013","","IEEE","IEEE Conference Publications"
"A novel drug delivery method by using a microrobot incorporated with an acoustically oscillating bubble","Kwon, J.O.; Ji Sun Yang; Jeong Byung Chae; Sang Kug Chung","Myongji Univ., Yongin, South Korea","Micro Electro Mechanical Systems (MEMS), 2013 IEEE 26th International Conference on","20130307","2013","","","1157","1160","This paper presents an untethered microrobot swimming in human blood vessels through electromagnetic actuation to manipulate bio/micro-objects using an acoustically oscillating bubble attached on the microrobot as a grasping tool. First, for the three-dimensional (3D) propulsion of the microrobot in arbitrary shaped blood vessels, an electromagnetic system consisting of the horizontal and vertical pairs of Helmholtz and Maxwell electric coils is designed and manufactured along with the verification of the magnetic flux density generated from the designed system with theory. Using the developed electromagnetic system, the propulsion of a spherical microrobot (800 μm dia.) made of a cylindrical magnet covered with clay is successfully demonstrated in x-y and x-z plains along with a T-shaped glass channel. Second, an acoustically oscillating bubble induced microstreaming is separately investigated by using a high speed camera integrated with a zoom lens and laser as a light source. When a bubble is acoustically excited by a piezoactuator around its natural frequency, it oscillates and simultaneously generates microstreaming and radiation forces, which can be used to manipulate (pull and push) neighboring objects. Finally, as the concept proof, the manipulation of a fish egg (800 μm dia.) in a microfabricated channel with tandem rectangular hills is experimentally achieved by the microrobot incorporated with an acoustically oscillating bubble.","1084-6999","978-1-4673-5654-1","","10.1109/MEMSYS.2013.6474456","http://ieeexplore.ieee.org/stamp/stamp.jsp?arnumber=6474456","","Blood vessels;Coils;Drug delivery;Electromagnetic launching;Electromagnetics;Magnetoacoustic effects;Marine animals","blood vessels;bubbles;drug delivery systems;electromagnetic actuators;microactuators;micromanipulators;microrobots;piezoelectric actuators;propulsion","3D propulsion;Helmholtz electric coils;Maxwell electric coils;T-shaped glass channel;acoustically oscillating bubble induced microstreaming;arbitrary shaped blood vessels;bioobject manipulation;cylindrical magnet;drug delivery method;electromagnetic actuation;electromagnetic system;fish egg manipulation;grasping tool;high speed camera;human blood vessels;laser;light source;magnetic flux density;microfabricated channel;microobject manipulation;piezoactuator;radiation forces;spherical microrobot;tandem rectangular hills;three-dimensional propulsion;untethered microrobot swimming;zoom lens","","0","","14","","","20-24 Jan. 2013","","IEEE","IEEE Conference Publications"
"Ald aluminum oxide as protective coating against oxidation of LPCVD SiC microhotplates","Morana, B.; Fiorentino, G.; Pandraud, G.; Creemer, J.F.; Sarro, P.M.","ECTM-DIMES, Delft Univ. of Technol., Delft, Netherlands","Micro Electro Mechanical Systems (MEMS), 2013 IEEE 26th International Conference on","20130307","2013","","","484","487","Here we present a method to strongly reduce the oxidation of conductive polycrystalline silicon carbide (poly-SiC) layers. We employed a thin (45 nm) layer of aluminum oxide (Al<sub>2</sub>O<sub>3</sub>) as protective coating against oxidation. This layer was deposited by atomic layer deposition (ALD) to achieve a high quality and conformal coating. Microheaters made of nitrogen doped poly-SiC (poly-SiC:N) were oxidized at elevated temperatures in both wet and dry atmospheres. Electrical characterizations of the microheaters show that the proposed coating is able to reduce the oxide growth by a factor of 11 for wet oxidation at 1000 °C.","1084-6999","978-1-4673-5654-1","","10.1109/MEMSYS.2013.6474284","http://ieeexplore.ieee.org/stamp/stamp.jsp?arnumber=6474284","","Aluminum oxide;Coatings;Oxidation;Silicon;Silicon carbide;Temperature;Temperature measurement","aluminium compounds;atomic layer deposition;electrical resistivity;micromechanical devices;nitrogen;oxidation;protective coatings;semiconductor growth;silicon compounds;wide band gap semiconductors","Al<sub>2</sub>O<sub>3</sub>;MEMS;SiC:N;aluminum oxide;atomic layer deposition;electrical properties;microheaters;microhotplates;nitrogen doped conductive polycrystalline silicon carbide layers;protective coating;size 45 nm;temperature 1000 degC;wet oxidation","","0","","9","","","20-24 Jan. 2013","","IEEE","IEEE Conference Publications"
"A handheld, cell phone-based electrochemical biodetector","Lillehoj, P.B.; Huang, M.-C.; Ho, C.-M.","Michigan State Univ., East Lansing, MI, USA","Micro Electro Mechanical Systems (MEMS), 2013 IEEE 26th International Conference on","20130307","2013","","","53","56","We present a handheld, biomolecular detector based on a cell phone platform. This prototype integrates a conventional smart phone with a custom electrical circuit and a microfluidic chip, which enables a portable, lightweight biodetection system. An electrochemical detection scheme is utilized, allowing for rapid (<; 20 min), high sensitivity, analytical measurements. As proof of concept, Plasmodium falciparum histidine-rich protein 2 (PfHRP2) was detected in buffer solution, with a lower limit of detection of 16 ng/mL. Based on its compact size and high performance characteristics, this cell phone biodetector is highly suitable for use in remote locations for multiple applications including disease diagnosis, water quality monitoring and pathogen/toxin detection.","1084-6999","978-1-4673-5654-1","","10.1109/MEMSYS.2013.6474174","http://ieeexplore.ieee.org/stamp/stamp.jsp?arnumber=6474174","","Biomedical measurement;Cellular phones;Microfluidics;Proteins;Semiconductor device measurement;Substrates;Universal Serial Bus","bioMEMS;bioelectric phenomena;biological techniques;biology computing;biosensors;cellular biophysics;diseases;electrochemical sensors;microfabrication;microfluidics;microorganisms;molecular biophysics;portable instruments;proteins;smart phones","analytical measurements;biomolecular detector;buffer solution;cell phone platform;cell phone-based electrochemical biodetector;compact size;conventional smart phone;custom electrical circuit;disease diagnosis;high performance characteristics;lightweight biodetection system;low detection limit;microfluidic chip;pathogen-toxin detection;plasmodium falciparum histidine-rich protein 2;portable biodetection system;remote locations;water quality monitoring","","0","","14","","","20-24 Jan. 2013","","IEEE","IEEE Conference Publications"
"Graphene based digital microfluidics","Tan, X.B.; Zeng, P.; Yi, W.W.; Cheng, M.M.C.","Electr. & Comput. Eng., Wayne State Univ., Detroit, MI, USA","Micro Electro Mechanical Systems (MEMS), 2013 IEEE 26th International Conference on","20130307","2013","","","1195","1198","We demonstrated a novel electrowetting-on-dielectric (EWOD) device for digital microfluidic using a flexible, transparent, and conducting graphene electrode. We showed that a graphene electrode had a lower leakage current and a higher breakdown voltage compared to a gold electrode when they were under the same dielectric layer such as Teflon. The droplet movement was manipulated on graphene-based EWOD using a sequential switching voltage controlled by a programmable logic controller (PLC) relay array.","1084-6999","978-1-4673-5654-1","","10.1109/MEMSYS.2013.6474466","http://ieeexplore.ieee.org/stamp/stamp.jsp?arnumber=6474466","","Copper;Dielectrics;Electrodes;Gold;Graphene;Leakage current;Microfluidics","electric breakdown;graphene;leakage currents;microelectrodes;microfluidics;programmable controllers;sequential switching","C;PLC relay array;Teflon;breakdown voltage;dielectric layer;electrowetting-on-dielectric device;gold electrode;graphene based digital microfluidics;graphene electrode;graphene-based EWOD device;leakage current;programmable logic controller relay array;sequential switching voltage","","0","","8","","","20-24 Jan. 2013","","IEEE","IEEE Conference Publications"
"In-liquid MEMS assembly by optical trapping","Gullo, M.R.; Jacot-Descombes, L.; Brugger, J.","Microsyst. Lab., Ecole Polytech. Fed. de Lausanne (EPFL), Lausanne, Switzerland","Micro Electro Mechanical Systems (MEMS), 2013 IEEE 26th International Conference on","20130307","2013","","","78","81","This paper presents a novel in-liquid method to manipulate and micro-assemble MEMS in 3D by means of holographic optical trapping and hydrophobic interaction. Up to eight traps can be simultaneously generated with a trapping stiffness of 5 pN/μm each. SU8 cylinders (10μm diameter, 10μm-40μm height) were used as test MEMS, which could be translated with a speed of 6μm/s and rotated at 30 rpm. All forces were calibrated by video tracking the Brownian motion of the trapped MEMS and applying Boltzmann statistics. Selected surfaces of the MEMS parts were rendered hydrophobic and used as assembly sites. Using this approach it was possible to permanently assemble SU8 cylinders.","1084-6999","978-1-4673-5654-1","","10.1109/MEMSYS.2013.6474181","http://ieeexplore.ieee.org/stamp/stamp.jsp?arnumber=6474181","","Assembly;Biomedical optical imaging;Charge carrier processes;Holographic optical components;Holography;Micromechanical devices;Optical device fabrication","Boltzmann equation;Brownian motion;calibration;electronic engineering computing;holographic optical elements;hydrophobicity;image motion analysis;microassembling;microfabrication;micromechanical devices;radiation pressure;statistics","3D holographic optical trapping;3D microassemble MEMS;Boltzmann statistics;Brownian motion;MEMS testing;SU8 cylinder;calibration;hydrophobic interaction;in-liquid MEMS assembly method;manipulation;size 10 mum to 40 mum;trapping stiffness;velocity 6 mum/s;video tracking","","0","","7","","","20-24 Jan. 2013","","IEEE","IEEE Conference Publications"
"Investigation on the thickness effect of a hydrophobic layer for operating voltage reduction in EWOD systems","Jeong Byung Chae; Kwon, J.O.; Ji Sun Yang; Kyehan Rhee; Sang Kug Chung","Myongji Univ., Yongin, South Korea","Micro Electro Mechanical Systems (MEMS), 2013 IEEE 26th International Conference on","20130307","2013","","","1109","1112","This paper studies the optimum thickness of a hydrophobic layer for operating voltage reduction in electrowetting-on-dielectric (EWOD) systems by investigating the thickness effect on the surface wettability and hysteresis using an atomic force microscopy (AFM). To investigate the surface wettability, the thicknesses of Cytop and Teflon layers coated with different weight percent of Cytop and Teflon solutions are precisely measured by AFM. And the contact angles of D.I. water droplets sitting on the Cytop and Teflon layers with different thicknesses are measured by a microscope from the side. The results show that for Cytop films the contact angles of D.I. water droplets on the Cytop films thicker than 3 nm maintain around 110° on the other hand, the contact angles with the Cytop film thinner than 3 nm suddenly drop and decrease as the film becomes thinner. Teflon films show the similar trend as Cytop films, except the critical thickness (7 nm). The contact angle hysteresis on the different thicknesses of Cytop and Teflon films is separately investigated by the tilting base method. The results show that for the thin hydrophobic films, the contact angle hysteresis is over 10° however, it decreases as the film thickness increases. When the film is thicker than 12 nm, the values of the contact angle hysteresis are approximately halved and saturated. Based on the test results, the optimum hydrophobic film thickness (12 nm) is suggested. Finally, the thickness effect of the hydrophobic film on the operating voltage in EWOD actuation is tested. As expected the operating voltage in thin hydrophobic films is lower than in thick films. For the Cytop film, the saturation voltage in 12 nm is 20 V lower than 500 nm and 40 V lower than 1500 nm, respectively. Similarly, for the Teflon film, the saturation voltage in 12 nm is 20 V lower than 600 nm and 40 V lower than 1600 nm, respectively.","1084-6999","978-1-4673-5654-1","","10.1109/MEMSYS.2013.6474444","http://ieeexplore.ieee.org/stamp/stamp.jsp?arnumber=6474444","","Decision support systems","atomic force microscopy;contact angle;dielectric properties;hydrophobicity;microfluidics;wetting","AFM;Cytop film thickness;Cytop films;DI water droplets;EWOD actuation testing;EWOD systems;Teflon layers;atomic force microscopy;contact angle hysteresis;electrowetting-on-dielectric system;hydrophobic film thickness;hydrophobic layer;microfluidics;operating voltage reduction;size 12 nm;size 7 nm;surface wettability;thickness effect;tilting base method;voltage 20 V;voltage 40 V","","0","","14","","","20-24 Jan. 2013","","IEEE","IEEE Conference Publications"
"Silicon nanowire and cantilever electromechanical switches with integrated piezoresistive transducers","Rui Yang; Tina He; Marcoux, C.; Andreucci, P.; Duraffourg, L.; Feng, P.X.-L.","Electr. Eng., Case Western Reserve Univ., Cleveland, OH, USA","Micro Electro Mechanical Systems (MEMS), 2013 IEEE 26th International Conference on","20130307","2013","","","229","232","This digest paper reports experimental demonstration of a new type of nanoelectromechanical device, combining contact-mode nanomechanical switching with sensitive integrated strain gauges in suspended thin (sub-100nm) silicon nanowires (SiNWs). By measuring and modeling the interesting coupling effects between mechanical strain and electrical transport in highly piezoresistive (PZR) thin SiNWs at room temperature, we demonstrate that, in both doubly-clamped SiNWs and mechanically `cross' coupled cantilever-SiNW structures, contact-mode and tunneling switching with multiple repeatable cycles can be also simultaneously monitored and read out in the SiNW PZR transducers naturally embedded in the devices. Given the strong piezoresistive effects in thin SiNWs, this type of devices offer a new approach for monitoring contact-mode operations, and may prove valuable when the nanoscale contacts are not highly conductive, or degrading over time.","1084-6999","978-1-4673-5654-1","","10.1109/MEMSYS.2013.6474219","http://ieeexplore.ieee.org/stamp/stamp.jsp?arnumber=6474219","","Current measurement;Logic gates;Nanoelectromechanical systems;Nanoscale devices;Strain;Switches;Voltage measurement","cantilevers;elemental semiconductors;nanoelectromechanical devices;nanowires;piezoresistive devices;silicon;strain gauges;transducers","Si;cantilever electromechanical switches;contact-mode nanomechanical switching;contact-mode operation monitoring;coupling effects;doubly-clamped thin-silicon nanowire;electrical transport;highly-piezoresistive thin-silicon nanowire;integrated piezoresistive transducers;mechanical strain;nanoelectromechanical device;nanoscale contacts;piezoresistive effects;sensitive integrated strain gauges;silicon-NW PZR transducers;suspended thin-silicon nanowires","","2","","6","","","20-24 Jan. 2013","","IEEE","IEEE Conference Publications"
"Sealless 3-D microfluidic channel fabrication by sacrificial caramel template direct-patterning","Koyata, Y.; Ikeuchi, M.; Ikuta, K.","Univ. of Tokyo, Tokyo, Japan","Micro Electro Mechanical Systems (MEMS), 2013 IEEE 26th International Conference on","20130307","2013","","","311","314","We succeeded in developing a new simple and unique method to fabricate enclosed microfluidic channels within Polydimethylsiloxane (PDMS) substrates. The procedure is extremely straight forward, where sacrificial caramel embedded inside solid PDMS simply dissolves to form arbitrary shaped enclosed channels. Arbitrary microchannel network including 3-D interchanges, cross-junctions and very thin (≤1μm) cylindrical channels can be produced with no costly equipment and no cytotoxic material.","1084-6999","978-1-4673-5654-1","","10.1109/MEMSYS.2013.6474240","http://ieeexplore.ieee.org/stamp/stamp.jsp?arnumber=6474240","","Fabrication;Microchannel;Microfluidics;Partial discharges;Shape;Substrates","microfabrication;microfluidics;polymers","3D interchanges;PDMS substrate;arbitrary microchannel network;arbitrary-shaped enclosed channels;enclosed microfluidic channels;polydimethylsiloxane substrate;sacrificial caramel template direct-patterning;sealless 3D microfluidic channel fabrication;solid PDMS","","0","","7","","","20-24 Jan. 2013","","IEEE","IEEE Conference Publications"
"Substrate effect in squeeze film damping of lateral oscillating microstructures","Mo Li; Rouf, V.T.; Horsley, D.A.","Univ. of California, Davis, Davis, CA, USA","Micro Electro Mechanical Systems (MEMS), 2013 IEEE 26th International Conference on","20130307","2013","","","393","396","We present a new squeeze film damping model for lateral oscillating microstructures which for the first time accounts for the increased damping created by proximity to the substrate. The proposed model improves the estimation of damping by a factor of 2 to 4 when the distance to the substrate is less than or equal to the gap between oscillating plates. The closed-form solution of this model agrees with the predictions of a FEM model within 12%. Experimental results show that the new model improves the accuracy of the estimated damping by approximately a factor of 2.","1084-6999","978-1-4673-5654-1","","10.1109/MEMSYS.2013.6474261","http://ieeexplore.ieee.org/stamp/stamp.jsp?arnumber=6474261","","Atmospheric modeling;Damping;Films;Finite element methods;Mathematical model;Predictive models;Substrates","finite element analysis;micromechanical devices","FEM model;damping estimation;lateral oscillating microstructures;oscillating plates;squeeze film damping model;substrate effect","","0","","10","","","20-24 Jan. 2013","","IEEE","IEEE Conference Publications"
