"http://ieeexplore.ieee.org/search/searchresult.jsp?bulkSetSize=2000&queryText%3D.LB..LB.Micro+Electro+Mechanical+Systems%2C+2010.+MEMS+2010..RB.+AND+IEEE+23rd+International+Conference+on.RB.",2015/06/23 16:25:27
"Infiltration-processed, functionally graded materials for microceramic componenets","Hassanin, H.; Jiang, K.","Sch. of Mech. Eng., Univ. of Birmingham, Birmingham, UK","Micro Electro Mechanical Systems (MEMS), 2010 IEEE 23rd International Conference on","20100408","2010","","","368","371","A three-dimensional micro ceramic functionally graded material (FGM) has been fabricated by an infiltration process. The proposed technique offers an effective way to tailor the composition and microstructure of ceramic micro components. The process involves soft lithography, colloidal powder processing and the infiltration of yttria stabilized zirconia with a pre-ceramic polymer solution. Analyses by SEM, BSE and EDS have revealed the existence of concentration gradients, the Si and C content decreasing with increasing of the sample depth. The resultant micro part has a homogeneous core encased with a graded and layer of YSZ / SiC.","1084-6999","978-1-4244-5761-8","978-1-4244-5763-2","10.1109/MEMSYS.2010.5442488","http://ieeexplore.ieee.org/stamp/stamp.jsp?arnumber=5442488","","Biological materials;Ceramics;Composite materials;Fabrication;Microstructure;Polymers;Scanning electron microscopy;Silicon carbide;Temperature;Thermal stresses","X-ray chemical analysis;ceramics;colloids;electron backscattering;functionally graded materials;melt infiltration;powders;scanning electron microscopy;silicon compounds;soft lithography","SEM;YO<sub>3</sub>ZrO<sub>3</sub>-SiC;colloidal powder processing;concentration gradients;electron backscattering;energy dispersive X-ray spectroscopy;functionally graded materials;infiltration process;microceramic componenets;microstructure;pre-ceramic polymer solution;scanning electron microscopy;soft lithography;yttria stabilized zirconia","","1","","16","","","24-28 Jan. 2010","","IEEE","IEEE Conference Publications"
"Monolithic micro gas chromatographic separation column and detector","Kaanta, B.; Hua Chen; Zhang, Xin","Boston Univ., Boston, MA, USA","Micro Electro Mechanical Systems (MEMS), 2010 IEEE 23rd International Conference on","20100408","2010","","","907","910","We present the design, fabrication, and operation of the first monolithic gas chromatography (GC) separation column and detector. The monolithic integration of a high sensitivity detector with a separation column has many potential advantages over the discrete components of a traditional chromatography system. In high-speed GC systems, component interconnections can cause crucial errors which increase with the square of analysis speed causing critical loss of resolution. A monolithically integrated device would eliminate the requirement for helium-tight interconnections, which are bulky and labor intensive. Additionally, batch fabrication of integrated devices would eliminate the requirement for a separate, expensive, and fragile detector, which decreases the cost of micro GC systems through economies of scale.","1084-6999","978-1-4244-5761-8","978-1-4244-5763-2","10.1109/MEMSYS.2010.5442354","http://ieeexplore.ieee.org/stamp/stamp.jsp?arnumber=5442354","","Assembly systems;Chemical analysis;Chemical industry;Costs;Delay;Detectors;Economies of scale;Fabrication;Gas chromatography;Monolithic integrated circuits","chromatography;gas sensors;monolithic integrated circuits","helium-tight interconnections;high sensitivity detector;high-speed GC systems;monolithic microgas chromatographic separation column;monolithically integrated device","","1","","13","","","24-28 Jan. 2010","","IEEE","IEEE Conference Publications"
"Synthesis of graphene using Micro Chemical Vapor Deposition","Qin Zhou; Liwei Lin","Dept. of Mech. Eng., Univ. of California, Berkeley, CA, USA","Micro Electro Mechanical Systems (MEMS), 2010 IEEE 23rd International Conference on","20100408","2010","","","43","46","Large area synthesis of graphene has been realized on top of a nickel-coated micro platform using the Micro Chemical Vapor Deposition (Micro-CVD) system. The capability of ultra-fast heating and cooling provided by the MEMS platform is crucial for the controlled growth of graphene. Theoretical analysis shows that cooling rate is about 4 orders of magnitude higher than the conventional CVD system. Experimentally, 1~2 layers of graphene structures have been consistently synthesized as confirmed by Raman spectroscopy on the whole 300 Ã 300 Â¿m<sup>2</sup> platform. As such, this approach opens up a new class of opportunity in graphene synthesis.","1084-6999","978-1-4244-5761-8","978-1-4244-5763-2","10.1109/MEMSYS.2010.5442571","http://ieeexplore.ieee.org/stamp/stamp.jsp?arnumber=5442571","","Chemical vapor deposition;Control system synthesis;Cooling;Grain boundaries;Hydrocarbons;Micromechanical devices;Nickel;Resistance heating;Substrates;Temperature control","Raman spectra;chemical vapour deposition;cooling;graphene;heating;microfabrication;micromechanical devices","C;MEMS platform;Raman spectroscopy;cooling rate;graphene structures;micro chemical vapor deposition;nickel-coated micro platform;ultrafast heating","","0","","14","","","24-28 Jan. 2010","","IEEE","IEEE Conference Publications"
"Handling adherent cells with magnetically functionalized microplates","Ishihara, H.; Takeuchi, S.","Inst. of Ind. Sci., Univ. of Tokyo, Tokyo, Japan","Micro Electro Mechanical Systems (MEMS), 2010 IEEE 23rd International Conference on","20100408","2010","","","959","962","We present a cell handling method using magnetically functionalized microplates. Rectangular-shaped permalloy inside the microplates enables the plates to rotate or flip upside down by magnetic field. We conduct two kinds of cell handling experiments: (1) rotating cells for the precise positioning of cell nucleus and (2) flipping over the microplate for culturing different types of cells on both sides of the microplates. These demonstrations indicate that our handling method can be useful for single-cell-level manipulations and be a platform for a heterogeneous 3D co-culture system.","1084-6999","978-1-4244-5761-8","978-1-4244-5763-2","10.1109/MEMSYS.2010.5442367","http://ieeexplore.ieee.org/stamp/stamp.jsp?arnumber=5442367","","Magnetic fields","Permalloy;biological techniques;biomedical materials;cellular biophysics","adherent cells handling;cell culture;cell nucleus positioning;cell rotation;flipping over;heterogeneous 3D co-culture system;magnetically functionalized microplates;rectangular-shaped permalloy;single-cell-level manipulations","","0","","8","","","24-28 Jan. 2010","","IEEE","IEEE Conference Publications"
"12° design rule for single crystal silicon curved beam compliant mechanisms with large deformation","Tzung-Ming Chen; Krausse, S.; Korvink, J.G.; Wallrabe, U.","IMTEK, Univ. of Freiburg, Freiburg, Germany","Micro Electro Mechanical Systems (MEMS), 2010 IEEE 23rd International Conference on","20100408","2010","","","552","555","We present a new 12Â° design rule to enhance the reliability of single crystal silicon (SCS) compliant mechanism with large deformation. This rule defines a suitable structure orientation on an SCS wafer and avoids failure of stress induced crystal slip on curved compliant beams. Our rule considers the crystalline directional properties, such as Young's Modulus and fracture strength, of SCS. We fabricated a rotational mirror as demonstrator which was displaced by a piezoelectric actuator. Obeying to the 12Â° design rule we achieved a 100% larger rotational angle at the mirror section than in case of arbitrary orientation.","1084-6999","978-1-4244-5761-8","978-1-4244-5763-2","10.1109/MEMSYS.2010.5442442","http://ieeexplore.ieee.org/stamp/stamp.jsp?arnumber=5442442","","Anisotropic magnetoresistance;Crystalline materials;Crystallization;Kinematics;Maintenance;Manufacturing;Micromechanical devices;Mirrors;Silicon;Stress","Young's modulus;deformation;elemental semiconductors;fracture toughness;mirrors;optical design techniques;optical fabrication;optical materials;silicon;slip","12Â° design rule;Si;Young's Modulus;crystalline directional properties;fracture strength;large deformation;optical fabrication;rotational angle;rotational mirror;single crystal silicon curved beam compliant mechanisms;stress induced crystal slip;structure orientation","","0","","10","","","24-28 Jan. 2010","","IEEE","IEEE Conference Publications"
"LPCVD amorphous SiC<inf>x</inf> for freestanding electron transparent windows","Morana, B.; Creemer, J.F.; Santagata, F.; Fan, C.-C.; Pham, H.T.M.; Pandraud, G.; Tichelaar, F.D.; Sarro, P.M.","DIMES-ECTM, Delft Univ. of Technol., Delft, Netherlands","Micro Electro Mechanical Systems (MEMS), 2010 IEEE 23rd International Conference on","20100408","2010","","","572","575","MEMS electron-transparent membranes made of low-stress silicon nitride are widely employed in electron microscopy. However, this material has limited resistance to electron beams. We therefore developed a layer of LPCVD SiC. Our layer is amorphous, uniform, continuous, low-stress, and has extremely low etch-rates in common wet etchants. As free-standing electron transparent window, it demonstrates a resistance to electron beam damage 3 times higher than low-stress LPCVD silicon nitride. Our SiC layer could be advantageously employed in other MEMS devices, especially those operating in harsh environments, and in applications where high etching selectivity is required.","1084-6999","978-1-4244-5761-8","978-1-4244-5763-2","10.1109/MEMSYS.2010.5442439","http://ieeexplore.ieee.org/stamp/stamp.jsp?arnumber=5442439","","Amorphous materials;Biomembranes;Electron beams;Electron microscopy;Etching;Micromechanical devices;Scanning electron microscopy;Silicon carbide;Testing;Transmission electron microscopy","amorphous semiconductors;chemical vapour deposition;micromechanical devices;silicon compounds","LPCVD;MEMS electron-transparent membrane;SiC;amorphous SiC<sub>x</sub>;electron beam;electron microscopy;free-standing electron transparent window;low-stress silicon nitride","","1","","8","","","24-28 Jan. 2010","","IEEE","IEEE Conference Publications"
"High-Q, low impedance polysilicon resonators with 10 nm air gaps","Cheng, T.J.; Bhave, S.A.","Cornell Univ., Ithaca, NY, USA","Micro Electro Mechanical Systems (MEMS), 2010 IEEE 23rd International Conference on","20100408","2010","","","695","698","This paper presents a fabrication process to manufacture air-gap capacitively-transduced RF MEMS resonators. 2-port measurements show motional impedance (R<sub>x</sub>) < 1.3 kÂ¿ and quality factor (Q) > 65,000 at 223 MHz in vacuum. The fabrication process involves depositing a dual-layer spacer of 10 nm of SiO<sub>2</sub> and 90 nm of hafnia via atomic layer deposition (ALD) followed by oxide release. Nanometer air gaps are achieved, while the hafnia provides reliability against shorting of resonator and electrode. Consistent performance was achieved across multiple devices, demonstrating the robustness of the process.","1084-6999","978-1-4244-5761-8","978-1-4244-5763-2","10.1109/MEMSYS.2010.5442311","http://ieeexplore.ieee.org/stamp/stamp.jsp?arnumber=5442311","","Air gaps;Atomic layer deposition;Electrodes;Fabrication;Impedance measurement;Manufacturing processes;Pulp manufacturing;Q factor;Q measurement;Radiofrequency microelectromechanical systems","air gaps;atomic layer deposition;micromechanical resonators;silicon","2-port measurements;ALD;SiO<sub>2</sub>;air gaps;air-gap capacitively-transduced RF MEMS resonators;atomic layer deposition;dual-layer spacer;electrode;fabrication process;hafnia;motional impedance;oxide release;polysilicon resonators;quality factor;size 90 nm","","6","1","8","","","24-28 Jan. 2010","","IEEE","IEEE Conference Publications"
"Optimized comb drive finger shape for shock-resistant actuation","Engelen, J.B.C.; Abelmann, L.; Elwenspoek, M.C.","Univ. of Twente, Enschede, Netherlands","Micro Electro Mechanical Systems (MEMS), 2010 IEEE 23rd International Conference on","20100408","2010","","","1147","1150","This work presents the analytical solution, realization and measurement of a comb drive with finger shapes optimized for shock-resistant actuation. The available force for actuating an external load determines how large shock forces can be compensated for. An analytical expression is presented for the finger shape that provides a constant large available force over the actuation range. The finger shape is asymmetric, resulting in a 20% smaller unit cell width compared to a symmetric shape. This finger shape provides 4 times more available force than the standard straight finger shape.","1084-6999","978-1-4244-5761-8","978-1-4244-5763-2","10.1109/MEMSYS.2010.5442414","http://ieeexplore.ieee.org/stamp/stamp.jsp?arnumber=5442414","","Capacitance;Electric shock;Electrostatic actuators;Fabrication;Fingers;Geometry;Micromechanical devices;Shape measurement;Springs;Voltage","drives;electrostatics;microactuators","MEMS actuators;electrostatic comb drives;optimized comb drive finger shape;shock-resistant actuation;symmetric shape","","1","","5","","","24-28 Jan. 2010","","IEEE","IEEE Conference Publications"
"3D stand-up metamaterials with a purely magnetic resonance at terahertz frequencies","Fan, Kebin; Strikwerda, A.C.; Tao, Hu; Averitt, R.D.; Zhang, Xin","Boston Univ., Boston, MA, USA","Micro Electro Mechanical Systems (MEMS), 2010 IEEE 23rd International Conference on","20100408","2010","","","843","846","In this paper we present a copper-based 3-dimensional (3D) stand-up metamaterial which displays a purely magnetic resonance at terahertz (THz) frequencies. A multilayer-electroplating technique is used to fabricate these arrayed structures and experimental results demonstrate a strong LC resonance at 1.38 THz with quality factor of 18.7. The successful design, fabrication and characterization of these 3D structures provides a new pathway for implementing novel electromagnetic properties at terahertz frequencies.","1084-6999","978-1-4244-5761-8","978-1-4244-5763-2","10.1109/MEMSYS.2010.5442338","http://ieeexplore.ieee.org/stamp/stamp.jsp?arnumber=5442338","","Bars;Fabrication;Magnetic fields;Magnetic materials;Magnetic resonance;Metamaterials;Permeability;Polarization;RLC circuits;Resonant frequency","copper;electroplating;magnetic resonance;metamaterials","copper-based 3D stand up metamaterial structures;electromagnetic properties;frequency 1.38 THz;magnetic resonance;multilayer electroplating technique","","2","","14","","","24-28 Jan. 2010","","IEEE","IEEE Conference Publications"
"Passive TCF compensation in high Q silicon micromechanical resonators","Samarao, A.K.; Casinovi, G.; Ayazi, F.","Georgia Inst. of Technol., Atlanta, GA, USA","Micro Electro Mechanical Systems (MEMS), 2010 IEEE 23rd International Conference on","20100408","2010","","","116","119","This paper reports on passive temperature compensation techniques for high quality factor (Q) silicon microresonators based on engineering the geometry of the resonator and its material properties. A 105 MHz concave silicon bulk acoustic resonator (CBAR) fabricated on a boron-doped substrate with a resistivity of 10<sup>-3</sup> Â¿-cm manifests a linear temperature coefficient of frequency (TCF) of -6.3 ppm/Â°C while exhibiting a Q of 101,550 (fQ = 1.06Ã10<sup>13</sup>). The TCF is further reduced by engineering the material property via a wafer-level aluminum thermomigration process to -3.6 ppm/Â°C while maintaining an fQ of over 4Ã10<sup>12</sup>. Such high fQ products with low TCF values are being reported for the first time in silicon and are critical for successful insertion of these devices into low-power low-phase noise frequency references and high performance resonant sensors.","1084-6999","978-1-4244-5761-8","978-1-4244-5763-2","10.1109/MEMSYS.2010.5442553","http://ieeexplore.ieee.org/stamp/stamp.jsp?arnumber=5442553","","Acoustical engineering;Conductivity;Frequency;Geometry;Material properties;Microcavities;Micromechanical devices;Q factor;Silicon;Temperature","Q-factor;acoustic resonators;bulk acoustic wave devices;compensation;elemental semiconductors;microfabrication;micromechanical resonators;silicon","Q-factor;Si;concave silicon bulk acoustic resonator;frequency 105 MHz;high Q silicon micromechanical resonators;high performance resonant sensors;linear temperature coefficient of frequency;low-power low-phase noise frequency references;passive TCF compensation;quality factor;wafer-level aluminum thermomigration process","","17","5","8","","","24-28 Jan. 2010","","IEEE","IEEE Conference Publications"
"Silicon monolithic acousto-optic modulator","Sridaran, S.; Bhave, S.A.","Cornell Univ., Ithaca, NY, USA","Micro Electro Mechanical Systems (MEMS), 2010 IEEE 23rd International Conference on","20100408","2010","","","835","838","This paper reports on the co-fabrication of RF MEMS radial contour mode resonators and photonic whispering gallery mode disk resonators on the same SOI substrate. By mechanically coupling the MEMS and photonic resonators, we have demonstrated a silicon acousto-optic modulator (AOM) which can modulate a 1550 nm laser at 288 MHz. An output RF power of -83.7 dBm is observed corresponding to a modulation of Â±415 nW around a biased optical output of 3.98 Â¿W. The AOM has a footprint of 50 Â¿m Ã 30 Â¿m and bandwidth of 24.2 kHz in vacuum due to a high mechanical quality factor (Q) of 11,890.","1084-6999","978-1-4244-5761-8","978-1-4244-5763-2","10.1109/MEMSYS.2010.5442278","http://ieeexplore.ieee.org/stamp/stamp.jsp?arnumber=5442278","","Bandwidth;Laser modes;Micromechanical devices;Optical coupling;Optical modulation;Optical resonators;Radio frequency;Radiofrequency microelectromechanical systems;Silicon;Whispering gallery modes","acousto-optical modulation;integrated optics;integrated optoelectronics;laser cavity resonators;micro-optomechanical devices;silicon;silicon-on-insulator;whispering gallery modes","RF MEMS radial contour mode resonator;SOI substrate;Si;bandwidth 24.2 kHz;monolithic acousto-optic modulator;photonic whispering gallery mode disk resonator;power 3.98 muW;wavelength 1550 nm","","0","","13","","","24-28 Jan. 2010","","IEEE","IEEE Conference Publications"
"Very large scale arrays of chemo-mechanical nanoswitches for ultralow power hydrogen sensing","Kiefer, T.; Salette, A.; Villanueva, G.; Brugger, J.","Ecole Polytech. Fed. de Lausanne (EPFL), Lausanne, Switzerland","Micro Electro Mechanical Systems (MEMS), 2010 IEEE 23rd International Conference on","20100408","2010","","","140","143","We present a novel hydrogen sensor that is based on large arrays of chemically actuated electromechanical nanoswitches, realized by nanogaps in palladium (Pd). An individual switch consists of a trimorph poly-Si/Ti/Pd structure and a fixed Ti/Pd electrode, separated by an approximately 10-15 nm wide nanogap. The volume expansion of Pd at hydrogenation bends the trimorph vertically and creates an electric contact with the electrode. The fabrication process enables the parallel fabrication of many nanoswitches in arbitrary topologies. Hydrogen is detected by current changes up to three orders of magnitude at room temperature and a power consumption of down to pW.","1084-6999","978-1-4244-5761-8","978-1-4244-5763-2","10.1109/MEMSYS.2010.5442547","http://ieeexplore.ieee.org/stamp/stamp.jsp?arnumber=5442547","","Chemical sensors;Contacts;Electrodes;Electromechanical sensors;Fabrication;Hydrogen;Large-scale systems;Palladium;Sensor arrays;Switches","chemical sensors;chemical variables measurement;hydrogenation;microswitches;palladium alloys;silicon alloys;titanium alloys","Si-Ti-Pd;chemical actuator;chemo-mechanical nanoswitches;electric contact;electromechanical nanoswitches;hydrogenation;nanogaps;palladium;temperature 293 K to 298 K;trimorph polystructure;ultralow power hydrogen sensing;very large scale arrays","","0","","7","","","24-28 Jan. 2010","","IEEE","IEEE Conference Publications"
"Hybrid fabrication of microfluidic chips based on COC, silicon and TMMF dry resist","Kalkandjiev, K.; Zengerle, Roland; Koltay, P.","IMTEK, Univ. of Freiburg, Freiburg, Germany","Micro Electro Mechanical Systems (MEMS), 2010 IEEE 23rd International Conference on","20100408","2010","","","400","403","We describe the hybrid fabrication of silicon-plastic microfluidic chips based on machining of Cyclic Olefin Copolymer (COC), standard silicon processing and TMMF lithography. The combination of different processes enables an individual material selection leading to significant reduction of the manufacturing costs. We demonstrate the potential of the hybrid technology by manufacturing and testing a 24-channel TopSpot dispenser which consists of an intermediate silicon layer, a COC interface and a TMMF sealing lid. Characterization studies show that TMMF lamination is ideally suited for the sealing of silicon microchannels showing numerous advantages over adhesive-based approaches, thermal and anodic bonding.","1084-6999","978-1-4244-5761-8","978-1-4244-5763-2","10.1109/MEMSYS.2010.5442480","http://ieeexplore.ieee.org/stamp/stamp.jsp?arnumber=5442480","","Costs;Fabrication;Lamination;Lithography;Machining;Manufacturing processes;Microfluidics;Resists;Silicon;Testing","lithography;microfluidics;polymer blends;resists;silicon","24-channel TopSpot dispenser;COC;TMMF dry resist;TMMF lithography;cyclic olefin copolymer;hybrid fabrication;silicon microchannel;silicon-plastic microfluidic chip;standard silicon processing","","0","","13","","","24-28 Jan. 2010","","IEEE","IEEE Conference Publications"
"High throughput analysis of drug effects on single breast cancer cells using droplet-microfluidic devices","Zhongcheng Gong; Fang Nie; Tianhua Zhang; Pathak, P.; Zhiyong Wang; Kemi Cui; Hong Zhao; Wong, S.; Long Que","Louisiana Tech Univ., Ruston, LA, USA","Micro Electro Mechanical Systems (MEMS), 2010 IEEE 23rd International Conference on","20100408","2010","","","1015","1018","This paper reports the analysis of drug effects on single breast cancer cells using the droplet-microfluidic devices for the first time. Hundreds of droplets can be generated in less than 5 minutes. Each droplet serves as a nanoliter-volume titer plate. About 50% of the droplets contain a human breast cancer cell MDA-MB-231 and Cytochalasin D drug solution. The drug effects on each cell are monitored by analyzing the fluorescence image of each cell. Clear change of the cell shape and size has been observed after incubation, suggesting this approach is a potential viable technical platform for drug effect analysis and for high throughput drug screen and discovery.","1084-6999","978-1-4244-5761-8","978-1-4244-5763-2","10.1109/MEMSYS.2010.5442381","http://ieeexplore.ieee.org/stamp/stamp.jsp?arnumber=5442381","","Breast cancer;Chemical compounds;Drugs;Microfluidics;Monitoring;Nanobioscience;Performance analysis;Robots;Shape;Throughput","bioMEMS;biological organs;biomedical measurement;cancer;cellular biophysics;drops;drugs;fluorescence;gynaecology;microfluidics","MDA-MB-231;cell incubation;cytochalasin D;droplet-microfluidic devices;drug effects;drug solution;fluorescence image;high throughput analysis;high throughput drug screen;nanoliter-volume titer plate;single breast cancer cells","","1","","11","","","24-28 Jan. 2010","","IEEE","IEEE Conference Publications"
"Design and implementation of a novel double-poly microphone with rigid acoustic receiver, flexible spring supporter, and harm backplate","Chun-Kai Chan; Wei-Cheng Lai; Mingching Wu; Weileun Fang","Nat. Tsing Hua Univ., Hsinchu, Taiwan","Micro Electro Mechanical Systems (MEMS), 2010 IEEE 23rd International Conference on","20100408","2010","","","651","654","This study reports the design and implementation of a novel micromachined microphone. The design of the microphone is based on the well-known two-poly processes. The design as shown in Fig.1 has four merits, (1) rigid-diaphragm formed by the rib-reinforced poly-Si as acoustic wave receiver and moving-electrodes, (2) flexible-spring formed by thin poly-Si as diaphragm supporter, (3) rigid-diaphragm anchored to flexible-spring by central poly-via, and (4) very rigid plate formed by high-aspect-ratio (HARM) trench-refilled poly-Si as stationary-electrodes and back-plate. To demonstrate the feasibility, the two-poly microphone has been implemented and tested. Typical measurement results show that the sensitivity of microphone is 12.63 mV/Pa (-37.97 dB/Pa) measured at the sound level of 94 dB.","1084-6999","978-1-4244-5761-8","978-1-4244-5763-2","10.1109/MEMSYS.2010.5442324","http://ieeexplore.ieee.org/stamp/stamp.jsp?arnumber=5442324","","Acoustic devices;Acoustic signal detection;Acoustic waves;Capacitance;Electrodes;Micromechanical devices;Microphones;Mobile handsets;Residual stresses;Springs","acoustic receivers;design engineering;micromachining;microphones","design;double-poly microphone;flexible spring supporter;harm backplate;micromachining;rigid acoustic receiver","","1","","7","","","24-28 Jan. 2010","","IEEE","IEEE Conference Publications"
