"http://ieeexplore.ieee.org/search/searchresult.jsp?bulkSetSize=2000&queryText%3D.LB.Embedded+Software+.LB.EMSOFT.RB.%2C+2013+International+Conference+on.RB.",2015/07/23 14:10:24
"Diversifying wear index for MLC NAND flash memory to extend the lifetime of SSDs","Yeong-Jae Woo; Jin-Soo Kim","Samsung Electron. Co., Hwaseong, South Korea","Embedded Software (EMSOFT), 2013 Proceedings of the International Conference on","20131111","2013","","","1","10","NAND flash-based solid state drives (SSDs) are replacing magnetic disks because of their fast random access performance, shock resistance, and low power consumption. However, the number of program and erase cycles that can be performed on NAND flash is limited. To overcome this limitation, SSDs require a sophisticated wear-leveling algorithm which distributes program/erase cycles evenly across all flash blocks. While most of existing wear-leveling algorithms are only based on the erase counts of flash blocks, our empirical study indicates that the erase count alone is not a good wear index which tells us how much a flash block is worn out. This paper proposes a new wear index for MLC NAND flash memory which takes into account more diverse properties of NAND flash memory. To show the effectiveness of the proposed wear index, we also develop a wear-leveling algorithm, named Equalizer. In our evaluation with three realistic workloads, Equalizer based on the proposed wear index improves the effective lifetime of SSDs by up to 145% compared to the existing wear-leveling technique based on the erase count.","","","","10.1109/EMSOFT.2013.6658584","http://ieeexplore.ieee.org/stamp/stamp.jsp?arnumber=6658584","NAND flash memory;lifetime;reliability;storage system;wear-leveling","Ash;Engines;Equalizers;Error correction codes;Indexes;Programming;Reliability","NAND circuits;flash memories;power aware computing","MLC NAND flash memory;NAND flash based solid state drives;SSD;diversifying wear index;flash blocks;power consumption;random access performance;shock resistance;wear leveling algorithm","","0","","16","","","Sept. 29 2013-Oct. 4 2013","","IEEE","IEEE Conference Publications"
"Keynote","","","Embedded Software (EMSOFT), 2013 Proceedings of the International Conference on","20131111","2013","","","1","3","Provides an abstract of the keynote presentation and a brief professional biography of the presenter. The complete presentation was not made available for publication as part of the conference proceedings.","","","","10.1109/EMSOFT.2013.6658577","http://ieeexplore.ieee.org/stamp/stamp.jsp?arnumber=6658577","","","","","","0","","","","","Sept. 29 2013-Oct. 4 2013","","IEEE","IEEE Conference Publications"
"Safety verification for linear systems","Duggirala, P.S.; Tiwari, A.","Univ. of Illinois at Urbana Champaign, Champaign, IL, USA","Embedded Software (EMSOFT), 2013 Proceedings of the International Conference on","20131111","2013","","","1","10","An embedded software controller is safe if the composition of the controller and the plant does not reach any unsafe state starting from legal initial states (in an unbounded time horizon). Linear systems - specified using linear ordinary differential or difference equations - form an important class of models for such control systems. We present a new decidability result for safety verification of linear systems. Our decidability result assumes that the set of initial states and the set of unsafe states satisfy some conditions. When the set of initial and unsafe states do not satisfy these conditions, they can be overapproximated by sets that do satisfy the conditions. We thus get a counterexample guided abstraction refinement (CEGAR) procedure for the unconstrained safety verification of linear systems. Our new procedure performs abstraction-refinement on the initial and unsafe region, and not on the system itself. We present the new procedure and describe experimental results that demonstrate its effectiveness.","","","","10.1109/EMSOFT.2013.6658585","http://ieeexplore.ieee.org/stamp/stamp.jsp?arnumber=6658585","","Abstracts;Concrete;Eigenvalues and eigenfunctions;Equations;Linear systems;Safety;Trajectory","approximation theory;decidability;difference equations;embedded systems;formal verification;linear systems;mathematics computing;partial differential equations;safety-critical software","CEGAR;counterexample guided abstraction refinement procedure for;decidability result;difference equations;embedded software controller;linear ordinary differential equations;linear systems;unbounded time horizon;unconstrained safety verification","","0","","22","","","Sept. 29 2013-Oct. 4 2013","","IEEE","IEEE Conference Publications"
"On the schedulability of real-time discrete-event systems","Matsikoudis, E.; Stergiou, C.; Lee, E.A.","Univ. of California, Berkeley, Berkeley, CA, USA","Embedded Software (EMSOFT), 2013 Proceedings of the International Conference on","20131111","2013","","","1","15","We consider end-to-end latency specifications for hard real-time embedded systems. We introduce a discrete-event programming model generalizing such specifications, and address its schedulability problem for uniprocessor systems. This turns out to be rather idiosyncratic, involving complex, time-dependent release predicates and precedence constraints, quite unlike anything we have seen in the hard real-time computing literature. We prove the optimality of the earliest-deadline-first scheduling policy, and provide an algorithmic solution, reducing the schedulability problem to a reachability problem for timed automata.","","","","10.1109/EMSOFT.2013.6658590","http://ieeexplore.ieee.org/stamp/stamp.jsp?arnumber=6658590","","Actuators;Delays;Programming;Real-time systems;Semantics;Semiconductor device measurement","algorithm theory;automata theory;formal specification;programming theory;reachability analysis;real-time systems;scheduling","algorithmic solution;complex release predicates;discrete-event programming model;earliest-deadline-first scheduling policy;end-to-end latency specifications;hard real-time embedded systems;precedence constraints;reachability problem;real-time discrete-event systems;schedulability problem;time-dependent release predicates;timed automata;uniprocessor systems","","0","","12","","","Sept. 29 2013-Oct. 4 2013","","IEEE","IEEE Conference Publications"
"Simple analysis of partial worst-case execution paths on general control flow graphs","Kleinsorge, J.C.; Falk, H.; Marwedel, P.","Tech. Univ. Dortmund, Dortmund, Germany","Embedded Software (EMSOFT), 2013 Proceedings of the International Conference on","20131111","2013","","","1","10","One of the most important computations in static worst-case execution time analyses is the path analysis which computes the potentially most time-consuming execution path in a program. This is typically done either with an implicit path computation based on solving an integer linear program, or with explicit path computations directly on the program's control flow graph. The former approach is powerful and comparably simple to use but hard to extend and to combine with other program analyses due to its restriction to the linear equation model. The latter approaches are often restricted to well-structured graphs, suffer from inaccuracy or require nontrivial structural analyses or graph transformations upfront or during their computations. In this paper, we propose a generalized computational model and a comprehensive explicit path analysis that operates on arbitrary directed control flow graphs. We propose simple and yet effective techniques to deal with unstructured control flows and complex flow fact models. The analysis does not require a control flow graph to be mutable, is non-recursive, fast, and provides the means to compute all worst-case paths from arbitrary source nodes. It is well suited for solving local problems and the computation of partial solutions, which is highly relevant for problems related to scheduling and execution modes alike.","","","","10.1109/EMSOFT.2013.6658594","http://ieeexplore.ieee.org/stamp/stamp.jsp?arnumber=6658594","Path Analysis;Static Analysis;Worst-case Execution Time","Algorithm design and analysis;Analytical models;Computational modeling;Context;Data structures;Redundancy;Vegetation","data flow graphs;program verification;scheduling","arbitrary directed control flow graphs;arbitrary source nodes;complex flow fact model;comprehensive explicit path analysis;execution mode;explicit path computation;general program control flow graphs;generalized computational model;implicit path computation;integer linear program;local problems;partial-worst-case execution path analysis;scheduling mode;static worst-case execution time analysis;unstructured control flow model","","0","","19","","","Sept. 29 2013-Oct. 4 2013","","IEEE","IEEE Conference Publications"
"WakeScope: Runtime WakeLock anomaly management scheme for Android platform","Kwanghwan Kim; Hojung Cha","Dept. of Comput. Sci., Yonsei Univ., Seoul, South Korea","Embedded Software (EMSOFT), 2013 Proceedings of the International Conference on","20131111","2013","","","1","10","Android provides a WakeLock mechanism for application developers to ensure the proper execution of applications without having to enter the sleep state of a device. When using the WakeLock mechanism, application developers should bear the responsibility of adequately releasing the acquired lock. Otherwise, the energy will unnecessarily be wasted due to a locked application. This paper presents a scheme, called WakeScope, to handle WakeLock misuse. The scheme is designed to detect and notify of a misuse case of WakeLock handling, which may arise with an application and even with an Android runtime system, and thus provides a practical tool to prevent energy waste in mobile devices. Our experiments with real applications show that WakeScope accurately detects the misused case, with runtime overhead of approximately 1.2% in CPU usage.","","","","10.1109/EMSOFT.2013.6658605","http://ieeexplore.ieee.org/stamp/stamp.jsp?arnumber=6658605","Android;Energy;Mobile;Smartphones;WakeLock","Androids;Batteries;Humanoid robots;Kernel;Keyboards;Linux;Runtime","energy conservation;mobile computing;operating systems (computers);power aware computing","Android platform;Android runtime system;WakeLock mechanism;WakeLock misuse handling;WakeScope scheme;energy waste prevention;mobile devices;runtime WakeLock anomaly management scheme","","1","","26","","","Sept. 29 2013-Oct. 4 2013","","IEEE","IEEE Conference Publications"
"[Front cover]","","","Embedded Software (EMSOFT), 2013 Proceedings of the International Conference on","20131111","2013","","","c1","c1","Presents the front cover or splash screen of the proceedings record.","","","","10.1109/EMSOFT.2013.6658573","http://ieeexplore.ieee.org/stamp/stamp.jsp?arnumber=6658573","","","","","","0","","","","","Sept. 29 2013-Oct. 4 2013","","IEEE","IEEE Conference Publications"
"Stability-aware analysis and design of embedded control systems","Aminifar, A.; Eles, P.; Zebo Peng; Cervin, A.","Dept. of Comput. & Inf. Sci., Linkoping Univ., Linkoping, Sweden","Embedded Software (EMSOFT), 2013 Proceedings of the International Conference on","20131111","2013","","","1","10","Many embedded systems comprise several controllers sharing available resources. It is well known that such resource sharing leads to complex timing behavior that can jeopardize stability of control applications, if it is not properly taken into account in the design process, e.g., mapping and scheduling. As opposed to hard real-time systems where meeting the deadline is a critical requirement, control applications do not enforce hard deadlines. Therefore, the traditional real-time analysis approaches are not readily applicable to control applications. Rather, in the context of control applications, stability is often the main requirement to be guaranteed, and can be expressed as the amount of delay and jitter a control application can tolerate. The nominal delay and response-time jitter can be regarded as the two main factors which relate the real-time aspects of a system to control performance and stability. Therefore, it is important to analyze the impact of variations in scheduling parameters, i.e., period and priority, on the nominal delay and response-time jitter and, ultimately, on stability. Based on such an analysis, we address, in this paper, priority assignment and sensitivity analysis problems for control applications considering stability as the main requirement.","","","","10.1109/EMSOFT.2013.6658601","http://ieeexplore.ieee.org/stamp/stamp.jsp?arnumber=6658601","","Delays;Equations;Jitter;Real-time systems;Sensitivity analysis;Stability analysis;Time factors","control system analysis;control system synthesis;delays;embedded systems;jitter;scheduling;sensitivity analysis;stability","control application stability;control performance;design process;embedded control systems;hard deadline;hard real-time system;mapping;nominal delay;priority assignment;resource sharing;response-time jitter;scheduling parameter;sensitivity analysis problem;stability guarantee;stability requirement;stability-aware analysis;stability-aware design;timing behavior","","1","","25","","","Sept. 29 2013-Oct. 4 2013","","IEEE","IEEE Conference Publications"
"Determinate composition of FMUs for co-simulation","Broman, D.; Brooks, C.; Greenberg, L.; Lee, E.A.; Masin, M.; Tripakis, S.; Wetter, M.","Univ. of California, Berkeley, Berkeley, CA, USA","Embedded Software (EMSOFT), 2013 Proceedings of the International Conference on","20131111","2013","","","1","12","In this paper, we explain how to achieve deterministic execution of FMUs (Functional Mockup Units) under the FMI (Functional Mockup Interface) standard. In particular, we focus on co-simulation, where an FMU either contains its own internal simulation algorithm or serves as a gateway to a simulation tool. We give conditions on the design of FMUs and master algorithms (which orchestrate the execution of FMUs) to achieve deterministic co-simulation. We show that with the current version of the standard, these conditions demand capabilities from FMUs that are optional in the standard and rarely provided by an FMU in practice. When FMUs lacking these required capabilities are used to compose a model, many basic modeling capabilities become unachievable, including simple discrete-event simulation and variable-step-size numerical integration algorithms. We propose a small extension to the standard and a policy for designing FMUs that enables deterministic execution for a much broader class of models. The extension enables a master algorithm to query an FMU for the time of events that are expected in the future. We show that a model can be executed deterministically if all FMUs in the model are either memoryless or implement one of rollback or step-size prediction. We show further that such a model can contain at most one “legacy” FMU that is not memoryless and provides neither rollback nor step-size prediction.","","","","10.1109/EMSOFT.2013.6658580","http://ieeexplore.ieee.org/stamp/stamp.jsp?arnumber=6658580","","Algorithm design and analysis;Computational modeling;Mathematical model;Numerical models;Ports (Computers);Semantics;Standards","discrete event simulation;extrapolation;integration;standards","FMI standard;FMU design;FMU determinate composition;deterministic co-simulation;functional mockup interface standard;functional mockup units;legacy FMU;master algorithms;modeling capabilities;simple discrete-event simulation;variable-step-size numerical integration algorithms","","1","","27","","","Sept. 29 2013-Oct. 4 2013","","IEEE","IEEE Conference Publications"
"StreaMorph: A case for synthesizing energy-efficient adaptive programs using high-level abstractions","Dai Bui; Lee, E.A.","Univ. of California, Berkeley, Berkeley, CA, USA","Embedded Software (EMSOFT), 2013 Proceedings of the International Conference on","20131111","2013","","","1","10","This paper presents the concept of adaptive programs, whose computation and communication structures can morph to adapt to environmental and demand changes to save energy and computing resources. In this approach, programmers write one single program using a language at a higher level of abstraction. The compiler will exploit the properties of the abstractions to generate an adaptive program that is able to adjust computation and communication structures to environmental and demand changes. We develop a technique, called StreaMorph, that exploits the properties of stream programs' Synchronous Dataflow (SDF) programming model to enable runtime stream graph transformation. The StreaMorph technique can be used to optimize memory usage and to adjust core utilization leading to energy reduction by turning off idle cores or reducing operating frequencies. The main challenge for such a runtime transformation is to maintain consistent program states by copying states between different stream graph structures, because a stream program optimized for different numbers of cores often has different sets of filters and inter-filter channels. We propose an analysis that helps simplify program state copying processes by minimizing copying of states based on the properties of the SDF model. Finally, we implement the StreaMorph method in the StreamIt compiler. Our experiments on the Intel Xeon E5450 show that using StreaMorph to minimize the number of cores used from eight cores to one core, e.g. when streaming rates become lower, can reduce energy consumption by 76.33% on average. Using StreaMorph to spread workload from four cores to six or seven cores, e.g. when more cores become available, to reduce operating frequencies, can lead to 10% energy reduction. In addition, StreaMorph can lead to a buffer size reduction of 82.58% in comparison with a straightforward inter-core filter migration technique when switching from using eight cores to one core.","","","","10.1109/EMSOFT.2013.6658598","http://ieeexplore.ieee.org/stamp/stamp.jsp?arnumber=6658598","","Computational modeling;Digital signal processing;Ports (Computers);Program processors;Runtime;Steady-state;Switches","data flow analysis;graph theory;program compilers","Intel Xeon E5450;SDF programming model;StreaMorph technique;StreamIt compiler;buffer size reduction;communication structures;computation structures;computing resource saving;consistent program state maintenance;demand changes;energy reduction;energy saving;energy-efficient adaptive program synthesis;environmental changes;high-level abstractions;interfilter channels;memory usage optimization;off-idle core turning;operating frequency reduction;program state copying processes;runtime stream graph transformation;runtime transformation;stream program optimization;stream program properties;synchronous dataflow programming model","","1","","36","","","Sept. 29 2013-Oct. 4 2013","","IEEE","IEEE Conference Publications"
"BPDF: A statically analyzable dataflow model with integer and boolean parameters","Bebelis, V.; Fradet, P.; Girault, A.; Lavigueur, B.","INRIA Rhone-Alpes, France","Embedded Software (EMSOFT), 2013 Proceedings of the International Conference on","20131111","2013","","","1","10","Dataflow programming models are well-suited to program many-core streaming applications. However, many streaming applications have a dynamic behavior. To capture this behavior, parametric dataflow models have been introduced over the years. Still, such models do not allow the topology of the dataflow graph to change at runtime, a feature that is also required to program modern streaming applications. To overcome these restrictions, we propose a new model of computation, the Boolean Parametric Data Flow (BPDF) model which combines integer parameters (to express dynamic rates) and boolean parameters (to express the activation and deactivation of communication channels). High dynamism is provided by integer parameters which can change at each basic iteration and boolean parameters which can even change within the iteration. The major challenge with such dynamic models is to guarantee liveness and boundedness. We present static analyses which ensure statically the liveness and the boundedness of BDPF graphs. We also introduce a scheduling methodology to implement our model on highly parallel platforms and demonstrate our approach using a video decoder case study.","","","","10.1109/EMSOFT.2013.6658581","http://ieeexplore.ieee.org/stamp/stamp.jsp?arnumber=6658581","Boundedness;Dataflow model;Dynamism;Liveness;Parameters;Scheduling","Computational modeling;Data models;Equations;Mathematical model;Ports (Computers);Schedules;Vectors","Boolean functions;data flow computing;data flow graphs","BDPF graph boundedness;BDPF graph liveness;Boolean parametric data flow;dataflow programming models;integer parameters;statically analyzable dataflow model;video decoder","","0","","17","","","Sept. 29 2013-Oct. 4 2013","","IEEE","IEEE Conference Publications"
"Middleware design for Physically-Asynchronous Logically-Synchronous (PALS) systems","Al-Nayeem, A.; Cheolgi Kim; Woochul Kang; Po-Liang Wu; Lui Sha","Univ. of Illinois at Urbana-Champaign, Urbana, IL, USA","Embedded Software (EMSOFT), 2013 Proceedings of the International Conference on","20131111","2013","","","1","10","The Physically-Asynchronous Logically-Synchronous (PALS) system is a recently proposed architectural pattern for cyber-physical systems. It guarantees a logically synchronous design abstraction for real-time distributed computations. In this work, we develop a new middleware, called PALSware, to support an efficient and robust implementation of the PALS system and its extensions. PALSware guarantees consistency in distributed applications by eliminating any asynchronous interactions resulting from distributed clocks and node failures. We present a layered design for this middle-ware that is both reusable in different system architectures and can be extended with architecture-specific solutions for fault management. We demonstrate the middleware for an academic control testbed and show the consistency in a fault injection framework designed for this middleware.","","","","10.1109/EMSOFT.2013.6658583","http://ieeexplore.ieee.org/stamp/stamp.jsp?arnumber=6658583","","Abstracts;Clocks;Computer architecture;Middleware;Servomotors","middleware;software architecture","PALS systems;PALSware;academic control testbed;architecture-specific solutions;distributed clocks;fault injection framework;fault management;middleware design;node failures;physically-asynchronous logically-synchronous systems;system architectures","","0","","34","","","Sept. 29 2013-Oct. 4 2013","","IEEE","IEEE Conference Publications"
"A characterization of integrated multi-view modeling in the context of embedded and cyber-physical systems","Persson, M.; Torngren, M.; Qamar, A.; Westman, J.; Biehl, M.; Tripakis, S.; Vangheluwe, H.; Denil, J.","KTH, Stockholm, Sweden","Embedded Software (EMSOFT), 2013 Proceedings of the International Conference on","20131111","2013","","","1","10","Embedded systems, with their tight technology integration, and multiple requirements and stakeholders, are characterized by tightly interrelated processes, information and tools. Embedded systems will as a consequence be described by multiple, heterogeneous and interrelated descriptions such as for example requirements documents, design and analysis models, software and hardware descriptions. We refer to a system designed this way as a multi-view (MV) system. The main contribution of this paper is a characterization of model-based approaches to MV systems. The characterization takes three main perspectives for the relations between viewpoints: semantic relations (content), relations over time (process), and manipulation of views (operations). We complement these perspectives by investigating MV system challenges and by a survey of related approaches. The characterization aims to provide a basis for a better understanding, design and implementation of MV systems, and thereby to overcome the current fragmented points of view on integrated multi-view modeling (MVM).","","","","10.1109/EMSOFT.2013.6658588","http://ieeexplore.ieee.org/stamp/stamp.jsp?arnumber=6658588","consistency;embedded systems;multi-view modeling (MVM);survey;view relations;viewpoint relationship patterns;viewpoints;views","Analytical models;Educational institutions;Embedded systems;Hardware;Semantics;Syntactics","embedded systems;modelling;programming language semantics;systems analysis","MV systems;MVM;cyber-physical systems;embedded systems;integrated multiview modeling;model-based approaches;relations-over-time;semantic relations;view manipulation","","1","","61","","","Sept. 29 2013-Oct. 4 2013","","IEEE","IEEE Conference Publications"
