"http://ieeexplore.ieee.org/search/searchresult.jsp?bulkSetSize=2000&queryText%3DISSCC%2C+2011+IEEE+International",2015/06/23 15:33:47
"A short-range UWB impulse-radio CMOS sensor for human feature detection","Ta-Shun Chu; Roderick, J.; SangHyun Chang; Mercer, T.; Chenliang Du; Hashemi, H.","Univ. of Southern California, Los Angeles, CA, USA","Solid-State Circuits Conference Digest of Technical Papers (ISSCC), 2011 IEEE International","20110407","2011","","","294","296","This paper presents a wireless non-contact sensor that enables detection, localization, and monitoring of people along with their specific features such as gait and cardiopulmonary activities. These types of sensors can be embedded in the environment and networked with the existing wireless infrastructure to create an intelligent and responsive ambient where the health of children, patients, and the elderly can be monitored without intrusion. None of the common sensing modalities including visible optical, infra-red, and ultra-sound can operate under different visibility conditions, without Line-Of-Sight (LOS), under environmental noise, and measure human-specific features simultaneously. Radio Frequency (RF) sensors have been used to localize humans, and monitor their gait and vital signs. Most of these RF sensors transmit a Continuous Wave (CW) modulated or un-modulated waveform and detect the Doppler shift caused by the movement of hearts, lungs, and other body parts the latter referred to as micro-Doppler technique. RF sensors do not require LOS and work under extreme weather and visibility conditions.","0193-6530","978-1-61284-303-2","","10.1109/ISSCC.2011.5746325","http://ieeexplore.ieee.org/stamp/stamp.jsp?arnumber=5746325","","Arrays;CMOS integrated circuits;Delay;Humans;Monitoring;Ultra wideband radar","CMOS image sensors;object detection;radar detection;ultra wideband communication;wireless sensor networks","Doppler shift;LOS;RF sensor;cardiopulmonary activity;continuous wave unmodulated waveform;environmental noise;human feature detection;line of sight;microDoppler technique;radiofrequency sensor;short-range UWB impulse-radio CMOS sensor;wireless infrastructure;wireless noncontact sensor","","20","","5","","","20-24 Feb. 2011","","IEEE","IEEE Conference Publications"
"A fully integrated multi-CPU, GPU and memory controller 32nm processor","Yuffe, M.; Knoll, E.; Mehalel, M.; Shor, J.; Kurts, T.","Intel, Haifa, Israel","Solid-State Circuits Conference Digest of Technical Papers (ISSCC), 2011 IEEE International","20110407","2011","","","264","266","This paper describes the 32nm Sandy Bridge processor that integrates up to 4 high performance Intel Architecture (IA) cores, a power/performance optimized graphic processing unit (GPU) and memory and PCIe controllers in the same die. The Sandy Bridge architecture block diagram is shown in Fig. 15.1.1 and the floorplan of a four IA-core version is shown in Fig. 15.1.2. The Sandy Bridge IA core implements an improved branch prediction algorithm, a micro-operation (Uop) cache, a floating point Advanced Vector Extension (AVX), a second load port in the L1 cache and bigger register files in the out-of-order part of the machine; all these architecture improvements boost the IA core performance without increasing the thermal power dissipation envelope or the average power consumption (to preserve battery life in mobile systems). The CPUs and GPU share the same 8MB level-3 cache memory. The data flow is optimized by a high performance on die interconnect fabric (called “ring”) that connects between the CPUs, the GPU, the L3 cache and the system agent (SA) unit that houses a 1600MT/s, dual channel DDR3 memory controller, a 20-lane PCIe gen2 controller, a two parallel pipe display engine, the power management control unit and the testability logic. An on die EPROM is used for configurability and yield optimization.","0193-6530","978-1-61284-303-2","","10.1109/ISSCC.2011.5746311","http://ieeexplore.ieee.org/stamp/stamp.jsp?arnumber=5746311","","Bridge circuits;Clocks;Graphics processing unit;Synchronization;Temperature sensors","EPROM;cache storage;coprocessors;data flow analysis;electronic engineering computing;floating point arithmetic;logic testing;memory architecture;parallel architectures;peripheral interfaces;program compilers","AVX;EPROM;GPU processor;IA cores;PCIe controllers;PCIe gen2 controller;Sandy Bridge IA core;Sandy Bridge architecture block diagram;Uop cache;average power consumption;branch prediction algorithm;cache memory;configurability;data flow;die interconnect fabric;dual channel DDR3 memory controller;floating point advanced vector extension;high performance Intel architecture cores;memory controller processor;microoperation cache;multiCPU processor;optimized graphic processing unit;power management control unit;register files;sandy bridge processor;size 32 nm;system agent unit;testability logic;thermal power dissipation envelope;two parallel pipe display engine;yield optimization","","29","","4","","","20-24 Feb. 2011","","IEEE","IEEE Conference Publications"
"A low-power wideband polar transmitter for 3G applications","Youssef, M.; Zolfaghari, A.; Darabi, H.; Abidi, A.","Broadcom, Irvine, CA, USA","Solid-State Circuits Conference Digest of Technical Papers (ISSCC), 2011 IEEE International","20110407","2011","","","378","380","So far all mainstream transmitters for WCDMA are of the direct upconversion type. This architecture is versatile but requires calibration of the imbalance in its quadrature branches and DC offset at its inputs, and it is vulnerable to mixer noise. We believe it consumes more power and chip area than is warranted, and propose the polar transmitter as an alternative. Although it has been widely discussed as the ideal transmitter for EDGE, the polar architecture has yet to make significant inroads there, let alone into wideband CDMA. We will describe new circuits that enable a compact, largely self-calibrated polar transmitter, whose lower power and chip area put it ahead of state-of-the-art direct upconversion transmitters.","0193-6530","978-1-61284-303-2","","10.1109/ISSCC.2011.5746362","http://ieeexplore.ieee.org/stamp/stamp.jsp?arnumber=5746362","","Delay;Frequency locked loops;Multiaccess communication;Phase locked loops;Spread spectrum communication;Transmitters;Voltage-controlled oscillators","3G mobile communication;calibration;code division multiple access;low-power electronics;radio transmitters","3G mobile communication;DC offset;EDGE;WCDMA;low-power wideband polar transmitter;mixer noise","","12","2","6","","","20-24 Feb. 2011","","IEEE","IEEE Conference Publications"
"A 65nm CMOS pulse-width-controlled driver with 8V<inf>pp</inf> output voltage for switch-mode RF PAs up to 3.6GHz","Calvillo-Cortes, D.A.; Acar, M.; van der Heijden, M.P.; Apostolidou, M.; de Vreede, L.C.N.; Leenaerts, D.; Sonsky, J.","Delft Univ. of Technol., Delft, Netherlands","Solid-State Circuits Conference Digest of Technical Papers (ISSCC), 2011 IEEE International","20110407","2011","","","58","60","This work presented the first broadband PWM-controlled RF SMPA driver reaching 8.04Vpp up to 3.6GHz using a 1.2V baseline 65nm CMOS technology. The CMOS driver can serve as a key building block for next-generation reconfigurable multiband multimode transmitters for wireless infrastructure systems, interfacing digital CMOS circuitry with high-power transistors.","0193-6530","978-1-61284-303-2","","10.1109/ISSCC.2011.5746218","http://ieeexplore.ieee.org/stamp/stamp.jsp?arnumber=5746218","","CMOS integrated circuits;CMOS technology;Driver circuits;Inverters;Power amplifiers;Radio frequency;Transistors","CMOS analogue integrated circuits;driver circuits;power amplifiers;radiofrequency amplifiers;switched mode power supplies","CMOS pulse-width-controlled driver;CMOS technology;broadband PWM-controlled RF SMPA driver;digital CMOS circuitry;frequency 3.6 GHz;high-power transistor;multiband multimode transmitter;size 65 nm;switch-mode RF PA;voltage 1.2 V;voltage 8.04 V;wireless infrastructure system","","7","","6","","","20-24 Feb. 2011","","IEEE","IEEE Conference Publications"
"A 0.014mm<sup>2</sup> 9b switched-current DAC for AMOLED mobile display drivers","Hyun-Sik Kim; Jin-Yong Jeon; Sung-Woo Lee; Jun-Hyeok Yang; Seung-Tak Ryu; Gyu-Hyeong Cho","KAIST, Daejeon, South Korea","Solid-State Circuits Conference Digest of Technical Papers (ISSCC), 2011 IEEE International","20110407","2011","","","316","318","In this paper, we present an area-efficient switched-current (SI) DAC structure for current-mode AMOLED display drivers. The designed 9b SI DAC reuses a single hardware unit up to N cycles to complete the N-bit conversion. Thus, the chip size of the DAC remains nearly constant regardless of the resolution, as long as the accuracy of the current division is guaranteed, resulting in excellent area-efficiency.","0193-6530","978-1-61284-303-2","","10.1109/ISSCC.2011.5746335","http://ieeexplore.ieee.org/stamp/stamp.jsp?arnumber=5746335","","Active matrix organic light emitting diodes;Capacitors;Current measurement;Driver circuits;Feedback loop;Linearity;Silicon","LED displays;digital-analogue conversion;driver circuits;switched current circuits","N cycle;N-bit conversion;active-matrix organic LED technology;area-efficient switched-current DAC structure;current-mode AMOLED display driver;hardware unit","","1","","6","","","20-24 Feb. 2011","","IEEE","IEEE Conference Publications"
"A 12b 1GS/s SiGe BiCMOS two-way time-interleaved pipeline ADC","Payne, R.; Sestok, C.; Bright, W.; El-Chammas, M.; Corsi, M.; Smith, D.; Tal, N.","Texas Instrum., Dallas, TX, USA","Solid-State Circuits Conference Digest of Technical Papers (ISSCC), 2011 IEEE International","20110407","2011","","","182","184","Pipelined ADCs designed in analog BiCMOS technologies can offer good linearity and high SNR performance for input signals with reasonable voltage swings. Such ADCs, however, face two critical design challenges: the process limits the sampling rate, and the pipeline architecture limits power efficiency. This paper introduces a two-way time-interleaved (TI) switched-current 1Gs/s 12b pipelined ADC in SiGe BiCMOS that addresses these issues.","0193-6530","978-1-61284-303-2","","10.1109/ISSCC.2011.5746273","http://ieeexplore.ieee.org/stamp/stamp.jsp?arnumber=5746273","","BiCMOS integrated circuits;Calibration;Clocks;Instruments;Pipelines;Solid state circuits;Timing","BiCMOS analogue integrated circuits;Ge-Si alloys;analogue-digital conversion;integrated circuit design","BiCMOS two-way time interleaved pipeline ADC;SNR performance;SiGe;analog BiCMOS technologies;pipeline architecture;power efficiency;sampling rate;switched-current pipelined ADC;voltage swings;word length 12 bit","","8","","5","","","20-24 Feb. 2011","","IEEE","IEEE Conference Publications"
"A 5Gb/s adaptive DFE for 2x blind ADC-based CDR in 65nm CMOS","Abiri, B.; Sheikholeslami, A.; Tamura, Hirotaka; Kibune, M.","Univ. of Toronto, Toronto, ON, Canada","Solid-State Circuits Conference Digest of Technical Papers (ISSCC), 2011 IEEE International","20110407","2011","","","436","438","ADC-based receivers allow for extensive equalization in the digital domain and therefore can easily compensate for channel loss at higher data rates. Digital equalization can be implemented as an FFE or DFE. An adaptive FFE is straight forward to implement, as it relies on magnitudes only (not phases) of the blind samples, however, it enhances the quantization noise of the ADC. A DFE has better noise immunity, but challenges remain in designing an adap tive DFE for receivers with blind clocks. A typical adaptive engine for a DFE com pares the equalized center samples against a desired level to calculate error in each sample. The power of this error is then minimized to guide equalization. In a blind receiver, however, the center samples are not known; the blind samples may deviate from the eye's center and move closer to the zero crossings. As a result, one cannot use a single desired level independent of the blind sampling phase; the desired level must change according to the sampling phase. In this paper, we use a desired waveform, instead of a desired level, to perform the adaptation. Our measurement results confirm that this approach adapts the coefficients within 80μs and opens an otherwise closed eye for a channel atten uation of 13.3dB at 2.5GHz.","0193-6530","978-1-61284-303-2","","10.1109/ISSCC.2011.5746386","http://ieeexplore.ieee.org/stamp/stamp.jsp?arnumber=5746386","","Adaptive equalizers;CMOS integrated circuits;Clocks;Decision feedback equalizers;Engines;Receivers;Signal generators","CMOS integrated circuits;analogue-digital conversion;clock and data recovery circuits;decision feedback equalisers","ADC-based receivers;CDR;CMOS;DFE;analogue-digital converters;bit rate 5 Gbit/s;blind clocks;blind receiver;clock and data recovery circuits;decision feedback equalisers;digital equalization;frequency 2.5 GHz;quantization noise;size 65 nm;time 80 mus","","0","","4","","","20-24 Feb. 2011","","IEEE","IEEE Conference Publications"
"Cellular and wireless LAN transceivers: From systems to circuit design","Long, J.R.; Darabi, H.; Eynde, F.O.; Razavi, B.; Staszewski, B.","Delft Univ. of Technol., Delft, Netherlands","Solid-State Circuits Conference Digest of Technical Papers (ISSCC), 2011 IEEE International","20110407","2011","","","524","524","RF design has matured to the point where almost any wireless standard (e.g., GSM, WiFi, Bluetooth, etc.) and/or multiple standards operating in different bands can be integrated onto a single chip in deep submicron CMOS. This course is an in-depth tutorial that discusses many of the challenges facing the designer of a single-chip radio, and their solutions. The topics addressed in the course range from the system right down to the circuit level, including: system requirements and the demands they place on transceiver circuit specs, the design of RF front-ends with >;100dB dynamic range at GHz frequencies, direct conversion architectures, autocalibration methods, sub-systems robust to substrate/supply coupling and crosstalk, fast responding PLL synthesizers with low spurious content, and the latest `more digital than analog' developments. This course is aimed at circuit designers who are familiar with the basic terminology of RF and mixed-signal/analog circuits and wish to acquire further depth in RF IC design.","0193-6530","978-1-61284-303-2","","10.1109/ISSCC.2011.5746197","http://ieeexplore.ieee.org/stamp/stamp.jsp?arnumber=5746197","","Calibration;Frequency synthesizers;Patents;Radio frequency;Standards;Transceivers;Wireless communication","CMOS integrated circuits;analogue circuits;cellular radio;integrated circuit design;local area networks;radio transceivers;radiofrequency integrated circuits","RF IC design;RF circuits;RF design;autocalibration methods;cellular transceivers;circuit design;deep submicron CMOS;mixed-signal/analog circuits;single-chip radio;wireless LAN transceivers;wireless standard","","0","","","","","20-24 Feb. 2011","","IEEE","IEEE Conference Publications"
"Eco-friendly semiconductor technologies for healthy living","Oh-Hyun Kwon","Samsung Electron., Giheung, South Korea","Solid-State Circuits Conference Digest of Technical Papers (ISSCC), 2011 IEEE International","20110407","2011","","","22","28","This paper will discuss how the semiconductor industry can contribute to reducing global energy consumption and greenhouse-gas emission, eventually making human life healthier (of course, without sacrificing convenience and productivity). In the following sections, we will present two different perspectives: (1) semiconductor products, and (2) semiconductor manufacturing processes.","0193-6530","978-1-61284-303-2","","10.1109/ISSCC.2011.5746205","http://ieeexplore.ieee.org/stamp/stamp.jsp?arnumber=5746205","","Energy efficiency;Industries;Manufacturing;Memory management;Power demand;Program processors;Random access memory","air pollution;manufacturing processes;semiconductor industry;semiconductor technology","eco-friendly semiconductor technologies;global energy consumption;greenhouse-gas emission;healthy living;semiconductor industry;semiconductor manufacturing process;semiconductor products","","2","","18","","","20-24 Feb. 2011","","IEEE","IEEE Conference Publications"
"A 120dB-SNR 100dB-THD+N 21.5mW/channel multibit CT ΔΣ DAC","Bandyopadhyay, A.; Determan, M.; Sejun Kim; Khiem Nguyen","Analog Devices, Wilmington, MA, USA","Solid-State Circuits Conference Digest of Technical Papers (ISSCC), 2011 IEEE International","20110407","2011","","","482","483","Automotive and consumer multi-channel 24 b audio systems have demanded low-cost digital-to-analog converters (DACs) which offer wide dynamic range, high linearity, small die size, and low power consumption such that the system can be housed in a small low-cost plastic package. Several 120 dB SNR audio ΔΣ DACs have been reported using either switched-capacitor or continuous-time techniques. This paper presents a continuous time (CT) area optimized multibit DAC which achieves 120dB SNR and 100dB THD+N at 21.5mW/chan nel. This performance is achieved by using a new 3-level rotational data shuffling scheme which achieves small area and low digital activity at low signal level, and by applying low-power low-noise analog techniques.","0193-6530","978-1-61284-303-2","","10.1109/ISSCC.2011.5746407","http://ieeexplore.ieee.org/stamp/stamp.jsp?arnumber=5746407","","Conferences;Generators;Modulation;Performance evaluation;Power demand;Signal to noise ratio","delta-sigma modulation;harmonic distortion;low-power electronics;plastic packaging;switched capacitor networks","3-level rotational data shuffling scheme;HD;SNR;audio systems;continuous time area optimized multibit DAC;continuous-time techniques;low power consumption;low-cost digital-to-analog converters;low-cost plastic package;low-power low-noise analog techniques;multibit CT ΔΣ DAC;switched capacitor","","1","","4","","","20-24 Feb. 2011","","IEEE","IEEE Conference Publications"
"95%-lower-BER 43%-lower-power intelligent solid-state drive (SSD) with asymmetric coding and stripe pattern elimination algorithm","Tanakamaru, S.; Hung, C.; Esumi, A.; Ito, M.; Kai Li; Takeuchi, K.","Univ. of Tokyo, Tokyo, Japan","Solid-State Circuits Conference Digest of Technical Papers (ISSCC), 2011 IEEE International","20110407","2011","","","204","206","This paper presents intelligent solid-state drives (SSDs), which decrease memory errors by 95% and reduce power consumption by 43%. Figure 11.4.1 shows the measured memory cell error in the data retention and program disturb of 4X, 3X and 2Xnm NAND flash memories. As the memory size decreases, both data retention and program disturb errors increase due to the interference, random telegraph noise and reduced electrons. In the scaled NAND, the electric field in the channel increases and the program disturb due to GIDL-induced hot electron injection becomes more significant (Fig. 11.4.1(c)). In conventional SSDs, 20 to 40 b correction per 1 KB codeword error-correcting code (ECC) is used to correct errors. As stronger codes, such as LDPC, are developed, the capability of ECC is close to the Shannon limit of a few percent error correction. Thus, the additional high-reliability scheme is required. As the feature size decreases, the power consumption increases due to the increased bit-line capacitance of NAND. As the space between bitlines decreases, the inter bitline capacitance increases. To overcome reliability and power problems in SSDs, this paper describes two technologies. Asymmetric coding improves memory-cell reliability by 95% without access-time penalty. Stripe pattern elimination algorithm eliminates the worst program data pattern and decreases the power during the program by 43% without circuit area or access time overhead.","0193-6530","978-1-61284-303-2","","10.1109/ISSCC.2011.5746283","http://ieeexplore.ieee.org/stamp/stamp.jsp?arnumber=5746283","","Capacitance;Computer architecture;Encoding;Flash memory;Measurement uncertainty;Microprocessors;Reliability","NAND circuits;error correction codes;error statistics;flash memories;integrated circuit reliability;low-power electronics","BER;ECC;GIDL-induced hot electron injection;NAND flash memory;Shannon limit;bit-line capacitance;data retention;electric field;error-correcting code;high-reliability scheme;low-power intelligent solid-state drive;memory cell error;memory-cell reliability;power consumption;random telegraph noise;stripe pattern elimination algorithm;word length 20 bit to 40 bit","","10","","8","","","20-24 Feb. 2011","","IEEE","IEEE Conference Publications"
"Analog-DFE-based 16Gb/s SerDes in 40nm CMOS that operates across 34dB loss channels at Nyquist with a baud rate CDR and 1.2V<inf>pp</inf> voltage-mode driver","Joy, A.K.; Mair, H.; Hae-Chang Lee; Feldman, A.; Portmann, C.; Bulman, N.; Crespo, E.C.; Hearne, P.; Huang, P.; Kerr, B.; Khandelwal, P.; Kuhlmann, F.; Lytollis, S.; Machado, J.; Morrison, C.; Morrison, S.; Rabii, S.; Rajapaksha, D.; Ravinuthula, V.; Surace, G.","Texas Instrum., Northampton, UK","Solid-State Circuits Conference Digest of Technical Papers (ISSCC), 2011 IEEE International","20110407","2011","","","350","351","In networking systems today data rates are increasing beyond 15Gb/s and yet the installed backplanes are made of low cost materials with losses in excess of 30dB at 7.5GHz. Standards, such as IEEE802.3ap-10GBASE-KR and OIF CEI25G, are specifying SerDes requirements for channels with 25dB loss at Nyquist and this has driven the development of SerDes with 4 or 5 tap DFEs. Until now, solutions for 34dB or more channel loss have been limited to 10.3Gb/s or below, whereas this paper describes an adaptive 14-tap DFE that achieves a 1017 BER across a 34dB loss channel at 16Gb/s for a power of 235mW/lane. A baud-rate CDR technique is specifically developed that gives excellent locking characteristics and alignment for use with a speculative DFE together with an enhanced swing TX voltage mode driver.","0193-6530","978-1-61284-303-2","","10.1109/ISSCC.2011.5746349","http://ieeexplore.ieee.org/stamp/stamp.jsp?arnumber=5746349","","Backplanes;CMOS integrated circuits;Decision feedback equalizers;Driver circuits;Finite impulse response filter;Transceivers;Transmitters","CMOS integrated circuits;decision feedback equalisers;transceivers","CMOS;Nyquist;SerDes requirements;adaptive 14-tap DFE;analog-DFE-based SerDes;baud rate CDR;bit rate 16 Gbit/s;loss 34 dB;size 40 nm;swing TX voltage mode driver;voltage-mode driver","","14","","5","","","20-24 Feb. 2011","","IEEE","IEEE Conference Publications"
"Foreword","","","Solid-State Circuits Conference Digest of Technical Papers (ISSCC), 2011 IEEE International","20110407","2011","","","3","3","Presents the foreword to the conference proceedings.","0193-6530","978-1-61284-303-2","","10.1109/ISSCC.2011.5746193","http://ieeexplore.ieee.org/stamp/stamp.jsp?arnumber=5746193","","","","","","0","","","","","20-24 Feb. 2011","","IEEE","IEEE Conference Publications"
