"http://ieeexplore.ieee.org/search/searchresult.jsp?bulkSetSize=2000&queryText%3DISSCC%2C+2011+IEEE+International",2015/06/23 15:33:47
"Design solutions for the Bulldozer 32nm SOI 2-core processor module in an 8-core CPU","Fischer, T.; Arekapudi, S.; Busta, E.; Dietz, C.; Golden, M.; Hilker, S.; Horiuchi, A.; Hurd, K.A.; Johnson, D.; McIntyre, H.; Naffziger, S.; Vinh, J.; White, J.; Wilcox, K.","AMD, Fort Collins, CO, USA","Solid-State Circuits Conference Digest of Technical Papers (ISSCC), 2011 IEEE International","20110407","2011","","","78","80","AMD's 2-core ""Bulldozer"" module contains 213 million transistors in an 11 metal layer 32nm HKMG SOI CMOS process and is designed to operate from 0.8 to 1.3V. This new micro-architecture improves performance and frequency while reducing area and power compared to a previous AMD x86-64 CPU in the same process. To achieve these goals, the design reduced the number of F04 inverter delays/cycle by more than 20%, achieving higher frequencies in the same power envelope even with increased core counts. The 2-core CPU module area (including 2MB L2 cache) is 30.9mm<sup>2</sup>. The Bulldozer micro-architecture is cycle-based, using soft-edge flip-flops (SEF) to provide high-frequency performance, process variation tolerance, and low power consumption.","0193-6530","978-1-61284-303-2","","10.1109/ISSCC.2011.5746227","http://ieeexplore.ieee.org/stamp/stamp.jsp?arnumber=5746227","","Arrays;Central Processing Unit;Clocks;Latches;Program processors;Registers","CMOS integrated circuits;flip-flops;microprocessor chips;silicon-on-insulator","2-core Bulldozer module;2MB L2 cache;8-core CPU;Bulldozer microarchitecture;HKMG SOI CMOS process;SEF;SOI 2-core processor module;high-frequency performance;low power consumption;process variation tolerance;size 32 nm;soft-edge flip-flops;voltage 0.8 V to 1.3 V","","15","","4","","","20-24 Feb. 2011","","IEEE","IEEE Conference Publications"
"Welcome!","","","Solid-State Circuits Conference Digest of Technical Papers (ISSCC), 2011 IEEE International","20110407","2011","","","1","1","Presents the welcome message from the conference proceedings.","0193-6530","978-1-61284-303-2","","10.1109/ISSCC.2011.5746383","http://ieeexplore.ieee.org/stamp/stamp.jsp?arnumber=5746383","","","","","","0","","","","","20-24 Feb. 2011","","IEEE","IEEE Conference Publications"
"A 95mV-startup step-up converter with V<inf>th</inf>-tuned oscillator by fixed-charge programming and capacitor pass-on scheme","Po-Hung Chen; Ishida, K.; Ikeuchi, K.; Xin Zhang; Honda, K.; Okuma, Y.; Ryu, Y.; Takamiya, M.; Sakurai, T.","Univ. of Tokyo, Tokyo, Japan","Solid-State Circuits Conference Digest of Technical Papers (ISSCC), 2011 IEEE International","20110407","2011","","","216","218","Harvesting energy from the environment by using a thermoelectric generator (TEG) or photovoltaic cells provides a solution for battery-free sensor networks or electronic healthcare systems. In these systems, the harvested energy is supplied at a very low voltages, requiring a low-startup-voltage power circuit for kick-start from low voltage. A previous sub-100mV-startup-voltage boost converter was implemented by using a mechanically assisted step-up process that needs vibration at startup and the application is rather limited. In this paper, a 95mV startup voltage step-up converter without any mechanical stimulus extends the applicability of energy harvesting. The circuit converts a 100mV input to a 0.9V output with 72% conversion efficiency without any external clocks or mechanical switches. A capacitor pass-on scheme eliminates an additional external output capacitor that functions only at the startup.","0193-6530","978-1-61284-303-2","","10.1109/ISSCC.2011.5746290","http://ieeexplore.ieee.org/stamp/stamp.jsp?arnumber=5746290","","Capacitors;Converters;Detectors;Oscillators;Programming;Semiconductor device measurement;Stress","capacitors;energy harvesting;oscillators;power convertors","TEG;V<sub>TH</sub>-tuned oscillator;boost converter;capacitor pass-on scheme;energy harvesting;fixed-charge programming;photovoltaic cell;step-up converter;thermoelectric generator;voltage 0.9 V;voltage 100 mV;voltage 95 mV;voltage power circuit","","6","","4","","","20-24 Feb. 2011","","IEEE","IEEE Conference Publications"
"Game-changing opportunities for wireless personal healthcare and lifestyle","De Boeck, J.","Imec, Leuven, Belgium","Solid-State Circuits Conference Digest of Technical Papers (ISSCC), 2011 IEEE International","20110407","2011","","","15","21","In recent years, Personalized, Predictive, Preventive, and Participatory health care have become more than just buzzwords. Silicon is playing an important enabling role in this gradual, but certain revolution of our healthcare system: Silicon will become more essential, in view of the many challenges in realizing ubiquitous monitoring, real-time diagnostics, and patient-centric therapies. By reviewing world-wide technology breakthroughs, as well as healthcare related trials with wireless sensors in Body-Area-Network (BAN) configura tions, we will demonstrate that application validation for personal diagnostics and theranostic products is driving game-changing circuit and system innova tion. Visionary applications such as brain-computer interfaces sound like magic! However, with every new generation of technology and application algorithms, wearable wireless systems become less obtrusive, higher per forming, and more autonomous. The envisaged large-scale deployment of wearable healthcare and lifestyle add-ons that can monitor systemic factors such as stress and emotions, will revolutionize how we live, play, and work. But, none of these developments is heralding a ""Brave New World""; instead, they will foster and strengthen the role and impact of each individual along the path to a longer, healthier and happier life.","0193-6530","978-1-61284-303-2","","10.1109/ISSCC.2011.5746204","http://ieeexplore.ieee.org/stamp/stamp.jsp?arnumber=5746204","","Biomedical monitoring;Electrocardiography;Medical services;Monitoring;Sensors;Wireless communication;Wireless sensor networks","biomedical telemetry;body area networks;health care;innovation management;patient diagnosis;patient monitoring;patient treatment;real-time systems;telemedicine;ubiquitous computing;wireless sensor networks","BAN configurations;body-area-network configurations;envisaged large-scale deployment;game-changing circuit;game-changing opportunity;healthcare related trials;healthcare system;lifestyle add-ons;patient-centric therapy;personal diagnostics;personal lifestyle;real-time diagnostics;silicon;system innovation;systemic factors;theranostic products;ubiquitous monitoring;visionary applications;wearable healthcare;wearable wireless systems;wireless personal healthcare;wireless sensors;world-wide technology breakthroughs","","5","","34","","","20-24 Feb. 2011","","IEEE","IEEE Conference Publications"
"Comparison of 65nm LP bulk and LP PD-SOI with adaptive power gate body bias for an LDPC codec","Le Coz, J.; Flatresse, P.; Engels, S.; Valentian, A.; Belleville, M.; Raynaud, C.; Croain, D.; Urard, P.","STMicroelectronics, Crolles, France","Solid-State Circuits Conference Digest of Technical Papers (ISSCC), 2011 IEEE International","20110407","2011","","","336","337","A Low-Density Parity-Check (LDPC) codec circuit is implemented in a 65nm Low-Power Partially-Depleted SOI (LP PD-SOI) technology, as well as in a ""conventional"" Low-Power Bulk technology for a fair comparison. PD-SOI allows to increase maximum frequency versus bulk at a given voltage, and to decrease dynamic power versus bulk at a given frequency. Thanks to a digital power switching technique specifically optimized for LP PD-SOI, we demonstrate a leakage current reduction versus bulk 65nm LP implementation, solving one of the most critical problems of PD-SOI technology, as identified in previous publications.","0193-6530","978-1-61284-303-2","","10.1109/ISSCC.2011.5746343","http://ieeexplore.ieee.org/stamp/stamp.jsp?arnumber=5746343","","Codecs;Decoding;Leakage current;Parity check codes;Silicon;Switches;Temperature measurement","CMOS digital integrated circuits;circuit optimisation;codecs;leakage currents;low-power electronics;parity check codes;power semiconductor switches;silicon-on-insulator","LDPC codec;LP PD-SOI;LP bulk;adaptive power gate body bias;digital power-switching technique;leakage current reduction;low-density parity-check codec circuit;low-power bulk technology;low-power partially-depleted SOI technology;size 65 nm","","9","","5","","","20-24 Feb. 2011","","IEEE","IEEE Conference Publications"
"A 4GHz CT ΔΣ ADC with 70dB DR and −74dBFS THD in 125MHz BW","Bolatkale, M.; Breems, L.J.; Rutten, R.; Makinwa, K.A.A.","NXP Semicond., Eindhoven, Netherlands","Solid-State Circuits Conference Digest of Technical Papers (ISSCC), 2011 IEEE International","20110407","2011","","","470","472","In this paper, a high-speed continuous-time (CT) ΔΣ ADC topology is proposed that absorbs the pole normally caused by the quantizer's input capacitance, while a local feedback loop compensates for the quantizer's excess delay. These meas ures allow a high-resolution multi-bit ΔΣ ADC to operate at GHz sampling rates. The bandwidth of this CMOS ΔΣ ADC is 6x wider than the state-of-the-art. Compared to a state-of-the-art pipeline BiCMOS ADC, it achieves similar power efficiency and bandwidth, but it only occupies 0.9mm2 in 45nm CMOS, which is essential for low-cost integration. The 4b 3,a-order CT ΔΣ ADC is sam pled at 4GHz and achieves 70dB DR and -74dBFS THD in a 125MHz BW while consuming 256mW. This prototype enables the use of ΔΣ ADCs in applications such as GSM base-stations and HD video systems.","0193-6530","978-1-61284-303-2","","10.1109/ISSCC.2011.5746401","http://ieeexplore.ieee.org/stamp/stamp.jsp?arnumber=5746401","","Bandwidth;CMOS integrated circuits;Capacitance;Driver circuits;Modulation;Noise;Solid state circuits","BiCMOS integrated circuits;CMOS integrated circuits;analogue-digital conversion;delta-sigma modulation;feedback;network topology","CMOS ΔΣ ADC;continuous-time ΔΣ ADC topology;frequency 125 MHz;frequency 4 GHz;local feedback loop;pipeline BiCMOS ADC","","8","","9","","","20-24 Feb. 2011","","IEEE","IEEE Conference Publications"
"Session 1 overview: Plenary session","Chandrakasan, Anantha; Gass, Wanda","Massachusetts Institute of Technology, Cambridge, MA, ISSCC Conference Chair","Solid-State Circuits Conference Digest of Technical Papers (ISSCC), 2011 IEEE International","20110407","2011","","","6","8","Summary form only given. The Plenary Session begins with opening remarks and a welcome to attendees from the Conference Chair, Anantha Chandrakasan. Then the three Plenary speakers will introduced by the Program Chair, Wanda Gass and their visionary presentations given.","0193-6530","978-1-61284-303-2","","10.1109/ISSCC.2011.5746434","http://ieeexplore.ieee.org/stamp/stamp.jsp?arnumber=5746434","","","","","","0","","","","","20-24 Feb. 2011","","IEEE","IEEE Conference Publications"
"A compact SAW-less multiband WCDMA/GPS receiver front-end with translational loop for input matching","Xin He; Kundur, H.","NXP Semicond., Eindhoven, Netherlands","Solid-State Circuits Conference Digest of Technical Papers (ISSCC), 2011 IEEE International","20110407","2011","","","372","374","This paper describes a compact SAW-less receiver front-end design targeting multiband multimode GSM/EDGE/WCDMA/GPS applications. Using a translational loop for input matching, the inductor-free receiver achieves high OOB lin earity and low NF at low power consumption.","0193-6530","978-1-61284-303-2","","10.1109/ISSCC.2011.5746359","http://ieeexplore.ieee.org/stamp/stamp.jsp?arnumber=5746359","","Impedance matching;Mixers;Multiaccess communication;Noise measurement;Radio frequency;Receivers;Spread spectrum communication","Global Positioning System;cellular radio;code division multiple access;low-power electronics","EDGE;GPS receiver front-end;GSM;SAW-less multiband WCDMA receiver;inductor-free receiver;input matching;translational loop","","10","3","8","","","20-24 Feb. 2011","","IEEE","IEEE Conference Publications"
"New interfaces to the body through implantable-system integration","Oesterle, S.; Gerrish, P.; Peng Cong","Medtronic, Minneapolis, MN, USA","Solid-State Circuits Conference Digest of Technical Papers (ISSCC), 2011 IEEE International","20110407","2011","","","9","14","The paper gives an overview on the technologies to revolutionize general healthcare, in particular through the implantable-device industry. It focuses on topics such as: implantable device design; smart interfaces; smart information management; energy supplies and power management; and system level integration.","0193-6530","978-1-61284-303-2","","10.1109/ISSCC.2011.5746203","http://ieeexplore.ieee.org/stamp/stamp.jsp?arnumber=5746203","","Capacitors;Diseases;Integrated circuits;Medical diagnostic imaging;Medical treatment;Packaging;Telemetry","prosthetics","energy supply;general healthcare;implantable system integration;power management;smart information management;smart interface","","2","","7","","","20-24 Feb. 2011","","IEEE","IEEE Conference Publications"
"A 21.7-to-27.8GHz 2.6-degrees-rms 40Mw frequency synthesizer in 45nm CMOS for mm-Wave communication applications","Osorio, J.F.; Vaucher, C.S.; Huff, B.; v.d.Heijden, E.; Anton de Graauw","NXP Semicond., Eindhoven, Netherlands","Solid-State Circuits Conference Digest of Technical Papers (ISSCC), 2011 IEEE International","20110407","2011","","","278","280","This work presents a 21.7-to-27.8GHz frequency synthesizer in a 45nm CMOS process that combines a tuning range of 24.8%, a residual phase modulation of 2.57°rms (with integrated phase noise from 100kHz to 100MHz), and a total power dissipation of 40mW. Combined with a frequency multiplier-by-two circuit and a divider-by-two circuit in a sliding-IF configuration, the PLL provides the four source frequencies required by the IEEE 802.15.3c 60GHz communication standard. In addition, the attained phase noise makes it suitable for microwave links with higher-order modulation schemes used as the back-bone for 3G/LTE base-station networks.","0193-6530","978-1-61284-303-2","","10.1109/ISSCC.2011.5746317","http://ieeexplore.ieee.org/stamp/stamp.jsp?arnumber=5746317","","CMOS integrated circuits;Frequency conversion;Frequency synthesizers;Phase locked loops;Phase noise;Tuning;Voltage-controlled oscillators","3G mobile communication;CMOS digital integrated circuits;Long Term Evolution;field effect MIMIC;frequency dividers;frequency multipliers;frequency synthesizers;microwave links;multiplying circuits;personal area networks;phase locked loops","3G-LTE base-station networks;CMOS process;IEEE 802.15.3c communication standard;PLL;divider-by-two circuit;frequency 21.7 GHz to 27.8 GHz;frequency multiplier-by-two circuit;frequency synthesizer;microwave links;mm-wave communication application;power dissipation;residual phase modulation;size 45 nm;sliding-IF configuration","","11","","5","","","20-24 Feb. 2011","","IEEE","IEEE Conference Publications"
"Session 22 overview / analog: DC/DC converters","Rezzi, Francesco; Haroun, Baher","Marvell Semiconductors, Pavia, Italy","Solid-State Circuits Conference Digest of Technical Papers (ISSCC), 2011 IEEE International","20110407","2011","","","380","381","Summary form only given. Market trends today are driving for highly efficient power conversion in high volume portable applications. This highlights the need for high-level single-chip integration of DC-DC converters in leading edge processes with other signal-path systems. This high-level of integration is driven by system cost and form factor. Moreover, system performance and cost and special design challenges at these advanced process nodes require taking into account the voltage and reliability limitations of nanometer technologies on switching converter designs. While power efficiency is of paramount importance, other system issues are driving new methods for design robustness and ease of test. The speakers in this session present the latest integration efforts and novel techniques to improve the performance and cost of DC-DC converters.","0193-6530","978-1-61284-303-2","","10.1109/ISSCC.2011.5746455","http://ieeexplore.ieee.org/stamp/stamp.jsp?arnumber=5746455","","","","","","0","","","","","20-24 Feb. 2011","","IEEE","IEEE Conference Publications"
"Robust and efficient synchronous buck converter with near-optimal dead-time control","Sungwoo Lee; Seungchul Jung; Jin Huh; Changbyung Park; Chun-Taek Rim; Gyu-Hyeong Cho","KAIST, Daejeon, South Korea","Solid-State Circuits Conference Digest of Technical Papers (ISSCC), 2011 IEEE International","20110407","2011","","","392","394","In switching power converters, the turn on/off process of switches is crucial for the reliability and efficiency of the converter. In general, optimum switching is challenging, and it is particularly difficult for hard switching. The MOSFET synchronous buck converter having wide applications due to high switching speed and low loss, however, operates in hard switching and needs a good timing control for its switching. On/off commutation dead-times should be adjusted care fully in accordance with load current change. Previous work on the dead-time control includes predictive gate drive technique, load current sensing, sensor-less optimization technique, and delay-locked loops. These techniques have problems of sensing noisy switching node or load current, and requiring high quantizing resolution. In this paper, a near optimum dead-time control method is proposed that resolves such problem.","0193-6530","978-1-61284-303-2","","10.1109/ISSCC.2011.5746366","http://ieeexplore.ieee.org/stamp/stamp.jsp?arnumber=5746366","","Converters;Delay;Logic gates;Sensors;Switches;Tin","MOSFET circuits;delay lock loops;optimisation;switching convertors","MOSFET;delay-locked loops;load current sensing;near-optimal dead-time control;optimum switching;predictive gate drive technique;sensor-less optimization technique;switching power converters;synchronous buck converter","","6","","8","","","20-24 Feb. 2011","","IEEE","IEEE Conference Publications"
"A receiver for WCDMA/EDGE mobile phones with inductorless front-end in 65nm CMOS","Beffa, F.; Tze Yee Sin; Tanzil, A.; Ivory, D.; Tenbroek, B.; Strange, J.; Ali-Ahmad, W.","MediaTek, West Malling, UK","Solid-State Circuits Conference Digest of Technical Papers (ISSCC), 2011 IEEE International","20110407","2011","","","370","372","The spectrum allocated for the operation of cellular services is country dependent and fragmented in several frequency bands. Mobile phones, to be usable globally, are therefore required to support many bands. The lack of suitable tuneable pre-selection filters and duplexers mandates the use of a large number of low-noise amplifiers (LNAs) in the receiver section of the transceiver. Minimization of the area occupied by the LNAs is therefore important. Virtually every transceiver for mobile phone applications published to date makes use of LNAs employing on-chip or on-passivation spiral inductors. Spiral inductors are large and do not scale with technology, leading to an increasing relative cost of the receiver front-end with newer technology nodes. Post-passivation and SiP technologies also add noticeably to the costs. In this paper we present the first receiver employing no on-chip or above-passivation spiral inductors on the receive signal path and with a linearity and noise performance suitable for WCDMA/EDGE applications. The eight channel direct-conversion receiver is part of a multimode transceiver requiring neither RX nor TX inter stage SAW filters for FDD 3G operation.","0193-6530","978-1-61284-303-2","","10.1109/ISSCC.2011.5746358","http://ieeexplore.ieee.org/stamp/stamp.jsp?arnumber=5746358","","Mixers;Multiaccess communication;Radio frequency;Receivers;Resistors;Spread spectrum communication;Transceivers","3G mobile communication;CMOS integrated circuits;cellular radio;code division multiple access;inductors;low noise amplifiers;radio transceivers","CMOS;EDGE mobile phone;FDD 3G operation;SiP technology;WCDMA mobile phone;cellular service;channel direct-conversion receiver;inductorless front-end;low-noise amplifier;multimode transceiver;on-chip spiral inductor;on-passivation spiral inductor;post-passivation;size 65 nm;spectrum allocation","","3","3","6","","","20-24 Feb. 2011","","IEEE","IEEE Conference Publications"
"A low-power process-scalable superheterodyne receiver with integrated high-Q filters","Mirzaei, A.; Darabi, H.; Murphy, D.","Broadcom, Irvine, CA, USA","Solid-State Circuits Conference Digest of Technical Papers (ISSCC), 2011 IEEE International","20110407","2011","","","60","62","Recently it has been shown that frequency-translated BPFs offer high-Q filtering with their center frequency precisely controlled by a clock. To address the scalability concerns and to achieve the same level of integration as the zero or low-IF receivers, this paper propose a low-power process-scalable superheterodyne receiver with integrated high-Q filters. The receiver presented exceeds the requirements of most applications today, achieves a low power consumption at a small die area, yet addresses the scalability issue of the conventional radios as is mainly built of basic CMOS building blocks, namely, inverters, switches, and MOS capacitors.","0193-6530","978-1-61284-303-2","","10.1109/ISSCC.2011.5746219","http://ieeexplore.ieee.org/stamp/stamp.jsp?arnumber=5746219","","Band pass filters;Capacitors;Clocks;Impedance;Radio frequency;Receivers","CMOS integrated circuits;low-power electronics;radiofrequency filters;superheterodyne receivers","CMOS building blocks;MOS capacitors;die area;frequency-translated BPF;integrated high-Q filters;inverters;low-power superheterodyne receiver;process-scalable superheterodyne receiver;scalability;switches","","13","","3","","","20-24 Feb. 2011","","IEEE","IEEE Conference Publications"
"A side-channel and fault-attack resistant AES circuit working on duplicated complemented values","Doulcier-Verdier, M.; Dutertre, J.-M.; Fournier, J.; Rigaud, J.-B.; Robisson, B.; Tria, A.","CEA-LETI-MINATEC, Gardanne, France","Solid-State Circuits Conference Digest of Technical Papers (ISSCC), 2011 IEEE International","20110407","2011","","","274","276","Cryptographic circuits can be subjected to several kinds of side-channel and fault attacks in order to extract the secret key. Side-channel attacks can be carried by measuring either the power consumed or the EM waves emitted by the cryptographic module and trying to find a correlation between the given side-channel and the data manipulated. Concerning fault attacks, in the case of differential fault attacks (DFA), a cryptographic calculation is corrupted in such a way as to retrieve information about the secret key. Faults can be induced by different means such as lasers, voltage glitches, electromagnetic perturbations or clock skews. Several counter-measures, like in, have been separately proposed to tackle either kind of attack. In this paper, we describe the implementation of an AES chip where duplicated and complemented data paths provide resistance against both side-channel and fault attacks.","0193-6530","978-1-61284-303-2","","10.1109/ISSCC.2011.5746316","http://ieeexplore.ieee.org/stamp/stamp.jsp?arnumber=5746316","","Analytical models;Circuit faults;Computer science;Correlation;Cryptography;Logic gates;Semiconductor device measurement","cryptography;microprocessor chips","AES chip;DFA;EM waves;clock skew;cryptographic circuit;differential fault attack;electromagnetic perturbation;fault-attack resistant AES circuit;laser;side-channel attack resistant AES circuit;voltage glitches","","3","","6","","","20-24 Feb. 2011","","IEEE","IEEE Conference Publications"
"20μA to 100mA DC-DC converter with 2.8 to 4.2V battery supply for portable applications in 45nm CMOS","Bandyopadhyay, S.; Ramadass, Y.K.; Chandrakasan, A.P.","Massachusetts Inst. of Technol., Cambridge, MA, USA","Solid-State Circuits Conference Digest of Technical Papers (ISSCC), 2011 IEEE International","20110407","2011","","","386","388","Digital baseband processors in portable devices today are able to operate off voltages of 1V and less. Efficient DC-DC converters are required to power these ICs from Li-ion batteries with a voltage range of 2.8 to 4.2V. This is done by a discrete power management IC (PMIC) capable of handling the high battery voltage. However, there is significant push in integrating the PMIC module with the baseband processor implemented in scaled technologies thereby reducing the number of system-level components. This paper presents the circuit techniques used in a 45nm CMOS DC-DC converter with high battery-voltage handling capability.","0193-6530","978-1-61284-303-2","","10.1109/ISSCC.2011.5746365","http://ieeexplore.ieee.org/stamp/stamp.jsp?arnumber=5746365","","Batteries;Capacitors;Converters;Instruments;Logic gates;MOS devices;Pulse width modulation","CMOS integrated circuits;DC-DC power convertors;PWM power convertors;secondary cells","CMOS DC-DC converter;Digital baseband processor;Li;Li-ion battery;battery-voltage handling capability;current 20 muA to 100 mA;discrete power management IC;portable device;size 45 nm;voltage 1 V;voltage 2.8 V to 4.2 V","","4","","7","","","20-24 Feb. 2011","","IEEE","IEEE Conference Publications"
